	en	ru	ru_tokens	en_tokens
0	One dollar and eighty-seven cents. 	Один доллар восемьдесят семь центов. 	['Один', 'доллар', 'восемьдесят', 'семь', 'центов']	['One', 'dollar', 'and', 'eighty-seven', 'cents']
1	That was all. 	Это было все. 	['Это', 'было', 'все']	['That', 'was', 'all']
2	And sixty cents of it was in pennies. 	Из них шестьдесят центов монетками по одному центу. 	['Из', 'них', 'шестьдесят', 'центов', 'монетками', 'по', 'одному', 'центу']	['And', 'sixty', 'cents', 'of', 'it', 'was', 'in', 'pennies']
3	Pennies saved one and two at a time by bulldozing the grocer and the vegetable man and the butcher until one's cheeks burned with the silent imputation of parsimony that such close dealing implied. 	За каждую из этих монеток пришлось торговаться с бакалейщиком, зеленщиком, мясником так, что даже уши горели от безмолвного неодобрения, которое вызывала подобная бережливость. 	['За', 'каждую', 'из', 'этих', 'монеток', 'пришлось', 'торговаться', 'с', 'бакалейщиком', 'зеленщиком', 'мясником', 'так', 'что', 'даже', 'уши', 'горели', 'от', 'безмолвного', 'неодобрения', 'которое', 'вызывала', 'подобная', 'бережливость']	"['Pennies', 'saved', 'one', 'and', 'two', 'at', 'a', 'time', 'by', 'bulldozing', 'the', 'grocer', 'and', 'the', 'vegetable', 'man', 'and', 'the', 'butcher', 'until', ""one's"", 'cheeks', 'burned', 'with', 'the', 'silent', 'imputation', 'of', 'parsimony', 'that', 'such', 'close', 'dealing', 'implied']"
4	Three times Della counted it. 	Делла пересчитала три раза. 	['Делла', 'пересчитала', 'три', 'раза']	['Three', 'times', 'Della', 'counted', 'it']
5	One dollar and eighty-seven cents. 	Один доллар восемьдесят семь центов. 	['Один', 'доллар', 'восемьдесят', 'семь', 'центов']	['One', 'dollar', 'and', 'eighty-seven', 'cents']
6	And the next day would be Christmas. 	А завтра рождество. 	['А', 'завтра', 'рождество']	['And', 'the', 'next', 'day', 'would', 'be', 'Christmas']
7	There was clearly nothing to do but flop down on the shabby little couch and howl. 	Единственное, что тут можно было сделать, это хлопнуться на старенькую кушетку и зареветь. 	['Единственное', 'что', 'тут', 'можно', 'было', 'сделать', 'это', 'хлопнуться', 'на', 'старенькую', 'кушетку', 'и', 'зареветь']	['There', 'was', 'clearly', 'nothing', 'to', 'do', 'but', 'flop', 'down', 'on', 'the', 'shabby', 'little', 'couch', 'and', 'howl']
8	So Della did it. 	Именно так Делла и поступила. 	['Именно', 'так', 'Делла', 'и', 'поступила']	['So', 'Della', 'did', 'it']
9	Which instigates the moral reflection that life is made up of sobs, sniffles, and smiles, with sniffles predominating. 	Откуда напрашивается философский вывод, что жизнь состоит из слез, вздохов и улыбок, причем вздохи преобладают. 	['Откуда', 'напрашивается', 'философский', 'вывод', 'что', 'жизнь', 'состоит', 'из', 'слез', 'вздохов', 'и', 'улыбок', 'причем', 'вздохи', 'преобладают']	['Which', 'instigates', 'the', 'moral', 'reflection', 'that', 'life', 'is', 'made', 'up', 'of', 'sobs', 'sniffles', 'and', 'smiles', 'with', 'sniffles', 'predominating']
10	While the mistress of the home is gradually subsiding from the first stage to the second, take a look at the home. 	Пока хозяйка дома проходит все эти стадии, оглядим самый дом. 	['Пока', 'хозяйка', 'дома', 'проходит', 'все', 'эти', 'стадии', 'оглядим', 'самый', 'дом']	['While', 'the', 'mistress', 'of', 'the', 'home', 'is', 'gradually', 'subsiding', 'from', 'the', 'first', 'stage', 'to', 'the', 'second', 'take', 'a', 'look', 'at', 'the', 'home']
11	A furnished flat at $8 per week. 	Меблированная квартирка за восемь долларов в неделю. 	['Меблированная', 'квартирка', 'за', 'восемь', 'долларов', 'в', 'неделю']	['A', 'furnished', 'flat', 'at', '8', 'per', 'week']
12	It did not exactly beggar description, but it certainly had that word on the lookout for the mendicancy squad. 	В обстановке не то чтобы вопиющая нищета, но скорее красноречиво молчащая бедность. 	['В', 'обстановке', 'не', 'то', 'чтобы', 'вопиющая', 'нищета', 'но', 'скорее', 'красноречиво', 'молчащая', 'бедность']	['It', 'did', 'not', 'exactly', 'beggar', 'description', 'but', 'it', 'certainly', 'had', 'that', 'word', 'on', 'the', 'lookout', 'for', 'the', 'mendicancy', 'squad']
13	In the vestibule below was a letter-box into which no letter would go, and an electric button from which no mortal finger could coax a ring. 	Внизу, на парадной двери, ящик для писем, в щель которого не протиснулось бы ни одно письмо, и кнопка электрического звонка, из которой ни одному смертному не удалось бы выдавить ни звука. 	['Внизу', 'на', 'парадной', 'двери', 'ящик', 'для', 'писем', 'в', 'щель', 'которого', 'не', 'протиснулось', 'бы', 'ни', 'одно', 'письмо', 'и', 'кнопка', 'электрического', 'звонка', 'из', 'которой', 'ни', 'одному', 'смертному', 'не', 'удалось', 'бы', 'выдавить', 'ни', 'звука']	['In', 'the', 'vestibule', 'below', 'was', 'a', 'letter-box', 'into', 'which', 'no', 'letter', 'would', 'go', 'and', 'an', 'electric', 'button', 'from', 'which', 'no', 'mortal', 'finger', 'could', 'coax', 'a', 'ring']
14	Also appertaining thereunto was a card bearing the name 	К сему присовокуплялась карточка с надписью: 	['К', 'сему', 'присовокуплялась', 'карточка', 'с', 'надписью']	['Also', 'appertaining', 'thereunto', 'was', 'a', 'card', 'bearing', 'the', 'name']
15	"""Mr. James Dillingham Young."" "	«М-р Джеймс Диллингхем Юнг» 	['«М-р', 'Джеймс', 'Диллингхем', 'Юнг»']	['Mr', 'James', 'Dillingham', 'Young']
16	"The ""Dillingham"" had been flung to the breeze during a former period of prosperity when its possessor was being paid $30 per week. "	«Диллингхем» развернулось во всю длину в недавний период благосостояния, когда обладатель указанного имени получал тридцать долларов в неделю. 	['«Диллингхем»', 'развернулось', 'во', 'всю', 'длину', 'в', 'недавний', 'период', 'благосостояния', 'когда', 'обладатель', 'указанного', 'имени', 'получал', 'тридцать', 'долларов', 'в', 'неделю']	['The', 'Dillingham', 'had', 'been', 'flung', 'to', 'the', 'breeze', 'during', 'a', 'former', 'period', 'of', 'prosperity', 'when', 'its', 'possessor', 'was', 'being', 'paid', '30', 'per', 'week']
17	Now, when the income was shrunk to $20, the letters of 	Теперь, после того как этот доход понизился до двадцати долларов, буквы в слове 	['Теперь', 'после', 'того', 'как', 'этот', 'доход', 'понизился', 'до', 'двадцати', 'долларов', 'буквы', 'в', 'слове']	['Now', 'when', 'the', 'income', 'was', 'shrunk', 'to', '20', 'the', 'letters', 'of']
18	"""Dillingham"" looked blurred, as though they were thinking seriously of contracting to a modest and unassuming D. "	«Диллингхем» потускнели, словно не на шутку задумавшись: а не сократиться ли им в скромное и непритязательное «Д»? 	['«Диллингхем»', 'потускнели', 'словно', 'не', 'на', 'шутку', 'задумавшись', 'а', 'не', 'сократиться', 'ли', 'им', 'в', 'скромное', 'и', 'непритязательное', '«Д»']	['Dillingham', 'looked', 'blurred', 'as', 'though', 'they', 'were', 'thinking', 'seriously', 'of', 'contracting', 'to', 'a', 'modest', 'and', 'unassuming', 'D']
19	But whenever Mr. James Dillingham Young came home and reached his flat above he was called 	Но когда мистер Джеймс Диллингхем Юнг приходил домой и поднимался к себе на верхний этаж, его неизменно встречал возглас: 	['Но', 'когда', 'мистер', 'Джеймс', 'Диллингхем', 'Юнг', 'приходил', 'домой', 'и', 'поднимался', 'к', 'себе', 'на', 'верхний', 'этаж', 'его', 'неизменно', 'встречал', 'возглас']	['But', 'whenever', 'Mr', 'James', 'Dillingham', 'Young', 'came', 'home', 'and', 'reached', 'his', 'flat', 'above', 'he', 'was', 'called']
20	"""Jim"" and greatly hugged by Mrs. James Dillingham Young, already introduced to you as Della. "	«Джим!» и нежные объятия миссис Джеймс Диллингхем Юнг, уже представленной вам под именем Деллы. 	['«Джим!»', 'и', 'нежные', 'объятия', 'миссис', 'Джеймс', 'Диллингхем', 'Юнг', 'уже', 'представленной', 'вам', 'под', 'именем', 'Деллы']	['Jim', 'and', 'greatly', 'hugged', 'by', 'Mrs', 'James', 'Dillingham', 'Young', 'already', 'introduced', 'to', 'you', 'as', 'Della']
21	Which is all very good. 	А это, право же, очень мило. 	['А', 'это', 'право', 'же', 'очень', 'мило']	['Which', 'is', 'all', 'very', 'good']
22	Della finished her cry and attended to her cheeks with the powder rag. 	Делла кончила плакать и прошлась пуховкой по щекам. 	['Делла', 'кончила', 'плакать', 'и', 'прошлась', 'пуховкой', 'по', 'щекам']	['Della', 'finished', 'her', 'cry', 'and', 'attended', 'to', 'her', 'cheeks', 'with', 'the', 'powder', 'rag']
23	She stood by the window and looked out dully at a grey cat walking a grey fence in a grey backyard. 	Она теперь стояла у окна и уныло глядела на серую кошку, прогуливавшуюся по серому забору вдоль серого двора. 	['Она', 'теперь', 'стояла', 'у', 'окна', 'и', 'уныло', 'глядела', 'на', 'серую', 'кошку', 'прогуливавшуюся', 'по', 'серому', 'забору', 'вдоль', 'серого', 'двора']	['She', 'stood', 'by', 'the', 'window', 'and', 'looked', 'out', 'dully', 'at', 'a', 'grey', 'cat', 'walking', 'a', 'grey', 'fence', 'in', 'a', 'grey', 'backyard']
24	Tomorrow would be Christmas Day, and she had only $1.87 with which to buy Jim a present. 	Завтра рождество, а у нее только один доллар восемьдесят семь центов на подарок Джиму! 	['Завтра', 'рождество', 'а', 'у', 'нее', 'только', 'один', 'доллар', 'восемьдесят', 'семь', 'центов', 'на', 'подарок', 'Джиму']	['Tomorrow', 'would', 'be', 'Christmas', 'Day', 'and', 'she', 'had', 'only', '1.87', 'with', 'which', 'to', 'buy', 'Jim', 'a', 'present']
25	She had been saving every penny she could for months, with this result. 	Долгие месяцы она выгадывала буквально каждый цент, и вот все, чего она достигла. 	['Долгие', 'месяцы', 'она', 'выгадывала', 'буквально', 'каждый', 'цент', 'и', 'вот', 'все', 'чего', 'она', 'достигла']	['She', 'had', 'been', 'saving', 'every', 'penny', 'she', 'could', 'for', 'months', 'with', 'this', 'result']
26	Twenty dollars a week doesn't go far. 	На двадцать долларов в неделю далеко не уедешь. 	['На', 'двадцать', 'долларов', 'в', 'неделю', 'далеко', 'не', 'уедешь']	"['Twenty', 'dollars', 'a', 'week', ""doesn't"", 'go', 'far']"
27	Expenses had been greater than she had calculated. 	Расходы оказались больше, чем она рассчитывала. 	['Расходы', 'оказались', 'больше', 'чем', 'она', 'рассчитывала']	['Expenses', 'had', 'been', 'greater', 'than', 'she', 'had', 'calculated']
28	They always are. 	С расходами всегда так бывает. 	['С', 'расходами', 'всегда', 'так', 'бывает']	['They', 'always', 'are']
29	Only $1.87 to buy a present for Jim. 	Только доллар восемьдесят семь центов на подарок Джиму! 	['Только', 'доллар', 'восемьдесят', 'семь', 'центов', 'на', 'подарок', 'Джиму']	['Only', '1.87', 'to', 'buy', 'a', 'present', 'for', 'Jim']
30	Her Jim. 	Ее Джиму! 	['Ее', 'Джиму']	['Her', 'Jim']
31	Many a happy hour she had spent planning for something nice for him. 	Сколько радостных часов она провела, придумывая, что бы такое ему подарить к рождеству. 	['Сколько', 'радостных', 'часов', 'она', 'провела', 'придумывая', 'что', 'бы', 'такое', 'ему', 'подарить', 'к', 'рождеству']	['Many', 'a', 'happy', 'hour', 'she', 'had', 'spent', 'planning', 'for', 'something', 'nice', 'for', 'him']
32	Something fine and rare and sterling—something just a little bit near to being worthy of the honour of being owned by Jim. 	Что-нибудь совсем особенное, редкостное, драгоценное, что-нибудь, хоть чуть-чуть достойное высокой чести принадлежать Джиму. 	['Что-нибудь', 'совсем', 'особенное', 'редкостное', 'драгоценное', 'что-нибудь', 'хоть', 'чуть-чуть', 'достойное', 'высокой', 'чести', 'принадлежать', 'Джиму']	['Something', 'fine', 'and', 'rare', 'and', 'sterling—something', 'just', 'a', 'little', 'bit', 'near', 'to', 'being', 'worthy', 'of', 'the', 'honour', 'of', 'being', 'owned', 'by', 'Jim']
33	There was a pier-glass between the windows of the room. 	В простенке между окнами стояло трюмо. 	['В', 'простенке', 'между', 'окнами', 'стояло', 'трюмо']	['There', 'was', 'a', 'pier-glass', 'between', 'the', 'windows', 'of', 'the', 'room']
34	Perhaps you have seen a pier-glass in an $8 flat. 	Вам никогда не приходилось смотреться в трюмо восьмидолларовой меблированной квартиры? 	['Вам', 'никогда', 'не', 'приходилось', 'смотреться', 'в', 'трюмо', 'восьмидолларовой', 'меблированной', 'квартиры']	['Perhaps', 'you', 'have', 'seen', 'a', 'pier-glass', 'in', 'an', '8', 'flat']
35	A very thin and very agile person may, by observing his reflection in a rapid sequence of longitudinal strips, obtain a fairly accurate conception of his looks. 	Очень худой и очень подвижной человек может, наблюдая последовательную смену отражений в его узких створках, составить себе довольно точное представление о собственной внешности. 	['Очень', 'худой', 'и', 'очень', 'подвижной', 'человек', 'может', 'наблюдая', 'последовательную', 'смену', 'отражений', 'в', 'его', 'узких', 'створках', 'составить', 'себе', 'довольно', 'точное', 'представление', 'о', 'собственной', 'внешности']	['A', 'very', 'thin', 'and', 'very', 'agile', 'person', 'may', 'by', 'observing', 'his', 'reflection', 'in', 'a', 'rapid', 'sequence', 'of', 'longitudinal', 'strips', 'obtain', 'a', 'fairly', 'accurate', 'conception', 'of', 'his', 'looks']
36	Della, being slender, had mastered the art. 	Делле, которая была хрупкого сложения, удалось овладеть этим искусством. 	['Делле', 'которая', 'была', 'хрупкого', 'сложения', 'удалось', 'овладеть', 'этим', 'искусством']	['Della', 'being', 'slender', 'had', 'mastered', 'the', 'art']
37	Suddenly she whirled from the window and stood before the glass. 	Она вдруг отскочила от окна и бросилась к зеркалу. 	['Она', 'вдруг', 'отскочила', 'от', 'окна', 'и', 'бросилась', 'к', 'зеркалу']	['Suddenly', 'she', 'whirled', 'from', 'the', 'window', 'and', 'stood', 'before', 'the', 'glass']
38	Her eyes were shining brilliantly, but her face had lost its colour within twenty seconds. 	Глаза ее сверкали, но с лица за двадцать секунд сбежали краски. 	['Глаза', 'ее', 'сверкали', 'но', 'с', 'лица', 'за', 'двадцать', 'секунд', 'сбежали', 'краски']	['Her', 'eyes', 'were', 'shining', 'brilliantly', 'but', 'her', 'face', 'had', 'lost', 'its', 'colour', 'within', 'twenty', 'seconds']
39	Rapidly she pulled down her hair and let it fall to its full length. 	Быстрым движением она вытащила шпильки и распустила волосы. 	['Быстрым', 'движением', 'она', 'вытащила', 'шпильки', 'и', 'распустила', 'волосы']	['Rapidly', 'she', 'pulled', 'down', 'her', 'hair', 'and', 'let', 'it', 'fall', 'to', 'its', 'full', 'length']
40	Now, there were two possessions of the James Dillingham Youngs in which they both took a mighty pride. 	Надо вам сказать, что у четы Джеймс. 	['Надо', 'вам', 'сказать', 'что', 'у', 'четы', 'Джеймс']	['Now', 'there', 'were', 'two', 'possessions', 'of', 'the', 'James', 'Dillingham', 'Youngs', 'in', 'which', 'they', 'both', 'took', 'a', 'mighty', 'pride']
41	One was Jim's gold watch that had been his father's and his grandfather's. 	Диллингхем Юнг было два сокровища, составлявших предмет их гордости. 	['Диллингхем', 'Юнг', 'было', 'два', 'сокровища', 'составлявших', 'предмет', 'их', 'гордости']	"['One', 'was', ""Jim's"", 'gold', 'watch', 'that', 'had', 'been', 'his', ""father's"", 'and', 'his', ""grandfather's""]"
42	The other was Della's hair. 	Одно — золотые часы Джима, принадлежавшие его отцу и деду, другое — волосы Деллы. 	['Одно', '—', 'золотые', 'часы', 'Джима', 'принадлежавшие', 'его', 'отцу', 'и', 'деду', 'другое', '—', 'волосы', 'Деллы']	"['The', 'other', 'was', ""Della's"", 'hair']"
43	Had the Queen of Sheba lived in the flat across the airshaft, Della would have let her hair hang out the window some day to dry just to depreciate Her Majesty's jewels and gifts. 	Если бы царица Савская проживала в доме напротив, Делла, помыв голову, непременно просушивала бы у окна распущенные волосы — специально для того, чтобы заставить померкнуть все наряди и украшения ее величества. 	['Если', 'бы', 'царица', 'Савская', 'проживала', 'в', 'доме', 'напротив', 'Делла', 'помыв', 'голову', 'непременно', 'просушивала', 'бы', 'у', 'окна', 'распущенные', 'волосы', '—', 'специально', 'для', 'того', 'чтобы', 'заставить', 'померкнуть', 'все', 'наряди', 'и', 'украшения', 'ее', 'величества']	"['Had', 'the', 'Queen', 'of', 'Sheba', 'lived', 'in', 'the', 'flat', 'across', 'the', 'airshaft', 'Della', 'would', 'have', 'let', 'her', 'hair', 'hang', 'out', 'the', 'window', 'some', 'day', 'to', 'dry', 'just', 'to', 'depreciate', 'Her', ""Majesty's"", 'jewels', 'and', 'gifts']"
44	Had King Solomon been the janitor, with all his treasures piled up in the basement, Jim would have pulled out his watch every time he passed, just to see him pluck at his beard from envy. 	Если бы царь Соломон служил в том же доме швейцаром и хранил в подвале все свои богатства, Джим, проходя мимо; всякий раз доставал бы часы из кармана — специально для того, чтобы увидеть, как он рвет на себе бороду от зависти. 	['Если', 'бы', 'царь', 'Соломон', 'служил', 'в', 'том', 'же', 'доме', 'швейцаром', 'и', 'хранил', 'в', 'подвале', 'все', 'свои', 'богатства', 'Джим', 'проходя', 'мимо', 'всякий', 'раз', 'доставал', 'бы', 'часы', 'из', 'кармана', '—', 'специально', 'для', 'того', 'чтобы', 'увидеть', 'как', 'он', 'рвет', 'на', 'себе', 'бороду', 'от', 'зависти']	['Had', 'King', 'Solomon', 'been', 'the', 'janitor', 'with', 'all', 'his', 'treasures', 'piled', 'up', 'in', 'the', 'basement', 'Jim', 'would', 'have', 'pulled', 'out', 'his', 'watch', 'every', 'time', 'he', 'passed', 'just', 'to', 'see', 'him', 'pluck', 'at', 'his', 'beard', 'from', 'envy']
45	So now Della's beautiful hair fell about her, rippling and shining like a cascade of brown waters. 	И вот прекрасные волосы Деллы рассыпались, блестя и переливаясь, точно струи каштанового водопада. 	['И', 'вот', 'прекрасные', 'волосы', 'Деллы', 'рассыпались', 'блестя', 'и', 'переливаясь', 'точно', 'струи', 'каштанового', 'водопада']	"['So', 'now', ""Della's"", 'beautiful', 'hair', 'fell', 'about', 'her', 'rippling', 'and', 'shining', 'like', 'a', 'cascade', 'of', 'brown', 'waters']"
46	It reached below her knee and made itself almost a garment for her. 	Они спускались ниже колен и плащом окутывали почти всю ее фигуру. 	['Они', 'спускались', 'ниже', 'колен', 'и', 'плащом', 'окутывали', 'почти', 'всю', 'ее', 'фигуру']	['It', 'reached', 'below', 'her', 'knee', 'and', 'made', 'itself', 'almost', 'a', 'garment', 'for', 'her']
47	And then she did it up again nervously and quickly. 	Но она тотчас же, нервничая и торопясь, принялась снова подбирать их. 	['Но', 'она', 'тотчас', 'же', 'нервничая', 'и', 'торопясь', 'принялась', 'снова', 'подбирать', 'их']	['And', 'then', 'she', 'did', 'it', 'up', 'again', 'nervously', 'and', 'quickly']
48	Once she faltered for a minute and stood still while a tear or two splashed on the worn red carpet. 	Потом, словно заколебавшись, с минуту стояла неподвижно, и две или три слезинки упали на ветхий красный ковер. 	['Потом', 'словно', 'заколебавшись', 'с', 'минуту', 'стояла', 'неподвижно', 'и', 'две', 'или', 'три', 'слезинки', 'упали', 'на', 'ветхий', 'красный', 'ковер']	['Once', 'she', 'faltered', 'for', 'a', 'minute', 'and', 'stood', 'still', 'while', 'a', 'tear', 'or', 'two', 'splashed', 'on', 'the', 'worn', 'red', 'carpet']
