	en	ru	ru_tokens	en_tokens
49	On went her old brown jacket; on went her old brown hat. With a whirl of skirts and with the brilliant sparkle still in her eyes, she fluttered out the door and down the stairs to the street. 	Старенький коричневый жакет на плечи, старенькую коричневую шляпку на голову — и, взметнув юбками, сверкнув невысохшими блестками в глазах, она уже мчалась вниз, на улицу. 	['Старенький', 'коричневый', 'жакет', 'на', 'плечи', 'старенькую', 'коричневую', 'шляпку', 'на', 'голову', '—', 'и', 'взметнув', 'юбками', 'сверкнув', 'невысохшими', 'блестками', 'в', 'глазах', 'она', 'уже', 'мчалась', 'вниз', 'на', 'улицу']	['On', 'went', 'her', 'old', 'brown', 'jacket', 'on', 'went', 'her', 'old', 'brown', 'hat', 'With', 'a', 'whirl', 'of', 'skirts', 'and', 'with', 'the', 'brilliant', 'sparkle', 'still', 'in', 'her', 'eyes', 'she', 'fluttered', 'out', 'the', 'door', 'and', 'down', 'the', 'stairs', 'to', 'the', 'street']
50	Where she stopped the sign read: 	Вывеска, у которой она остановилась, гласила: 	['Вывеска', 'у', 'которой', 'она', 'остановилась', 'гласила']	['Where', 'she', 'stopped', 'the', 'sign', 'read']
51	"""Mme. Sofronie. "	«M-me Sophronie. 	['«M-me', 'Sophronie']	['Mme', 'Sofronie']
52	"Hair Goods of All Kinds."" One flight up Della ran, and collected herself, panting. Madame, large, too white, chilly, hardly looked the ""Sofronie."" "	Всевозможные изделия из волос», Делла взбежала на второй этаж и остановилась, с трудом переводя дух. 	['Всевозможные', 'изделия', 'из', 'волос»', 'Делла', 'взбежала', 'на', 'второй', 'этаж', 'и', 'остановилась', 'с', 'трудом', 'переводя', 'дух']	['Hair', 'Goods', 'of', 'All', 'Kinds', 'One', 'flight', 'up', 'Della', 'ran', 'and', 'collected', 'herself', 'panting', 'Madame', 'large', 'too', 'white', 'chilly', 'hardly', 'looked', 'the', 'Sofronie']
53	"""Will you buy my hair?"" asked Della. "	— Не купите ли вы мои волосы? — спросила она у мадам. 	['—', 'Не', 'купите', 'ли', 'вы', 'мои', 'волосы', '—', 'спросила', 'она', 'у', 'мадам']	['Will', 'you', 'buy', 'my', 'hair', 'asked', 'Della']
54	"""I buy hair,"" said Madame. "	— Я покупаю волосы, — ответила мадам. 	['—', 'Я', 'покупаю', 'волосы', '—', 'ответила', 'мадам']	['I', 'buy', 'hair', 'said', 'Madame']
55	"""Take yer hat off and let's have a sight at the looks of it."" "	— Снимите шляпу, надо посмотреть товар. 	['—', 'Снимите', 'шляпу', 'надо', 'посмотреть', 'товар']	"['Take', 'yer', 'hat', 'off', 'and', ""let's"", 'have', 'a', 'sight', 'at', 'the', 'looks', 'of', 'it']"
56	Down rippled the brown cascade. 	Снова заструился каштановый водопад. 	['Снова', 'заструился', 'каштановый', 'водопад']	['Down', 'rippled', 'the', 'brown', 'cascade']
57	"""Twenty dollars,"" said Madame, lifting the mass with a practised hand. "	— Двадцать долларов, — сказала мадам, привычно взвешивая на руке густую массу. 	['—', 'Двадцать', 'долларов', '—', 'сказала', 'мадам', 'привычно', 'взвешивая', 'на', 'руке', 'густую', 'массу']	['Twenty', 'dollars', 'said', 'Madame', 'lifting', 'the', 'mass', 'with', 'a', 'practised', 'hand']
58	"""Give it to me quick,"" said Della. "	— Давайте скорее, — сказала Делла. 	['—', 'Давайте', 'скорее', '—', 'сказала', 'Делла']	['Give', 'it', 'to', 'me', 'quick', 'said', 'Della']
59	Oh, and the next two hours tripped by on rosy wings. Forget the hashed metaphor. 	Следующие два часа пролетели на розовых крыльях — прошу прощенья за избитую метафору. 	['Следующие', 'два', 'часа', 'пролетели', 'на', 'розовых', 'крыльях', '—', 'прошу', 'прощенья', 'за', 'избитую', 'метафору']	['Oh', 'and', 'the', 'next', 'two', 'hours', 'tripped', 'by', 'on', 'rosy', 'wings', 'Forget', 'the', 'hashed', 'metaphor']
60	She was ransacking the stores for Jim's present. 	Делла рыскала по магазинам в поисках подарка для Джима. 	['Делла', 'рыскала', 'по', 'магазинам', 'в', 'поисках', 'подарка', 'для', 'Джима']	"['She', 'was', 'ransacking', 'the', 'stores', 'for', ""Jim's"", 'present']"
61	She found it at last. 	Наконец, она нашла. 	['Наконец', 'она', 'нашла']	['She', 'found', 'it', 'at', 'last']
62	It surely had been made for Jim and no one else. 	Без сомнения, что было создано для Джима, и только для него. 	['Без', 'сомнения', 'что', 'было', 'создано', 'для', 'Джима', 'и', 'только', 'для', 'него']	['It', 'surely', 'had', 'been', 'made', 'for', 'Jim', 'and', 'no', 'one', 'else']
63	There was no other like it in any of the stores, and she had turned all of them inside out. It was a platinum fob chain simple and chaste in design, properly proclaiming its value by substance alone and not by meretricious ornamentation—as all good things should do. 	Ничего подобного не нашлось в других магазинах, а уж она все в них перевернула вверх дном, Это была платиновая цепочка для карманных часов, простого и строгого рисунка, пленявшая истинными своими качествами, а не показным блеском, — такими и должны быть все хорошие вещи. 	['Ничего', 'подобного', 'не', 'нашлось', 'в', 'других', 'магазинах', 'а', 'уж', 'она', 'все', 'в', 'них', 'перевернула', 'вверх', 'дном', 'Это', 'была', 'платиновая', 'цепочка', 'для', 'карманных', 'часов', 'простого', 'и', 'строгого', 'рисунка', 'пленявшая', 'истинными', 'своими', 'качествами', 'а', 'не', 'показным', 'блеском', '—', 'такими', 'и', 'должны', 'быть', 'все', 'хорошие', 'вещи']	['There', 'was', 'no', 'other', 'like', 'it', 'in', 'any', 'of', 'the', 'stores', 'and', 'she', 'had', 'turned', 'all', 'of', 'them', 'inside', 'out', 'It', 'was', 'a', 'platinum', 'fob', 'chain', 'simple', 'and', 'chaste', 'in', 'design', 'properly', 'proclaiming', 'its', 'value', 'by', 'substance', 'alone', 'and', 'not', 'by', 'meretricious', 'ornamentation—as', 'all', 'good', 'things', 'should', 'do']
64	It was even worthy of The Watch. 	Ее, пожалуй, даже можно было признать достойной часов. 	['Ее', 'пожалуй', 'даже', 'можно', 'было', 'признать', 'достойной', 'часов']	['It', 'was', 'even', 'worthy', 'of', 'The', 'Watch']
65	As soon as she saw it she knew that it must be Jim's. It was like him. 	Как только Делла увидела ее, она поняла, что цепочка должна принадлежать Джиму, Она была такая же, как сам Джим. 	['Как', 'только', 'Делла', 'увидела', 'ее', 'она', 'поняла', 'что', 'цепочка', 'должна', 'принадлежать', 'Джиму', 'Она', 'была', 'такая', 'же', 'как', 'сам', 'Джим']	"['As', 'soon', 'as', 'she', 'saw', 'it', 'she', 'knew', 'that', 'it', 'must', 'be', ""Jim's"", 'It', 'was', 'like', 'him']"
66	Quietness and value—the description applied to both. 	Скромность и достоинство — эти качества отличали обоих. 	['Скромность', 'и', 'достоинство', '—', 'эти', 'качества', 'отличали', 'обоих']	['Quietness', 'and', 'value—the', 'description', 'applied', 'to', 'both']
67	Twenty-one dollars they took from her for it, and she hurried home with the 87 cents. 	Двадцать один доллар пришлось уплатить в кассу, и Делла поспешила домой с восемьюдесятью семью центами в кармане. 	['Двадцать', 'один', 'доллар', 'пришлось', 'уплатить', 'в', 'кассу', 'и', 'Делла', 'поспешила', 'домой', 'с', 'восемьюдесятью', 'семью', 'центами', 'в', 'кармане']	['Twenty-one', 'dollars', 'they', 'took', 'from', 'her', 'for', 'it', 'and', 'she', 'hurried', 'home', 'with', 'the', '87', 'cents']
68	With that chain on his watch Jim might be properly anxious about the time in any company. 	При такой цепочке Джиму в любом обществе не зазорно будет поинтересоваться, который час. 	['При', 'такой', 'цепочке', 'Джиму', 'в', 'любом', 'обществе', 'не', 'зазорно', 'будет', 'поинтересоваться', 'который', 'час']	['With', 'that', 'chain', 'on', 'his', 'watch', 'Jim', 'might', 'be', 'properly', 'anxious', 'about', 'the', 'time', 'in', 'any', 'company']
69	Grand as the watch was, he sometimes looked at it on the sly on account of the old leather strap that he used in place of a chain. 	Как ни великолепны были его часы, а смотрел он на них часто украдкой, потому что они висели на дрянном кожаном ремешке. 	['Как', 'ни', 'великолепны', 'были', 'его', 'часы', 'а', 'смотрел', 'он', 'на', 'них', 'часто', 'украдкой', 'потому', 'что', 'они', 'висели', 'на', 'дрянном', 'кожаном', 'ремешке']	['Grand', 'as', 'the', 'watch', 'was', 'he', 'sometimes', 'looked', 'at', 'it', 'on', 'the', 'sly', 'on', 'account', 'of', 'the', 'old', 'leather', 'strap', 'that', 'he', 'used', 'in', 'place', 'of', 'a', 'chain']
70	When Della reached home her intoxication gave way a little to prudence and reason. 	Дома оживление Деллы поулеглось и уступило место предусмотрительности и расчету. 	['Дома', 'оживление', 'Деллы', 'поулеглось', 'и', 'уступило', 'место', 'предусмотрительности', 'и', 'расчету']	['When', 'Della', 'reached', 'home', 'her', 'intoxication', 'gave', 'way', 'a', 'little', 'to', 'prudence', 'and', 'reason']
71	She got out her curling irons and lighted the gas and went to work repairing the ravages made by generosity added to love. 	Она достала щипцы для завивки, зажгла газ и принялась исправлять разрушения, причиненные великодушием в сочетании с любовью. 	['Она', 'достала', 'щипцы', 'для', 'завивки', 'зажгла', 'газ', 'и', 'принялась', 'исправлять', 'разрушения', 'причиненные', 'великодушием', 'в', 'сочетании', 'с', 'любовью']	['She', 'got', 'out', 'her', 'curling', 'irons', 'and', 'lighted', 'the', 'gas', 'and', 'went', 'to', 'work', 'repairing', 'the', 'ravages', 'made', 'by', 'generosity', 'added', 'to', 'love']
72	Which is always a tremendous task, dear friends—a mammoth task. 	А это всегда тягчайший труд, друзья мои, исполинский труд. 	['А', 'это', 'всегда', 'тягчайший', 'труд', 'друзья', 'мои', 'исполинский', 'труд']	['Which', 'is', 'always', 'a', 'tremendous', 'task', 'dear', 'friends—a', 'mammoth', 'task']
73	Within forty minutes her head was covered with tiny, close-lying curls that made her look wonderfully like a truant schoolboy. 	Не прошло и сорока минут, как ее голова покрылась крутыми мелкими локончиками, которые сделали ее удивительно похожей на мальчишку, удравшего с уроков. 	['Не', 'прошло', 'и', 'сорока', 'минут', 'как', 'ее', 'голова', 'покрылась', 'крутыми', 'мелкими', 'локончиками', 'которые', 'сделали', 'ее', 'удивительно', 'похожей', 'на', 'мальчишку', 'удравшего', 'с', 'уроков']	['Within', 'forty', 'minutes', 'her', 'head', 'was', 'covered', 'with', 'tiny', 'close-lying', 'curls', 'that', 'made', 'her', 'look', 'wonderfully', 'like', 'a', 'truant', 'schoolboy']
74	She looked at her reflection in the mirror long, carefully, and critically. 	Она посмотрела на себя в зеркало долгим, внимательным и критическим взглядом. 	['Она', 'посмотрела', 'на', 'себя', 'в', 'зеркало', 'долгим', 'внимательным', 'и', 'критическим', 'взглядом']	['She', 'looked', 'at', 'her', 'reflection', 'in', 'the', 'mirror', 'long', 'carefully', 'and', 'critically']
75	"""If Jim doesn't kill me,"" she said to herself, ""before he takes a second look at me, he'll say I look like a Coney Island chorus girl. "	«Ну, — сказала она себе, — если Джим не убьет меня сразу, как только взглянет, он решит, что я похожа на хористку с Кони-Айленда. 	['«Ну', '—', 'сказала', 'она', 'себе', '—', 'если', 'Джим', 'не', 'убьет', 'меня', 'сразу', 'как', 'только', 'взглянет', 'он', 'решит', 'что', 'я', 'похожа', 'на', 'хористку', 'с', 'Кони-Айленда']	"['If', 'Jim', ""doesn't"", 'kill', 'me', 'she', 'said', 'to', 'herself', 'before', 'he', 'takes', 'a', 'second', 'look', 'at', 'me', ""he'll"", 'say', 'I', 'look', 'like', 'a', 'Coney', 'Island', 'chorus', 'girl']"
76	"But what could I do—oh! what could I do with a dollar and eighty-seven cents?"" "	Но что же мне было делать, ах, что же мне было делать, раз у меня был только доллар и восемьдесят семь центов!» 	['Но', 'что', 'же', 'мне', 'было', 'делать', 'ах', 'что', 'же', 'мне', 'было', 'делать', 'раз', 'у', 'меня', 'был', 'только', 'доллар', 'и', 'восемьдесят', 'семь', 'центов!»']	['But', 'what', 'could', 'I', 'do—oh', 'what', 'could', 'I', 'do', 'with', 'a', 'dollar', 'and', 'eighty-seven', 'cents']
77	At 7 o'clock the coffee was made and the frying-pan was on the back of the stove hot and ready to cook the chops. 	В семь часов кофе был сварен, раскаленная сковорода стояла на газовой плите, дожидаясь бараньих котлеток 	['В', 'семь', 'часов', 'кофе', 'был', 'сварен', 'раскаленная', 'сковорода', 'стояла', 'на', 'газовой', 'плите', 'дожидаясь', 'бараньих', 'котлеток']	"['At', '7', ""o'clock"", 'the', 'coffee', 'was', 'made', 'and', 'the', 'frying-pan', 'was', 'on', 'the', 'back', 'of', 'the', 'stove', 'hot', 'and', 'ready', 'to', 'cook', 'the', 'chops']"
78	Jim was never late. 	Джим никогда не запаздывал. 	['Джим', 'никогда', 'не', 'запаздывал']	['Jim', 'was', 'never', 'late']
79	Della doubled the fob chain in her hand and sat on the corner of the table near the door that he always entered. 	Делла зажала платиновую цепочку в руке и уселась на краешек стола поближе к входной двери. 	['Делла', 'зажала', 'платиновую', 'цепочку', 'в', 'руке', 'и', 'уселась', 'на', 'краешек', 'стола', 'поближе', 'к', 'входной', 'двери']	['Della', 'doubled', 'the', 'fob', 'chain', 'in', 'her', 'hand', 'and', 'sat', 'on', 'the', 'corner', 'of', 'the', 'table', 'near', 'the', 'door', 'that', 'he', 'always', 'entered']
80	Then she heard his step on the stair away down on the first flight, and she turned white for just a moment. 	Вскоре она услышала его шаги внизу на лестнице и на мгновение побледнела. 	['Вскоре', 'она', 'услышала', 'его', 'шаги', 'внизу', 'на', 'лестнице', 'и', 'на', 'мгновение', 'побледнела']	['Then', 'she', 'heard', 'his', 'step', 'on', 'the', 'stair', 'away', 'down', 'on', 'the', 'first', 'flight', 'and', 'she', 'turned', 'white', 'for', 'just', 'a', 'moment']
81	She had a habit for saying little silent prayers about the simplest everyday things, and now she whispered: 	У нее была привычка обращаться к богу с коротенькими молитвами по поводу всяких житейских мелочей, и она торопливо зашептала: 	['У', 'нее', 'была', 'привычка', 'обращаться', 'к', 'богу', 'с', 'коротенькими', 'молитвами', 'по', 'поводу', 'всяких', 'житейских', 'мелочей', 'и', 'она', 'торопливо', 'зашептала']	['She', 'had', 'a', 'habit', 'for', 'saying', 'little', 'silent', 'prayers', 'about', 'the', 'simplest', 'everyday', 'things', 'and', 'now', 'she', 'whispered']
82	"""Please God, make him think I am still pretty."" "	— Господи, сделай так, чтобы я ему не разонравилась. 	['—', 'Господи', 'сделай', 'так', 'чтобы', 'я', 'ему', 'не', 'разонравилась']	['Please', 'God', 'make', 'him', 'think', 'I', 'am', 'still', 'pretty']
83	The door opened and Jim stepped in and closed it. 	Дверь отворилась, Джим вошел и закрыл ее за собой. 	['Дверь', 'отворилась', 'Джим', 'вошел', 'и', 'закрыл', 'ее', 'за', 'собой']	['The', 'door', 'opened', 'and', 'Jim', 'stepped', 'in', 'and', 'closed', 'it']
84	He looked thin and very serious. 	У него было худое, озабоченное лицо. 	['У', 'него', 'было', 'худое', 'озабоченное', 'лицо']	['He', 'looked', 'thin', 'and', 'very', 'serious']
85	Poor fellow, he was only twenty-two—and to be burdened with a family! 	Нелегкое дело в двадцать два года быть обремененным семьей! 	['Нелегкое', 'дело', 'в', 'двадцать', 'два', 'года', 'быть', 'обремененным', 'семьей']	['Poor', 'fellow', 'he', 'was', 'only', 'twenty-two—and', 'to', 'be', 'burdened', 'with', 'a', 'family']
86	He needed a new overcoat and he was without gloves. 	Ему уже давно нужно было новое пальто, и руки мерзли без перчаток. 	['Ему', 'уже', 'давно', 'нужно', 'было', 'новое', 'пальто', 'и', 'руки', 'мерзли', 'без', 'перчаток']	['He', 'needed', 'a', 'new', 'overcoat', 'and', 'he', 'was', 'without', 'gloves']
87	Jim stopped inside the door, as immovable as a setter at the scent of quail. 	Джим неподвижно замер у дверей, точно сеттера учуявший перепела. 	['Джим', 'неподвижно', 'замер', 'у', 'дверей', 'точно', 'сеттера', 'учуявший', 'перепела']	['Jim', 'stopped', 'inside', 'the', 'door', 'as', 'immovable', 'as', 'a', 'setter', 'at', 'the', 'scent', 'of', 'quail']
88	His eyes were fixed upon Della, and there was an expression in them that she could not read, and it terrified her. 	Его глаза остановились на Делле с выражением, которого она не могла понять, и ей стало Страшно. 	['Его', 'глаза', 'остановились', 'на', 'Делле', 'с', 'выражением', 'которого', 'она', 'не', 'могла', 'понять', 'и', 'ей', 'стало', 'Страшно']	['His', 'eyes', 'were', 'fixed', 'upon', 'Della', 'and', 'there', 'was', 'an', 'expression', 'in', 'them', 'that', 'she', 'could', 'not', 'read', 'and', 'it', 'terrified', 'her']
89	It was not anger, nor surprise, nor disapproval, nor horror, nor any of the sentiments that she had been prepared for. 	Это не был ни гнев, ни удивление, ни упрек, ни ужас — ни одно из тех чувств, которых можно было бы ожидать. 	['Это', 'не', 'был', 'ни', 'гнев', 'ни', 'удивление', 'ни', 'упрек', 'ни', 'ужас', '—', 'ни', 'одно', 'из', 'тех', 'чувств', 'которых', 'можно', 'было', 'бы', 'ожидать']	['It', 'was', 'not', 'anger', 'nor', 'surprise', 'nor', 'disapproval', 'nor', 'horror', 'nor', 'any', 'of', 'the', 'sentiments', 'that', 'she', 'had', 'been', 'prepared', 'for']
90	He simply stared at her fixedly with that peculiar expression on his face. 	Он просто смотрел на нее, не отрывая взгляда, в лицо его не меняло своего странного выражения. 	['Он', 'просто', 'смотрел', 'на', 'нее', 'не', 'отрывая', 'взгляда', 'в', 'лицо', 'его', 'не', 'меняло', 'своего', 'странного', 'выражения']	['He', 'simply', 'stared', 'at', 'her', 'fixedly', 'with', 'that', 'peculiar', 'expression', 'on', 'his', 'face']
91	Della wriggled off the table and went for him. 	Делла соскочила со стола и бросилась к нему. 	['Делла', 'соскочила', 'со', 'стола', 'и', 'бросилась', 'к', 'нему']	['Della', 'wriggled', 'off', 'the', 'table', 'and', 'went', 'for', 'him']
92	"""Jim, darling,"" she cried, ""don't look at me that way. "	— Джим, милый, — закричала она, — не смотри на меня так. 	['—', 'Джим', 'милый', '—', 'закричала', 'она', '—', 'не', 'смотри', 'на', 'меня', 'так']	"['Jim', 'darling', 'she', 'cried', ""don't"", 'look', 'at', 'me', 'that', 'way']"
93	I had my hair cut off and sold because I couldn't have lived through Christmas without giving you a present. 	Я остригла волосы и продала их, потому что я не пережила бы, если б мне нечего было подарить тебе к рождеству. Они опять отрастут. 	['Я', 'остригла', 'волосы', 'и', 'продала', 'их', 'потому', 'что', 'я', 'не', 'пережила', 'бы', 'если', 'б', 'мне', 'нечего', 'было', 'подарить', 'тебе', 'к', 'рождеству', 'Они', 'опять', 'отрастут']	"['I', 'had', 'my', 'hair', 'cut', 'off', 'and', 'sold', 'because', 'I', ""couldn't"", 'have', 'lived', 'through', 'Christmas', 'without', 'giving', 'you', 'a', 'present']"
94	It'll grow out again—you won't mind, will you? 	Ты ведь не сердишься, правда? 	['Ты', 'ведь', 'не', 'сердишься', 'правда']	"[""It'll"", 'grow', 'out', 'again—you', ""won't"", 'mind', 'will', 'you']"
95	I just had to do it. 	Я не могла иначе. 	['Я', 'не', 'могла', 'иначе']	['I', 'just', 'had', 'to', 'do', 'it']
96	My hair grows awfully fast. 	У меня очень быстро растут волосы. 	['У', 'меня', 'очень', 'быстро', 'растут', 'волосы']	['My', 'hair', 'grows', 'awfully', 'fast']
97	Say 'Merry Christmas!' Jim, and let's be happy. 	Ну, поздравь меня с рождеством, Джим, и давай радоваться празднику. 	['Ну', 'поздравь', 'меня', 'с', 'рождеством', 'Джим', 'и', 'давай', 'радоваться', 'празднику']	"['Say', ""'Merry"", ""Christmas!'"", 'Jim', 'and', ""let's"", 'be', 'happy']"
