	en	ru	ru_tokens	en_tokens
0	Mr. Towers Chandler was pressing his evening suit in his hall bedroom. 	Мистер Тауэрс Чендлер гладил у себя в комнатушке свой выходной костюм. 	['Мистер', 'Тауэрс', 'Чендлер', 'гладил', 'у', 'себя', 'в', 'комнатушке', 'свой', 'выходной', 'костюм']	['Mr', 'Towers', 'Chandler', 'was', 'pressing', 'his', 'evening', 'suit', 'in', 'his', 'hall', 'bedroom']
1	One iron was heating on a small gas stove; the other was being pushed vigorously back and forth to make the desirable crease that would be seen later on extending in straight lines from Mr. Chandler's patent leather shoes to the edge of his low-cut vest. 	Один утюг грелся на газовой плитке, а другим он — энергично водил взад и вперед, добиваясь желаемой складки; спустя некоторое время можно будет видеть, как она протянется, прямая, словно стрела от его лакированных ботинок до края жилета с низким вырезом. 	['Один', 'утюг', 'грелся', 'на', 'газовой', 'плитке', 'а', 'другим', 'он', '—', 'энергично', 'водил', 'взад', 'и', 'вперед', 'добиваясь', 'желаемой', 'складки', 'спустя', 'некоторое', 'время', 'можно', 'будет', 'видеть', 'как', 'она', 'протянется', 'прямая', 'словно', 'стрела', 'от', 'его', 'лакированных', 'ботинок', 'до', 'края', 'жилета', 'с', 'низким', 'вырезом']	"['One', 'iron', 'was', 'heating', 'on', 'a', 'small', 'gas', 'stove', 'the', 'other', 'was', 'being', 'pushed', 'vigorously', 'back', 'and', 'forth', 'to', 'make', 'the', 'desirable', 'crease', 'that', 'would', 'be', 'seen', 'later', 'on', 'extending', 'in', 'straight', 'lines', 'from', 'Mr', ""Chandler's"", 'patent', 'leather', 'shoes', 'to', 'the', 'edge', 'of', 'his', 'low-cut', 'vest']"
2	So much of the hero's toilet may be intrusted to our confidence. 	Вот и все о туалете нашего героя, что можно довести до всеобщего сведения. 	['Вот', 'и', 'все', 'о', 'туалете', 'нашего', 'героя', 'что', 'можно', 'довести', 'до', 'всеобщего', 'сведения']	"['So', 'much', 'of', 'the', ""hero's"", 'toilet', 'may', 'be', 'intrusted', 'to', 'our', 'confidence']"
3	The remainder may be guessed by those whom genteel poverty has driven to ignoble expedient. 	Об остальном пусть догадываются те, кого благородная нищета толкает на жалкие уловки. 	['Об', 'остальном', 'пусть', 'догадываются', 'те', 'кого', 'благородная', 'нищета', 'толкает', 'на', 'жалкие', 'уловки']	['The', 'remainder', 'may', 'be', 'guessed', 'by', 'those', 'whom', 'genteel', 'poverty', 'has', 'driven', 'to', 'ignoble', 'expedient']
4	Our next view of him shall be as he descends the steps of his lodging-house immaculately and correctly clothed; calm, assured, handsome—in appearance the typical New York young clubman setting out, slightly bored, to inaugurate the pleasures of the evening. 	Мы снова увидим мистера Чендлера, когда он будет спускаться по лестнице дешевых меблированных комнат; безупречно одетый, самоуверенный, элегантный, по внешности — типичный нью-йоркский клубмен, прожигатель жизни, отправляющийся с несколько скучающим видом в погоню за вечерними удовольствиями. 	['Мы', 'снова', 'увидим', 'мистера', 'Чендлера', 'когда', 'он', 'будет', 'спускаться', 'по', 'лестнице', 'дешевых', 'меблированных', 'комнат', 'безупречно', 'одетый', 'самоуверенный', 'элегантный', 'по', 'внешности', '—', 'типичный', 'нью-йоркский', 'клубмен', 'прожигатель', 'жизни', 'отправляющийся', 'с', 'несколько', 'скучающим', 'видом', 'в', 'погоню', 'за', 'вечерними', 'удовольствиями']	['Our', 'next', 'view', 'of', 'him', 'shall', 'be', 'as', 'he', 'descends', 'the', 'steps', 'of', 'his', 'lodging-house', 'immaculately', 'and', 'correctly', 'clothed', 'calm', 'assured', 'handsome—in', 'appearance', 'the', 'typical', 'New', 'York', 'young', 'clubman', 'setting', 'out', 'slightly', 'bored', 'to', 'inaugurate', 'the', 'pleasures', 'of', 'the', 'evening']
5	Chandler's honorarium was $18 per week. 	Чендлер получал восемнадцать долларов в неделю. 	['Чендлер', 'получал', 'восемнадцать', 'долларов', 'в', 'неделю']	"[""Chandler's"", 'honorarium', 'was', '18', 'per', 'week']"
6	He was employed in the office of an architect. 	Он служил в конторе у одного архитектора. 	['Он', 'служил', 'в', 'конторе', 'у', 'одного', 'архитектора']	['He', 'was', 'employed', 'in', 'the', 'office', 'of', 'an', 'architect']
7	He was twenty-two years old; he considered architecture to be truly an art; and he honestly believed—though he would not have dared to admit it in New York—that the Flatiron Building was inferior to design to the great cathedral in Milan. 	Ему было двадцать два года. Он считал архитектуру настоящим искусством и был искренне убежден, — хотя не рискнул бы заявить об этом в Нью-Йорке, — что небоскреб «Утюг» по своим архитектурным формам уступает Миланскому собору. 	['Ему', 'было', 'двадцать', 'два', 'года', 'Он', 'считал', 'архитектуру', 'настоящим', 'искусством', 'и', 'был', 'искренне', 'убежден', '—', 'хотя', 'не', 'рискнул', 'бы', 'заявить', 'об', 'этом', 'в', 'Нью-Йорке', '—', 'что', 'небоскреб', '«Утюг»', 'по', 'своим', 'архитектурным', 'формам', 'уступает', 'Миланскому', 'собору']	['He', 'was', 'twenty-two', 'years', 'old', 'he', 'considered', 'architecture', 'to', 'be', 'truly', 'an', 'art', 'and', 'he', 'honestly', 'believed—though', 'he', 'would', 'not', 'have', 'dared', 'to', 'admit', 'it', 'in', 'New', 'York—that', 'the', 'Flatiron', 'Building', 'was', 'inferior', 'to', 'design', 'to', 'the', 'great', 'cathedral', 'in', 'Milan']
8	Out of each week's earnings Chandler set aside $1. 	Каждую неделю Чендлер откладывал из своей получки один доллар. 	['Каждую', 'неделю', 'Чендлер', 'откладывал', 'из', 'своей', 'получки', 'один', 'доллар']	"['Out', 'of', 'each', ""week's"", 'earnings', 'Chandler', 'set', 'aside', '1']"
9	At the end of each ten weeks with the extra capital thus accumulated, he purchased one gentleman's evening from the bargain counter of stingy old Father Time. 	В конце каждой десятой недели на добытый таким способом сверхкапитал он покупал в лавочке скаредного Папаши Времени один-единственный вечер, который мог провести, как джентльмен. 	['В', 'конце', 'каждой', 'десятой', 'недели', 'на', 'добытый', 'таким', 'способом', 'сверхкапитал', 'он', 'покупал', 'в', 'лавочке', 'скаредного', 'Папаши', 'Времени', 'один-единственный', 'вечер', 'который', 'мог', 'провести', 'как', 'джентльмен']	"['At', 'the', 'end', 'of', 'each', 'ten', 'weeks', 'with', 'the', 'extra', 'capital', 'thus', 'accumulated', 'he', 'purchased', 'one', ""gentleman's"", 'evening', 'from', 'the', 'bargain', 'counter', 'of', 'stingy', 'old', 'Father', 'Time']"
10	He arrayed himself in the regalia of millionaires and presidents; he took himself to the quarter where life is brightest and showiest, and there dined with taste and luxury. 	Украсив себя регалиями миллионеров и президентов, он отправлялся в ту часть города, что ярче всего сверкает огнями реклам и витрин, и обедал со вкусом и шиком. 	['Украсив', 'себя', 'регалиями', 'миллионеров', 'и', 'президентов', 'он', 'отправлялся', 'в', 'ту', 'часть', 'города', 'что', 'ярче', 'всего', 'сверкает', 'огнями', 'реклам', 'и', 'витрин', 'и', 'обедал', 'со', 'вкусом', 'и', 'шиком']	['He', 'arrayed', 'himself', 'in', 'the', 'regalia', 'of', 'millionaires', 'and', 'presidents', 'he', 'took', 'himself', 'to', 'the', 'quarter', 'where', 'life', 'is', 'brightest', 'and', 'showiest', 'and', 'there', 'dined', 'with', 'taste', 'and', 'luxury']
11	With ten dollars a man may, for a few hours, play the wealthy idler to perfection. 	Имея в кармане десять долларов, можно в течение нескольких часов мастерски разыгрывать богатого бездельника. 	['Имея', 'в', 'кармане', 'десять', 'долларов', 'можно', 'в', 'течение', 'нескольких', 'часов', 'мастерски', 'разыгрывать', 'богатого', 'бездельника']	['With', 'ten', 'dollars', 'a', 'man', 'may', 'for', 'a', 'few', 'hours', 'play', 'the', 'wealthy', 'idler', 'to', 'perfection']
12	The sum is ample for a well-considered meal, a bottle bearing a respectable label, commensurate tips, a smoke, cab fare and the ordinary etceteras. 	Этой суммы достаточно на хорошую еду, бутылку вина с приличной этикеткой, соответствующие чаевые, сигару, извозчика и обычные и т. п. 	['Этой', 'суммы', 'достаточно', 'на', 'хорошую', 'еду', 'бутылку', 'вина', 'с', 'приличной', 'этикеткой', 'соответствующие', 'чаевые', 'сигару', 'извозчика', 'и', 'обычные', 'и', 'т', 'п']	['The', 'sum', 'is', 'ample', 'for', 'a', 'well-considered', 'meal', 'a', 'bottle', 'bearing', 'a', 'respectable', 'label', 'commensurate', 'tips', 'a', 'smoke', 'cab', 'fare', 'and', 'the', 'ordinary', 'etceteras']
13	This one delectable evening culled from each dull seventy was to Chandler a source of renascent bliss. 	Этот один усладительный вечер, выкроенный из семидесяти нудных вечеров, являлся для него источником периодически возрождающегося блаженства. 	['Этот', 'один', 'усладительный', 'вечер', 'выкроенный', 'из', 'семидесяти', 'нудных', 'вечеров', 'являлся', 'для', 'него', 'источником', 'периодически', 'возрождающегося', 'блаженства']	['This', 'one', 'delectable', 'evening', 'culled', 'from', 'each', 'dull', 'seventy', 'was', 'to', 'Chandler', 'a', 'source', 'of', 'renascent', 'bliss']
14	To the society bud comes but one début; it stands alone sweet in her memory when her hair has whitened; but to Chandler each ten weeks brought a joy as keen, as thrilling, as new as the first had been. 	У девушки первый выезд в свет бывает только раз в жизни; и когда волосы ее поседеют, он по- прежнему будет всплывать в ее памяти, как нечто радостное и неповторимое. Чендлер же каждые десять недель испытывал удовольствие столь же острое и сильное, как в первый раз. 	['У', 'девушки', 'первый', 'выезд', 'в', 'свет', 'бывает', 'только', 'раз', 'в', 'жизни', 'и', 'когда', 'волосы', 'ее', 'поседеют', 'он', 'по', 'прежнему', 'будет', 'всплывать', 'в', 'ее', 'памяти', 'как', 'нечто', 'радостное', 'и', 'неповторимое', 'Чендлер', 'же', 'каждые', 'десять', 'недель', 'испытывал', 'удовольствие', 'столь', 'же', 'острое', 'и', 'сильное', 'как', 'в', 'первый', 'раз']	['To', 'the', 'society', 'bud', 'comes', 'but', 'one', 'début', 'it', 'stands', 'alone', 'sweet', 'in', 'her', 'memory', 'when', 'her', 'hair', 'has', 'whitened', 'but', 'to', 'Chandler', 'each', 'ten', 'weeks', 'brought', 'a', 'joy', 'as', 'keen', 'as', 'thrilling', 'as', 'new', 'as', 'the', 'first', 'had', 'been']
15	To sit among bon vivants under palms in the swirl of concealed music, to look upon the habitués of such a paradise and to be looked upon by them—what is a girl's first dance and short-sleeved tulle compared with this? 	Сидеть под пальмами в кругу бонвиванов, в вихре звуков невидимого оркестра, смотреть на завсегдатаев этого рая и чувствовать на себе их взгляды — что в сравнении с этим первый вальс и газовое платьице юной дебютантки? 	['Сидеть', 'под', 'пальмами', 'в', 'кругу', 'бонвиванов', 'в', 'вихре', 'звуков', 'невидимого', 'оркестра', 'смотреть', 'на', 'завсегдатаев', 'этого', 'рая', 'и', 'чувствовать', 'на', 'себе', 'их', 'взгляды', '—', 'что', 'в', 'сравнении', 'с', 'этим', 'первый', 'вальс', 'и', 'газовое', 'платьице', 'юной', 'дебютантки']	"['To', 'sit', 'among', 'bon', 'vivants', 'under', 'palms', 'in', 'the', 'swirl', 'of', 'concealed', 'music', 'to', 'look', 'upon', 'the', 'habitués', 'of', 'such', 'a', 'paradise', 'and', 'to', 'be', 'looked', 'upon', 'by', 'them—what', 'is', 'a', ""girl's"", 'first', 'dance', 'and', 'short-sleeved', 'tulle', 'compared', 'with', 'this']"
16	Up Broadway Chandler moved with the vespertine dress parade. 	Чендлер шел по Бродвею, как полноправный участник его передвижной выставки вечерних нарядов. 	['Чендлер', 'шел', 'по', 'Бродвею', 'как', 'полноправный', 'участник', 'его', 'передвижной', 'выставки', 'вечерних', 'нарядов']	['Up', 'Broadway', 'Chandler', 'moved', 'with', 'the', 'vespertine', 'dress', 'parade']
17	For this evening he was an exhibit as well as a gazer. 	В этот вечер он был не только зрителем, но и экспонатом. 	['В', 'этот', 'вечер', 'он', 'был', 'не', 'только', 'зрителем', 'но', 'и', 'экспонатом']	['For', 'this', 'evening', 'he', 'was', 'an', 'exhibit', 'as', 'well', 'as', 'a', 'gazer']
18	For the next sixty-nine evenings he would be dining in cheviot and worsted at dubious table d'hôtes, at whirlwind lunch counters, on sandwiches and beer in his hall-bedroom. 	Последующие шестьдесят девять дней он будет ходить в плохоньком костюме и питаться за сомнительными табльдотами, у стойки случайного бара, бутербродами и пивом у себя в комнатушке. 	['Последующие', 'шестьдесят', 'девять', 'дней', 'он', 'будет', 'ходить', 'в', 'плохоньком', 'костюме', 'и', 'питаться', 'за', 'сомнительными', 'табльдотами', 'у', 'стойки', 'случайного', 'бара', 'бутербродами', 'и', 'пивом', 'у', 'себя', 'в', 'комнатушке']	"['For', 'the', 'next', 'sixty-nine', 'evenings', 'he', 'would', 'be', 'dining', 'in', 'cheviot', 'and', 'worsted', 'at', 'dubious', 'table', ""d'hôtes"", 'at', 'whirlwind', 'lunch', 'counters', 'on', 'sandwiches', 'and', 'beer', 'in', 'his', 'hall-bedroom']"
19	He was willing to do that, for he was a true son of the great city of razzle-dazzle, and to him one evening in the limelight made up for many dark ones. 	Но это его не смущало, ибо он был подлинным сыном великого города мишурного блеска, и один вечер, освещенный огнями Бродвея, возмещал ему множество вечеров, проведенных во мраке. 	['Но', 'это', 'его', 'не', 'смущало', 'ибо', 'он', 'был', 'подлинным', 'сыном', 'великого', 'города', 'мишурного', 'блеска', 'и', 'один', 'вечер', 'освещенный', 'огнями', 'Бродвея', 'возмещал', 'ему', 'множество', 'вечеров', 'проведенных', 'во', 'мраке']	['He', 'was', 'willing', 'to', 'do', 'that', 'for', 'he', 'was', 'a', 'true', 'son', 'of', 'the', 'great', 'city', 'of', 'razzle-dazzle', 'and', 'to', 'him', 'one', 'evening', 'in', 'the', 'limelight', 'made', 'up', 'for', 'many', 'dark', 'ones']
20	Chandler protracted his walk until the Forties began to intersect the great and glittering primrose way, for the evening was yet young, and when one is of the beau monde only one day in seventy, one loves to protract the pleasure. 	Он все шел и шел, и вот уже сороковые улицы начали пересекать сверкающий огнями путь наслаждений; было еще рано, а когда человек приобщается к избранному обществу всего раз в семьдесят дней, ему хочется продлить это удовольствие. 	['Он', 'все', 'шел', 'и', 'шел', 'и', 'вот', 'уже', 'сороковые', 'улицы', 'начали', 'пересекать', 'сверкающий', 'огнями', 'путь', 'наслаждений', 'было', 'еще', 'рано', 'а', 'когда', 'человек', 'приобщается', 'к', 'избранному', 'обществу', 'всего', 'раз', 'в', 'семьдесят', 'дней', 'ему', 'хочется', 'продлить', 'это', 'удовольствие']	['Chandler', 'protracted', 'his', 'walk', 'until', 'the', 'Forties', 'began', 'to', 'intersect', 'the', 'great', 'and', 'glittering', 'primrose', 'way', 'for', 'the', 'evening', 'was', 'yet', 'young', 'and', 'when', 'one', 'is', 'of', 'the', 'beau', 'monde', 'only', 'one', 'day', 'in', 'seventy', 'one', 'loves', 'to', 'protract', 'the', 'pleasure']
21	Eyes bright, sinister, curious, admiring, provocative, alluring were bent upon him, for his garb and air proclaimed him a devotee to the hour of solace and pleasure. 	Взгляды — сияющие, угрюмые, любопытные, восхищенные, вызывающие, манящие — были обращены на него, ибо его наряд и вид выдавали в нем поклонника часа веселья и удовольствий. 	['Взгляды', '—', 'сияющие', 'угрюмые', 'любопытные', 'восхищенные', 'вызывающие', 'манящие', '—', 'были', 'обращены', 'на', 'него', 'ибо', 'его', 'наряд', 'и', 'вид', 'выдавали', 'в', 'нем', 'поклонника', 'часа', 'веселья', 'и', 'удовольствий']	['Eyes', 'bright', 'sinister', 'curious', 'admiring', 'provocative', 'alluring', 'were', 'bent', 'upon', 'him', 'for', 'his', 'garb', 'and', 'air', 'proclaimed', 'him', 'a', 'devotee', 'to', 'the', 'hour', 'of', 'solace', 'and', 'pleasure']
22	At a certain corner he came to a standstill, proposing to himself the question of turning back toward the showy and fashionable restaurant in which he usually dined on the evenings of his especial luxury. 	На одном углу он остановился, подумывая о том, не пора ли ему повернуть обратно и направиться в роскошный модный ресторан, где он обычно обедал в дни своего расточительства. 	['На', 'одном', 'углу', 'он', 'остановился', 'подумывая', 'о', 'том', 'не', 'пора', 'ли', 'ему', 'повернуть', 'обратно', 'и', 'направиться', 'в', 'роскошный', 'модный', 'ресторан', 'где', 'он', 'обычно', 'обедал', 'в', 'дни', 'своего', 'расточительства']	['At', 'a', 'certain', 'corner', 'he', 'came', 'to', 'a', 'standstill', 'proposing', 'to', 'himself', 'the', 'question', 'of', 'turning', 'back', 'toward', 'the', 'showy', 'and', 'fashionable', 'restaurant', 'in', 'which', 'he', 'usually', 'dined', 'on', 'the', 'evenings', 'of', 'his', 'especial', 'luxury']
23	Just then a girl scuddled lightly around the corner, slipped on a patch of icy snow and fell plump upon the sidewalk. 	Как раз в эту минуту какая-то девушка, стремительно огибая угол, поскользнулась на кусочке льда и шлепнулась на тротуар, 	['Как', 'раз', 'в', 'эту', 'минуту', 'какая-то', 'девушка', 'стремительно', 'огибая', 'угол', 'поскользнулась', 'на', 'кусочке', 'льда', 'и', 'шлепнулась', 'на', 'тротуар']	['Just', 'then', 'a', 'girl', 'scuddled', 'lightly', 'around', 'the', 'corner', 'slipped', 'on', 'a', 'patch', 'of', 'icy', 'snow', 'and', 'fell', 'plump', 'upon', 'the', 'sidewalk']
24	Chandler assisted her to her feet with instant and solicitous courtesy. 	Чендлер помог ей подняться с отменной и безотлагательной вежливостью. 	['Чендлер', 'помог', 'ей', 'подняться', 'с', 'отменной', 'и', 'безотлагательной', 'вежливостью']	['Chandler', 'assisted', 'her', 'to', 'her', 'feet', 'with', 'instant', 'and', 'solicitous', 'courtesy']
25	The girl hobbled to the wall of the building, leaned against it, and thanked him demurely. 	Прихрамывая, девушка отошла к стене, прислонилась к ней и застенчиво поблагодарила его. 	['Прихрамывая', 'девушка', 'отошла', 'к', 'стене', 'прислонилась', 'к', 'ней', 'и', 'застенчиво', 'поблагодарила', 'его']	['The', 'girl', 'hobbled', 'to', 'the', 'wall', 'of', 'the', 'building', 'leaned', 'against', 'it', 'and', 'thanked', 'him', 'demurely']
26	"""I think my ankle is strained,"" she said. "	— Кажется, я растянула ногу, — сказала она. 	['—', 'Кажется', 'я', 'растянула', 'ногу', '—', 'сказала', 'она']	['I', 'think', 'my', 'ankle', 'is', 'strained', 'she', 'said']
27	"""It twisted when I fell."" "	— Я почувствовала, как она подвернулась. 	['—', 'Я', 'почувствовала', 'как', 'она', 'подвернулась']	['It', 'twisted', 'when', 'I', 'fell']
28	"""Does it pain you much?"" inquired Chandler. "	— Очень больно? — спросил Чендлер. 	['—', 'Очень', 'больно', '—', 'спросил', 'Чендлер']	['Does', 'it', 'pain', 'you', 'much', 'inquired', 'Chandler']
29	"""Only when I rest my weight upon it. "	— Только когда наступаю на всю ступню. 	['—', 'Только', 'когда', 'наступаю', 'на', 'всю', 'ступню']	['Only', 'when', 'I', 'rest', 'my', 'weight', 'upon', 'it']
30	"I think I will be able to walk in a minute or two."" "	Думаю, что через несколько минут я уже буду в состоянии двигаться. 	['Думаю', 'что', 'через', 'несколько', 'минут', 'я', 'уже', 'буду', 'в', 'состоянии', 'двигаться']	['I', 'think', 'I', 'will', 'be', 'able', 'to', 'walk', 'in', 'a', 'minute', 'or', 'two']
