	en	ru	ru_tokens	en_tokens
31	"""If I can be of any further service,"" suggested the young man, "	— Не могу ли я быть вам чем-нибудь полезен? — предложил молодой человек. 	['—', 'Не', 'могу', 'ли', 'я', 'быть', 'вам', 'чем-нибудь', 'полезен', '—', 'предложил', 'молодой', 'человек']	['If', 'I', 'can', 'be', 'of', 'any', 'further', 'service', 'suggested', 'the', 'young', 'man']
32	"""I will call a cab, or—"" "	— Хотите, я позову извозчика или… 	['—', 'Хотите', 'я', 'позову', 'извозчика', 'или…']	['I', 'will', 'call', 'a', 'cab', 'or—']
33	"""Thank you,"" said the girl, softly but heartily. "	— Благодарю вас, — негромко, но с чувством сказала девушка. 	['—', 'Благодарю', 'вас', '—', 'негромко', 'но', 'с', 'чувством', 'сказала', 'девушка']	['Thank', 'you', 'said', 'the', 'girl', 'softly', 'but', 'heartily']
34	"""I am sure you need not trouble yourself any further. "	— Право, не стоит беспокоиться. 	['—', 'Право', 'не', 'стоит', 'беспокоиться']	['I', 'am', 'sure', 'you', 'need', 'not', 'trouble', 'yourself', 'any', 'further']
35	It was so awkward of me. 	Как это меня угораздило? 	['Как', 'это', 'меня', 'угораздило']	['It', 'was', 'so', 'awkward', 'of', 'me']
36	"And my shoe heels are horridly common-sense; I can't blame them at all."" "	И каблуки у меня самые банальные. 	['И', 'каблуки', 'у', 'меня', 'самые', 'банальные']	"['And', 'my', 'shoe', 'heels', 'are', 'horridly', 'common-sense', 'I', ""can't"", 'blame', 'them', 'at', 'all']"
37	Chandler looked at the girl and found her swiftly drawing his interest. 	Их винить не приходится. 	['Их', 'винить', 'не', 'приходится']	['Chandler', 'looked', 'at', 'the', 'girl', 'and', 'found', 'her', 'swiftly', 'drawing', 'his', 'interest']
38	She was pretty in a refined way; and her eye was both merry and kind. 	Чендлер посмотрел на девушку и убедился, что его интерес к ней быстро возрастает. 	['Чендлер', 'посмотрел', 'на', 'девушку', 'и', 'убедился', 'что', 'его', 'интерес', 'к', 'ней', 'быстро', 'возрастает']	['She', 'was', 'pretty', 'in', 'a', 'refined', 'way', 'and', 'her', 'eye', 'was', 'both', 'merry', 'and', 'kind']
39	She was inexpensively clothed in a plain black dress that suggested a sort of uniform such as shop girls wear. 	Она была хорошенькая и изящная, глядела весело и радушно. 	['Она', 'была', 'хорошенькая', 'и', 'изящная', 'глядела', 'весело', 'и', 'радушно']	['She', 'was', 'inexpensively', 'clothed', 'in', 'a', 'plain', 'black', 'dress', 'that', 'suggested', 'a', 'sort', 'of', 'uniform', 'such', 'as', 'shop', 'girls', 'wear']
40	Her glossy dark-brown hair showed its coils beneath a cheap hat of black straw whose only ornament was a velvet ribbon and bow. 	На ней было простенькое черное платьице, похожее на те, в какие одевают продавщиц. Из- под дешевой соломенной шляпки, единственным украшением которой была бархатная лента с бантом, выбивались колечки блестящих темно-каштановых волос. 	['На', 'ней', 'было', 'простенькое', 'черное', 'платьице', 'похожее', 'на', 'те', 'в', 'какие', 'одевают', 'продавщиц', 'Из', 'под', 'дешевой', 'соломенной', 'шляпки', 'единственным', 'украшением', 'которой', 'была', 'бархатная', 'лента', 'с', 'бантом', 'выбивались', 'колечки', 'блестящих', 'темно-каштановых', 'волос']	['Her', 'glossy', 'dark-brown', 'hair', 'showed', 'its', 'coils', 'beneath', 'a', 'cheap', 'hat', 'of', 'black', 'straw', 'whose', 'only', 'ornament', 'was', 'a', 'velvet', 'ribbon', 'and', 'bow']
41	She could have posed as a model for the self-respecting working girl of the best type. 	С нее можно было писать портрет хорошей, полной собственного достоинства трудящейся девушки. 	['С', 'нее', 'можно', 'было', 'писать', 'портрет', 'хорошей', 'полной', 'собственного', 'достоинства', 'трудящейся', 'девушки']	['She', 'could', 'have', 'posed', 'as', 'a', 'model', 'for', 'the', 'self-respecting', 'working', 'girl', 'of', 'the', 'best', 'type']
42	A sudden idea came into the head of the young architect. He would ask this girl to dine with him. 	Вдруг молодого архитектора осенило Он пригласит эту девушку пообедать с ним. 	['Вдруг', 'молодого', 'архитектора', 'осенило', 'Он', 'пригласит', 'эту', 'девушку', 'пообедать', 'с', 'ним']	['A', 'sudden', 'idea', 'came', 'into', 'the', 'head', 'of', 'the', 'young', 'architect', 'He', 'would', 'ask', 'this', 'girl', 'to', 'dine', 'with', 'him']
43	Here was the element that his splendid but solitary periodic feasts had lacked. 	Вот чего недоставало его роскошным, но одиноким пиршествам. 	['Вот', 'чего', 'недоставало', 'его', 'роскошным', 'но', 'одиноким', 'пиршествам']	['Here', 'was', 'the', 'element', 'that', 'his', 'splendid', 'but', 'solitary', 'periodic', 'feasts', 'had', 'lacked']
44	His brief season of elegant luxury would be doubly enjoyable if he could add to it a lady's society. 	Краткий час его изысканных наслаждений был бы приятнее вдвойне, если бы он мог провести его в женском обществе. 	['Краткий', 'час', 'его', 'изысканных', 'наслаждений', 'был', 'бы', 'приятнее', 'вдвойне', 'если', 'бы', 'он', 'мог', 'провести', 'его', 'в', 'женском', 'обществе']	"['His', 'brief', 'season', 'of', 'elegant', 'luxury', 'would', 'be', 'doubly', 'enjoyable', 'if', 'he', 'could', 'add', 'to', 'it', 'a', ""lady's"", 'society']"
45	This girl was a lady, he was sure—her manner and speech settled that. 	Он не сомневался, что перед ним вполне порядочная девушка, — ее речь и манеры подтверждали это. 	['Он', 'не', 'сомневался', 'что', 'перед', 'ним', 'вполне', 'порядочная', 'девушка', '—', 'ее', 'речь', 'и', 'манеры', 'подтверждали', 'это']	['This', 'girl', 'was', 'a', 'lady', 'he', 'was', 'sure—her', 'manner', 'and', 'speech', 'settled', 'that']
46	And in spite of her extremely plain attire he felt that he would be pleased to sit at table with her. 	И, несмотря на ее простенький наряд, он почувствовал, что ему будет приятно сидеть с ней за столом. 	['И', 'несмотря', 'на', 'ее', 'простенький', 'наряд', 'он', 'почувствовал', 'что', 'ему', 'будет', 'приятно', 'сидеть', 'с', 'ней', 'за', 'столом']	['And', 'in', 'spite', 'of', 'her', 'extremely', 'plain', 'attire', 'he', 'felt', 'that', 'he', 'would', 'be', 'pleased', 'to', 'sit', 'at', 'table', 'with', 'her']
47	These thoughts passed swiftly through his mind, and he decided to ask her. 	Эти мысли быстро пронеслись в его голове, и он решился. 	['Эти', 'мысли', 'быстро', 'пронеслись', 'в', 'его', 'голове', 'и', 'он', 'решился']	['These', 'thoughts', 'passed', 'swiftly', 'through', 'his', 'mind', 'and', 'he', 'decided', 'to', 'ask', 'her']
48	It was a breach of etiquette, of course, but oftentimes wage-earning girls waived formalities in matters of this kind. 	Разумеется, он нарушал правила приличия, но девушки, живущие на собственный заработок, нередко в таких делах пренебрегают формальностями. 	['Разумеется', 'он', 'нарушал', 'правила', 'приличия', 'но', 'девушки', 'живущие', 'на', 'собственный', 'заработок', 'нередко', 'в', 'таких', 'делах', 'пренебрегают', 'формальностями']	['It', 'was', 'a', 'breach', 'of', 'etiquette', 'of', 'course', 'but', 'oftentimes', 'wage-earning', 'girls', 'waived', 'formalities', 'in', 'matters', 'of', 'this', 'kind']
49	They were generally shrewd judges of men; and thought better of their own judgment than they did of useless conventions. 	Как правило, они отлично разбираются в мужчинах и скорее будут полагаться на свое личное суждение, чем соблюдать никчемные условности. 	['Как', 'правило', 'они', 'отлично', 'разбираются', 'в', 'мужчинах', 'и', 'скорее', 'будут', 'полагаться', 'на', 'свое', 'личное', 'суждение', 'чем', 'соблюдать', 'никчемные', 'условности']	['They', 'were', 'generally', 'shrewd', 'judges', 'of', 'men', 'and', 'thought', 'better', 'of', 'their', 'own', 'judgment', 'than', 'they', 'did', 'of', 'useless', 'conventions']
50	His ten dollars, discreetly expended, would enable the two to dine very well indeed. 	Если его десять долларов истратить с толком, они вдвоем смогут отлично пообедать. 	['Если', 'его', 'десять', 'долларов', 'истратить', 'с', 'толком', 'они', 'вдвоем', 'смогут', 'отлично', 'пообедать']	['His', 'ten', 'dollars', 'discreetly', 'expended', 'would', 'enable', 'the', 'two', 'to', 'dine', 'very', 'well', 'indeed']
51	The dinner would no doubt be a wonderful experience thrown into the dull routine of the girl's life; and her lively appreciation of it would add to his own triumph and pleasure. 	Можно себе представить, каким ярким событием явится этот обед в бесцветной жизни девушки; а от ее искреннего восхищения его триумф и удовольствие станут еще хладостней. 	['Можно', 'себе', 'представить', 'каким', 'ярким', 'событием', 'явится', 'этот', 'обед', 'в', 'бесцветной', 'жизни', 'девушки', 'а', 'от', 'ее', 'искреннего', 'восхищения', 'его', 'триумф', 'и', 'удовольствие', 'станут', 'еще', 'хладостней']	"['The', 'dinner', 'would', 'no', 'doubt', 'be', 'a', 'wonderful', 'experience', 'thrown', 'into', 'the', 'dull', 'routine', 'of', 'the', ""girl's"", 'life', 'and', 'her', 'lively', 'appreciation', 'of', 'it', 'would', 'add', 'to', 'his', 'own', 'triumph', 'and', 'pleasure']"
52	"""I think,"" he said to her, with frank gravity, ""that your foot needs a longer rest than you suppose. "	— По моему, — сказал он серьезно, — вашей ноге требуется более длительный отдых, чем вы полагаете. 	['—', 'По', 'моему', '—', 'сказал', 'он', 'серьезно', '—', 'вашей', 'ноге', 'требуется', 'более', 'длительный', 'отдых', 'чем', 'вы', 'полагаете']	['I', 'think', 'he', 'said', 'to', 'her', 'with', 'frank', 'gravity', 'that', 'your', 'foot', 'needs', 'a', 'longer', 'rest', 'than', 'you', 'suppose']
53	Now, I am going to suggest a way in which you can give it that and at the same time do me a favour. 	И я хочу подсказать вам, как можно помочь ей и, вместе с тем, сделать мне одолжение. 	['И', 'я', 'хочу', 'подсказать', 'вам', 'как', 'можно', 'помочь', 'ей', 'и', 'вместе', 'с', 'тем', 'сделать', 'мне', 'одолжение']	['Now', 'I', 'am', 'going', 'to', 'suggest', 'a', 'way', 'in', 'which', 'you', 'can', 'give', 'it', 'that', 'and', 'at', 'the', 'same', 'time', 'do', 'me', 'a', 'favour']
54	I was on my way to dine all by my lonely self when you came tumbling around the corner. 	Когда вы появились из-за угла, я как раз собирался пообедать в печальном одиночестве. 	['Когда', 'вы', 'появились', 'из-за', 'угла', 'я', 'как', 'раз', 'собирался', 'пообедать', 'в', 'печальном', 'одиночестве']	['I', 'was', 'on', 'my', 'way', 'to', 'dine', 'all', 'by', 'my', 'lonely', 'self', 'when', 'you', 'came', 'tumbling', 'around', 'the', 'corner']
55	"You come with me and we'll have a cozy dinner and a pleasant talk together, and by that time your game ankle will carry you home very nicely, I am sure."" "	Пойдемте со мной, посидим в уютной обстановке, пообедаем, поболтаем, а за это время боль в ноге утихнет и вы, я уверен, легко дойдете до дому. 	['Пойдемте', 'со', 'мной', 'посидим', 'в', 'уютной', 'обстановке', 'пообедаем', 'поболтаем', 'а', 'за', 'это', 'время', 'боль', 'в', 'ноге', 'утихнет', 'и', 'вы', 'я', 'уверен', 'легко', 'дойдете', 'до', 'дому']	"['You', 'come', 'with', 'me', 'and', ""we'll"", 'have', 'a', 'cozy', 'dinner', 'and', 'a', 'pleasant', 'talk', 'together', 'and', 'by', 'that', 'time', 'your', 'game', 'ankle', 'will', 'carry', 'you', 'home', 'very', 'nicely', 'I', 'am', 'sure']"
56	The girl looked quickly up into Chandler's clear, pleasant countenance. 	Девушка сбросила быстрый взгляд на открытое и приятное лицо Чендлера. 	['Девушка', 'сбросила', 'быстрый', 'взгляд', 'на', 'открытое', 'и', 'приятное', 'лицо', 'Чендлера']	"['The', 'girl', 'looked', 'quickly', 'up', 'into', ""Chandler's"", 'clear', 'pleasant', 'countenance']"
57	Her eyes twinkled once very brightly, and then she smiled ingenuously. 	В глазах у нее сверкнул огонек, затем она мило улыбнулась. 	['В', 'глазах', 'у', 'нее', 'сверкнул', 'огонек', 'затем', 'она', 'мило', 'улыбнулась']	['Her', 'eyes', 'twinkled', 'once', 'very', 'brightly', 'and', 'then', 'she', 'smiled', 'ingenuously']
58	"""But we don't know each other—it wouldn't be right, would it?"" she said, doubtfully. "	— Но мы не знакомы а так ведь, кажется, не полагается, — в нерешительности проговорила она. 	['—', 'Но', 'мы', 'не', 'знакомы', 'а', 'так', 'ведь', 'кажется', 'не', 'полагается', '—', 'в', 'нерешительности', 'проговорила', 'она']	"['But', 'we', ""don't"", 'know', 'each', 'other—it', ""wouldn't"", 'be', 'right', 'would', 'it', 'she', 'said', 'doubtfully']"
59	"""There is nothing wrong about it,"" said the young man, candidly. "	— В этом нет ничего плохого, — сказал он простодушно. 	['—', 'В', 'этом', 'нет', 'ничего', 'плохого', '—', 'сказал', 'он', 'простодушно']	['There', 'is', 'nothing', 'wrong', 'about', 'it', 'said', 'the', 'young', 'man', 'candidly']
60	"""I'll introduce myself—permit me—Mr. Towers Chandler. "	— Я сам вам представлюсь… разрешите… Мистер Тауэрс Чендлер. 	['—', 'Я', 'сам', 'вам', 'представлюсь…', 'разрешите…', 'Мистер', 'Тауэрс', 'Чендлер']	"[""I'll"", 'introduce', 'myself—permit', 'me—Mr', 'Towers', 'Chandler']"
61	"After our dinner, which I will try to make as pleasant as possible, I will bid you good-evening, or attend you safely to your door, whichever you prefer."" "	После обеда, который я постараюсь сделать для вас как можно приятнее, я распрощаюсь с вами или провожу вас до вашего дома, — как вам будет угодно. 	['После', 'обеда', 'который', 'я', 'постараюсь', 'сделать', 'для', 'вас', 'как', 'можно', 'приятнее', 'я', 'распрощаюсь', 'с', 'вами', 'или', 'провожу', 'вас', 'до', 'вашего', 'дома', '—', 'как', 'вам', 'будет', 'угодно']	['After', 'our', 'dinner', 'which', 'I', 'will', 'try', 'to', 'make', 'as', 'pleasant', 'as', 'possible', 'I', 'will', 'bid', 'you', 'good-evening', 'or', 'attend', 'you', 'safely', 'to', 'your', 'door', 'whichever', 'you', 'prefer']
62	"""But, dear me!"" said the girl, with a glance at Chandler's faultless attire. ""In this old dress and hat!"" "	— Да, но в таком платье и в этой шляпке! — проговорила девушка, взглянув на безупречный костюм Чендлера. 	['—', 'Да', 'но', 'в', 'таком', 'платье', 'и', 'в', 'этой', 'шляпке', '—', 'проговорила', 'девушка', 'взглянув', 'на', 'безупречный', 'костюм', 'Чендлера']	"['But', 'dear', 'me', 'said', 'the', 'girl', 'with', 'a', 'glance', 'at', ""Chandler's"", 'faultless', 'attire', 'In', 'this', 'old', 'dress', 'and', 'hat']"
63	"""Never mind that,"" said Chandler, cheerfully. "	— Это не важно, — радостно сказал Чендлер. 	['—', 'Это', 'не', 'важно', '—', 'радостно', 'сказал', 'Чендлер']	['Never', 'mind', 'that', 'said', 'Chandler', 'cheerfully']
64	"""I'm sure you look more charming in them than any one we shall see in the most elaborate dinner toilette."" "	— Право, вы более очаровательны в вашем народе, чем любая из дам, которые там будут в самых изысканных вечерних туалетах. 	['—', 'Право', 'вы', 'более', 'очаровательны', 'в', 'вашем', 'народе', 'чем', 'любая', 'из', 'дам', 'которые', 'там', 'будут', 'в', 'самых', 'изысканных', 'вечерних', 'туалетах']	"[""I'm"", 'sure', 'you', 'look', 'more', 'charming', 'in', 'them', 'than', 'any', 'one', 'we', 'shall', 'see', 'in', 'the', 'most', 'elaborate', 'dinner', 'toilette']"
65	"""My ankle does hurt yet,"" admitted the girl, attempting a limping step. "	— Нога еще побаливает, — призналась девушка, сделав неуверенный шаг. 	['—', 'Нога', 'еще', 'побаливает', '—', 'призналась', 'девушка', 'сделав', 'неуверенный', 'шаг']	['My', 'ankle', 'does', 'hurt', 'yet', 'admitted', 'the', 'girl', 'attempting', 'a', 'limping', 'step']
66	"""I think I will accept your invitation, Mr. Chandler. "	— По- видимому, мне придется принять ваше приглашение. 	['—', 'По', 'видимому', 'мне', 'придется', 'принять', 'ваше', 'приглашение']	['I', 'think', 'I', 'will', 'accept', 'your', 'invitation', 'Mr', 'Chandler']
67	"You may call me—Miss Marian."" "	Вы можете называть меня… мисс Мэриан. 	['Вы', 'можете', 'называть', 'меня…', 'мисс', 'Мэриан']	['You', 'may', 'call', 'me—Miss', 'Marian']
68	"""Come then, Miss Marian,"" said the young architect, gaily, but with perfect courtesy; ""you will not have far to walk. "	— Идемте же, мисс Мэриан, — весело, но с изысканной вежливостью сказал молодой архитектор. — Вам не придется идти далеко. 	['—', 'Идемте', 'же', 'мисс', 'Мэриан', '—', 'весело', 'но', 'с', 'изысканной', 'вежливостью', 'сказал', 'молодой', 'архитектор', '—', 'Вам', 'не', 'придется', 'идти', 'далеко']	['Come', 'then', 'Miss', 'Marian', 'said', 'the', 'young', 'architect', 'gaily', 'but', 'with', 'perfect', 'courtesy', 'you', 'will', 'not', 'have', 'far', 'to', 'walk']
69	There is a very respectable and good restaurant in the next block. 	Тут поблизости есть вполне приличный и очень хороший ресторан. 	['Тут', 'поблизости', 'есть', 'вполне', 'приличный', 'и', 'очень', 'хороший', 'ресторан']	['There', 'is', 'a', 'very', 'respectable', 'and', 'good', 'restaurant', 'in', 'the', 'next', 'block']
70	You will have to lean on my arm—so—and walk slowly. 	Обопритесь на мою руку, вот так… и пошли, не торопясь. 	['Обопритесь', 'на', 'мою', 'руку', 'вот', 'так…', 'и', 'пошли', 'не', 'торопясь']	['You', 'will', 'have', 'to', 'lean', 'on', 'my', 'arm—so—and', 'walk', 'slowly']
71	It is lonely dining all by one's self. 	Скучно обедать одному. 	['Скучно', 'обедать', 'одному']	"['It', 'is', 'lonely', 'dining', 'all', 'by', ""one's"", 'self']"
72	"I'm just a little bit glad that you slipped on the ice."" "	Я даже немножко рад, что вы поскользнулись. 	['Я', 'даже', 'немножко', 'рад', 'что', 'вы', 'поскользнулись']	"[""I'm"", 'just', 'a', 'little', 'bit', 'glad', 'that', 'you', 'slipped', 'on', 'the', 'ice']"
73	When the two were established at a well-appointed table, with a promising waiter hovering in attendance, Chandler began to experience the real joy that his regular outing always brought to him. 	Когда их усадили за хорошо сервированный столик и услужливый официант склонился к ним в вопросительной позе, Чендлер почувствовал блаженное состояние, какое испытывал всякий раз во время своих вылазок в светскую жизнь. 	['Когда', 'их', 'усадили', 'за', 'хорошо', 'сервированный', 'столик', 'и', 'услужливый', 'официант', 'склонился', 'к', 'ним', 'в', 'вопросительной', 'позе', 'Чендлер', 'почувствовал', 'блаженное', 'состояние', 'какое', 'испытывал', 'всякий', 'раз', 'во', 'время', 'своих', 'вылазок', 'в', 'светскую', 'жизнь']	['When', 'the', 'two', 'were', 'established', 'at', 'a', 'well-appointed', 'table', 'with', 'a', 'promising', 'waiter', 'hovering', 'in', 'attendance', 'Chandler', 'began', 'to', 'experience', 'the', 'real', 'joy', 'that', 'his', 'regular', 'outing', 'always', 'brought', 'to', 'him']
74	The restaurant was not so showy or pretentious as the one further down Broadway, which he always preferred, but it was nearly so. 	Ресторан этот был не так роскошен, как тот, дальше по Бродвею, который он облюбовал себе, но мало в чем уступал ему. 	['Ресторан', 'этот', 'был', 'не', 'так', 'роскошен', 'как', 'тот', 'дальше', 'по', 'Бродвею', 'который', 'он', 'облюбовал', 'себе', 'но', 'мало', 'в', 'чем', 'уступал', 'ему']	['The', 'restaurant', 'was', 'not', 'so', 'showy', 'or', 'pretentious', 'as', 'the', 'one', 'further', 'down', 'Broadway', 'which', 'he', 'always', 'preferred', 'but', 'it', 'was', 'nearly', 'so']
