	en	ru	ru_tokens	en_tokens
75	The tables were well filled with prosperous-looking diners, there was a good orchestra, playing softly enough to make conversation a possible pleasure, and the cuisine and service were beyond criticism. 	За столиками сидели состоятельного вида посетители, оркестр играл хорошо и не мешал приятной беседе, а кухня и обслуживание были вне всякой критики. 	['За', 'столиками', 'сидели', 'состоятельного', 'вида', 'посетители', 'оркестр', 'играл', 'хорошо', 'и', 'не', 'мешал', 'приятной', 'беседе', 'а', 'кухня', 'и', 'обслуживание', 'были', 'вне', 'всякой', 'критики']	['The', 'tables', 'were', 'well', 'filled', 'with', 'prosperous-looking', 'diners', 'there', 'was', 'a', 'good', 'orchestra', 'playing', 'softly', 'enough', 'to', 'make', 'conversation', 'a', 'possible', 'pleasure', 'and', 'the', 'cuisine', 'and', 'service', 'were', 'beyond', 'criticism']
76	His companion, even in her cheap hat and dress, held herself with an air that added distinction to the natural beauty of her face and figure. 	Его спутница, несмотря, на простенькое платье и дешевую шляпку, держалась с достоинством, что придавало особую прелесть природной красоте ее лица и фигуры. 	['Его', 'спутница', 'несмотря', 'на', 'простенькое', 'платье', 'и', 'дешевую', 'шляпку', 'держалась', 'с', 'достоинством', 'что', 'придавало', 'особую', 'прелесть', 'природной', 'красоте', 'ее', 'лица', 'и', 'фигуры']	['His', 'companion', 'even', 'in', 'her', 'cheap', 'hat', 'and', 'dress', 'held', 'herself', 'with', 'an', 'air', 'that', 'added', 'distinction', 'to', 'the', 'natural', 'beauty', 'of', 'her', 'face', 'and', 'figure']
77	And it is certain that she looked at Chandler, with his animated but self-possessed manner and his kindling and frank blue eyes, with something not far from admiration in her own charming face. 	И видно было по ее очаровательному личику, что она смотрит на Чендлера, который был оживлен, но сдержан, смотрит в его веселые и честные синие глаза почти с восхищением. 	['И', 'видно', 'было', 'по', 'ее', 'очаровательному', 'личику', 'что', 'она', 'смотрит', 'на', 'Чендлера', 'который', 'был', 'оживлен', 'но', 'сдержан', 'смотрит', 'в', 'его', 'веселые', 'и', 'честные', 'синие', 'глаза', 'почти', 'с', 'восхищением']	['And', 'it', 'is', 'certain', 'that', 'she', 'looked', 'at', 'Chandler', 'with', 'his', 'animated', 'but', 'self-possessed', 'manner', 'and', 'his', 'kindling', 'and', 'frank', 'blue', 'eyes', 'with', 'something', 'not', 'far', 'from', 'admiration', 'in', 'her', 'own', 'charming', 'face']
78	Then it was that the Madness of Manhattan, the frenzy of Fuss and Feathers, the Bacillus of Brag, the Provincial Plague of Pose seized upon Towers Chandler. 	И вот тут в Тауэрса Чендлера вселилось безумие Манхэттена, бешенство суеты и тщеславия, бацилла хвастовства, чума дешевенького позерства. 	['И', 'вот', 'тут', 'в', 'Тауэрса', 'Чендлера', 'вселилось', 'безумие', 'Манхэттена', 'бешенство', 'суеты', 'и', 'тщеславия', 'бацилла', 'хвастовства', 'чума', 'дешевенького', 'позерства']	['Then', 'it', 'was', 'that', 'the', 'Madness', 'of', 'Manhattan', 'the', 'frenzy', 'of', 'Fuss', 'and', 'Feathers', 'the', 'Bacillus', 'of', 'Brag', 'the', 'Provincial', 'Plague', 'of', 'Pose', 'seized', 'upon', 'Towers', 'Chandler']
79	He was on Broadway, surrounded by pomp and style, and there were eyes to look at him. 	Он — на Бродвее, всюду блеск и шик, и зрителей полным-полно. 	['Он', '—', 'на', 'Бродвее', 'всюду', 'блеск', 'и', 'шик', 'и', 'зрителей', 'полным-полно']	['He', 'was', 'on', 'Broadway', 'surrounded', 'by', 'pomp', 'and', 'style', 'and', 'there', 'were', 'eyes', 'to', 'look', 'at', 'him']
80	On the stage of that comedy he had assumed to play the one-night part of a butterfly of fashion and an idler of means and taste. 	Он почувствовал себя на сцене и решил в комедии-однодневке сыграть роль богатого светского повесы и гурмана. 	['Он', 'почувствовал', 'себя', 'на', 'сцене', 'и', 'решил', 'в', 'комедии-однодневке', 'сыграть', 'роль', 'богатого', 'светского', 'повесы', 'и', 'гурмана']	['On', 'the', 'stage', 'of', 'that', 'comedy', 'he', 'had', 'assumed', 'to', 'play', 'the', 'one-night', 'part', 'of', 'a', 'butterfly', 'of', 'fashion', 'and', 'an', 'idler', 'of', 'means', 'and', 'taste']
81	He was dressed for the part, and all his good angels had not the power to prevent him from acting it. 	Его костюм соответствовал роли, и никакие ангелы-хранители не могли помешать ему исполнить ее. 	['Его', 'костюм', 'соответствовал', 'роли', 'и', 'никакие', 'ангелы-хранители', 'не', 'могли', 'помешать', 'ему', 'исполнить', 'ее']	['He', 'was', 'dressed', 'for', 'the', 'part', 'and', 'all', 'his', 'good', 'angels', 'had', 'not', 'the', 'power', 'to', 'prevent', 'him', 'from', 'acting', 'it']
82	So he began to prate to Miss Marian of clubs, of teas, of golf and riding and kennels and cotillions and tours abroad and threw out hints of a yacht lying at Larchmont. 	И он пошел врать мисс Мэриан о клубах и банкетах, гольфе и верховой езде, псарнях и котильонах и поездках за границу и даже намекнул на яхту, которая стоит будто бы у него в Ларчмонте. 	['И', 'он', 'пошел', 'врать', 'мисс', 'Мэриан', 'о', 'клубах', 'и', 'банкетах', 'гольфе', 'и', 'верховой', 'езде', 'псарнях', 'и', 'котильонах', 'и', 'поездках', 'за', 'границу', 'и', 'даже', 'намекнул', 'на', 'яхту', 'которая', 'стоит', 'будто', 'бы', 'у', 'него', 'в', 'Ларчмонте']	['So', 'he', 'began', 'to', 'prate', 'to', 'Miss', 'Marian', 'of', 'clubs', 'of', 'teas', 'of', 'golf', 'and', 'riding', 'and', 'kennels', 'and', 'cotillions', 'and', 'tours', 'abroad', 'and', 'threw', 'out', 'hints', 'of', 'a', 'yacht', 'lying', 'at', 'Larchmont']
83	He could see that she was vastly impressed by this vague talk, so he endorsed his pose by random insinuations concerning great wealth, and mentioned familiarly a few names that are handled reverently by the proletariat. 	Заметив, что его болтовня производит на девушку впечатление, он поддал жару, наплел ей что-то о миллионах и упомянул запросто несколько фамилий, которые обыватель произносит с почтительным вздохом. 	['Заметив', 'что', 'его', 'болтовня', 'производит', 'на', 'девушку', 'впечатление', 'он', 'поддал', 'жару', 'наплел', 'ей', 'что-то', 'о', 'миллионах', 'и', 'упомянул', 'запросто', 'несколько', 'фамилий', 'которые', 'обыватель', 'произносит', 'с', 'почтительным', 'вздохом']	['He', 'could', 'see', 'that', 'she', 'was', 'vastly', 'impressed', 'by', 'this', 'vague', 'talk', 'so', 'he', 'endorsed', 'his', 'pose', 'by', 'random', 'insinuations', 'concerning', 'great', 'wealth', 'and', 'mentioned', 'familiarly', 'a', 'few', 'names', 'that', 'are', 'handled', 'reverently', 'by', 'the', 'proletariat']
84	It was Chandler's short little day, and he was wringing from it the best that could be had, as he saw it. 	Этот час принадлежал ему, и он выжимал из него все, что, по его мнению, было самым лучшим. 	['Этот', 'час', 'принадлежал', 'ему', 'и', 'он', 'выжимал', 'из', 'него', 'все', 'что', 'по', 'его', 'мнению', 'было', 'самым', 'лучшим']	"['It', 'was', ""Chandler's"", 'short', 'little', 'day', 'and', 'he', 'was', 'wringing', 'from', 'it', 'the', 'best', 'that', 'could', 'be', 'had', 'as', 'he', 'saw', 'it']"
85	And yet once or twice he saw the pure gold of this girl shine through the mist that his egotism had raised between him and all objects. 	И все же раз или два чистое золото ее сердца засияло перед ним сквозь туман самомнения, застлавшего ему глаза. 	['И', 'все', 'же', 'раз', 'или', 'два', 'чистое', 'золото', 'ее', 'сердца', 'засияло', 'перед', 'ним', 'сквозь', 'туман', 'самомнения', 'застлавшего', 'ему', 'глаза']	['And', 'yet', 'once', 'or', 'twice', 'he', 'saw', 'the', 'pure', 'gold', 'of', 'this', 'girl', 'shine', 'through', 'the', 'mist', 'that', 'his', 'egotism', 'had', 'raised', 'between', 'him', 'and', 'all', 'objects']
86	"""This way of living that you speak of,"" she said, ""sounds so futile and purposeless. "	— Образ жизни, о котором вы говорите, — сказала она, — кажется мне таким пустым и бесцельным. 	['—', 'Образ', 'жизни', 'о', 'котором', 'вы', 'говорите', '—', 'сказала', 'она', '—', 'кажется', 'мне', 'таким', 'пустым', 'и', 'бесцельным']	['This', 'way', 'of', 'living', 'that', 'you', 'speak', 'of', 'she', 'said', 'sounds', 'so', 'futile', 'and', 'purposeless']
87	"Haven't you any work to do in the world that might interest you more?"" "	Неужели в целом свете вы не можете найти для себя работы, которая заинтересовала бы вас? 	['Неужели', 'в', 'целом', 'свете', 'вы', 'не', 'можете', 'найти', 'для', 'себя', 'работы', 'которая', 'заинтересовала', 'бы', 'вас']	"[""Haven't"", 'you', 'any', 'work', 'to', 'do', 'in', 'the', 'world', 'that', 'might', 'interest', 'you', 'more']"
88	"""My dear Miss Marian,"" he exclaimed—""work! "	— Работа?! — воскликнул он. — Дорогая моя мисс Мэриан! 	['—', 'Работа', '—', 'воскликнул', 'он', '—', 'Дорогая', 'моя', 'мисс', 'Мэриан']	"['My', 'dear', 'Miss', 'Marian', 'he', 'exclaimed—""work']"
89	Think of dressing every day for dinner, of making half a dozen calls in an afternoon—with a policeman at every corner ready to jump into your auto and take you to the station, if you get up any greater speed than a donkey cart's gait. 	Попытайтесь представить себе, что вам каждый день надо переодеваться к обеду, делать в день по десяти визитов, а на каждом углу полицейские только и ждут, чтобы прыгнуть к вам в машину и потащить вас в участок, если вы чуточку превысите скорость ослиного шага! 	['Попытайтесь', 'представить', 'себе', 'что', 'вам', 'каждый', 'день', 'надо', 'переодеваться', 'к', 'обеду', 'делать', 'в', 'день', 'по', 'десяти', 'визитов', 'а', 'на', 'каждом', 'углу', 'полицейские', 'только', 'и', 'ждут', 'чтобы', 'прыгнуть', 'к', 'вам', 'в', 'машину', 'и', 'потащить', 'вас', 'в', 'участок', 'если', 'вы', 'чуточку', 'превысите', 'скорость', 'ослиного', 'шага']	"['Think', 'of', 'dressing', 'every', 'day', 'for', 'dinner', 'of', 'making', 'half', 'a', 'dozen', 'calls', 'in', 'an', 'afternoon—with', 'a', 'policeman', 'at', 'every', 'corner', 'ready', 'to', 'jump', 'into', 'your', 'auto', 'and', 'take', 'you', 'to', 'the', 'station', 'if', 'you', 'get', 'up', 'any', 'greater', 'speed', 'than', 'a', 'donkey', ""cart's"", 'gait']"
90	"We do-nothings are the hardest workers in the land."" "	Мы, бездельники, и есть самые работящие люди на земле. 	['Мы', 'бездельники', 'и', 'есть', 'самые', 'работящие', 'люди', 'на', 'земле']	['We', 'do-nothings', 'are', 'the', 'hardest', 'workers', 'in', 'the', 'land']
91	The dinner was concluded, the waiter generously fed, and the two walked out to the corner where they had met. 	Обед был окончен, официант щедро вознагражден, они вышли из ресторана и дошли до того угла, где состоялось их знакомство. 	['Обед', 'был', 'окончен', 'официант', 'щедро', 'вознагражден', 'они', 'вышли', 'из', 'ресторана', 'и', 'дошли', 'до', 'того', 'угла', 'где', 'состоялось', 'их', 'знакомство']	['The', 'dinner', 'was', 'concluded', 'the', 'waiter', 'generously', 'fed', 'and', 'the', 'two', 'walked', 'out', 'to', 'the', 'corner', 'where', 'they', 'had', 'met']
92	Miss Marian walked very well now; her limp was scarcely noticeable. 	Мисс Мэриан шла теперь совсем хорошо, ее хромота почти не была заметна. 	['Мисс', 'Мэриан', 'шла', 'теперь', 'совсем', 'хорошо', 'ее', 'хромота', 'почти', 'не', 'была', 'заметна']	['Miss', 'Marian', 'walked', 'very', 'well', 'now', 'her', 'limp', 'was', 'scarcely', 'noticeable']
93	"""Thank you for a nice time,"" she said, frankly. "	— Благодарю вас за приятно проведенный вечер, — искренне проговорила она. 	['—', 'Благодарю', 'вас', 'за', 'приятно', 'проведенный', 'вечер', '—', 'искренне', 'проговорила', 'она']	['Thank', 'you', 'for', 'a', 'nice', 'time', 'she', 'said', 'frankly']
94	"""I must run home now. "	— Ну, мне надо бежать домой. 	['—', 'Ну', 'мне', 'надо', 'бежать', 'домой']	['I', 'must', 'run', 'home', 'now']
95	"I liked the dinner very much, Mr. Chandler."" "	Обед мне очень понравился, мистер Чендлер. 	['Обед', 'мне', 'очень', 'понравился', 'мистер', 'Чендлер']	['I', 'liked', 'the', 'dinner', 'very', 'much', 'Mr', 'Chandler']
96	He shook hands with her, smiling cordially, and said something about a game of bridge at his club. 	Сердечно улыбаясь, он пожал ей руку и сказал что-то насчет своего клуба и партии в бридж. 	['Сердечно', 'улыбаясь', 'он', 'пожал', 'ей', 'руку', 'и', 'сказал', 'что-то', 'насчет', 'своего', 'клуба', 'и', 'партии', 'в', 'бридж']	['He', 'shook', 'hands', 'with', 'her', 'smiling', 'cordially', 'and', 'said', 'something', 'about', 'a', 'game', 'of', 'bridge', 'at', 'his', 'club']
97	He watched her for a moment, walking rather rapidly eastward, and then he found a cab to drive him slowly homeward. 	С минуту он смотрел, как она быстро шла в восточном направлении, затем нанял извозчика и не спеша покатил домой. 	['С', 'минуту', 'он', 'смотрел', 'как', 'она', 'быстро', 'шла', 'в', 'восточном', 'направлении', 'затем', 'нанял', 'извозчика', 'и', 'не', 'спеша', 'покатил', 'домой']	['He', 'watched', 'her', 'for', 'a', 'moment', 'walking', 'rather', 'rapidly', 'eastward', 'and', 'then', 'he', 'found', 'a', 'cab', 'to', 'drive', 'him', 'slowly', 'homeward']
98	In his chilly bedroom Chandler laid away his evening clothes for a sixty-nine days' rest. 	У себя, в сырой комнатушке, он сложил свой выходной костюм, предоставив ему отлеживаться шестьдесят девять дней. 	['У', 'себя', 'в', 'сырой', 'комнатушке', 'он', 'сложил', 'свой', 'выходной', 'костюм', 'предоставив', 'ему', 'отлеживаться', 'шестьдесят', 'девять', 'дней']	"['In', 'his', 'chilly', 'bedroom', 'Chandler', 'laid', 'away', 'his', 'evening', 'clothes', 'for', 'a', 'sixty-nine', ""days'"", 'rest']"
99	He went about it thoughtfully. 	Потом сел и задумался. 	['Потом', 'сел', 'и', 'задумался']	['He', 'went', 'about', 'it', 'thoughtfully']
100	"""That was a stunning girl,"" he said to himself. "	— Вот это девушка! — проговорил он вслух. 	['—', 'Вот', 'это', 'девушка', '—', 'проговорил', 'он', 'вслух']	['That', 'was', 'a', 'stunning', 'girl', 'he', 'said', 'to', 'himself']
101	"""She's all right, too, I'd be sworn, even if she does have to work. "	— А что она порядочная, головой ручаюсь, хоть ей и приходится работать из-за куска хлеба. 	['—', 'А', 'что', 'она', 'порядочная', 'головой', 'ручаюсь', 'хоть', 'ей', 'и', 'приходится', 'работать', 'из-за', 'куска', 'хлеба']	"[""She's"", 'all', 'right', 'too', ""I'd"", 'be', 'sworn', 'even', 'if', 'she', 'does', 'have', 'to', 'work']"
102	Perhaps if I'd told her the truth instead of all that razzle-dazzle we might—but, confound it! 	Как знать, не нагороди я всей этой идиотской чепухи, а скажи ей правду, мы могли бы… А, черт бы все побрал! 	['Как', 'знать', 'не', 'нагороди', 'я', 'всей', 'этой', 'идиотской', 'чепухи', 'а', 'скажи', 'ей', 'правду', 'мы', 'могли', 'бы…', 'А', 'черт', 'бы', 'все', 'побрал']	"['Perhaps', 'if', ""I'd"", 'told', 'her', 'the', 'truth', 'instead', 'of', 'all', 'that', 'razzle-dazzle', 'we', 'might—but', 'confound', 'it']"
103	"I had to play up to my clothes."" "	Костюм обязывал. 	['Костюм', 'обязывал']	['I', 'had', 'to', 'play', 'up', 'to', 'my', 'clothes']
104	Thus spoke the brave who was born and reared in the wigwams of the tribe of the Manhattans. 	Так рассуждал дикарь наших дней, рожденный и воспитанный в вигвамах племени манхэттенцев. 	['Так', 'рассуждал', 'дикарь', 'наших', 'дней', 'рожденный', 'и', 'воспитанный', 'в', 'вигвамах', 'племени', 'манхэттенцев']	['Thus', 'spoke', 'the', 'brave', 'who', 'was', 'born', 'and', 'reared', 'in', 'the', 'wigwams', 'of', 'the', 'tribe', 'of', 'the', 'Manhattans']
105	The girl, after leaving her entertainer, sped swiftly cross-town until she arrived at a handsome and sedate mansion two squares to the east, facing on that avenue which is the highway of Mammon and the auxiliary gods. 	Расставшись со своим кавалером, девушка быстро пошла прямо на восток и, пройдя два квартала, поровнялась с красивым большим особняком, выходящим на авеню, которая является главной магистралью Маммоны и вспомогательного отряда богов. 	['Расставшись', 'со', 'своим', 'кавалером', 'девушка', 'быстро', 'пошла', 'прямо', 'на', 'восток', 'и', 'пройдя', 'два', 'квартала', 'поровнялась', 'с', 'красивым', 'большим', 'особняком', 'выходящим', 'на', 'авеню', 'которая', 'является', 'главной', 'магистралью', 'Маммоны', 'и', 'вспомогательного', 'отряда', 'богов']	['The', 'girl', 'after', 'leaving', 'her', 'entertainer', 'sped', 'swiftly', 'cross-town', 'until', 'she', 'arrived', 'at', 'a', 'handsome', 'and', 'sedate', 'mansion', 'two', 'squares', 'to', 'the', 'east', 'facing', 'on', 'that', 'avenue', 'which', 'is', 'the', 'highway', 'of', 'Mammon', 'and', 'the', 'auxiliary', 'gods']
106	Here she entered hurriedly and ascended to a room where a handsome young lady in an elaborate house dress was looking anxiously out the window. 	Она поспешно вошла в дом и поднялась в комнату, где красивая молодая девушка в изящном домашнем платье беспокойно смотрела в окно. 	['Она', 'поспешно', 'вошла', 'в', 'дом', 'и', 'поднялась', 'в', 'комнату', 'где', 'красивая', 'молодая', 'девушка', 'в', 'изящном', 'домашнем', 'платье', 'беспокойно', 'смотрела', 'в', 'окно']	['Here', 'she', 'entered', 'hurriedly', 'and', 'ascended', 'to', 'a', 'room', 'where', 'a', 'handsome', 'young', 'lady', 'in', 'an', 'elaborate', 'house', 'dress', 'was', 'looking', 'anxiously', 'out', 'the', 'window']
107	"""Oh, you madcap!"" exclaimed the elder girl, when the other entered. "	— Ах ты, сорви-голова! — воскликнула она, увидев младшую сестру. 	['—', 'Ах', 'ты', 'сорви-голова', '—', 'воскликнула', 'она', 'увидев', 'младшую', 'сестру']	['Oh', 'you', 'madcap', 'exclaimed', 'the', 'elder', 'girl', 'when', 'the', 'other', 'entered']
108	"""When will you quit frightening us this way? "	— Когда ты перестанешь пугать нас своими выходками? 	['—', 'Когда', 'ты', 'перестанешь', 'пугать', 'нас', 'своими', 'выходками']	['When', 'will', 'you', 'quit', 'frightening', 'us', 'this', 'way']
109	It is two hours since you ran out in that rag of an old dress and Marie's hat. 	Вот уже два часа, как ты убежала в этих лохмотьях и в шляпке Мэри. 	['Вот', 'уже', 'два', 'часа', 'как', 'ты', 'убежала', 'в', 'этих', 'лохмотьях', 'и', 'в', 'шляпке', 'Мэри']	"['It', 'is', 'two', 'hours', 'since', 'you', 'ran', 'out', 'in', 'that', 'rag', 'of', 'an', 'old', 'dress', 'and', ""Marie's"", 'hat']"
110	Mamma has been so alarmed. 	Мама страшно встревожена. 	['Мама', 'страшно', 'встревожена']	['Mamma', 'has', 'been', 'so', 'alarmed']
111	She sent Louis in the auto to try to find you. 	Она послала Луи искать тебя на машине по всему городу. 	['Она', 'послала', 'Луи', 'искать', 'тебя', 'на', 'машине', 'по', 'всему', 'городу']	['She', 'sent', 'Louis', 'in', 'the', 'auto', 'to', 'try', 'to', 'find', 'you']
112	"You are a bad, thoughtless Puss."" "	Ты скверная и глупая девчонка! 	['Ты', 'скверная', 'и', 'глупая', 'девчонка']	['You', 'are', 'a', 'bad', 'thoughtless', 'Puss']
113	The elder girl touched a button, and a maid came in a moment. 	Она нажала кнопку, и в ту же минуту вошла горничная. 	['Она', 'нажала', 'кнопку', 'и', 'в', 'ту', 'же', 'минуту', 'вошла', 'горничная']	['The', 'elder', 'girl', 'touched', 'a', 'button', 'and', 'a', 'maid', 'came', 'in', 'a', 'moment']
114	"""Marie, tell mamma that Miss Marian has returned."" "	— Мэри, скажите маме, что мисс Мэриан вернулась. 	['—', 'Мэри', 'скажите', 'маме', 'что', 'мисс', 'Мэриан', 'вернулась']	['Marie', 'tell', 'mamma', 'that', 'Miss', 'Marian', 'has', 'returned']
115	"""Don't scold, sister. "	— Не ворчи, сестричка. 	['—', 'Не', 'ворчи', 'сестричка']	"[""Don't"", 'scold', 'sister']"
