	en	ru	ru_tokens	en_tokens
94	"""I'm glad to know you gents; I take great interest in the West. "	- Рад познакомиться с вами, джентльмены; меня очень интересует Запад. 	['Рад', 'познакомиться', 'с', 'вами', 'джентльмены', 'меня', 'очень', 'интересует', 'Запад']	"[""I'm"", 'glad', 'to', 'know', 'you', 'gents', 'I', 'take', 'great', 'interest', 'in', 'the', 'West']"
95	Klein tells me you're from Little Rock. 	Клейн сказал мне, что вы из Литл-Рока. 	['Клейн', 'сказал', 'мне', 'что', 'вы', 'из', 'Литл-Рока']	"['Klein', 'tells', 'me', ""you're"", 'from', 'Little', 'Rock']"
96	I think I've a railroad or two out there somewhere. 	У меня как будто имеется парочка железных дорог в тех краях. 	['У', 'меня', 'как', 'будто', 'имеется', 'парочка', 'железных', 'дорог', 'в', 'тех', 'краях']	"['I', 'think', ""I've"", 'a', 'railroad', 'or', 'two', 'out', 'there', 'somewhere']"
97	"If either of you guys would like to deal a hand or two of stud poker I—"" "	Может, кому из вас, ребята, охота перекинуться в покер, так я... 	['Может', 'кому', 'из', 'вас', 'ребята', 'охота', 'перекинуться', 'в', 'покер', 'так', 'я']	['If', 'either', 'of', 'you', 'guys', 'would', 'like', 'to', 'deal', 'a', 'hand', 'or', 'two', 'of', 'stud', 'poker', 'I—']
98	"""Now, Pierpont,"" cuts in Klein, ""you forget!"" "	- Пирпонт, Пирпонт, - перебивает Клейн. - Вы что, забыли? 	['Пирпонт', 'Пирпонт', 'перебивает', 'Клейн', 'Вы', 'что', 'забыли']	['Now', 'Pierpont', 'cuts', 'in', 'Klein', 'you', 'forget']
99	"""Excuse me, gents!"" says Morgan; ""since I've had the gout so bad I sometimes play a social game of cards at my house. "	- Ах, извините, джентльмены! - говорит Морган. - С тех пор как у меня сделалась подагра, я иногда играю в картишки со знакомыми, которые навещают меня в моем особняке. 	['Ах', 'извините', 'джентльмены', 'говорит', 'Морган', 'С', 'тех', 'пор', 'как', 'у', 'меня', 'сделалась', 'подагра', 'я', 'иногда', 'играю', 'в', 'картишки', 'со', 'знакомыми', 'которые', 'навещают', 'меня', 'в', 'моем', 'особняке']	"['Excuse', 'me', 'gents', 'says', 'Morgan', 'since', ""I've"", 'had', 'the', 'gout', 'so', 'bad', 'I', 'sometimes', 'play', 'a', 'social', 'game', 'of', 'cards', 'at', 'my', 'house']"
100	Neither of you never knew One-eyed Peters, did you, while you was around Little Rock? 	Скажите, никому из вас не приходилось там, на Западе, встречать Одноглазого Питера? 	['Скажите', 'никому', 'из', 'вас', 'не', 'приходилось', 'там', 'на', 'Западе', 'встречать', 'Одноглазого', 'Питера']	['Neither', 'of', 'you', 'never', 'knew', 'One-eyed', 'Peters', 'did', 'you', 'while', 'you', 'was', 'around', 'Little', 'Rock']
101	"He lived in Seattle, New Mexico."" "	Он жил в Сиэтле, Нью-Мексико. 	['Он', 'жил', 'в', 'Сиэтле', 'Нью-Мексико']	['He', 'lived', 'in', 'Seattle', 'New', 'Mexico']
102	Before we could answer, Mr. Morgan hammers on the floor with his cane and begins to walk up and down, swearing in a loud tone of voice. 	Не дожидаясь нашего ответа, мистер Морган вдруг сердито застучал палкой об пол и принялся расхаживать по комнате взад и вперед, браня кого-то громким голосом. 	['Не', 'дожидаясь', 'нашего', 'ответа', 'мистер', 'Морган', 'вдруг', 'сердито', 'застучал', 'палкой', 'об', 'пол', 'и', 'принялся', 'расхаживать', 'по', 'комнате', 'взад', 'и', 'вперед', 'браня', 'кого-то', 'громким', 'голосом']	['Before', 'we', 'could', 'answer', 'Mr', 'Morgan', 'hammers', 'on', 'the', 'floor', 'with', 'his', 'cane', 'and', 'begins', 'to', 'walk', 'up', 'and', 'down', 'swearing', 'in', 'a', 'loud', 'tone', 'of', 'voice']
103	"""They have been pounding your stocks to-day on the Street, Pierpont?"" asks Klein, smiling. "	- Что, Пирпонт, наверное, на Уолл-стрите опять стараются сбить курс ваших акций? - спрашивает Клейн с усмешкой. 	['Что', 'Пирпонт', 'наверное', 'на', 'Уолл-стрите', 'опять', 'стараются', 'сбить', 'курс', 'ваших', 'акций', 'спрашивает', 'Клейн', 'с', 'усмешкой']	['They', 'have', 'been', 'pounding', 'your', 'stocks', 'to-day', 'on', 'the', 'Street', 'Pierpont', 'asks', 'Klein', 'smiling']
104	"""Stocks! No!"" roars Mr. Morgan. "	- Какие там еще акции! - грозно рычит мистер Морган. 	['Какие', 'там', 'еще', 'акции', 'грозно', 'рычит', 'мистер', 'Морган']	['Stocks', 'No', 'roars', 'Mr', 'Morgan']
105	"""It's that picture I sent an agent to Europe to buy. I just thought about it. "	Это я расстраиваюсь из-за той картины, за которой специально посылал человека в Европу. 	['Это', 'я', 'расстраиваюсь', 'из-за', 'той', 'картины', 'за', 'которой', 'специально', 'посылал', 'человека', 'в', 'Европу']	"[""It's"", 'that', 'picture', 'I', 'sent', 'an', 'agent', 'to', 'Europe', 'to', 'buy', 'I', 'just', 'thought', 'about', 'it']"
106	He cabled me to-day that it ain't to be found in all Italy. 	Только сегодня получил от него телеграмму, что он ищет ее по всей Италии и не может найти. 	['Только', 'сегодня', 'получил', 'от', 'него', 'телеграмму', 'что', 'он', 'ищет', 'ее', 'по', 'всей', 'Италии', 'и', 'не', 'может', 'найти']	"['He', 'cabled', 'me', 'to-day', 'that', 'it', ""ain't"", 'to', 'be', 'found', 'in', 'all', 'Italy']"
107	I'd pay $50,000 to-morrow for that picture—yes, $75,000. 	Я бы завтрашний день заплатил за эту картину пятьдесят тысяч долларов - да что пятьдесят! Семьдесят пять тысяч заплатил бы. 	['Я', 'бы', 'завтрашний', 'день', 'заплатил', 'за', 'эту', 'картину', 'пятьдесят', 'тысяч', 'долларов', 'да', 'что', 'пятьдесят', 'Семьдесят', 'пять', 'тысяч', 'заплатил', 'бы']	"[""I'd"", 'pay', '50,000', 'to-morrow', 'for', 'that', 'picture—yes', '75,000']"
108	I give the agent a la carte in purchasing it. 	Я дал своему человеку a la carte: покупать за любую цену. 	['Я', 'дал', 'своему', 'человеку', 'a', 'la', 'carte', 'покупать', 'за', 'любую', 'цену']	['I', 'give', 'the', 'agent', 'a', 'la', 'carte', 'in', 'purchasing', 'it']
109	"I cannot understand why the art galleries will allow a De Vinchy to—"" "	Просто не понимаю, почему картинные галереи терпят, что настоящий де Винчи... 	['Просто', 'не', 'понимаю', 'почему', 'картинные', 'галереи', 'терпят', 'что', 'настоящий', 'де', 'Винчи']	['I', 'cannot', 'understand', 'why', 'the', 'art', 'galleries', 'will', 'allow', 'a', 'De', 'Vinchy', 'to—']
110	"""Why, Mr. Morgan,"" says klein; "	- Как, мистер Морган? - говорит Клейн. 	['Как', 'мистер', 'Морган', 'говорит', 'Клейн']	['Why', 'Mr', 'Morgan', 'says', 'klein']
111	"""I thought you owned all of the De Vinchy paintings."" "	- Разве не все картины де Винчи находятся в вашей коллекции? 	['Разве', 'не', 'все', 'картины', 'де', 'Винчи', 'находятся', 'в', 'вашей', 'коллекции']	['I', 'thought', 'you', 'owned', 'all', 'of', 'the', 'De', 'Vinchy', 'paintings']
112	"""What is the picture like, Mr. Morgan?"" asks Silver. "	- А что это за картина, мистер Морган? - спрашивает Силвер. 	['А', 'что', 'это', 'за', 'картина', 'мистер', 'Морган', 'спрашивает', 'Силвер']	['What', 'is', 'the', 'picture', 'like', 'Mr', 'Morgan', 'asks', 'Silver']
113	"""It must be as big as the side of the Flatiron Building."" "	"- Наверно, она величиной с боковую стену небоскреба ""Утюг""? "	['Наверно', 'она', 'величиной', 'с', 'боковую', 'стену', 'небоскреба', 'Утюг']	['It', 'must', 'be', 'as', 'big', 'as', 'the', 'side', 'of', 'the', 'Flatiron', 'Building']
114	"""I'm afraid your art education is on the bum, Mr. Silver,"" says Morgan. "	- Вы, я вижу, не очень разбираетесь в искусстве, мистер Силвер, - говорит Морган. 	['Вы', 'я', 'вижу', 'не', 'очень', 'разбираетесь', 'в', 'искусстве', 'мистер', 'Силвер', 'говорит', 'Морган']	"[""I'm"", 'afraid', 'your', 'art', 'education', 'is', 'on', 'the', 'bum', 'Mr', 'Silver', 'says', 'Morgan']"
115	"""The picture is 27 inches by 42; and it is called 'Love's Idle Hour.' "	"- Это картинка размером двадцать семь дюймов на сорок два, и называется она ""Досуг любви"". "	['Это', 'картинка', 'размером', 'двадцать', 'семь', 'дюймов', 'на', 'сорок', 'два', 'и', 'называется', 'она', 'Досуг', 'любви']	"['The', 'picture', 'is', '27', 'inches', 'by', '42', 'and', 'it', 'is', 'called', ""'Love's"", 'Idle', ""Hour.'""]"
116	It represents a number of cloak models doing the two-step on the bank of a purple river. The cablegram said it might have been brought to this country. 	Нарисовано на ней несколько барышень-манекенш, которые танцуют тустеп на берегу лиловой речки, В телеграмме говорится, что скорей всего эта картинка уже вывезена в Америку. 	['Нарисовано', 'на', 'ней', 'несколько', 'барышень-манекенш', 'которые', 'танцуют', 'тустеп', 'на', 'берегу', 'лиловой', 'речки', 'В', 'телеграмме', 'говорится', 'что', 'скорей', 'всего', 'эта', 'картинка', 'уже', 'вывезена', 'в', 'Америку']	['It', 'represents', 'a', 'number', 'of', 'cloak', 'models', 'doing', 'the', 'two-step', 'on', 'the', 'bank', 'of', 'a', 'purple', 'river', 'The', 'cablegram', 'said', 'it', 'might', 'have', 'been', 'brought', 'to', 'this', 'country']
117	My collection will never be complete without that picture. 	А без нее моя коллекция не полна. 	['А', 'без', 'нее', 'моя', 'коллекция', 'не', 'полна']	['My', 'collection', 'will', 'never', 'be', 'complete', 'without', 'that', 'picture']
118	"Well, so long, gents; us financiers must keep early hours."" "	Ну, мне пора, джентльмены. Наш брат, финансист, должен, знаете, соблюдать режим. 	['Ну', 'мне', 'пора', 'джентльмены', 'Наш', 'брат', 'финансист', 'должен', 'знаете', 'соблюдать', 'режим']	['Well', 'so', 'long', 'gents', 'us', 'financiers', 'must', 'keep', 'early', 'hours']
119	Mr. Morgan and Klein went away together in a cab. 	Мистер Морган уехал от нас в кэбе вместе с Клейном. 	['Мистер', 'Морган', 'уехал', 'от', 'нас', 'в', 'кэбе', 'вместе', 'с', 'Клейном']	['Mr', 'Morgan', 'and', 'Klein', 'went', 'away', 'together', 'in', 'a', 'cab']
120	Me and Silver talked about how simple and unsuspecting great people was; and Silver said what a shame it would be to try to rob a man like Mr. Morgan; and I said I thought it would be rather imprudent, myself. 	После их ухода мы с Силвером долго говорили о том, как простодушны и доверчивы великие люди; Силвер сказал, что обмануть такого человека, как мистер Морган, было бы просто бессовестно; а я сказал, что, на мой взгляд, это было бы неосторожно. 	['После', 'их', 'ухода', 'мы', 'с', 'Силвером', 'долго', 'говорили', 'о', 'том', 'как', 'простодушны', 'и', 'доверчивы', 'великие', 'люди', 'Силвер', 'сказал', 'что', 'обмануть', 'такого', 'человека', 'как', 'мистер', 'Морган', 'было', 'бы', 'просто', 'бессовестно', 'а', 'я', 'сказал', 'что', 'на', 'мой', 'взгляд', 'это', 'было', 'бы', 'неосторожно']	['Me', 'and', 'Silver', 'talked', 'about', 'how', 'simple', 'and', 'unsuspecting', 'great', 'people', 'was', 'and', 'Silver', 'said', 'what', 'a', 'shame', 'it', 'would', 'be', 'to', 'try', 'to', 'rob', 'a', 'man', 'like', 'Mr', 'Morgan', 'and', 'I', 'said', 'I', 'thought', 'it', 'would', 'be', 'rather', 'imprudent', 'myself']
121	Klein proposes a stroll after dinner; and me and him and Silver walks down toward Seventh Avenue to see the sights. 	После обеда Клейн предложил пройтись по городу, и мы втроем, я, он и Силвер, отправились на Седьмую авеню посмотреть, какие там есть достопримечательности. 	['После', 'обеда', 'Клейн', 'предложил', 'пройтись', 'по', 'городу', 'и', 'мы', 'втроем', 'я', 'он', 'и', 'Силвер', 'отправились', 'на', 'Седьмую', 'авеню', 'посмотреть', 'какие', 'там', 'есть', 'достопримечательности']	['Klein', 'proposes', 'a', 'stroll', 'after', 'dinner', 'and', 'me', 'and', 'him', 'and', 'Silver', 'walks', 'down', 'toward', 'Seventh', 'Avenue', 'to', 'see', 'the', 'sights']
122	Klein sees a pair of cuff links that instigate his admiration in a pawnshop window, and we all go in while he buys 'em. 	В витрине у закладчика Клейн вдруг увидел запонки, которые ему ужасно понравились. Он вошел в лавку, чтобы купить их, а мы вошли вместе с ним. 	['В', 'витрине', 'у', 'закладчика', 'Клейн', 'вдруг', 'увидел', 'запонки', 'которые', 'ему', 'ужасно', 'понравились', 'Он', 'вошел', 'в', 'лавку', 'чтобы', 'купить', 'их', 'а', 'мы', 'вошли', 'вместе', 'с', 'ним']	"['Klein', 'sees', 'a', 'pair', 'of', 'cuff', 'links', 'that', 'instigate', 'his', 'admiration', 'in', 'a', 'pawnshop', 'window', 'and', 'we', 'all', 'go', 'in', 'while', 'he', 'buys', ""'em""]"
123	After we got back to the hotel and Klein had gone, Silver jumps at me and waves his hands. 	Когда мы вернулись в отель и Клейн ушел к себе, Силвер вдруг кидается ко мне и начинает размахивать руками. 	['Когда', 'мы', 'вернулись', 'в', 'отель', 'и', 'Клейн', 'ушел', 'к', 'себе', 'Силвер', 'вдруг', 'кидается', 'ко', 'мне', 'и', 'начинает', 'размахивать', 'руками']	['After', 'we', 'got', 'back', 'to', 'the', 'hotel', 'and', 'Klein', 'had', 'gone', 'Silver', 'jumps', 'at', 'me', 'and', 'waves', 'his', 'hands']
124	"""Did you see it?"" says he. "	- Видал? - говорит он. 	['Видал', 'говорит', 'он']	['Did', 'you', 'see', 'it', 'says', 'he']
125	"""Did you see it, Billy?"" "	- Ты ее видал, Билли? 	['Ты', 'ее', 'видал', 'Билли']	['Did', 'you', 'see', 'it', 'Billy']
126	"""What?"" I asks. "	- Кого - ее? - спрашиваю. 	['Кого', 'ее', 'спрашиваю']	['What', 'I', 'asks']
127	"""Why, that picture that Morgan wants. "	- Да ту самую картинку, за которой охотится Морган. 	['Да', 'ту', 'самую', 'картинку', 'за', 'которой', 'охотится', 'Морган']	['Why', 'that', 'picture', 'that', 'Morgan', 'wants']
128	It's hanging in that pawnshop, behind the desk. 	Она висит у закладчика, прямо над его конторкой. 	['Она', 'висит', 'у', 'закладчика', 'прямо', 'над', 'его', 'конторкой']	"[""It's"", 'hanging', 'in', 'that', 'pawnshop', 'behind', 'the', 'desk']"
129	I didn't say anything because Klein was there. 	Я только не хотел ничего говорить при Клейне. 	['Я', 'только', 'не', 'хотел', 'ничего', 'говорить', 'при', 'Клейне']	"['I', ""didn't"", 'say', 'anything', 'because', 'Klein', 'was', 'there']"
130	It's the article sure as you live. 	Будь уверен, это та самая. 	['Будь', 'уверен', 'это', 'та', 'самая']	"[""It's"", 'the', 'article', 'sure', 'as', 'you', 'live']"
131	The girls are as natural as paint can make them, all measuring 36 and 25 and 42 skirts, if they had any skirts, and they're doing a buck-and-wing on the bank of a river with the blues. 	Барышни прямо как живые, из таких, что носят платья сорок шестого размера, но там-то они обходятся без платьев. И все так меланхолично выбрыкивают ногами, и речка тут же, и берег. 	['Барышни', 'прямо', 'как', 'живые', 'из', 'таких', 'что', 'носят', 'платья', 'сорок', 'шестого', 'размера', 'но', 'там-то', 'они', 'обходятся', 'без', 'платьев', 'И', 'все', 'так', 'меланхолично', 'выбрыкивают', 'ногами', 'и', 'речка', 'тут', 'же', 'и', 'берег']	"['The', 'girls', 'are', 'as', 'natural', 'as', 'paint', 'can', 'make', 'them', 'all', 'measuring', '36', 'and', '25', 'and', '42', 'skirts', 'if', 'they', 'had', 'any', 'skirts', 'and', ""they're"", 'doing', 'a', 'buck-and-wing', 'on', 'the', 'bank', 'of', 'a', 'river', 'with', 'the', 'blues']"
132	What did Mr. Morgan say he'd give for it? 	Сколько, мистер Морган сказал, он бы отдал за эту картину? 	['Сколько', 'мистер', 'Морган', 'сказал', 'он', 'бы', 'отдал', 'за', 'эту', 'картину']	"['What', 'did', 'Mr', 'Morgan', 'say', ""he'd"", 'give', 'for', 'it']"
133	Oh, don't make me tell you. 	Ну, неужели не понимаешь? 	['Ну', 'неужели', 'не', 'понимаешь']	"['Oh', ""don't"", 'make', 'me', 'tell', 'you']"
134	"They can't know what it is in that pawnshop."" "	Ведь хозяин лавки наверняка не знает, что у него там за сокровище. 	['Ведь', 'хозяин', 'лавки', 'наверняка', 'не', 'знает', 'что', 'у', 'него', 'там', 'за', 'сокровище']	"['They', ""can't"", 'know', 'what', 'it', 'is', 'in', 'that', 'pawnshop']"
135	When the pawnshop opened the next morning me and Silver was standing there as anxious as if we wanted to soak our Sunday suit to buy a drink. 	На следующее утро лавка еще не успела открыться, а мы с Силвером уже были тут как тут, словно двое забулдыг, которым не терпится раздобыть денег на выпивку под заклад воскресного костюма. 	['На', 'следующее', 'утро', 'лавка', 'еще', 'не', 'успела', 'открыться', 'а', 'мы', 'с', 'Силвером', 'уже', 'были', 'тут', 'как', 'тут', 'словно', 'двое', 'забулдыг', 'которым', 'не', 'терпится', 'раздобыть', 'денег', 'на', 'выпивку', 'под', 'заклад', 'воскресного', 'костюма']	['When', 'the', 'pawnshop', 'opened', 'the', 'next', 'morning', 'me', 'and', 'Silver', 'was', 'standing', 'there', 'as', 'anxious', 'as', 'if', 'we', 'wanted', 'to', 'soak', 'our', 'Sunday', 'suit', 'to', 'buy', 'a', 'drink']
136	We sauntered inside, and began to look at watch-chains. 	Входим мы в лавку и начинаем рассматривать цепочки для часов. 	['Входим', 'мы', 'в', 'лавку', 'и', 'начинаем', 'рассматривать', 'цепочки', 'для', 'часов']	['We', 'sauntered', 'inside', 'and', 'began', 'to', 'look', 'at', 'watch-chains']
137	"""That's a violent specimen of a chromo you've got up there,"" remarked Silver, casual, to the pawnbroker. "	- Это что за мазня у вас там висит, над конторкой? говорит Силвер хозяину как бы между прочим. 	['Это', 'что', 'за', 'мазня', 'у', 'вас', 'там', 'висит', 'над', 'конторкой', 'говорит', 'Силвер', 'хозяину', 'как', 'бы', 'между', 'прочим']	"[""That's"", 'a', 'violent', 'specimen', 'of', 'a', 'chromo', ""you've"", 'got', 'up', 'there', 'remarked', 'Silver', 'casual', 'to', 'the', 'pawnbroker']"
138	"""But I kind of enthuse over the girl with the shoulder-blades and red bunting. "	- Вообще говоря, никудышная картинка, но мне на ней приглянулась вон та рыженькая, с острыми лопатками. 	['Вообще', 'говоря', 'никудышная', 'картинка', 'но', 'мне', 'на', 'ней', 'приглянулась', 'вон', 'та', 'рыженькая', 'с', 'острыми', 'лопатками']	['But', 'I', 'kind', 'of', 'enthuse', 'over', 'the', 'girl', 'with', 'the', 'shoulder-blades', 'and', 'red', 'bunting']
139	"Would an offer of $2.25 for it cause you to knock over any fragile articles of your stock in hurrying it off the nail?"" "	Я бы вам предложил за нее два доллара с четвертью, да боюсь, как бы вы не разбили какие-нибудь хрупкие предметы, когда броситесь поскорее снимать ее с гвоздя. 	['Я', 'бы', 'вам', 'предложил', 'за', 'нее', 'два', 'доллара', 'с', 'четвертью', 'да', 'боюсь', 'как', 'бы', 'вы', 'не', 'разбили', 'какие-нибудь', 'хрупкие', 'предметы', 'когда', 'броситесь', 'поскорее', 'снимать', 'ее', 'с', 'гвоздя']	['Would', 'an', 'offer', 'of', '2.25', 'for', 'it', 'cause', 'you', 'to', 'knock', 'over', 'any', 'fragile', 'articles', 'of', 'your', 'stock', 'in', 'hurrying', 'it', 'off', 'the', 'nail']
140	The pawnbroker smiles and goes on showing us plate watch-chains. 	Хозяин усмехается и продолжает раскладывать перед нами часовые цепочки накладного золота. 	['Хозяин', 'усмехается', 'и', 'продолжает', 'раскладывать', 'перед', 'нами', 'часовые', 'цепочки', 'накладного', 'золота']	['The', 'pawnbroker', 'smiles', 'and', 'goes', 'on', 'showing', 'us', 'plate', 'watch-chains']
141	"""That picture,"" says he, ""was pledged a year ago by an Italian gentleman. "	- Эту картину, - говорит он, - принес мне в заклад один итальянец год тому назад. 	['Эту', 'картину', 'говорит', 'он', 'принес', 'мне', 'в', 'заклад', 'один', 'итальянец', 'год', 'тому', 'назад']	['That', 'picture', 'says', 'he', 'was', 'pledged', 'a', 'year', 'ago', 'by', 'an', 'Italian', 'gentleman']
142	I loaned him $500 on it. 	Я ему дал под нее пятьсот долларов. 	['Я', 'ему', 'дал', 'под', 'нее', 'пятьсот', 'долларов']	['I', 'loaned', 'him', '500', 'on', 'it']
