	en	ru	ru_tokens	en_tokens
47	As for burglars, they won't go in a house now unless there's a hot supper ready and a few college students to wait on 'em. 	Грабители, например, так те просто не войдут в дом, если там не приготовлен горячий ужин и нет достаточного штата прислуги с высшим образованием. 	['Грабители', 'например', 'так', 'те', 'просто', 'не', 'войдут', 'в', 'дом', 'если', 'там', 'не', 'приготовлен', 'горячий', 'ужин', 'и', 'нет', 'достаточного', 'штата', 'прислуги', 'с', 'высшим', 'образованием']	"['As', 'for', 'burglars', 'they', ""won't"", 'go', 'in', 'a', 'house', 'now', 'unless', ""there's"", 'a', 'hot', 'supper', 'ready', 'and', 'a', 'few', 'college', 'students', 'to', 'wait', 'on', ""'em""]"
48	"They're slugging citizens all over the upper part of the city and I guess, taking the town from end to end, it's a plain case of assault and Battery."" "	В любом районе бандиты дырявят граждан без всякого затруднения, и это рассматривается как простой случай оскорбления действием. 	['В', 'любом', 'районе', 'бандиты', 'дырявят', 'граждан', 'без', 'всякого', 'затруднения', 'и', 'это', 'рассматривается', 'как', 'простой', 'случай', 'оскорбления', 'действием']	"[""They're"", 'slugging', 'citizens', 'all', 'over', 'the', 'upper', 'part', 'of', 'the', 'city', 'and', 'I', 'guess', 'taking', 'the', 'town', 'from', 'end', 'to', 'end', ""it's"", 'a', 'plain', 'case', 'of', 'assault', 'and', 'Battery']"
49	"""Monty,"" says I, when Silver had slacked, up, ""you may have Manhattan correctly discriminated in your perorative, but I doubt it. "	- Монти, - говорю я, как только Силвер затормозил, может, ты и правильно разделал Манхэттен в своем резюме, но что-то мне не верится. 	['Монти', 'говорю', 'я', 'как', 'только', 'Силвер', 'затормозил', 'может', 'ты', 'и', 'правильно', 'разделал', 'Манхэттен', 'в', 'своем', 'резюме', 'но', 'что-то', 'мне', 'не', 'верится']	['Monty', 'says', 'I', 'when', 'Silver', 'had', 'slacked', 'up', 'you', 'may', 'have', 'Manhattan', 'correctly', 'discriminated', 'in', 'your', 'perorative', 'but', 'I', 'doubt', 'it']
50	I've only been in town two hours, but it don't dawn upon me that it's ours with a cherry in it. 	Я здесь всего два часа, но у меня нет такого впечатления, что этот городишко уже выложен для нас на тарелочку и даже ложка рядом. 	['Я', 'здесь', 'всего', 'два', 'часа', 'но', 'у', 'меня', 'нет', 'такого', 'впечатления', 'что', 'этот', 'городишко', 'уже', 'выложен', 'для', 'нас', 'на', 'тарелочку', 'и', 'даже', 'ложка', 'рядом']	"[""I've"", 'only', 'been', 'in', 'town', 'two', 'hours', 'but', 'it', ""don't"", 'dawn', 'upon', 'me', 'that', ""it's"", 'ours', 'with', 'a', 'cherry', 'in', 'it']"
51	There ain't enough rus in urbe about it to suit me. 	На мой вкус, ему не хватает rus in urbe (1). 	['На', 'мой', 'вкус', 'ему', 'не', 'хватает', 'rus', 'in', 'urbe', '1']	"['There', ""ain't"", 'enough', 'rus', 'in', 'urbe', 'about', 'it', 'to', 'suit', 'me']"
52	I'd be a good deal much better satisfied if the citizens had a straw or more in their hair, and run more to velveteen vests and buckeye watch charms. 	Меня бы, прямо скажу, больше устроило, если бы у здешних граждан порой торчали соломинки в волосах и они питали пристрастие к бархатным жилетам и брелокам с гирю величиной. 	['Меня', 'бы', 'прямо', 'скажу', 'больше', 'устроило', 'если', 'бы', 'у', 'здешних', 'граждан', 'порой', 'торчали', 'соломинки', 'в', 'волосах', 'и', 'они', 'питали', 'пристрастие', 'к', 'бархатным', 'жилетам', 'и', 'брелокам', 'с', 'гирю', 'величиной']	"[""I'd"", 'be', 'a', 'good', 'deal', 'much', 'better', 'satisfied', 'if', 'the', 'citizens', 'had', 'a', 'straw', 'or', 'more', 'in', 'their', 'hair', 'and', 'run', 'more', 'to', 'velveteen', 'vests', 'and', 'buckeye', 'watch', 'charms']"
53	"They don't look easy to me."" "	Боюсь, что не так уж они просты. 	['Боюсь', 'что', 'не', 'так', 'уж', 'они', 'просты']	"['They', ""don't"", 'look', 'easy', 'to', 'me']"
54	"""You've got it, Billy,"" says Silver. "	- Все понятно. Билли, - говорит Силвер. 	['Все', 'понятно', 'Билли', 'говорит', 'Силвер']	"[""You've"", 'got', 'it', 'Billy', 'says', 'Silver']"
55	"""All emigrants have it. "	- Ты заболел эмигрантской болезнью. 	['Ты', 'заболел', 'эмигрантской', 'болезнью']	['All', 'emigrants', 'have', 'it']
56	New York's bigger than Little Rock or Europe, and it frightens a foreigner. 	Само собой, Нью-Йорк чуть побольше, чем Литл-Рок или Европа, я приезжему человеку с непривычки страшновато. 	['Само', 'собой', 'Нью-Йорк', 'чуть', 'побольше', 'чем', 'Литл-Рок', 'или', 'Европа', 'я', 'приезжему', 'человеку', 'с', 'непривычки', 'страшновато']	"['New', ""York's"", 'bigger', 'than', 'Little', 'Rock', 'or', 'Europe', 'and', 'it', 'frightens', 'a', 'foreigner']"
57	You'll be all right. 	Но ничего, это у тебя пройдет. 	['Но', 'ничего', 'это', 'у', 'тебя', 'пройдет']	"[""You'll"", 'be', 'all', 'right']"
58	I tell you I feel like slapping the people here because they don't send me all their money in laundry baskets, with germicide sprinkled over it. 	"Я же тебе говорю, мне иной раз хочется отшлепать здешних жителей за то, что они не присылают мне все свои"" деньги уложенными в корзины для белья и обрызганными жидкостью от насекомых. "	['Я', 'же', 'тебе', 'говорю', 'мне', 'иной', 'раз', 'хочется', 'отшлепать', 'здешних', 'жителей', 'за', 'то', 'что', 'они', 'не', 'присылают', 'мне', 'все', 'свои', 'деньги', 'уложенными', 'в', 'корзины', 'для', 'белья', 'и', 'обрызганными', 'жидкостью', 'от', 'насекомых']	"['I', 'tell', 'you', 'I', 'feel', 'like', 'slapping', 'the', 'people', 'here', 'because', 'they', ""don't"", 'send', 'me', 'all', 'their', 'money', 'in', 'laundry', 'baskets', 'with', 'germicide', 'sprinkled', 'over', 'it']"
59	I hate to go down on the street to get it. 	А то еще тащись за ними на улицу! 	['А', 'то', 'еще', 'тащись', 'за', 'ними', 'на', 'улицу']	['I', 'hate', 'to', 'go', 'down', 'on', 'the', 'street', 'to', 'get', 'it']
60	Who wears the diamonds in this town? 	Знаешь, кто в этом городе ходит в брильянтах? 	['Знаешь', 'кто', 'в', 'этом', 'городе', 'ходит', 'в', 'брильянтах']	['Who', 'wears', 'the', 'diamonds', 'in', 'this', 'town']
61	Why, Winnie, the Wiretapper's wife, and Bella, the Buncosteerer's bride. 	Жены мазуриков и невесты шулеров. 	['Жены', 'мазуриков', 'и', 'невесты', 'шулеров']	"['Why', 'Winnie', 'the', ""Wiretapper's"", 'wife', 'and', 'Bella', 'the', ""Buncosteerer's"", 'bride']"
62	New Yorkers can be worked easier than a blue rose on a tidy. 	Облапошить ньюйоркца легче, чем вышить голубую розу на салфеточке. 	['Облапошить', 'ньюйоркца', 'легче', 'чем', 'вышить', 'голубую', 'розу', 'на', 'салфеточке']	['New', 'Yorkers', 'can', 'be', 'worked', 'easier', 'than', 'a', 'blue', 'rose', 'on', 'a', 'tidy']
63	"The only thing that bothers me is I know I'll break the cigars in my vest pocket when I get my clothes all full of twenties."" "	Меня только одна вещь беспокоит - как бы мои сигары не поломались, когда у меня все карманы будут набиты двадцатками. 	['Меня', 'только', 'одна', 'вещь', 'беспокоит', 'как', 'бы', 'мои', 'сигары', 'не', 'поломались', 'когда', 'у', 'меня', 'все', 'карманы', 'будут', 'набиты', 'двадцатками']	"['The', 'only', 'thing', 'that', 'bothers', 'me', 'is', 'I', 'know', ""I'll"", 'break', 'the', 'cigars', 'in', 'my', 'vest', 'pocket', 'when', 'I', 'get', 'my', 'clothes', 'all', 'full', 'of', 'twenties']"
64	"""I hope you are right, Monty,"" says I; ""but I wish all the same I had been satisfied with a small business in Little Rock. "	- Что ж, дай бог, чтоб ты оказался прав, Монти, - говорю я, - только лучше бы мне все-таки сидеть в Литл-Роке и не гнаться за большими доходами. 	['Что', 'ж', 'дай', 'бог', 'чтоб', 'ты', 'оказался', 'прав', 'Монти', 'говорю', 'я', 'только', 'лучше', 'бы', 'мне', 'все-таки', 'сидеть', 'в', 'Литл-Роке', 'и', 'не', 'гнаться', 'за', 'большими', 'доходами']	['I', 'hope', 'you', 'are', 'right', 'Monty', 'says', 'I', 'but', 'I', 'wish', 'all', 'the', 'same', 'I', 'had', 'been', 'satisfied', 'with', 'a', 'small', 'business', 'in', 'Little', 'Rock']
65	The crop of farmers is never so short out there but what you can get a few of 'em to sign a petition for a new post office that you can discount for $200 at the county bank. 	Даже в неурожайный год там всегда наберется десяток-другой фермеров, готовых поставить свое имя на подписном листе в пользу постройки нового здания для почты, который можно учесть в местном банке сотни за две долларов. 	['Даже', 'в', 'неурожайный', 'год', 'там', 'всегда', 'наберется', 'десяток-другой', 'фермеров', 'готовых', 'поставить', 'свое', 'имя', 'на', 'подписном', 'листе', 'в', 'пользу', 'постройки', 'нового', 'здания', 'для', 'почты', 'который', 'можно', 'учесть', 'в', 'местном', 'банке', 'сотни', 'за', 'две', 'долларов']	"['The', 'crop', 'of', 'farmers', 'is', 'never', 'so', 'short', 'out', 'there', 'but', 'what', 'you', 'can', 'get', 'a', 'few', 'of', ""'em"", 'to', 'sign', 'a', 'petition', 'for', 'a', 'new', 'post', 'office', 'that', 'you', 'can', 'discount', 'for', '200', 'at', 'the', 'county', 'bank']"
66	The people here appear to possess instincts of self-preservation and illiberality. 	А у здешних людей, сдается мне, чересчур развит инстинкт самосохранения и сохранения своего кошелька. 	['А', 'у', 'здешних', 'людей', 'сдается', 'мне', 'чересчур', 'развит', 'инстинкт', 'самосохранения', 'и', 'сохранения', 'своего', 'кошелька']	['The', 'people', 'here', 'appear', 'to', 'possess', 'instincts', 'of', 'self-preservation', 'and', 'illiberality']
67	"I fear me that we are not cultured enough to tackle this game."" "	Боюсь, что у нас с тобой для такой игры тренировки маловато. 	['Боюсь', 'что', 'у', 'нас', 'с', 'тобой', 'для', 'такой', 'игры', 'тренировки', 'маловато']	['I', 'fear', 'me', 'that', 'we', 'are', 'not', 'cultured', 'enough', 'to', 'tackle', 'this', 'game']
68	"""Don't worry,"" says Silver. "	- Напрасные опасения, - говорит Силвер. 	['Напрасные', 'опасения', 'говорит', 'Силвер']	"[""Don't"", 'worry', 'says', 'Silver']"
69	"""I've got this Jayville-near-Tarrytown correctly estimated as sure as North River is the Hudson and East River ain't a river. "	- Я знаю настоящую цену этому Кретинтауну близ Разиньвилля, и это так же верно, как то, что Северная река-это Гудзон, а Восточная река - вообще не река (2). 	['Я', 'знаю', 'настоящую', 'цену', 'этому', 'Кретинтауну', 'близ', 'Разиньвилля', 'и', 'это', 'так', 'же', 'верно', 'как', 'то', 'что', 'Северная', 'река-это', 'Гудзон', 'а', 'Восточная', 'река', 'вообще', 'не', 'река', '2']	"[""I've"", 'got', 'this', 'Jayville-near-Tarrytown', 'correctly', 'estimated', 'as', 'sure', 'as', 'North', 'River', 'is', 'the', 'Hudson', 'and', 'East', 'River', ""ain't"", 'a', 'river']"
70	Why, there are people living in four blocks of Broadway who never saw any kind of a building except a skyscraper in their lives! 	Да тут в четырех кварталах от Бродвея живут люди, которые в жизни не видели никаких домов, кроме небоскребов. 	['Да', 'тут', 'в', 'четырех', 'кварталах', 'от', 'Бродвея', 'живут', 'люди', 'которые', 'в', 'жизни', 'не', 'видели', 'никаких', 'домов', 'кроме', 'небоскребов']	['Why', 'there', 'are', 'people', 'living', 'in', 'four', 'blocks', 'of', 'Broadway', 'who', 'never', 'saw', 'any', 'kind', 'of', 'a', 'building', 'except', 'a', 'skyscraper', 'in', 'their', 'lives']
71	"A good, live hustling Western man ought to get conspicuous enough here inside of three months to incur either Jerome's clemency or Lawson's displeasure."" "	Живой, деятельный, энергичный житель Запада за каких-нибудь три месяца должен сделаться здесь достаточно заметной фигурой, чтобы заслужить либо снисхождение Джерома, либо осуждение Лоусона. 	['Живой', 'деятельный', 'энергичный', 'житель', 'Запада', 'за', 'каких-нибудь', 'три', 'месяца', 'должен', 'сделаться', 'здесь', 'достаточно', 'заметной', 'фигурой', 'чтобы', 'заслужить', 'либо', 'снисхождение', 'Джерома', 'либо', 'осуждение', 'Лоусона']	"['A', 'good', 'live', 'hustling', 'Western', 'man', 'ought', 'to', 'get', 'conspicuous', 'enough', 'here', 'inside', 'of', 'three', 'months', 'to', 'incur', 'either', ""Jerome's"", 'clemency', 'or', ""Lawson's"", 'displeasure']"
72	"""Hyperbole aside,"" says I, ""do you know of any immediate system of buncoing the community out of a dollar or two except by applying to the Salvation Army or having a fit on Miss Helen Gould's doorsteps?"" "	- Оставим гиперболы, - говорю я, - и скажи, можешь ли ты предложить конкретный способ облегчить здешнее общество на доллар-другой, не обращаясь к Армии спасения и не падая в обморок на крыльце особняка мисс Эллен Гулд? 	['Оставим', 'гиперболы', 'говорю', 'я', 'и', 'скажи', 'можешь', 'ли', 'ты', 'предложить', 'конкретный', 'способ', 'облегчить', 'здешнее', 'общество', 'на', 'доллар-другой', 'не', 'обращаясь', 'к', 'Армии', 'спасения', 'и', 'не', 'падая', 'в', 'обморок', 'на', 'крыльце', 'особняка', 'мисс', 'Эллен', 'Гулд']	"['Hyperbole', 'aside', 'says', 'I', 'do', 'you', 'know', 'of', 'any', 'immediate', 'system', 'of', 'buncoing', 'the', 'community', 'out', 'of', 'a', 'dollar', 'or', 'two', 'except', 'by', 'applying', 'to', 'the', 'Salvation', 'Army', 'or', 'having', 'a', 'fit', 'on', 'Miss', 'Helen', ""Gould's"", 'doorsteps']"
73	"""Dozens of 'em,"" says Silver. "	- Могу предложить хоть двадцать способов, - говорит Силвер. 	['Могу', 'предложить', 'хоть', 'двадцать', 'способов', 'говорит', 'Силвер']	"['Dozens', 'of', ""'em"", 'says', 'Silver']"
74	"""How much capital have you got, Billy?"" "	- Сколько у тебя капиталу, Билли? 	['Сколько', 'у', 'тебя', 'капиталу', 'Билли']	['How', 'much', 'capital', 'have', 'you', 'got', 'Billy']
75	"""A thousand,"" I told him. "	- Тысяча, - отвечаю. 	['Тысяча', 'отвечаю']	['A', 'thousand', 'I', 'told', 'him']
76	"""I've got $1,200,"" says he. "	- А у меня тысяча двести, - говорит он. 	['А', 'у', 'меня', 'тысяча', 'двести', 'говорит', 'он']	"[""I've"", 'got', '1,200', 'says', 'he']"
77	"""We'll pool and do a big piece of business. "	- Составим компанию и будем делать большие дела. 	['Составим', 'компанию', 'и', 'будем', 'делать', 'большие', 'дела']	"[""We'll"", 'pool', 'and', 'do', 'a', 'big', 'piece', 'of', 'business']"
78	"There's so many ways we can make a million that I don't know how to begin."" "	Есть столько возможностей нажить миллион, что я просто не знаю, с какой начинать. 	['Есть', 'столько', 'возможностей', 'нажить', 'миллион', 'что', 'я', 'просто', 'не', 'знаю', 'с', 'какой', 'начинать']	"[""There's"", 'so', 'many', 'ways', 'we', 'can', 'make', 'a', 'million', 'that', 'I', ""don't"", 'know', 'how', 'to', 'begin']"
79	The next morning Silver meets me at the hotel and he is all sonorous and stirred with a kind of silent joy. 	На следующее утро Силвер встречает меня в вестибюле отеля, и я вижу, что он так и пыжится от удовольствия. 	['На', 'следующее', 'утро', 'Силвер', 'встречает', 'меня', 'в', 'вестибюле', 'отеля', 'и', 'я', 'вижу', 'что', 'он', 'так', 'и', 'пыжится', 'от', 'удовольствия']	['The', 'next', 'morning', 'Silver', 'meets', 'me', 'at', 'the', 'hotel', 'and', 'he', 'is', 'all', 'sonorous', 'and', 'stirred', 'with', 'a', 'kind', 'of', 'silent', 'joy']
80	"""We're to meet J. P. Morgan this afternoon,"" says he. "	- Сегодня мы познакомимся с Дж. П. Морганом, - говорит он. 	['Сегодня', 'мы', 'познакомимся', 'с', 'Дж', 'П', 'Морганом', 'говорит', 'он']	"[""We're"", 'to', 'meet', 'J', 'P', 'Morgan', 'this', 'afternoon', 'says', 'he']"
81	"""A man I know in the hotel wants to introduce us. "	- Тут у меня есть один знакомый в отеле, который хочет нас ему представить. 	['Тут', 'у', 'меня', 'есть', 'один', 'знакомый', 'в', 'отеле', 'который', 'хочет', 'нас', 'ему', 'представить']	['A', 'man', 'I', 'know', 'in', 'the', 'hotel', 'wants', 'to', 'introduce', 'us']
82	He's a friend of his. 	Он его близкий приятель. 	['Он', 'его', 'близкий', 'приятель']	"[""He's"", 'a', 'friend', 'of', 'his']"
83	"He says he likes to meet people from the West."" "	Говорит, что тот очень любит приезжих с Запада. 	['Говорит', 'что', 'тот', 'очень', 'любит', 'приезжих', 'с', 'Запада']	['He', 'says', 'he', 'likes', 'to', 'meet', 'people', 'from', 'the', 'West']
84	"""That sounds nice and plausible,"" says I. "	- Вот это уже похоже на дело! - говорю я. 	['Вот', 'это', 'уже', 'похоже', 'на', 'дело', 'говорю', 'я']	['That', 'sounds', 'nice', 'and', 'plausible', 'says', 'I']
85	"""I'd like to know Mr. Morgan."" "	- Очень буду рад познакомиться с мистером Морганом. 	['Очень', 'буду', 'рад', 'познакомиться', 'с', 'мистером', 'Морганом']	"[""I'd"", 'like', 'to', 'know', 'Mr', 'Morgan']"
86	"""It won't hurt us a bit,"" says Silver, ""to get acquainted with a few finance kings. "	- Да, - говорит Силвер, - нам, пожалуй, не помешает завести знакомства среди финансовых воротил. 	['Да', 'говорит', 'Силвер', 'нам', 'пожалуй', 'не', 'помешает', 'завести', 'знакомства', 'среди', 'финансовых', 'воротил']	"['It', ""won't"", 'hurt', 'us', 'a', 'bit', 'says', 'Silver', 'to', 'get', 'acquainted', 'with', 'a', 'few', 'finance', 'kings']"
87	"I kind of like the social way New York has with strangers."" "	Мне нравится, что в Нью-Йорке так радушно встречают приезжих. 	['Мне', 'нравится', 'что', 'в', 'Нью-Йорке', 'так', 'радушно', 'встречают', 'приезжих']	['I', 'kind', 'of', 'like', 'the', 'social', 'way', 'New', 'York', 'has', 'with', 'strangers']
88	The man Silver knew was named Klein. 	Фамилия знакомого Силвера была Клейн. 	['Фамилия', 'знакомого', 'Силвера', 'была', 'Клейн']	['The', 'man', 'Silver', 'knew', 'was', 'named', 'Klein']
89	At three o'clock Klein brought his Wall Street friend to see us in Silver's room. 	В три часа Клейн явился к Силверу в номер вместе со своим приятелем с Уолл-стрита. 	['В', 'три', 'часа', 'Клейн', 'явился', 'к', 'Силверу', 'в', 'номер', 'вместе', 'со', 'своим', 'приятелем', 'с', 'Уолл-стрита']	"['At', 'three', ""o'clock"", 'Klein', 'brought', 'his', 'Wall', 'Street', 'friend', 'to', 'see', 'us', 'in', ""Silver's"", 'room']"
90	"""Mr. Morgan"" looked some like his pictures, and he had a Turkish towel wrapped around his left foot, and he walked with a cane. "	Мистер Морган был немного похож на свои портреты; левая нога у него была обернута мохнатым полотенцем, и он ходил, опираясь на палку. 	['Мистер', 'Морган', 'был', 'немного', 'похож', 'на', 'свои', 'портреты', 'левая', 'нога', 'у', 'него', 'была', 'обернута', 'мохнатым', 'полотенцем', 'и', 'он', 'ходил', 'опираясь', 'на', 'палку']	['Mr', 'Morgan', 'looked', 'some', 'like', 'his', 'pictures', 'and', 'he', 'had', 'a', 'Turkish', 'towel', 'wrapped', 'around', 'his', 'left', 'foot', 'and', 'he', 'walked', 'with', 'a', 'cane']
91	"""Mr. Silver and Mr. Pescud,"" says Klein. "	- Это мистер Силвер, а это мистер Пескад, - говорит Клейн. 	['Это', 'мистер', 'Силвер', 'а', 'это', 'мистер', 'Пескад', 'говорит', 'Клейн']	['Mr', 'Silver', 'and', 'Mr', 'Pescud', 'says', 'Klein']
92	"""It sounds superfluous,"" says he, ""to mention the name of the greatest financial—"" "	- Я думаю, нет нужды, - говорит он, - называть имя великого финансового... 	['Я', 'думаю', 'нет', 'нужды', 'говорит', 'он', 'называть', 'имя', 'великого', 'финансового']	['It', 'sounds', 'superfluous', 'says', 'he', 'to', 'mention', 'the', 'name', 'of', 'the', 'greatest', 'financial—']
93	"""Cut it out, Klein,"" says Mr. Morgan. "	- Ну, ну, ладно, Клейн, - говорит мистер Морган. 	['Ну', 'ну', 'ладно', 'Клейн', 'говорит', 'мистер', 'Морган']	['Cut', 'it', 'out', 'Klein', 'says', 'Mr', 'Morgan']
