	en	ru	ru_tokens	en_tokens
72	It is the great honor you will have, monsieur. Ah, that milady could call upon Armand to do this thing! 	Вам оказывают большую честь, мсье, Ах, если бы мадам поручила это Арману! 	['Вам', 'оказывают', 'большую', 'честь', 'мсье', 'Ах', 'если', 'бы', 'мадам', 'поручила', 'это', 'Арману']	['It', 'is', 'the', 'great', 'honor', 'you', 'will', 'have', 'monsieur', 'Ah', 'that', 'milady', 'could', 'call', 'upon', 'Armand', 'to', 'do', 'this', 'thing']
73	"But, no, I am only one chauffeur."" "	Но нет, я всего-навсего шофер. 	['Но', 'нет', 'я', 'всего-навсего', 'шофер']	['But', 'no', 'I', 'am', 'only', 'one', 'chauffeur']
74	With vehement gestures the chauffeur conducted Hopkins into the house. 	Оживленно жестикулируя, шофер провел Гопкинса в дом. 	['Оживленно', 'жестикулируя', 'шофер', 'провел', 'Гопкинса', 'в', 'дом']	['With', 'vehement', 'gestures', 'the', 'chauffeur', 'conducted', 'Hopkins', 'into', 'the', 'house']
75	He was ushered into a small but luxurious reception chamber. 	Его впустили в небольшую, но роскошно убранную гостиную. 	['Его', 'впустили', 'в', 'небольшую', 'но', 'роскошно', 'убранную', 'гостиную']	['He', 'was', 'ushered', 'into', 'a', 'small', 'but', 'luxurious', 'reception', 'chamber']
76	A lady, young, and possessing the beauty of visions, rose from a chair. 	Навстречу им поднялась дама, молодая и прелестная, как видение. 	['Навстречу', 'им', 'поднялась', 'дама', 'молодая', 'и', 'прелестная', 'как', 'видение']	['A', 'lady', 'young', 'and', 'possessing', 'the', 'beauty', 'of', 'visions', 'rose', 'from', 'a', 'chair']
77	In her eyes smouldered a becoming anger. 	Ее глаза горели гневом, что было ей весьма к лицу. 	['Ее', 'глаза', 'горели', 'гневом', 'что', 'было', 'ей', 'весьма', 'к', 'лицу']	['In', 'her', 'eyes', 'smouldered', 'a', 'becoming', 'anger']
78	Her high-arched, threadlike brows were ruffled into a delicious frown. 	Тоненькие, как ниточки, сильно изогнутые брови красиво хмурились. 	['Тоненькие', 'как', 'ниточки', 'сильно', 'изогнутые', 'брови', 'красиво', 'хмурились']	['Her', 'high-arched', 'threadlike', 'brows', 'were', 'ruffled', 'into', 'a', 'delicious', 'frown']
79	"""Milady,"" said the chauffeur, bowing low, ""I have the honor to relate to you that I went to the house of Monsieur Long and found him to be not at home. "	- Мадам, - сказал шофер, низко кланяясь, - имею честь докладывать, что я был у мсье Лонг и не застал его дома. 	['Мадам', 'сказал', 'шофер', 'низко', 'кланяясь', 'имею', 'честь', 'докладывать', 'что', 'я', 'был', 'у', 'мсье', 'Лонг', 'и', 'не', 'застал', 'его', 'дома']	['Milady', 'said', 'the', 'chauffeur', 'bowing', 'low', 'I', 'have', 'the', 'honor', 'to', 'relate', 'to', 'you', 'that', 'I', 'went', 'to', 'the', 'house', 'of', 'Monsieur', 'Long', 'and', 'found', 'him', 'to', 'be', 'not', 'at', 'home']
80	As I came back I see this gentleman in combat against—how you say—greatest odds. He is fighting with five—ten—thirty men—gendarmes, aussi. 	На обратном пути я увидел, что вот этот джентльмен, как это сказать, бьется с неравными силами - на него напали пять... десять... тридцать человек, и жандармы тоже. 	['На', 'обратном', 'пути', 'я', 'увидел', 'что', 'вот', 'этот', 'джентльмен', 'как', 'это', 'сказать', 'бьется', 'с', 'неравными', 'силами', 'на', 'него', 'напали', 'пять', 'десять', 'тридцать', 'человек', 'и', 'жандармы', 'тоже']	['As', 'I', 'came', 'back', 'I', 'see', 'this', 'gentleman', 'in', 'combat', 'against—how', 'you', 'say—greatest', 'odds', 'He', 'is', 'fighting', 'with', 'five—ten—thirty', 'men—gendarmes', 'aussi']
81	Yes, milady, he what you call 'swat' one—three—eight policemans. 	Да, мадам, он, как это сказать, побил одного... три... восемь полисменов. 	['Да', 'мадам', 'он', 'как', 'это', 'сказать', 'побил', 'одного', 'три', 'восемь', 'полисменов']	"['Yes', 'milady', 'he', 'what', 'you', 'call', ""'swat'"", 'one—three—eight', 'policemans']"
82	"If that Monsieur Long is out I say to myself this gentleman he will serve milady so well, and I bring him here."" "	Если мсье Лонга нет дома, сказал я себе, то этот джентльмен так же сможет оказать услугу мадам, и я привез его сюда. 	['Если', 'мсье', 'Лонга', 'нет', 'дома', 'сказал', 'я', 'себе', 'то', 'этот', 'джентльмен', 'так', 'же', 'сможет', 'оказать', 'услугу', 'мадам', 'и', 'я', 'привез', 'его', 'сюда']	['If', 'that', 'Monsieur', 'Long', 'is', 'out', 'I', 'say', 'to', 'myself', 'this', 'gentleman', 'he', 'will', 'serve', 'milady', 'so', 'well', 'and', 'I', 'bring', 'him', 'here']
83	"""Very well, Armand,"" said the lady, ""you may go."" "	- Очень хорошо, Арман, - сказала дама, - можете идти. 	['Очень', 'хорошо', 'Арман', 'сказала', 'дама', 'можете', 'идти']	['Very', 'well', 'Armand', 'said', 'the', 'lady', 'you', 'may', 'go']
84	She turned to Hopkins. 	Она повернулась к Гопкинсу. 	['Она', 'повернулась', 'к', 'Гопкинсу']	['She', 'turned', 'to', 'Hopkins']
85	"""I sent my chauffeur,"" she said, ""to bring my cousin, Walter Long. "	- Я посылала шофера за моим кузеном, Уолтером Лонгом. 	['Я', 'посылала', 'шофера', 'за', 'моим', 'кузеном', 'Уолтером', 'Лонгом']	['I', 'sent', 'my', 'chauffeur', 'she', 'said', 'to', 'bring', 'my', 'cousin', 'Walter', 'Long']
86	There is a man in this house who has treated me with insult and abuse. 	В этом доме находится человек, который обращался со мной дурно и оскорбил меня. 	['В', 'этом', 'доме', 'находится', 'человек', 'который', 'обращался', 'со', 'мной', 'дурно', 'и', 'оскорбил', 'меня']	['There', 'is', 'a', 'man', 'in', 'this', 'house', 'who', 'has', 'treated', 'me', 'with', 'insult', 'and', 'abuse']
87	I have complained to my aunt, and she laughs at me. 	Я пожаловалась тете, а она смеется надо мной. 	['Я', 'пожаловалась', 'тете', 'а', 'она', 'смеется', 'надо', 'мной']	['I', 'have', 'complained', 'to', 'my', 'aunt', 'and', 'she', 'laughs', 'at', 'me']
88	Armand says you are brave. 	Арман говорит, что вы храбры. 	['Арман', 'говорит', 'что', 'вы', 'храбры']	['Armand', 'says', 'you', 'are', 'brave']
89	In these prosaic days men who are both brave and chivalrous are few. 	В наше прозаическое время мало таких людей, которые были бы и храбры и рыцарски благородны. 	['В', 'наше', 'прозаическое', 'время', 'мало', 'таких', 'людей', 'которые', 'были', 'бы', 'и', 'храбры', 'и', 'рыцарски', 'благородны']	['In', 'these', 'prosaic', 'days', 'men', 'who', 'are', 'both', 'brave', 'and', 'chivalrous', 'are', 'few']
90	"May I count upon your assistance?"" "	Могу ли я рассчитывать на вашу помощь? 	['Могу', 'ли', 'я', 'рассчитывать', 'на', 'вашу', 'помощь']	['May', 'I', 'count', 'upon', 'your', 'assistance']
91	John Hopkins thrust the remains of his cigar into his coat pocket. He looked upon this winning creature and felt his first thrill of romance. 	Джон Гопкинс сунул окурок сигары в карман пиджака и, взглянув на это очаровательное существо, впервые в жизни ощутил романтическое волнение. 	['Джон', 'Гопкинс', 'сунул', 'окурок', 'сигары', 'в', 'карман', 'пиджака', 'и', 'взглянув', 'на', 'это', 'очаровательное', 'существо', 'впервые', 'в', 'жизни', 'ощутил', 'романтическое', 'волнение']	['John', 'Hopkins', 'thrust', 'the', 'remains', 'of', 'his', 'cigar', 'into', 'his', 'coat', 'pocket', 'He', 'looked', 'upon', 'this', 'winning', 'creature', 'and', 'felt', 'his', 'first', 'thrill', 'of', 'romance']
92	It was a knightly love, and contained no disloyalty to the flat with the flea-bitten terrier and the lady of his choice. 	Это была рыцарская любовь, вовсе не означавшая, что Джон Гопкинс изменил квартирке с блохастым терьером и своей подруге жизни. 	['Это', 'была', 'рыцарская', 'любовь', 'вовсе', 'не', 'означавшая', 'что', 'Джон', 'Гопкинс', 'изменил', 'квартирке', 'с', 'блохастым', 'терьером', 'и', 'своей', 'подруге', 'жизни']	['It', 'was', 'a', 'knightly', 'love', 'and', 'contained', 'no', 'disloyalty', 'to', 'the', 'flat', 'with', 'the', 'flea-bitten', 'terrier', 'and', 'the', 'lady', 'of', 'his', 'choice']
93	He had married her after a picnic of the Lady Label Stickers' Union, Lodge No. 2, on a dare and a bet of new hats and chowder all around with his friend, Billy McManus. 	Он женился на ней после пикника, устроенного вторым отделением союза этикетчиц, поспорив со своим приятелем Билли Макманусом на новую шляпу и порцию рыбной солянки. 	['Он', 'женился', 'на', 'ней', 'после', 'пикника', 'устроенного', 'вторым', 'отделением', 'союза', 'этикетчиц', 'поспорив', 'со', 'своим', 'приятелем', 'Билли', 'Макманусом', 'на', 'новую', 'шляпу', 'и', 'порцию', 'рыбной', 'солянки']	"['He', 'had', 'married', 'her', 'after', 'a', 'picnic', 'of', 'the', 'Lady', 'Label', ""Stickers'"", 'Union', 'Lodge', 'No', '2', 'on', 'a', 'dare', 'and', 'a', 'bet', 'of', 'new', 'hats', 'and', 'chowder', 'all', 'around', 'with', 'his', 'friend', 'Billy', 'McManus']"
94	This angel who was begging him to come to her rescue was something too heavenly for chowder, and as for hats—golden, jewelled crowns for her! 	А с этим неземным созданием, которое молило его о помощи, не могло быть и речи о солянке; что же касается шляп, то лишь золотая корона с брильянтами была ее достойна! 	['А', 'с', 'этим', 'неземным', 'созданием', 'которое', 'молило', 'его', 'о', 'помощи', 'не', 'могло', 'быть', 'и', 'речи', 'о', 'солянке', 'что', 'же', 'касается', 'шляп', 'то', 'лишь', 'золотая', 'корона', 'с', 'брильянтами', 'была', 'ее', 'достойна']	['This', 'angel', 'who', 'was', 'begging', 'him', 'to', 'come', 'to', 'her', 'rescue', 'was', 'something', 'too', 'heavenly', 'for', 'chowder', 'and', 'as', 'for', 'hats—golden', 'jewelled', 'crowns', 'for', 'her']
95	"""Say,"" said John Hopkins, ""just show me the guy that you've got the grouch at. "	- Слушайте, - сказал Джон Гопкинс, - вы мне только покажите этого парня, который действует вам на нервы. 	['Слушайте', 'сказал', 'Джон', 'Гопкинс', 'вы', 'мне', 'только', 'покажите', 'этого', 'парня', 'который', 'действует', 'вам', 'на', 'нервы']	"['Say', 'said', 'John', 'Hopkins', 'just', 'show', 'me', 'the', 'guy', 'that', ""you've"", 'got', 'the', 'grouch', 'at']"
96	"I've neglected my talents as a scrapper heretofore, but this is my busy night."" "	До сих пор я, правда, не интересовался драться, но нынче вечером никому не спущу. 	['До', 'сих', 'пор', 'я', 'правда', 'не', 'интересовался', 'драться', 'но', 'нынче', 'вечером', 'никому', 'не', 'спущу']	"[""I've"", 'neglected', 'my', 'talents', 'as', 'a', 'scrapper', 'heretofore', 'but', 'this', 'is', 'my', 'busy', 'night']"
97	"""He is in there,"" said the lady, pointing to a closed door. "	- Он там, - сказала дама, указывая на закрытую дверь. 	['Он', 'там', 'сказала', 'дама', 'указывая', 'на', 'закрытую', 'дверь']	['He', 'is', 'in', 'there', 'said', 'the', 'lady', 'pointing', 'to', 'a', 'closed', 'door']
98	"""Come. "	Идите. 	['Идите']	['Come']
99	"Are you sure that you do not falter or fear?"" "	Вы уверены, что не боитесь? 	['Вы', 'уверены', 'что', 'не', 'боитесь']	['Are', 'you', 'sure', 'that', 'you', 'do', 'not', 'falter', 'or', 'fear']
100	"""Me?"" said John Hopkins. "	- Я! - сказал Джон Гопкинс. 	['Я', 'сказал', 'Джон', 'Гопкинс']	['Me', 'said', 'John', 'Hopkins']
101	"""Just give me one of those roses in the bunch you are wearing, will you?"" "	- Дайте мне только розу из вашего букета, ладно? 	['Дайте', 'мне', 'только', 'розу', 'из', 'вашего', 'букета', 'ладно']	['Just', 'give', 'me', 'one', 'of', 'those', 'roses', 'in', 'the', 'bunch', 'you', 'are', 'wearing', 'will', 'you']
102	The lady gave him a red, red rose. 	Она дала ему красную-красную розу. 	['Она', 'дала', 'ему', 'красную-красную', 'розу']	['The', 'lady', 'gave', 'him', 'a', 'red', 'red', 'rose']
103	John Hopkins kissed it, stuffed it into his vest pocket, opened the door and walked into the room. 	Джон Гопкинс поцеловал ее, воткнул в жилетный карман, открыл дверь и вошел в комнату. 	['Джон', 'Гопкинс', 'поцеловал', 'ее', 'воткнул', 'в', 'жилетный', 'карман', 'открыл', 'дверь', 'и', 'вошел', 'в', 'комнату']	['John', 'Hopkins', 'kissed', 'it', 'stuffed', 'it', 'into', 'his', 'vest', 'pocket', 'opened', 'the', 'door', 'and', 'walked', 'into', 'the', 'room']
104	It was a handsome library, softly but brightly lighted. 	Это была богатая библиотека, освещенная мягким, но сильным светом. 	['Это', 'была', 'богатая', 'библиотека', 'освещенная', 'мягким', 'но', 'сильным', 'светом']	['It', 'was', 'a', 'handsome', 'library', 'softly', 'but', 'brightly', 'lighted']
105	A young man was there, reading. 	В кресле сидел молодой человек, погруженный в чтение. 	['В', 'кресле', 'сидел', 'молодой', 'человек', 'погруженный', 'в', 'чтение']	['A', 'young', 'man', 'was', 'there', 'reading']
106	"""Books on etiquette is what you want to study,"" said John Hopkins, abruptly. "	- Книжки о хорошем тоне - вот что вам нужно читать, резко сказал Джон Гопкинс. 	['Книжки', 'о', 'хорошем', 'тоне', 'вот', 'что', 'вам', 'нужно', 'читать', 'резко', 'сказал', 'Джон', 'Гопкинс']	['Books', 'on', 'etiquette', 'is', 'what', 'you', 'want', 'to', 'study', 'said', 'John', 'Hopkins', 'abruptly']
107	"""Get up here, and I'll give you some lessors. "	- Подите-ка сюда, я вас проучу. 	['Подите-ка', 'сюда', 'я', 'вас', 'проучу']	"['Get', 'up', 'here', 'and', ""I'll"", 'give', 'you', 'some', 'lessors']"
108	"Be rude to a lady, will you?"" "	Да как вы смеете грубить даме? 	['Да', 'как', 'вы', 'смеете', 'грубить', 'даме']	['Be', 'rude', 'to', 'a', 'lady', 'will', 'you']
109	The young man looked mildly surprised. Then he arose languidly, dextrously caught the arms of John Hopkins and conducted him irresistibly to the front door of the house. 	Молодой человек слегка изумился, после чего он томно поднялся с места, ловко схватил Гопкинса за руки и, невзирая на сопротивление, повел его к выходу на улицу. 	['Молодой', 'человек', 'слегка', 'изумился', 'после', 'чего', 'он', 'томно', 'поднялся', 'с', 'места', 'ловко', 'схватил', 'Гопкинса', 'за', 'руки', 'и', 'невзирая', 'на', 'сопротивление', 'повел', 'его', 'к', 'выходу', 'на', 'улицу']	['The', 'young', 'man', 'looked', 'mildly', 'surprised', 'Then', 'he', 'arose', 'languidly', 'dextrously', 'caught', 'the', 'arms', 'of', 'John', 'Hopkins', 'and', 'conducted', 'him', 'irresistibly', 'to', 'the', 'front', 'door', 'of', 'the', 'house']
110	"""Beware, Ralph Branscombe,"" cried the lady, who had followed, ""what you do to the gallant man who has tried to protect me."" "	- Осторожнее, Ральф Бранскомб? - воскликнула дама, которая последовала за ними. - Обращайтесь осторожней с человеком, который доблестно пытался защитить меня. 	['Осторожнее', 'Ральф', 'Бранскомб', 'воскликнула', 'дама', 'которая', 'последовала', 'за', 'ними', 'Обращайтесь', 'осторожней', 'с', 'человеком', 'который', 'доблестно', 'пытался', 'защитить', 'меня']	['Beware', 'Ralph', 'Branscombe', 'cried', 'the', 'lady', 'who', 'had', 'followed', 'what', 'you', 'do', 'to', 'the', 'gallant', 'man', 'who', 'has', 'tried', 'to', 'protect', 'me']
111	The young man shoved John Hopkins gently out the door and then closed it. 	Молодой человек тихонько вытолкнул Джона Гопкинса на улицу и запер за, ним дверь. 	['Молодой', 'человек', 'тихонько', 'вытолкнул', 'Джона', 'Гопкинса', 'на', 'улицу', 'и', 'запер', 'за', 'ним', 'дверь']	['The', 'young', 'man', 'shoved', 'John', 'Hopkins', 'gently', 'out', 'the', 'door', 'and', 'then', 'closed', 'it']
112	"""Bess,"" he said calmly, ""I wish you would quit reading historical novels. "	- Бесс, - сказал он спокойно, - напрасно ты читаешь исторические романы. 	['Бесс', 'сказал', 'он', 'спокойно', 'напрасно', 'ты', 'читаешь', 'исторические', 'романы']	['Bess', 'he', 'said', 'calmly', 'I', 'wish', 'you', 'would', 'quit', 'reading', 'historical', 'novels']
113	"How in the world did that fellow get in here?"" "	Каким образом попал сюда этот субъект? 	['Каким', 'образом', 'попал', 'сюда', 'этот', 'субъект']	['How', 'in', 'the', 'world', 'did', 'that', 'fellow', 'get', 'in', 'here']
114	"""Armand brought him,"" said the young lady. "	- Его привез Арман, - сказала молодая дама. 	['Его', 'привез', 'Арман', 'сказала', 'молодая', 'дама']	['Armand', 'brought', 'him', 'said', 'the', 'young', 'lady']
115	"""I think you are awfully mean not to let me have that St. Bernard. "	- По-моему, это такая низость с твоей стороны, что ты не позволил мне взять сенбернара. 	['По-моему', 'это', 'такая', 'низость', 'с', 'твоей', 'стороны', 'что', 'ты', 'не', 'позволил', 'мне', 'взять', 'сенбернара']	['I', 'think', 'you', 'are', 'awfully', 'mean', 'not', 'to', 'let', 'me', 'have', 'that', 'St', 'Bernard']
116	I sent Armand for Walter. 	Вот потому я и послала Армана за Уолтером. 	['Вот', 'потому', 'я', 'и', 'послала', 'Армана', 'за', 'Уолтером']	['I', 'sent', 'Armand', 'for', 'Walter']
117	"I was so angry with you."" "	Я так рассердилась на тебя. 	['Я', 'так', 'рассердилась', 'на', 'тебя']	['I', 'was', 'so', 'angry', 'with', 'you']
118	"""Be sensible, Bess,"" said the young man, taking her arm. ""That dog isn't safe. "	- Будь благоразумна, Бесс, - сказал молодой человек, беря ее за руку - Эта собака опасна. 	['Будь', 'благоразумна', 'Бесс', 'сказал', 'молодой', 'человек', 'беря', 'ее', 'за', 'руку', 'Эта', 'собака', 'опасна']	"['Be', 'sensible', 'Bess', 'said', 'the', 'young', 'man', 'taking', 'her', 'arm', 'That', 'dog', ""isn't"", 'safe']"
119	He has bitten two or three people around the kennels. 	Она перекусала уже нескольких человек на псарне. 	['Она', 'перекусала', 'уже', 'нескольких', 'человек', 'на', 'псарне']	['He', 'has', 'bitten', 'two', 'or', 'three', 'people', 'around', 'the', 'kennels']
120	"Come now, let's go tell auntie we are in good humor again."" "	Пойдем лучше скажем тете, что мы теперь в хорошем настроении. 	['Пойдем', 'лучше', 'скажем', 'тете', 'что', 'мы', 'теперь', 'в', 'хорошем', 'настроении']	"['Come', 'now', ""let's"", 'go', 'tell', 'auntie', 'we', 'are', 'in', 'good', 'humor', 'again']"
121	Arm in arm, they moved away. 	И они ушли рука об руку. 	['И', 'они', 'ушли', 'рука', 'об', 'руку']	['Arm', 'in', 'arm', 'they', 'moved', 'away']
122	John Hopkins walked to his flat. 	Джон Гопкинс подошел к своему дому. 	['Джон', 'Гопкинс', 'подошел', 'к', 'своему', 'дому']	['John', 'Hopkins', 'walked', 'to', 'his', 'flat']
123	The janitor's five-year-old daughter was playing on the steps. 	На крыльце играла пятилетняя дочка швейцара. 	['На', 'крыльце', 'играла', 'пятилетняя', 'дочка', 'швейцара']	"['The', ""janitor's"", 'five-year-old', 'daughter', 'was', 'playing', 'on', 'the', 'steps']"
124	Hopkins gave her a nice, red rose and walked upstairs. 	Гопкинс дал ей красивую красную розу и поднялся к себе. 	['Гопкинс', 'дал', 'ей', 'красивую', 'красную', 'розу', 'и', 'поднялся', 'к', 'себе']	['Hopkins', 'gave', 'her', 'a', 'nice', 'red', 'rose', 'and', 'walked', 'upstairs']
125	Mrs. Hopkins was philandering with curl-papers. 	Миссис Гопкинс лениво завертывала волосы в папильотки. 	['Миссис', 'Гопкинс', 'лениво', 'завертывала', 'волосы', 'в', 'папильотки']	['Mrs', 'Hopkins', 'was', 'philandering', 'with', 'curl-papers']
126	"""Get your cigar?"" she asked, disinterestedly. "	- Купил себе сигару? - спросила она равнодушно. 	['Купил', 'себе', 'сигару', 'спросила', 'она', 'равнодушно']	['Get', 'your', 'cigar', 'she', 'asked', 'disinterestedly']
127	"""Sure,"" said Hopkins, ""and I knocked around a while outside. "	- Конечно, - сказал Гопкинс, - и еще прошелся немножко по улице. 	['Конечно', 'сказал', 'Гопкинс', 'и', 'еще', 'прошелся', 'немножко', 'по', 'улице']	['Sure', 'said', 'Hopkins', 'and', 'I', 'knocked', 'around', 'a', 'while', 'outside']
128	"It's a nice night."" "	Вечер хороший. 	['Вечер', 'хороший']	"[""It's"", 'a', 'nice', 'night']"
