	en	ru	ru_tokens	en_tokens
0	Henry O. 	О. Генри 	['О', 'Генри']	['Henry', 'O']
1	THE COMPLETE LIFE OF JOHN HOPKINS 	Один час полной жизни 	['Один', 'час', 'полной', 'жизни']	['THE', 'COMPLETE', 'LIFE', 'OF', 'JOHN', 'HOPKINS']
2	There is a saying that no man has tasted the full flavour of life until he has known poverty, love and war. 	Существует поговорка, что тот еще не жил полной жизнью, кто не знал бедности, любви и войны. 	['Существует', 'поговорка', 'что', 'тот', 'еще', 'не', 'жил', 'полной', 'жизнью', 'кто', 'не', 'знал', 'бедности', 'любви', 'и', 'войны']	['There', 'is', 'a', 'saying', 'that', 'no', 'man', 'has', 'tasted', 'the', 'full', 'flavour', 'of', 'life', 'until', 'he', 'has', 'known', 'poverty', 'love', 'and', 'war']
3	The justness of this reflection commends it to the lover of condensed philosophy. 	Справедливость такого суждения должна прельстить всякого любителя сокращенной философии. 	['Справедливость', 'такого', 'суждения', 'должна', 'прельстить', 'всякого', 'любителя', 'сокращенной', 'философии']	['The', 'justness', 'of', 'this', 'reflection', 'commends', 'it', 'to', 'the', 'lover', 'of', 'condensed', 'philosophy']
4	The three conditions embrace about all there is in life worth knowing. A surface thinker might deem that wealth should be added to the list. 	В этих трех условиям заключается все, что стоит знать о жизни Поверхностный мыслитель, возможно, счел бы, что к этому списку следует прибавить еще и богатство. 	['В', 'этих', 'трех', 'условиям', 'заключается', 'все', 'что', 'стоит', 'знать', 'о', 'жизни', 'Поверхностный', 'мыслитель', 'возможно', 'счел', 'бы', 'что', 'к', 'этому', 'списку', 'следует', 'прибавить', 'еще', 'и', 'богатство']	['The', 'three', 'conditions', 'embrace', 'about', 'all', 'there', 'is', 'in', 'life', 'worth', 'knowing', 'A', 'surface', 'thinker', 'might', 'deem', 'that', 'wealth', 'should', 'be', 'added', 'to', 'the', 'list']
5	Not so. 	Но это не так. 	['Но', 'это', 'не', 'так']	['Not', 'so']
6	When a poor man finds a long-hidden quarter-dollar that has slipped through a rip into his vest lining, he sounds the pleasure of life with a deeper plummet than any millionaire can hope to cast. 	Когда бедняк находит за подкладкой жилета давным давно провалившуюся в прореху четверть доллара, он забрасывает лот в такие глубины жизненной радости, до каких не добраться ни одному миллионеру. 	['Когда', 'бедняк', 'находит', 'за', 'подкладкой', 'жилета', 'давным', 'давно', 'провалившуюся', 'в', 'прореху', 'четверть', 'доллара', 'он', 'забрасывает', 'лот', 'в', 'такие', 'глубины', 'жизненной', 'радости', 'до', 'каких', 'не', 'добраться', 'ни', 'одному', 'миллионеру']	['When', 'a', 'poor', 'man', 'finds', 'a', 'long-hidden', 'quarter-dollar', 'that', 'has', 'slipped', 'through', 'a', 'rip', 'into', 'his', 'vest', 'lining', 'he', 'sounds', 'the', 'pleasure', 'of', 'life', 'with', 'a', 'deeper', 'plummet', 'than', 'any', 'millionaire', 'can', 'hope', 'to', 'cast']
7	It seems that the wise executive power that rules life has thought best to drill man in these three conditions; and none may escape all three. 	По-видимому, так распорядилась мудрая исполнительная власть, которая управляет жизнью, что человек неизбежно проходит через все эти три условия, и никто не может быть избавлен от всех трех. 	['По-видимому', 'так', 'распорядилась', 'мудрая', 'исполнительная', 'власть', 'которая', 'управляет', 'жизнью', 'что', 'человек', 'неизбежно', 'проходит', 'через', 'все', 'эти', 'три', 'условия', 'и', 'никто', 'не', 'может', 'быть', 'избавлен', 'от', 'всех', 'трех']	['It', 'seems', 'that', 'the', 'wise', 'executive', 'power', 'that', 'rules', 'life', 'has', 'thought', 'best', 'to', 'drill', 'man', 'in', 'these', 'three', 'conditions', 'and', 'none', 'may', 'escape', 'all', 'three']
8	In rural places the terms do not mean so much. 	В сельских местностях эти условия не имеют такого значения. 	['В', 'сельских', 'местностях', 'эти', 'условия', 'не', 'имеют', 'такого', 'значения']	['In', 'rural', 'places', 'the', 'terms', 'do', 'not', 'mean', 'so', 'much']
9	Poverty is less pinching; love is temperate; war shrinks to contests about boundary lines and the neighbors' hens. 	Бедность гнетет меньше, любовь не так горяча, война сводится к дракам из-за соседской курицы или границы участка. 	['Бедность', 'гнетет', 'меньше', 'любовь', 'не', 'так', 'горяча', 'война', 'сводится', 'к', 'дракам', 'из-за', 'соседской', 'курицы', 'или', 'границы', 'участка']	"['Poverty', 'is', 'less', 'pinching', 'love', 'is', 'temperate', 'war', 'shrinks', 'to', 'contests', 'about', 'boundary', 'lines', 'and', 'the', ""neighbors'"", 'hens']"
10	It is in the cities that our epigram gains in truth and vigor; and it has remained for one John Hopkins to crowd the experience into a rather small space of time. 	Зато в больших городах наш афоризм приобретает особую правдивость и силу, и некоему Джону Гопкинсу досталось в удел испытать все это на себе в сравнительно короткое время. 	['Зато', 'в', 'больших', 'городах', 'наш', 'афоризм', 'приобретает', 'особую', 'правдивость', 'и', 'силу', 'и', 'некоему', 'Джону', 'Гопкинсу', 'досталось', 'в', 'удел', 'испытать', 'все', 'это', 'на', 'себе', 'в', 'сравнительно', 'короткое', 'время']	['It', 'is', 'in', 'the', 'cities', 'that', 'our', 'epigram', 'gains', 'in', 'truth', 'and', 'vigor', 'and', 'it', 'has', 'remained', 'for', 'one', 'John', 'Hopkins', 'to', 'crowd', 'the', 'experience', 'into', 'a', 'rather', 'small', 'space', 'of', 'time']
11	The Hopkins flat was like a thousand others. 	Квартира Гопкинса была такая же, как тысячи других. 	['Квартира', 'Гопкинса', 'была', 'такая', 'же', 'как', 'тысячи', 'других']	['The', 'Hopkins', 'flat', 'was', 'like', 'a', 'thousand', 'others']
12	There was a rubber plant in one window; a flea-bitten terrier sat in the other, wondering when he was to have his day. 	На одном окне стоял фикус, на другом сидел блохастый терьер, изнывая от скуки. 	['На', 'одном', 'окне', 'стоял', 'фикус', 'на', 'другом', 'сидел', 'блохастый', 'терьер', 'изнывая', 'от', 'скуки']	['There', 'was', 'a', 'rubber', 'plant', 'in', 'one', 'window', 'a', 'flea-bitten', 'terrier', 'sat', 'in', 'the', 'other', 'wondering', 'when', 'he', 'was', 'to', 'have', 'his', 'day']
13	John Hopkins was like a thousand others. 	Джон Гопкинс был такой же, как тысячи других. 	['Джон', 'Гопкинс', 'был', 'такой', 'же', 'как', 'тысячи', 'других']	['John', 'Hopkins', 'was', 'like', 'a', 'thousand', 'others']
14	He worked at $20 per week in a nine-story, red-brick building at either Insurance, Buckle's Hoisting Engines, Chiropody, Loans, Pulleys, Boas Renovated, Waltz Guaranteed in Five Lessons, or Artificial Limbs. 	За двадцать долларов в неделю он служил в девятиэтажном кирпичном доме занимаясь не то страхованием жизни, не то подъемниками Бокля, а может быть, педикюром, ссудами, блоками, переделкой горжеток, изготовлением искусственных рук и ног или же обучением вальсу в пять уроков с гарантией. 	['За', 'двадцать', 'долларов', 'в', 'неделю', 'он', 'служил', 'в', 'девятиэтажном', 'кирпичном', 'доме', 'занимаясь', 'не', 'то', 'страхованием', 'жизни', 'не', 'то', 'подъемниками', 'Бокля', 'а', 'может', 'быть', 'педикюром', 'ссудами', 'блоками', 'переделкой', 'горжеток', 'изготовлением', 'искусственных', 'рук', 'и', 'ног', 'или', 'же', 'обучением', 'вальсу', 'в', 'пять', 'уроков', 'с', 'гарантией']	"['He', 'worked', 'at', '20', 'per', 'week', 'in', 'a', 'nine-story', 'red-brick', 'building', 'at', 'either', 'Insurance', ""Buckle's"", 'Hoisting', 'Engines', 'Chiropody', 'Loans', 'Pulleys', 'Boas', 'Renovated', 'Waltz', 'Guaranteed', 'in', 'Five', 'Lessons', 'or', 'Artificial', 'Limbs']"
15	It is not for us to wring Mr. Hopkins's avocation from these outward signs that be. 	Не наше дело догадываться о призвании мистера Гопкинса, судя по этим внешним признакам. 	['Не', 'наше', 'дело', 'догадываться', 'о', 'призвании', 'мистера', 'Гопкинса', 'судя', 'по', 'этим', 'внешним', 'признакам']	"['It', 'is', 'not', 'for', 'us', 'to', 'wring', 'Mr', ""Hopkins's"", 'avocation', 'from', 'these', 'outward', 'signs', 'that', 'be']"
16	Mrs. Hopkins was like a thousand others. 	Миссис Гопкинс была такая же, как тысячи других. 	['Миссис', 'Гопкинс', 'была', 'такая', 'же', 'как', 'тысячи', 'других']	['Mrs', 'Hopkins', 'was', 'like', 'a', 'thousand', 'others']
17	The auriferous tooth, the sedentary disposition, the Sunday afternoon wanderlust, the draught upon the delicatessen store for home-made comforts, the furor for department store marked-down sales, the feeling of superiority to the lady in the third-floor front who wore genuine ostrich tips and had two names over her bell, the mucilaginous hours during which she remained glued to the window sill, the vigilant avoidance of the instalment man, the tireless patronage of the acoustics of the dumb-waiter shaft—all the attributes of the Gotham flat-dweller were hers. 	Золотой зуб, наклонность к сидячей жизни, охота к перемене мест по воскресеньям, тяга в гастрономический магазин за домашними лакомствами, погоня за дешевкой на распродажах, чувство превосходства по отношению к жилице третьего этажа с настоящими страусовыми перьями на шляпке и двумя фамилиями на двери, тягучие часы, в течение которых она липла к подоконнику, бдительное уклонение от визитов сборщика взносов за мебель, неутомимое внимание к акустическим эффектам мусоропровода - все эти свойства обитательницы нью-йоркского захолустья были ей не чужды. 	['Золотой', 'зуб', 'наклонность', 'к', 'сидячей', 'жизни', 'охота', 'к', 'перемене', 'мест', 'по', 'воскресеньям', 'тяга', 'в', 'гастрономический', 'магазин', 'за', 'домашними', 'лакомствами', 'погоня', 'за', 'дешевкой', 'на', 'распродажах', 'чувство', 'превосходства', 'по', 'отношению', 'к', 'жилице', 'третьего', 'этажа', 'с', 'настоящими', 'страусовыми', 'перьями', 'на', 'шляпке', 'и', 'двумя', 'фамилиями', 'на', 'двери', 'тягучие', 'часы', 'в', 'течение', 'которых', 'она', 'липла', 'к', 'подоконнику', 'бдительное', 'уклонение', 'от', 'визитов', 'сборщика', 'взносов', 'за', 'мебель', 'неутомимое', 'внимание', 'к', 'акустическим', 'эффектам', 'мусоропровода', 'все', 'эти', 'свойства', 'обитательницы', 'нью-йоркского', 'захолустья', 'были', 'ей', 'не', 'чужды']	['The', 'auriferous', 'tooth', 'the', 'sedentary', 'disposition', 'the', 'Sunday', 'afternoon', 'wanderlust', 'the', 'draught', 'upon', 'the', 'delicatessen', 'store', 'for', 'home-made', 'comforts', 'the', 'furor', 'for', 'department', 'store', 'marked-down', 'sales', 'the', 'feeling', 'of', 'superiority', 'to', 'the', 'lady', 'in', 'the', 'third-floor', 'front', 'who', 'wore', 'genuine', 'ostrich', 'tips', 'and', 'had', 'two', 'names', 'over', 'her', 'bell', 'the', 'mucilaginous', 'hours', 'during', 'which', 'she', 'remained', 'glued', 'to', 'the', 'window', 'sill', 'the', 'vigilant', 'avoidance', 'of', 'the', 'instalment', 'man', 'the', 'tireless', 'patronage', 'of', 'the', 'acoustics', 'of', 'the', 'dumb-waiter', 'shaft—all', 'the', 'attributes', 'of', 'the', 'Gotham', 'flat-dweller', 'were', 'hers']
18	One moment yet of sententiousness and the story moves. 	Еще один миг, посвященный рассуждениям, - и рассказ двинется с места. 	['Еще', 'один', 'миг', 'посвященный', 'рассуждениям', 'и', 'рассказ', 'двинется', 'с', 'места']	['One', 'moment', 'yet', 'of', 'sententiousness', 'and', 'the', 'story', 'moves']
19	In the Big City large and sudden things happen. 	В большом городе происходят важные и неожиданные события. 	['В', 'большом', 'городе', 'происходят', 'важные', 'и', 'неожиданные', 'события']	['In', 'the', 'Big', 'City', 'large', 'and', 'sudden', 'things', 'happen']
20	You round a corner and thrust the rib of your umbrella into the eye of your old friend from Kootenai Falls. 	Заворачиваешь за угол и попадаешь острием зонта в глаз старому знакомому из Кутни-фоллс. 	['Заворачиваешь', 'за', 'угол', 'и', 'попадаешь', 'острием', 'зонта', 'в', 'глаз', 'старому', 'знакомому', 'из', 'Кутни-фоллс']	['You', 'round', 'a', 'corner', 'and', 'thrust', 'the', 'rib', 'of', 'your', 'umbrella', 'into', 'the', 'eye', 'of', 'your', 'old', 'friend', 'from', 'Kootenai', 'Falls']
21	You stroll out to pluck a Sweet William in the park—and lo! bandits attack you—you are ambulanced to the hospital—you marry your nurse; are divorced—get squeezed while short on U. P. S. and D. O. W. N. S.—stand in the bread line—marry an heiress, take out your laundry and pay your club dues—seemingly all in the wink of an eye. 	Гуляешь в парке, хочешь сорвать гвоздику - и вдруг на тебя нападают бандиты, скорая помощь везет тебя в больницу, ты женишься на сиделке; разводишься, перебиваешься кое- как с хлеба на квас, стоишь в очереди в ночлежку, женишься на богатой наследнице, отдаешь белье в стирку, платишь членские взносы в клуб - и все это в мгновение ока. 	['Гуляешь', 'в', 'парке', 'хочешь', 'сорвать', 'гвоздику', 'и', 'вдруг', 'на', 'тебя', 'нападают', 'бандиты', 'скорая', 'помощь', 'везет', 'тебя', 'в', 'больницу', 'ты', 'женишься', 'на', 'сиделке', 'разводишься', 'перебиваешься', 'кое', 'как', 'с', 'хлеба', 'на', 'квас', 'стоишь', 'в', 'очереди', 'в', 'ночлежку', 'женишься', 'на', 'богатой', 'наследнице', 'отдаешь', 'белье', 'в', 'стирку', 'платишь', 'членские', 'взносы', 'в', 'клуб', 'и', 'все', 'это', 'в', 'мгновение', 'ока']	['You', 'stroll', 'out', 'to', 'pluck', 'a', 'Sweet', 'William', 'in', 'the', 'park—and', 'lo', 'bandits', 'attack', 'you—you', 'are', 'ambulanced', 'to', 'the', 'hospital—you', 'marry', 'your', 'nurse', 'are', 'divorced—get', 'squeezed', 'while', 'short', 'on', 'U', 'P', 'S', 'and', 'D', 'O', 'W', 'N', 'S.—stand', 'in', 'the', 'bread', 'line—marry', 'an', 'heiress', 'take', 'out', 'your', 'laundry', 'and', 'pay', 'your', 'club', 'dues—seemingly', 'all', 'in', 'the', 'wink', 'of', 'an', 'eye']
22	You travel the streets, and a finger beckons to you, a handkerchief is dropped for you, a brick is dropped upon you, the elevator cable or your bank breaks, a table d'hôte or your wife disagrees with you, and Fate tosses you about like cork crumbs in wine opened by an un-feed waiter. 	Бродишь по улицам, кто-то манит тебя пальцем, роняет к твоим ногам платок, на тебя роняют кирпич, лопается трос в лифте или твой банк, ты не ладишь с женой или твой желудок не ладит с готовыми обедами - судьба швыряет тебя из стороны в сторону, как кусок пробки в вине, откупоренном официантом, которому ты не дал на чай. 	['Бродишь', 'по', 'улицам', 'кто-то', 'манит', 'тебя', 'пальцем', 'роняет', 'к', 'твоим', 'ногам', 'платок', 'на', 'тебя', 'роняют', 'кирпич', 'лопается', 'трос', 'в', 'лифте', 'или', 'твой', 'банк', 'ты', 'не', 'ладишь', 'с', 'женой', 'или', 'твой', 'желудок', 'не', 'ладит', 'с', 'готовыми', 'обедами', 'судьба', 'швыряет', 'тебя', 'из', 'стороны', 'в', 'сторону', 'как', 'кусок', 'пробки', 'в', 'вине', 'откупоренном', 'официантом', 'которому', 'ты', 'не', 'дал', 'на', 'чай']	"['You', 'travel', 'the', 'streets', 'and', 'a', 'finger', 'beckons', 'to', 'you', 'a', 'handkerchief', 'is', 'dropped', 'for', 'you', 'a', 'brick', 'is', 'dropped', 'upon', 'you', 'the', 'elevator', 'cable', 'or', 'your', 'bank', 'breaks', 'a', 'table', ""d'hôte"", 'or', 'your', 'wife', 'disagrees', 'with', 'you', 'and', 'Fate', 'tosses', 'you', 'about', 'like', 'cork', 'crumbs', 'in', 'wine', 'opened', 'by', 'an', 'un-feed', 'waiter']"
23	The City is a sprightly youngster, and you are red paint upon its toy, and you get licked off. 	Город жизнерадостный малыш, а ты - красная краска, которую он слизывает со своей игрушки. 	['Город', 'жизнерадостный', 'малыш', 'а', 'ты', 'красная', 'краска', 'которую', 'он', 'слизывает', 'со', 'своей', 'игрушки']	['The', 'City', 'is', 'a', 'sprightly', 'youngster', 'and', 'you', 'are', 'red', 'paint', 'upon', 'its', 'toy', 'and', 'you', 'get', 'licked', 'off']
24	John Hopkins sat, after a compressed dinner, in his glove-fitting straight-front flat. 	После уплотненного обеда Джон Гопкинс сидел в своей квартире строгого фасона, тесной, как перчатка. 	['После', 'уплотненного', 'обеда', 'Джон', 'Гопкинс', 'сидел', 'в', 'своей', 'квартире', 'строгого', 'фасона', 'тесной', 'как', 'перчатка']	['John', 'Hopkins', 'sat', 'after', 'a', 'compressed', 'dinner', 'in', 'his', 'glove-fitting', 'straight-front', 'flat']
25	"He sat upon a hornblende couch and gazed, with satiated eyes, at Art Brought Home to the People in the shape of ""The Storm"" tacked against the wall. "	"Он сидел на каменном диване и сытыми глазами разглядывал ""Искусство на дом"" в виде картинки ""Буря"", прикрепленной кнопками к стене. "	['Он', 'сидел', 'на', 'каменном', 'диване', 'и', 'сытыми', 'глазами', 'разглядывал', 'Искусство', 'на', 'дом', 'в', 'виде', 'картинки', 'Буря', 'прикрепленной', 'кнопками', 'к', 'стене']	['He', 'sat', 'upon', 'a', 'hornblende', 'couch', 'and', 'gazed', 'with', 'satiated', 'eyes', 'at', 'Art', 'Brought', 'Home', 'to', 'the', 'People', 'in', 'the', 'shape', 'of', 'The', 'Storm', 'tacked', 'against', 'the', 'wall']
26	Mrs. Hopkins discoursed droningly of the dinner smells from the flat across the hall. 	Миссис Гопкинс. Вялым голосом жаловалась на кухонный чад из соседней квартиры. 	['Миссис', 'Гопкинс', 'Вялым', 'голосом', 'жаловалась', 'на', 'кухонный', 'чад', 'из', 'соседней', 'квартиры']	['Mrs', 'Hopkins', 'discoursed', 'droningly', 'of', 'the', 'dinner', 'smells', 'from', 'the', 'flat', 'across', 'the', 'hall']
27	The flea-bitten terrier gave Hopkins a look of disgust, and showed a man-hating tooth. 	Блохастый терьер человеконенавистнически покосился на Гопкинса и презрительно обнажил клыки. 	['Блохастый', 'терьер', 'человеконенавистнически', 'покосился', 'на', 'Гопкинса', 'и', 'презрительно', 'обнажил', 'клыки']	['The', 'flea-bitten', 'terrier', 'gave', 'Hopkins', 'a', 'look', 'of', 'disgust', 'and', 'showed', 'a', 'man-hating', 'tooth']
28	Here was neither poverty, love, nor war; but upon such barren stems may be grafted those essentials of a complete life. 	Тут не было ни бедности, ни войны, ни любви; но и к такому бесплодному стволу можно привить эти основы полной жизни. 	['Тут', 'не', 'было', 'ни', 'бедности', 'ни', 'войны', 'ни', 'любви', 'но', 'и', 'к', 'такому', 'бесплодному', 'стволу', 'можно', 'привить', 'эти', 'основы', 'полной', 'жизни']	['Here', 'was', 'neither', 'poverty', 'love', 'nor', 'war', 'but', 'upon', 'such', 'barren', 'stems', 'may', 'be', 'grafted', 'those', 'essentials', 'of', 'a', 'complete', 'life']
29	John Hopkins sought to inject a few raisins of conversation into the tasteless dough of existence. 	Джон Гопкинс попытался вклеить изюминку разговора в пресное тесто существования. 	['Джон', 'Гопкинс', 'попытался', 'вклеить', 'изюминку', 'разговора', 'в', 'пресное', 'тесто', 'существования']	['John', 'Hopkins', 'sought', 'to', 'inject', 'a', 'few', 'raisins', 'of', 'conversation', 'into', 'the', 'tasteless', 'dough', 'of', 'existence']
30	"""Putting a new elevator in at the office,"" he said, discarding the nominative noun, ""and the boss has turned out his whiskers."" "	- В конторе ставят новый лифт, - сказал он, отбрасывая личное местоимение, - а шеф начал отпускать бакенбарды. 	['В', 'конторе', 'ставят', 'новый', 'лифт', 'сказал', 'он', 'отбрасывая', 'личное', 'местоимение', 'а', 'шеф', 'начал', 'отпускать', 'бакенбарды']	['Putting', 'a', 'new', 'elevator', 'in', 'at', 'the', 'office', 'he', 'said', 'discarding', 'the', 'nominative', 'noun', 'and', 'the', 'boss', 'has', 'turned', 'out', 'his', 'whiskers']
