	en	ru	ru_tokens	en_tokens
31	"""You don't mean it!"" commented Mrs. Hopkins. "	- Да что ты говоришь! - отозвалась миссис Гопкинс. 	['Да', 'что', 'ты', 'говоришь', 'отозвалась', 'миссис', 'Гопкинс']	"['You', ""don't"", 'mean', 'it', 'commented', 'Mrs', 'Hopkins']"
32	"""Mr. Whipples,"" continued John, ""wore his new spring suit down to-day. "	- Мистер Уиплз пришел нынче в новом весеннем костюме. 	['Мистер', 'Уиплз', 'пришел', 'нынче', 'в', 'новом', 'весеннем', 'костюме']	['Mr', 'Whipples', 'continued', 'John', 'wore', 'his', 'new', 'spring', 'suit', 'down', 'to-day']
33	"I liked it fine It's a gray with—"" He stopped, suddenly stricken by a need that made itself known to him. "	Мне очень даже нравится. Такой серый, в... - Он замолчал, вдруг почувствовав, что ему захотелось курить. 	['Мне', 'очень', 'даже', 'нравится', 'Такой', 'серый', 'в', 'Он', 'замолчал', 'вдруг', 'почувствовав', 'что', 'ему', 'захотелось', 'курить']	"['I', 'liked', 'it', 'fine', ""It's"", 'a', 'gray', 'with—', 'He', 'stopped', 'suddenly', 'stricken', 'by', 'a', 'need', 'that', 'made', 'itself', 'known', 'to', 'him']"
34	"""I believe I'll walk down to the corner and get a five-cent cigar,"" he concluded. "	- Я, пожалуй, пройдусь до угла, куплю себе сигару за пять центов, - заключил он. 	['Я', 'пожалуй', 'пройдусь', 'до', 'угла', 'куплю', 'себе', 'сигару', 'за', 'пять', 'центов', 'заключил', 'он']	"['I', 'believe', ""I'll"", 'walk', 'down', 'to', 'the', 'corner', 'and', 'get', 'a', 'five-cent', 'cigar', 'he', 'concluded']"
35	John Hopkins took his hat and picked his way down the musty halls and stairs of the flat-house. 	Джон Гопкинс взял шляпу и направился к выходу по затхлым коридорам и лестницам доходного дома. 	['Джон', 'Гопкинс', 'взял', 'шляпу', 'и', 'направился', 'к', 'выходу', 'по', 'затхлым', 'коридорам', 'и', 'лестницам', 'доходного', 'дома']	['John', 'Hopkins', 'took', 'his', 'hat', 'and', 'picked', 'his', 'way', 'down', 'the', 'musty', 'halls', 'and', 'stairs', 'of', 'the', 'flat-house']
36	The evening air was mild, and the streets shrill with the careless cries of children playing games controlled by mysterious rhythms and phrases. 	Вечерний воздух был мягок, на улице звонко распевали дети, беззаботно прыгая в такт непонятным словам напева. 	['Вечерний', 'воздух', 'был', 'мягок', 'на', 'улице', 'звонко', 'распевали', 'дети', 'беззаботно', 'прыгая', 'в', 'такт', 'непонятным', 'словам', 'напева']	['The', 'evening', 'air', 'was', 'mild', 'and', 'the', 'streets', 'shrill', 'with', 'the', 'careless', 'cries', 'of', 'children', 'playing', 'games', 'controlled', 'by', 'mysterious', 'rhythms', 'and', 'phrases']
37	Their elders held the doorways and steps with leisurely pipe and gossip. 	Их родители сидели на порогах и крылечках, покуривая и болтая на досуге. 	['Их', 'родители', 'сидели', 'на', 'порогах', 'и', 'крылечках', 'покуривая', 'и', 'болтая', 'на', 'досуге']	['Their', 'elders', 'held', 'the', 'doorways', 'and', 'steps', 'with', 'leisurely', 'pipe', 'and', 'gossip']
38	Paradoxically, the fire-escapes supported lovers in couples who made no attempt to fly the mounting conflagration they were there to fan. 	Как это ни странно, пожарные лестницы давали приют влюбленным парочкам, которые раздували начинающийся пожар, вместо того чтобы потушить его в самом начале. 	['Как', 'это', 'ни', 'странно', 'пожарные', 'лестницы', 'давали', 'приют', 'влюбленным', 'парочкам', 'которые', 'раздували', 'начинающийся', 'пожар', 'вместо', 'того', 'чтобы', 'потушить', 'его', 'в', 'самом', 'начале']	['Paradoxically', 'the', 'fire-escapes', 'supported', 'lovers', 'in', 'couples', 'who', 'made', 'no', 'attempt', 'to', 'fly', 'the', 'mounting', 'conflagration', 'they', 'were', 'there', 'to', 'fan']
39	The corner cigar store aimed at by John Hopkins was kept by a man named Freshmayer, who looked upon the earth as a sterile promontory. 	Табачную лавочку на углу, куда направлялся Джон Гопкинс, содержал некий торговец по фамилии Фрешмейер; который не ждал от жизни ничего хорошего и всю землю рассматривал как бесплодную пустыню. 	['Табачную', 'лавочку', 'на', 'углу', 'куда', 'направлялся', 'Джон', 'Гопкинс', 'содержал', 'некий', 'торговец', 'по', 'фамилии', 'Фрешмейер', 'который', 'не', 'ждал', 'от', 'жизни', 'ничего', 'хорошего', 'и', 'всю', 'землю', 'рассматривал', 'как', 'бесплодную', 'пустыню']	['The', 'corner', 'cigar', 'store', 'aimed', 'at', 'by', 'John', 'Hopkins', 'was', 'kept', 'by', 'a', 'man', 'named', 'Freshmayer', 'who', 'looked', 'upon', 'the', 'earth', 'as', 'a', 'sterile', 'promontory']
40	"Hopkins, unknown in the store, entered and called genially for his ""bunch of spinach, car-fare grade."" "	"Гопкинс, не знакомый с хозяином, вошел и добродушно спросил пучок ""шпината, не дороже трамвайного билета"". "	['Гопкинс', 'не', 'знакомый', 'с', 'хозяином', 'вошел', 'и', 'добродушно', 'спросил', 'пучок', 'шпината', 'не', 'дороже', 'трамвайного', 'билета']	['Hopkins', 'unknown', 'in', 'the', 'store', 'entered', 'and', 'called', 'genially', 'for', 'his', 'bunch', 'of', 'spinach', 'car-fare', 'grade']
41	This imputation deepened the pessimism of Freshmayer; but he set out a brand that came perilously near to filling the order. 	Этот неуместный намек только усугубил пессимизм Фрешмейера; однако он предложил покупателю товар, довольно близко отвечавший требованию. 	['Этот', 'неуместный', 'намек', 'только', 'усугубил', 'пессимизм', 'Фрешмейера', 'однако', 'он', 'предложил', 'покупателю', 'товар', 'довольно', 'близко', 'отвечавший', 'требованию']	['This', 'imputation', 'deepened', 'the', 'pessimism', 'of', 'Freshmayer', 'but', 'he', 'set', 'out', 'a', 'brand', 'that', 'came', 'perilously', 'near', 'to', 'filling', 'the', 'order']
42	Hopkins bit off the roots of his purchase, and lighted up at the swinging gas jet. 	Гопкинс откусил кончик сигары и закурил ее от газового рожка. 	['Гопкинс', 'откусил', 'кончик', 'сигары', 'и', 'закурил', 'ее', 'от', 'газового', 'рожка']	['Hopkins', 'bit', 'off', 'the', 'roots', 'of', 'his', 'purchase', 'and', 'lighted', 'up', 'at', 'the', 'swinging', 'gas', 'jet']
43	Feeling in his pockets to make payment, he found not a penny there. 	Сунув руку в карман, чтобы заплатить за покупку, он не нашел там ни цента. 	['Сунув', 'руку', 'в', 'карман', 'чтобы', 'заплатить', 'за', 'покупку', 'он', 'не', 'нашел', 'там', 'ни', 'цента']	['Feeling', 'in', 'his', 'pockets', 'to', 'make', 'payment', 'he', 'found', 'not', 'a', 'penny', 'there']
44	"""Say, my friend,"" he explained, frankly, "	- Послушайте, дружище, - откровенно объяснил он. 	['Послушайте', 'дружище', 'откровенно', 'объяснил', 'он']	['Say', 'my', 'friend', 'he', 'explained', 'frankly']
45	"""I've come out without any change. "	- Я вышел из дому без мелочи. 	['Я', 'вышел', 'из', 'дому', 'без', 'мелочи']	"[""I've"", 'come', 'out', 'without', 'any', 'change']"
46	"Hand you that nickel first time I pass."" "	Я вам заплачу в первый же раз, как буду проходить мимо. 	['Я', 'вам', 'заплачу', 'в', 'первый', 'же', 'раз', 'как', 'буду', 'проходить', 'мимо']	['Hand', 'you', 'that', 'nickel', 'first', 'time', 'I', 'pass']
47	Joy surged in Freshmayer's heart. 	Сердце Фрешмейера дрогнуло от радости. 	['Сердце', 'Фрешмейера', 'дрогнуло', 'от', 'радости']	"['Joy', 'surged', 'in', ""Freshmayer's"", 'heart']"
48	Here was corroboration of his belief that the world was rotten and man a peripatetic evil. 	Этим подтверждалось его убеждение, что весь мир - сплошная мерзость, а человек есть ходячее зло. 	['Этим', 'подтверждалось', 'его', 'убеждение', 'что', 'весь', 'мир', 'сплошная', 'мерзость', 'а', 'человек', 'есть', 'ходячее', 'зло']	['Here', 'was', 'corroboration', 'of', 'his', 'belief', 'that', 'the', 'world', 'was', 'rotten', 'and', 'man', 'a', 'peripatetic', 'evil']
49	Without a word he rounded the end of his counter and made earnest onslaught upon his customer. 	Не говоря худого слова, он обошел вокруг прилавка и с кулаками набросился на покупателя. 	['Не', 'говоря', 'худого', 'слова', 'он', 'обошел', 'вокруг', 'прилавка', 'и', 'с', 'кулаками', 'набросился', 'на', 'покупателя']	['Without', 'a', 'word', 'he', 'rounded', 'the', 'end', 'of', 'his', 'counter', 'and', 'made', 'earnest', 'onslaught', 'upon', 'his', 'customer']
50	Hopkins was no man to serve as a punching-bag for a pessimistic tobacconist. 	Гопкинс был не такой человек, чтобы капитулировать перед впавшим в пессимизм лавочником. 	['Гопкинс', 'был', 'не', 'такой', 'человек', 'чтобы', 'капитулировать', 'перед', 'впавшим', 'в', 'пессимизм', 'лавочником']	['Hopkins', 'was', 'no', 'man', 'to', 'serve', 'as', 'a', 'punching-bag', 'for', 'a', 'pessimistic', 'tobacconist']
51	He quickly bestowed upon Freshmayer a colorado-maduro eye in return for the ardent kick that he received from that dealer in goods for cash only. 	Он моментально подставил Фрешмейеру золотисто-лиловый синяк под глазом в уплату за удар, нанесенный сгоряча любителем наличных... 	['Он', 'моментально', 'подставил', 'Фрешмейеру', 'золотисто-лиловый', 'синяк', 'под', 'глазом', 'в', 'уплату', 'за', 'удар', 'нанесенный', 'сгоряча', 'любителем', 'наличных']	['He', 'quickly', 'bestowed', 'upon', 'Freshmayer', 'a', 'colorado-maduro', 'eye', 'in', 'return', 'for', 'the', 'ardent', 'kick', 'that', 'he', 'received', 'from', 'that', 'dealer', 'in', 'goods', 'for', 'cash', 'only']
52	The impetus of the enemy's attack forced the Hopkins line back to the sidewalk. 	Стремительная атака неприятеля отбросила Гопкинса на тротуар. 	['Стремительная', 'атака', 'неприятеля', 'отбросила', 'Гопкинса', 'на', 'тротуар']	"['The', 'impetus', 'of', 'the', ""enemy's"", 'attack', 'forced', 'the', 'Hopkins', 'line', 'back', 'to', 'the', 'sidewalk']"
53	There the conflict raged; the pacific wooden Indian, with his carven smile, was overturned, and those of the street who delighted in carnage pressed round to view the zealous joust. 	Там и разыгралось сражение: мирный индеец со своей деревянной улыбкой был повержен в прах, и уличные любители побоищ столпились вокруг, созерцая этот рыцарский поединок. 	['Там', 'и', 'разыгралось', 'сражение', 'мирный', 'индеец', 'со', 'своей', 'деревянной', 'улыбкой', 'был', 'повержен', 'в', 'прах', 'и', 'уличные', 'любители', 'побоищ', 'столпились', 'вокруг', 'созерцая', 'этот', 'рыцарский', 'поединок']	['There', 'the', 'conflict', 'raged', 'the', 'pacific', 'wooden', 'Indian', 'with', 'his', 'carven', 'smile', 'was', 'overturned', 'and', 'those', 'of', 'the', 'street', 'who', 'delighted', 'in', 'carnage', 'pressed', 'round', 'to', 'view', 'the', 'zealous', 'joust']
54	But then came the inevitable cop and imminent inconvenience for both the attacker and attacked. 	Но тут появился неизбежный полисмен, что предвещало неприятности и обидчику и. его жертве. 	['Но', 'тут', 'появился', 'неизбежный', 'полисмен', 'что', 'предвещало', 'неприятности', 'и', 'обидчику', 'и', 'его', 'жертве']	['But', 'then', 'came', 'the', 'inevitable', 'cop', 'and', 'imminent', 'inconvenience', 'for', 'both', 'the', 'attacker', 'and', 'attacked']
55	John Hopkins was a peaceful citizen, who worked at rebuses of nights in a flat, but he was not without the fundamental spirit of resistance that comes with the battle-rage. He knocked the policeman into a grocer's sidewalk display of goods and gave Freshmayer a punch that caused him temporarily to regret that he had not made it a rule to extend a five-cent line of credit to certain customers. 	Джон Гопкинс был мирный обыватель и по вечерам сидел дома, решая ребусы, однако он был не лишен того духа сопротивления, который разгорается в пылу битвы Он повалил полисмена прямо на выставленные бакалейщиком товары, а Фрешмейеру дал такую затрещину, что тот пожалел было, зачем он не завел обыкновения предоставлять хотя бы некоторым покупателям кредит до пяти центов. 	['Джон', 'Гопкинс', 'был', 'мирный', 'обыватель', 'и', 'по', 'вечерам', 'сидел', 'дома', 'решая', 'ребусы', 'однако', 'он', 'был', 'не', 'лишен', 'того', 'духа', 'сопротивления', 'который', 'разгорается', 'в', 'пылу', 'битвы', 'Он', 'повалил', 'полисмена', 'прямо', 'на', 'выставленные', 'бакалейщиком', 'товары', 'а', 'Фрешмейеру', 'дал', 'такую', 'затрещину', 'что', 'тот', 'пожалел', 'было', 'зачем', 'он', 'не', 'завел', 'обыкновения', 'предоставлять', 'хотя', 'бы', 'некоторым', 'покупателям', 'кредит', 'до', 'пяти', 'центов']	"['John', 'Hopkins', 'was', 'a', 'peaceful', 'citizen', 'who', 'worked', 'at', 'rebuses', 'of', 'nights', 'in', 'a', 'flat', 'but', 'he', 'was', 'not', 'without', 'the', 'fundamental', 'spirit', 'of', 'resistance', 'that', 'comes', 'with', 'the', 'battle-rage', 'He', 'knocked', 'the', 'policeman', 'into', 'a', ""grocer's"", 'sidewalk', 'display', 'of', 'goods', 'and', 'gave', 'Freshmayer', 'a', 'punch', 'that', 'caused', 'him', 'temporarily', 'to', 'regret', 'that', 'he', 'had', 'not', 'made', 'it', 'a', 'rule', 'to', 'extend', 'a', 'five-cent', 'line', 'of', 'credit', 'to', 'certain', 'customers']"
56	Then Hopkins took spiritedly to his heels down the sidewalk, closely followed by the cigar-dealer and the policeman, whose uniform testified to the reason in the grocer's sign that read: 	После чего Гопкинс бросился бегом по тротуару, а в погоню за ним - табачный торговец и полисмен, мундир которого наглядно доказывал, Почему на вывеске бакалейщика было написано: 	['После', 'чего', 'Гопкинс', 'бросился', 'бегом', 'по', 'тротуару', 'а', 'в', 'погоню', 'за', 'ним', 'табачный', 'торговец', 'и', 'полисмен', 'мундир', 'которого', 'наглядно', 'доказывал', 'Почему', 'на', 'вывеске', 'бакалейщика', 'было', 'написано']	"['Then', 'Hopkins', 'took', 'spiritedly', 'to', 'his', 'heels', 'down', 'the', 'sidewalk', 'closely', 'followed', 'by', 'the', 'cigar-dealer', 'and', 'the', 'policeman', 'whose', 'uniform', 'testified', 'to', 'the', 'reason', 'in', 'the', ""grocer's"", 'sign', 'that', 'read']"
57	"""Eggs cheaper than anywhere else in the city."" "	"""Яйца дешевле, чем где-либо в городе"" "	['Яйца', 'дешевле', 'чем', 'где-либо', 'в', 'городе']	['Eggs', 'cheaper', 'than', 'anywhere', 'else', 'in', 'the', 'city']
58	As Hopkins ran he became aware of a big, low, red, racing automobile that kept abreast of him in the street. 	На бегу Гопкинс заметил, что по мостовой, держась наравне с ним, едет большой низкий гоночный автомобиль красного цвета. 	['На', 'бегу', 'Гопкинс', 'заметил', 'что', 'по', 'мостовой', 'держась', 'наравне', 'с', 'ним', 'едет', 'большой', 'низкий', 'гоночный', 'автомобиль', 'красного', 'цвета']	['As', 'Hopkins', 'ran', 'he', 'became', 'aware', 'of', 'a', 'big', 'low', 'red', 'racing', 'automobile', 'that', 'kept', 'abreast', 'of', 'him', 'in', 'the', 'street']
59	This auto steered in to the side of the sidewalk, and the man guiding it motioned to Hopkins to jump into it. 	Автомобиль подъехал к тротуару, и человек за рулем сделал Гопкинсу знак садиться. 	['Автомобиль', 'подъехал', 'к', 'тротуару', 'и', 'человек', 'за', 'рулем', 'сделал', 'Гопкинсу', 'знак', 'садиться']	['This', 'auto', 'steered', 'in', 'to', 'the', 'side', 'of', 'the', 'sidewalk', 'and', 'the', 'man', 'guiding', 'it', 'motioned', 'to', 'Hopkins', 'to', 'jump', 'into', 'it']
60	He did so without slackening his speed, and fell into the turkey-red upholstered seat beside the chauffeur. 	Он вскочил на ходу и повалился на мягкое оранжевое сиденье рядом с шофером. 	['Он', 'вскочил', 'на', 'ходу', 'и', 'повалился', 'на', 'мягкое', 'оранжевое', 'сиденье', 'рядом', 'с', 'шофером']	['He', 'did', 'so', 'without', 'slackening', 'his', 'speed', 'and', 'fell', 'into', 'the', 'turkey-red', 'upholstered', 'seat', 'beside', 'the', 'chauffeur']
61	The big machine, with a diminuendo cough, flew away like an albatross down the avenue into which the street emptied. 	Большая машина, фыркая все глуше, летела, как альбатрос, уже свернув с улицы на широкую авеню. 	['Большая', 'машина', 'фыркая', 'все', 'глуше', 'летела', 'как', 'альбатрос', 'уже', 'свернув', 'с', 'улицы', 'на', 'широкую', 'авеню']	['The', 'big', 'machine', 'with', 'a', 'diminuendo', 'cough', 'flew', 'away', 'like', 'an', 'albatross', 'down', 'the', 'avenue', 'into', 'which', 'the', 'street', 'emptied']
62	The driver of the auto sped his machine without a word. 	Шофер вел машину, не говоря ни слова. 	['Шофер', 'вел', 'машину', 'не', 'говоря', 'ни', 'слова']	['The', 'driver', 'of', 'the', 'auto', 'sped', 'his', 'machine', 'without', 'a', 'word']
63	He was masked beyond guess in the goggles and diabolic garb of the chauffeur. 	Автомобильные очки и дьявольский наряд водителя маскировали его как нельзя лучше. 	['Автомобильные', 'очки', 'и', 'дьявольский', 'наряд', 'водителя', 'маскировали', 'его', 'как', 'нельзя', 'лучше']	['He', 'was', 'masked', 'beyond', 'guess', 'in', 'the', 'goggles', 'and', 'diabolic', 'garb', 'of', 'the', 'chauffeur']
64	"""Much obliged, old man,"" called Hopkins, gratefully. ""I guess you've got sporting blood in you, all right, and don't admire the sight of two men trying to soak one. "	- Спасибо, друг, - благодарно обратился к нему Гопкинс Ты, должно быть, и сам честный малый, тебе противно глядеть, когда двое нападают на одного? 	['Спасибо', 'друг', 'благодарно', 'обратился', 'к', 'нему', 'Гопкинс', 'Ты', 'должно', 'быть', 'и', 'сам', 'честный', 'малый', 'тебе', 'противно', 'глядеть', 'когда', 'двое', 'нападают', 'на', 'одного']	"['Much', 'obliged', 'old', 'man', 'called', 'Hopkins', 'gratefully', 'I', 'guess', ""you've"", 'got', 'sporting', 'blood', 'in', 'you', 'all', 'right', 'and', ""don't"", 'admire', 'the', 'sight', 'of', 'two', 'men', 'trying', 'to', 'soak', 'one']"
65	"Little more and I'd have been pinched."" "	Еще немножко, и мне пришлось бы плохо? 	['Еще', 'немножко', 'и', 'мне', 'пришлось', 'бы', 'плохо']	"['Little', 'more', 'and', ""I'd"", 'have', 'been', 'pinched']"
66	The chauffeur made no sign that he had heard. 	Шофер и ухом не повел - будто не слышал. 	['Шофер', 'и', 'ухом', 'не', 'повел', 'будто', 'не', 'слышал']	['The', 'chauffeur', 'made', 'no', 'sign', 'that', 'he', 'had', 'heard']
67	Hopkins shrugged a shoulder and chewed at his cigar, to which his teeth had clung grimly throughout the mêlée. 	Гопкинс передернул плечами и стал жевать сигару, которую так и не выпускал из зубов в продолжение всей свалки. 	['Гопкинс', 'передернул', 'плечами', 'и', 'стал', 'жевать', 'сигару', 'которую', 'так', 'и', 'не', 'выпускал', 'из', 'зубов', 'в', 'продолжение', 'всей', 'свалки']	['Hopkins', 'shrugged', 'a', 'shoulder', 'and', 'chewed', 'at', 'his', 'cigar', 'to', 'which', 'his', 'teeth', 'had', 'clung', 'grimly', 'throughout', 'the', 'mêlée']
68	Ten minutes and the auto turned into the open carriage entrance of a noble mansion of brown stone, and stood still. 	Через десять минут автомобиль влетел в распахнутые настежь ворота изящного особняка и остановился. 	['Через', 'десять', 'минут', 'автомобиль', 'влетел', 'в', 'распахнутые', 'настежь', 'ворота', 'изящного', 'особняка', 'и', 'остановился']	['Ten', 'minutes', 'and', 'the', 'auto', 'turned', 'into', 'the', 'open', 'carriage', 'entrance', 'of', 'a', 'noble', 'mansion', 'of', 'brown', 'stone', 'and', 'stood', 'still']
69	The chauffeur leaped out, and said: 	Шофер выскочил из машины и сказал: 	['Шофер', 'выскочил', 'из', 'машины', 'и', 'сказал']	['The', 'chauffeur', 'leaped', 'out', 'and', 'said']
70	"""Come quick. "	- Идите скорей. 	['Идите', 'скорей']	['Come', 'quick']
71	The lady, she will explain. 	Мадам объяснит все сама. 	['Мадам', 'объяснит', 'все', 'сама']	['The', 'lady', 'she', 'will', 'explain']
