	en	ru	ru_tokens	en_tokens
157	Pneumonia, too. 	Тоже воспаление легких. 	['Тоже', 'воспаление', 'легких']	['Pneumonia', 'too']
158	He is an old, weak man, and the attack is acute. 	Он уже старик и очень слаб, а форма болезни тяжелая. 	['Он', 'уже', 'старик', 'и', 'очень', 'слаб', 'а', 'форма', 'болезни', 'тяжелая']	['He', 'is', 'an', 'old', 'weak', 'man', 'and', 'the', 'attack', 'is', 'acute']
159	"There is no hope for him; but he goes to the hospital to-day to be made more comfortable."" "	Надежды нет никакой, но сегодня его отправят в больницу, там ему будет покойнее. 	['Надежды', 'нет', 'никакой', 'но', 'сегодня', 'его', 'отправят', 'в', 'больницу', 'там', 'ему', 'будет', 'покойнее']	['There', 'is', 'no', 'hope', 'for', 'him', 'but', 'he', 'goes', 'to', 'the', 'hospital', 'to-day', 'to', 'be', 'made', 'more', 'comfortable']
160	The next day the doctor said to Sue: 	На другой день доктор сказал Сью: 	['На', 'другой', 'день', 'доктор', 'сказал', 'Сью']	['The', 'next', 'day', 'the', 'doctor', 'said', 'to', 'Sue']
161	"""She's out of danger. "	— Она вне опасности. 	['—', 'Она', 'вне', 'опасности']	"[""She's"", 'out', 'of', 'danger']"
162	You've won. 	Вы победили. 	['Вы', 'победили']	"[""You've"", 'won']"
163	"Nutrition and care now—that's all."" "	Теперь питание и уход — и больше ничего не нужно. 	['Теперь', 'питание', 'и', 'уход', '—', 'и', 'больше', 'ничего', 'не', 'нужно']	"['Nutrition', 'and', 'care', ""now—that's"", 'all']"
164	And that afternoon Sue came to the bed where Johnsy lay, contentedly knitting a very blue and very useless woolen shoulder scarf, and put one arm around her, pillows and all. 	В тот же вечер Сью подошла к кровати, где лежала Джонси, с удовольствием довязывая ярко-синий, совершенно бесполезный шарф, и обняла ее одной рукой — вместе с подушкой. 	['В', 'тот', 'же', 'вечер', 'Сью', 'подошла', 'к', 'кровати', 'где', 'лежала', 'Джонси', 'с', 'удовольствием', 'довязывая', 'ярко-синий', 'совершенно', 'бесполезный', 'шарф', 'и', 'обняла', 'ее', 'одной', 'рукой', '—', 'вместе', 'с', 'подушкой']	['And', 'that', 'afternoon', 'Sue', 'came', 'to', 'the', 'bed', 'where', 'Johnsy', 'lay', 'contentedly', 'knitting', 'a', 'very', 'blue', 'and', 'very', 'useless', 'woolen', 'shoulder', 'scarf', 'and', 'put', 'one', 'arm', 'around', 'her', 'pillows', 'and', 'all']
165	"""I have something to tell you, white mouse,"" she said. "	— Мне надо кое-что сказать тебе, белая мышка, — начала она. 	['—', 'Мне', 'надо', 'кое-что', 'сказать', 'тебе', 'белая', 'мышка', '—', 'начала', 'она']	['I', 'have', 'something', 'to', 'tell', 'you', 'white', 'mouse', 'she', 'said']
166	"""Mr. Behrman died of pneumonia to-day in the hospital. "	— Мистер Берман умер сегодня в больнице от воспаления легких. 	['—', 'Мистер', 'Берман', 'умер', 'сегодня', 'в', 'больнице', 'от', 'воспаления', 'легких']	['Mr', 'Behrman', 'died', 'of', 'pneumonia', 'to-day', 'in', 'the', 'hospital']
167	He was ill only two days. 	Он болел всего только два дня. 	['Он', 'болел', 'всего', 'только', 'два', 'дня']	['He', 'was', 'ill', 'only', 'two', 'days']
168	The janitor found him on the morning of the first day in his room downstairs helpless with pain. 	Утром первого дня швейцар нашел бедного старика на полу в его комнате. Он был без сознания. 	['Утром', 'первого', 'дня', 'швейцар', 'нашел', 'бедного', 'старика', 'на', 'полу', 'в', 'его', 'комнате', 'Он', 'был', 'без', 'сознания']	['The', 'janitor', 'found', 'him', 'on', 'the', 'morning', 'of', 'the', 'first', 'day', 'in', 'his', 'room', 'downstairs', 'helpless', 'with', 'pain']
169	His shoes and clothing were wet through and icy cold. 	Башмаки и вся его одежда промокли насквозь и были холодны, как лед. 	['Башмаки', 'и', 'вся', 'его', 'одежда', 'промокли', 'насквозь', 'и', 'были', 'холодны', 'как', 'лед']	['His', 'shoes', 'and', 'clothing', 'were', 'wet', 'through', 'and', 'icy', 'cold']
170	They couldn't imagine where he had been on such a dreadful night. 	Никто не мог понять, куда он выходил в такую ужасную ночь. 	['Никто', 'не', 'мог', 'понять', 'куда', 'он', 'выходил', 'в', 'такую', 'ужасную', 'ночь']	"['They', ""couldn't"", 'imagine', 'where', 'he', 'had', 'been', 'on', 'such', 'a', 'dreadful', 'night']"
171	And then they found a lantern, still lighted, and a ladder that had been dragged from its place, and some scattered brushes, and a palette with green and yellow colors mixed on it, and—look out the window, dear, at the last ivy leaf on the wall. 	Потом нашли фонарь, который все еще горел, лестницу, сдвинутую с места, несколько брошенных кистей и палитру с желтой и зеленой красками. Посмотри в окно, дорогая, на последний лист плюща. 	['Потом', 'нашли', 'фонарь', 'который', 'все', 'еще', 'горел', 'лестницу', 'сдвинутую', 'с', 'места', 'несколько', 'брошенных', 'кистей', 'и', 'палитру', 'с', 'желтой', 'и', 'зеленой', 'красками', 'Посмотри', 'в', 'окно', 'дорогая', 'на', 'последний', 'лист', 'плюща']	['And', 'then', 'they', 'found', 'a', 'lantern', 'still', 'lighted', 'and', 'a', 'ladder', 'that', 'had', 'been', 'dragged', 'from', 'its', 'place', 'and', 'some', 'scattered', 'brushes', 'and', 'a', 'palette', 'with', 'green', 'and', 'yellow', 'colors', 'mixed', 'on', 'it', 'and—look', 'out', 'the', 'window', 'dear', 'at', 'the', 'last', 'ivy', 'leaf', 'on', 'the', 'wall']
172	Didn't you wonder why it never fluttered or moved when the wind blew? 	Тебя не удивляло, что он не дрожит и не шевелится от ветра? 	['Тебя', 'не', 'удивляло', 'что', 'он', 'не', 'дрожит', 'и', 'не', 'шевелится', 'от', 'ветра']	"[""Didn't"", 'you', 'wonder', 'why', 'it', 'never', 'fluttered', 'or', 'moved', 'when', 'the', 'wind', 'blew']"
173	"Ah, darling, it's Behrman's masterpiece—he painted it there the night that the last leaf fell."" "	Да, милая, это и есть шедевр Бермана — он написал его в ту ночь, когда слетел последний лист. 	['Да', 'милая', 'это', 'и', 'есть', 'шедевр', 'Бермана', '—', 'он', 'написал', 'его', 'в', 'ту', 'ночь', 'когда', 'слетел', 'последний', 'лист']	"['Ah', 'darling', ""it's"", ""Behrman's"", 'masterpiece—he', 'painted', 'it', 'there', 'the', 'night', 'that', 'the', 'last', 'leaf', 'fell']"
