	en	ru	ru_tokens	en_tokens
0	"In a little district west of Washington Square the streets have run crazy and broken themselves into small strips called ""places."" "	В небольшом квартале к западу от Вашингтон-сквера улицы перепутались и переломались в короткие полоски, именуемые проездами. 	['В', 'небольшом', 'квартале', 'к', 'западу', 'от', 'Вашингтон-сквера', 'улицы', 'перепутались', 'и', 'переломались', 'в', 'короткие', 'полоски', 'именуемые', 'проездами']	['In', 'a', 'little', 'district', 'west', 'of', 'Washington', 'Square', 'the', 'streets', 'have', 'run', 'crazy', 'and', 'broken', 'themselves', 'into', 'small', 'strips', 'called', 'places']
1	"These ""places"" make strange angles and curves. "	Эти проезды образуют странные углы и кривые линии. 	['Эти', 'проезды', 'образуют', 'странные', 'углы', 'и', 'кривые', 'линии']	['These', 'places', 'make', 'strange', 'angles', 'and', 'curves']
2	One street crosses itself a time or two. 	Одна улица там даже пересекает самое себя раза два. 	['Одна', 'улица', 'там', 'даже', 'пересекает', 'самое', 'себя', 'раза', 'два']	['One', 'street', 'crosses', 'itself', 'a', 'time', 'or', 'two']
3	An artist once discovered a valuable possibility in this street. 	Некоему художнику удалось открыть весьма ценное свойство этой улицы. 	['Некоему', 'художнику', 'удалось', 'открыть', 'весьма', 'ценное', 'свойство', 'этой', 'улицы']	['An', 'artist', 'once', 'discovered', 'a', 'valuable', 'possibility', 'in', 'this', 'street']
4	Suppose a collector with a bill for paints, paper and canvas should, in traversing this route, suddenly meet himself coming back, without a cent having been paid on account! 	Предположим, сборщик из магазина со счетом за краски, бумагу и холст повстречает там самого себя, идущего восвояси, не получив ни единого цента по счету! 	['Предположим', 'сборщик', 'из', 'магазина', 'со', 'счетом', 'за', 'краски', 'бумагу', 'и', 'холст', 'повстречает', 'там', 'самого', 'себя', 'идущего', 'восвояси', 'не', 'получив', 'ни', 'единого', 'цента', 'по', 'счету']	['Suppose', 'a', 'collector', 'with', 'a', 'bill', 'for', 'paints', 'paper', 'and', 'canvas', 'should', 'in', 'traversing', 'this', 'route', 'suddenly', 'meet', 'himself', 'coming', 'back', 'without', 'a', 'cent', 'having', 'been', 'paid', 'on', 'account']
5	So, to quaint old Greenwich Village the art people soon came prowling, hunting for north windows and eighteenth-century gables and Dutch attics and low rents. 	И вот люди искусства набрели на своеобразный квартал Гринич-Виллидж в поисках окон, выходящих на север, кровель ХVIII столетия, голландских мансард и дешевой квартирной платы. 	['И', 'вот', 'люди', 'искусства', 'набрели', 'на', 'своеобразный', 'квартал', 'Гринич-Виллидж', 'в', 'поисках', 'окон', 'выходящих', 'на', 'север', 'кровель', 'ХVIII', 'столетия', 'голландских', 'мансард', 'и', 'дешевой', 'квартирной', 'платы']	['So', 'to', 'quaint', 'old', 'Greenwich', 'Village', 'the', 'art', 'people', 'soon', 'came', 'prowling', 'hunting', 'for', 'north', 'windows', 'and', 'eighteenth-century', 'gables', 'and', 'Dutch', 'attics', 'and', 'low', 'rents']
6	"Then they imported some pewter mugs and a chafing dish or two from Sixth avenue, and became a ""colony."" "	Затем они перевезли туда с Шестой авеню несколько оловянных кружек и одну-две жаровни и основали «колонию». 	['Затем', 'они', 'перевезли', 'туда', 'с', 'Шестой', 'авеню', 'несколько', 'оловянных', 'кружек', 'и', 'одну-две', 'жаровни', 'и', 'основали', '«колонию»']	['Then', 'they', 'imported', 'some', 'pewter', 'mugs', 'and', 'a', 'chafing', 'dish', 'or', 'two', 'from', 'Sixth', 'avenue', 'and', 'became', 'a', 'colony']
7	At the top of a squatty, three-story brick Sue and Johnsy had their studio. 	Студия Сью и Джонси помещалась наверху трехэтажного кирпичного дома. 	['Студия', 'Сью', 'и', 'Джонси', 'помещалась', 'наверху', 'трехэтажного', 'кирпичного', 'дома']	['At', 'the', 'top', 'of', 'a', 'squatty', 'three-story', 'brick', 'Sue', 'and', 'Johnsy', 'had', 'their', 'studio']
8	"""Johnsy"" was familiar for Joanna. "	Джонси — уменьшительное от Джоанны. 	['Джонси', '—', 'уменьшительное', 'от', 'Джоанны']	['Johnsy', 'was', 'familiar', 'for', 'Joanna']
9	One was from Maine; the other from California. 	Одна приехала из штата Мэйн, другая из Калифорнии. 	['Одна', 'приехала', 'из', 'штата', 'Мэйн', 'другая', 'из', 'Калифорнии']	['One', 'was', 'from', 'Maine', 'the', 'other', 'from', 'California']
10	They had met at the table d'hote of an Eighth street 	Они познакомились за табльдотом одного ресторанчика на Вольмой улице и нашли, что их взгляды на искусство, цикорный салат и модные рукава вполне совпадают. 	['Они', 'познакомились', 'за', 'табльдотом', 'одного', 'ресторанчика', 'на', 'Вольмой', 'улице', 'и', 'нашли', 'что', 'их', 'взгляды', 'на', 'искусство', 'цикорный', 'салат', 'и', 'модные', 'рукава', 'вполне', 'совпадают']	"['They', 'had', 'met', 'at', 'the', 'table', ""d'hote"", 'of', 'an', 'Eighth', 'street']"
11	"""Delmonico's,"" and found their tastes in art, chicory salad and bishop sleeves so congenial that the joint studio resulted. "	В результате и возникла общая студия. 	['В', 'результате', 'и', 'возникла', 'общая', 'студия']	"[""Delmonico's"", 'and', 'found', 'their', 'tastes', 'in', 'art', 'chicory', 'salad', 'and', 'bishop', 'sleeves', 'so', 'congenial', 'that', 'the', 'joint', 'studio', 'resulted']"
12	That was in May. 	Это было в мае. 	['Это', 'было', 'в', 'мае']	['That', 'was', 'in', 'May']
13	In November a cold, unseen stranger, whom the doctors called Pneumonia, stalked about the colony, touching one here and there with his icy fingers. 	В ноябре неприветливый чужак, которого доктора именуют Пневмонией, незримо разгуливал по колонии, касаясь то одного, то другого своими ледяными пальцами. 	['В', 'ноябре', 'неприветливый', 'чужак', 'которого', 'доктора', 'именуют', 'Пневмонией', 'незримо', 'разгуливал', 'по', 'колонии', 'касаясь', 'то', 'одного', 'то', 'другого', 'своими', 'ледяными', 'пальцами']	['In', 'November', 'a', 'cold', 'unseen', 'stranger', 'whom', 'the', 'doctors', 'called', 'Pneumonia', 'stalked', 'about', 'the', 'colony', 'touching', 'one', 'here', 'and', 'there', 'with', 'his', 'icy', 'fingers']
14	"Over on the east side this ravager strode boldly, smiting his victims by scores, but his feet trod slowly through the maze of the narrow and moss-grown ""places."" "	По Восточной стороне этот душегуб шагал смело, поражая десятки жертв, но здесь, в лабиринте узких, поросших мохом переулков, он плелся нога за нагу. 	['По', 'Восточной', 'стороне', 'этот', 'душегуб', 'шагал', 'смело', 'поражая', 'десятки', 'жертв', 'но', 'здесь', 'в', 'лабиринте', 'узких', 'поросших', 'мохом', 'переулков', 'он', 'плелся', 'нога', 'за', 'нагу']	['Over', 'on', 'the', 'east', 'side', 'this', 'ravager', 'strode', 'boldly', 'smiting', 'his', 'victims', 'by', 'scores', 'but', 'his', 'feet', 'trod', 'slowly', 'through', 'the', 'maze', 'of', 'the', 'narrow', 'and', 'moss-grown', 'places']
15	Mr. Pneumonia was not what you would call a chivalric old gentleman. 	Господина Пневмонию никак нельзя было назвать галантным старым джентльменом. 	['Господина', 'Пневмонию', 'никак', 'нельзя', 'было', 'назвать', 'галантным', 'старым', 'джентльменом']	['Mr', 'Pneumonia', 'was', 'not', 'what', 'you', 'would', 'call', 'a', 'chivalric', 'old', 'gentleman']
16	A mite of a little woman with blood thinned by California zephyrs was hardly fair game for the red-fisted, short-breathed old duffer. 	Миниатюрная девушка, малокровная от калифорнийских зефиров, едва ли могла считаться достойным противником для дюжего старого тупицы с красными кулачищами и одышкой. 	['Миниатюрная', 'девушка', 'малокровная', 'от', 'калифорнийских', 'зефиров', 'едва', 'ли', 'могла', 'считаться', 'достойным', 'противником', 'для', 'дюжего', 'старого', 'тупицы', 'с', 'красными', 'кулачищами', 'и', 'одышкой']	['A', 'mite', 'of', 'a', 'little', 'woman', 'with', 'blood', 'thinned', 'by', 'California', 'zephyrs', 'was', 'hardly', 'fair', 'game', 'for', 'the', 'red-fisted', 'short-breathed', 'old', 'duffer']
17	But Johnsy he smote; and she lay, scarcely moving, on her painted iron bedstead, looking through the small Dutch window-panes at the blank side of the next brick house. 	Однако он свалил ее с ног, и Джонси лежала неподвижно на крашеной железной кровати, глядя сквозь мелкий переплет голландского окна на глухую стену соседнего кирпичного дома. 	['Однако', 'он', 'свалил', 'ее', 'с', 'ног', 'и', 'Джонси', 'лежала', 'неподвижно', 'на', 'крашеной', 'железной', 'кровати', 'глядя', 'сквозь', 'мелкий', 'переплет', 'голландского', 'окна', 'на', 'глухую', 'стену', 'соседнего', 'кирпичного', 'дома']	['But', 'Johnsy', 'he', 'smote', 'and', 'she', 'lay', 'scarcely', 'moving', 'on', 'her', 'painted', 'iron', 'bedstead', 'looking', 'through', 'the', 'small', 'Dutch', 'window-panes', 'at', 'the', 'blank', 'side', 'of', 'the', 'next', 'brick', 'house']
18	One morning the busy doctor invited Sue into the hallway with a shaggy, gray eyebrow. 	Однажды утром озабоченный доктор одним движением косматых седых бровей вызвал Сью в коридор. 	['Однажды', 'утром', 'озабоченный', 'доктор', 'одним', 'движением', 'косматых', 'седых', 'бровей', 'вызвал', 'Сью', 'в', 'коридор']	['One', 'morning', 'the', 'busy', 'doctor', 'invited', 'Sue', 'into', 'the', 'hallway', 'with', 'a', 'shaggy', 'gray', 'eyebrow']
19	"""She has one chance in—let us say, ten,"" he said, as he shook down the mercury in his clinical thermometer. "	— У нее один шанс… ну, скажем, против десяти, — сказал он, стряхивая ртуть в термометре. 	['—', 'У', 'нее', 'один', 'шанс…', 'ну', 'скажем', 'против', 'десяти', '—', 'сказал', 'он', 'стряхивая', 'ртуть', 'в', 'термометре']	['She', 'has', 'one', 'chance', 'in—let', 'us', 'say', 'ten', 'he', 'said', 'as', 'he', 'shook', 'down', 'the', 'mercury', 'in', 'his', 'clinical', 'thermometer']
20	"""And that chance is for her to want to live. "	— И то, если она сама захочет жить. 	['—', 'И', 'то', 'если', 'она', 'сама', 'захочет', 'жить']	['And', 'that', 'chance', 'is', 'for', 'her', 'to', 'want', 'to', 'live']
21	This way people have of lining-up on the side of the undertaker makes the entire pharmacopeia look silly. 	Вся наша фармакопея теряет смысл, когда люди начинают действовать в интересах гробовщика. 	['Вся', 'наша', 'фармакопея', 'теряет', 'смысл', 'когда', 'люди', 'начинают', 'действовать', 'в', 'интересах', 'гробовщика']	['This', 'way', 'people', 'have', 'of', 'lining-up', 'on', 'the', 'side', 'of', 'the', 'undertaker', 'makes', 'the', 'entire', 'pharmacopeia', 'look', 'silly']
22	Your little lady has made up her mind that she's not going to get well. 	Ваша маленькая барышня решила, что ей уже не поправиться. 	['Ваша', 'маленькая', 'барышня', 'решила', 'что', 'ей', 'уже', 'не', 'поправиться']	"['Your', 'little', 'lady', 'has', 'made', 'up', 'her', 'mind', 'that', ""she's"", 'not', 'going', 'to', 'get', 'well']"
23	"Has she anything on her mind?"" "	О чем она думает? 	['О', 'чем', 'она', 'думает']	['Has', 'she', 'anything', 'on', 'her', 'mind']
24	"""She—she wanted to paint the Bay of Naples some day,"" said Sue. "	— Ей… ей хотелось написать красками Неаполитанский залив. 	['—', 'Ей…', 'ей', 'хотелось', 'написать', 'красками', 'Неаполитанский', 'залив']	['She—she', 'wanted', 'to', 'paint', 'the', 'Bay', 'of', 'Naples', 'some', 'day', 'said', 'Sue']
25	"""Paint?—bosh! "	— Красками? Чепуха! 	['—', 'Красками', 'Чепуха']	['Paint?—bosh']
26	"Has she anything on her mind worth thinking about twice—a man, for instance?"" "	Нет ли у нее на душе чего-нибудь такого, о чем действительно стоило бы думать, например, мужчины? 	['Нет', 'ли', 'у', 'нее', 'на', 'душе', 'чего-нибудь', 'такого', 'о', 'чем', 'действительно', 'стоило', 'бы', 'думать', 'например', 'мужчины']	['Has', 'she', 'anything', 'on', 'her', 'mind', 'worth', 'thinking', 'about', 'twice—a', 'man', 'for', 'instance']
27	"""A man?"" said Sue, with a jew's-harp twang in her voice. "	— Мужчины? — переспросила Сью, и ее голос зазвучал резко, как губная гармоника. 	['—', 'Мужчины', '—', 'переспросила', 'Сью', 'и', 'ее', 'голос', 'зазвучал', 'резко', 'как', 'губная', 'гармоника']	"['A', 'man', 'said', 'Sue', 'with', 'a', ""jew's-harp"", 'twang', 'in', 'her', 'voice']"
28	"""Is a man worth—but, no, doctor; there is nothing of the kind."" "	— Неужели мужчина стоит… Да нет, доктор, ничего подобного нет. 	['—', 'Неужели', 'мужчина', 'стоит…', 'Да', 'нет', 'доктор', 'ничего', 'подобного', 'нет']	['Is', 'a', 'man', 'worth—but', 'no', 'doctor', 'there', 'is', 'nothing', 'of', 'the', 'kind']
29	"""Well, it is the weakness, then,"" said the doctor. "	— Ну, тогда она просто ослабла, — решил доктор. 	['—', 'Ну', 'тогда', 'она', 'просто', 'ослабла', '—', 'решил', 'доктор']	['Well', 'it', 'is', 'the', 'weakness', 'then', 'said', 'the', 'doctor']
30	"""I will do all that science, so far as it may filter through my efforts, can accomplish. "	— Я сделаю все, что буду в силах сделать как представитель науки. 	['—', 'Я', 'сделаю', 'все', 'что', 'буду', 'в', 'силах', 'сделать', 'как', 'представитель', 'науки']	['I', 'will', 'do', 'all', 'that', 'science', 'so', 'far', 'as', 'it', 'may', 'filter', 'through', 'my', 'efforts', 'can', 'accomplish']
31	But whenever my patient begins to count the carriages in her funeral procession I subtract 50 per cent. from the curative power of medicines. 	Но когда мой пациент начинает считать кареты в своей похоронной процессии, я скидываю пятьдесят процентов с целебной силы лекарств. 	['Но', 'когда', 'мой', 'пациент', 'начинает', 'считать', 'кареты', 'в', 'своей', 'похоронной', 'процессии', 'я', 'скидываю', 'пятьдесят', 'процентов', 'с', 'целебной', 'силы', 'лекарств']	['But', 'whenever', 'my', 'patient', 'begins', 'to', 'count', 'the', 'carriages', 'in', 'her', 'funeral', 'procession', 'I', 'subtract', '50', 'per', 'cent', 'from', 'the', 'curative', 'power', 'of', 'medicines']
32	"If you will get her to ask one question about the new winter styles in cloak sleeves I will promise you a one-in-five chance for her, instead of one in ten."" "	Если вы сумеете добиться, чтобы она хоть раз спросила, какого фасона рукава будут носить этой зимой, я вам ручаюсь, что у нее будет один шанс из пяти, вместо одного из десяти. 	['Если', 'вы', 'сумеете', 'добиться', 'чтобы', 'она', 'хоть', 'раз', 'спросила', 'какого', 'фасона', 'рукава', 'будут', 'носить', 'этой', 'зимой', 'я', 'вам', 'ручаюсь', 'что', 'у', 'нее', 'будет', 'один', 'шанс', 'из', 'пяти', 'вместо', 'одного', 'из', 'десяти']	['If', 'you', 'will', 'get', 'her', 'to', 'ask', 'one', 'question', 'about', 'the', 'new', 'winter', 'styles', 'in', 'cloak', 'sleeves', 'I', 'will', 'promise', 'you', 'a', 'one-in-five', 'chance', 'for', 'her', 'instead', 'of', 'one', 'in', 'ten']
33	After the doctor had gone Sue went into the workroom and cried a Japanese napkin to a pulp. 	После того как доктор ушел, Сью выбежала в мастерскую и плакала в японскую бумажную салфеточку до тех пор, пока та не размокла окончательно. 	['После', 'того', 'как', 'доктор', 'ушел', 'Сью', 'выбежала', 'в', 'мастерскую', 'и', 'плакала', 'в', 'японскую', 'бумажную', 'салфеточку', 'до', 'тех', 'пор', 'пока', 'та', 'не', 'размокла', 'окончательно']	['After', 'the', 'doctor', 'had', 'gone', 'Sue', 'went', 'into', 'the', 'workroom', 'and', 'cried', 'a', 'Japanese', 'napkin', 'to', 'a', 'pulp']
34	Then she swaggered into Johnsy's room with her drawing board, whistling ragtime. 	Потом она храбро вошла в комнату Джонси с чертежной доской, насвистывая рэгтайм. 	['Потом', 'она', 'храбро', 'вошла', 'в', 'комнату', 'Джонси', 'с', 'чертежной', 'доской', 'насвистывая', 'рэгтайм']	"['Then', 'she', 'swaggered', 'into', ""Johnsy's"", 'room', 'with', 'her', 'drawing', 'board', 'whistling', 'ragtime']"
35	Johnsy lay, scarcely making a ripple under the bedclothes, with her face toward the window. 	Джонси лежала, повернувшись лицом к окну, едва заметная под одеялами. 	['Джонси', 'лежала', 'повернувшись', 'лицом', 'к', 'окну', 'едва', 'заметная', 'под', 'одеялами']	['Johnsy', 'lay', 'scarcely', 'making', 'a', 'ripple', 'under', 'the', 'bedclothes', 'with', 'her', 'face', 'toward', 'the', 'window']
36	Sue stopped whistling, thinking she was asleep. 	Сью перестала насвистывать, думая, что Джонси уснула. 	['Сью', 'перестала', 'насвистывать', 'думая', 'что', 'Джонси', 'уснула']	['Sue', 'stopped', 'whistling', 'thinking', 'she', 'was', 'asleep']
37	She arranged her board and began a pen-and-ink drawing to illustrate a magazine story. 	Она пристроила доску и начала рисунок тушью к журнальному рассказу. 	['Она', 'пристроила', 'доску', 'и', 'начала', 'рисунок', 'тушью', 'к', 'журнальному', 'рассказу']	['She', 'arranged', 'her', 'board', 'and', 'began', 'a', 'pen-and-ink', 'drawing', 'to', 'illustrate', 'a', 'magazine', 'story']
38	Young artists must pave their way to Art by drawing pictures for magazine stories that young authors write to pave their way to Literature. 	Для молодых художников путь в Искусство бывает вымощен иллюстрациями к журнальным рассказам, которыми молодые авторы мостят себе путь в Литературу. 	['Для', 'молодых', 'художников', 'путь', 'в', 'Искусство', 'бывает', 'вымощен', 'иллюстрациями', 'к', 'журнальным', 'рассказам', 'которыми', 'молодые', 'авторы', 'мостят', 'себе', 'путь', 'в', 'Литературу']	['Young', 'artists', 'must', 'pave', 'their', 'way', 'to', 'Art', 'by', 'drawing', 'pictures', 'for', 'magazine', 'stories', 'that', 'young', 'authors', 'write', 'to', 'pave', 'their', 'way', 'to', 'Literature']
39	As Sue was sketching a pair of elegant horseshow riding trousers and a monocle on the figure of the hero, an Idaho cowboy, she heard a low sound, several times repeated. 	Набрасывая для рассказа фигуру ковбоя из Айдахо в элегантных бриджах и с моноклем в глазу, Сью услышала тихий шепот, повторившийся несколько раз. 	['Набрасывая', 'для', 'рассказа', 'фигуру', 'ковбоя', 'из', 'Айдахо', 'в', 'элегантных', 'бриджах', 'и', 'с', 'моноклем', 'в', 'глазу', 'Сью', 'услышала', 'тихий', 'шепот', 'повторившийся', 'несколько', 'раз']	['As', 'Sue', 'was', 'sketching', 'a', 'pair', 'of', 'elegant', 'horseshow', 'riding', 'trousers', 'and', 'a', 'monocle', 'on', 'the', 'figure', 'of', 'the', 'hero', 'an', 'Idaho', 'cowboy', 'she', 'heard', 'a', 'low', 'sound', 'several', 'times', 'repeated']
40	She went quickly to the bedside. 	Она торопливо подошла к кровати. 	['Она', 'торопливо', 'подошла', 'к', 'кровати']	['She', 'went', 'quickly', 'to', 'the', 'bedside']
41	Johnsy's eyes were open wide. 	Глаза Джонси были широко открыты. 	['Глаза', 'Джонси', 'были', 'широко', 'открыты']	"[""Johnsy's"", 'eyes', 'were', 'open', 'wide']"
42	She was looking out the window and counting—counting backward. 	Она смотрела в окно и считала — считала в обратном порядке. 	['Она', 'смотрела', 'в', 'окно', 'и', 'считала', '—', 'считала', 'в', 'обратном', 'порядке']	['She', 'was', 'looking', 'out', 'the', 'window', 'and', 'counting—counting', 'backward']
