	en	ru	ru_tokens	en_tokens
43	"""Twelve,"" she said, and a little later ""eleven;"" and then ""ten,"" and ""nine;"" and then ""eight"" and ""seven,"" almost together. "	— Двенадцать, — произнесла она, и немного погодя: — одиннадцать, — а потом: — «десять» и «девять», а потом: — «восемь» и «семь» — почти одновременно. 	['—', 'Двенадцать', '—', 'произнесла', 'она', 'и', 'немного', 'погодя', '—', 'одиннадцать', '—', 'а', 'потом', '—', '«десять»', 'и', '«девять»', 'а', 'потом', '—', '«восемь»', 'и', '«семь»', '—', 'почти', 'одновременно']	['Twelve', 'she', 'said', 'and', 'a', 'little', 'later', 'eleven', 'and', 'then', 'ten', 'and', 'nine', 'and', 'then', 'eight', 'and', 'seven', 'almost', 'together']
44	Sue looked solicitously out the window. 	Сью посмотрела в окно. 	['Сью', 'посмотрела', 'в', 'окно']	['Sue', 'looked', 'solicitously', 'out', 'the', 'window']
45	What was there to count? 	Что там было считать? 	['Что', 'там', 'было', 'считать']	['What', 'was', 'there', 'to', 'count']
46	There was only a bare, dreary yard to be seen, and the blank side of the brick house twenty feet away. 	Был виден только пустой, унылый двор и глухая стена кирпичного дома в двадцати шагах. 	['Был', 'виден', 'только', 'пустой', 'унылый', 'двор', 'и', 'глухая', 'стена', 'кирпичного', 'дома', 'в', 'двадцати', 'шагах']	['There', 'was', 'only', 'a', 'bare', 'dreary', 'yard', 'to', 'be', 'seen', 'and', 'the', 'blank', 'side', 'of', 'the', 'brick', 'house', 'twenty', 'feet', 'away']
47	An old, old ivy vine, gnarled and decayed at the roots, climbed half way up the brick wall. 	Старый-старый плющ с узловатым, подгнившим у корней стволом заплел до половины кирпичную стену. 	['Старый-старый', 'плющ', 'с', 'узловатым', 'подгнившим', 'у', 'корней', 'стволом', 'заплел', 'до', 'половины', 'кирпичную', 'стену']	['An', 'old', 'old', 'ivy', 'vine', 'gnarled', 'and', 'decayed', 'at', 'the', 'roots', 'climbed', 'half', 'way', 'up', 'the', 'brick', 'wall']
48	The cold breath of autumn had stricken its leaves from the vine until its skeleton branches clung, almost bare, to the crumbling bricks. 	Холодное дыхание осени сорвало листья с лозы, и оголенные скелеты ветвей цеплялись за осыпающиеся кирпичи. 	['Холодное', 'дыхание', 'осени', 'сорвало', 'листья', 'с', 'лозы', 'и', 'оголенные', 'скелеты', 'ветвей', 'цеплялись', 'за', 'осыпающиеся', 'кирпичи']	['The', 'cold', 'breath', 'of', 'autumn', 'had', 'stricken', 'its', 'leaves', 'from', 'the', 'vine', 'until', 'its', 'skeleton', 'branches', 'clung', 'almost', 'bare', 'to', 'the', 'crumbling', 'bricks']
49	"""What is it, dear?"" asked Sue. "	— Что там такое, милая? — спросила Сью. 	['—', 'Что', 'там', 'такое', 'милая', '—', 'спросила', 'Сью']	['What', 'is', 'it', 'dear', 'asked', 'Sue']
50	"""Six,"" said Johnsy, in almost a whisper. "	— Шесть, — едва слышно ответила Джонси. 	['—', 'Шесть', '—', 'едва', 'слышно', 'ответила', 'Джонси']	['Six', 'said', 'Johnsy', 'in', 'almost', 'a', 'whisper']
51	"""They're falling faster now. "	— Теперь они облетают гораздо быстрее. 	['—', 'Теперь', 'они', 'облетают', 'гораздо', 'быстрее']	"[""They're"", 'falling', 'faster', 'now']"
52	Three days ago there were almost a hundred. 	Три дня назад их было почти сто. 	['Три', 'дня', 'назад', 'их', 'было', 'почти', 'сто']	['Three', 'days', 'ago', 'there', 'were', 'almost', 'a', 'hundred']
53	It made my head ache to count them. 	Голова кружилась считать. 	['Голова', 'кружилась', 'считать']	['It', 'made', 'my', 'head', 'ache', 'to', 'count', 'them']
54	But now it's easy. 	А теперь это легко. 	['А', 'теперь', 'это', 'легко']	"['But', 'now', ""it's"", 'easy']"
55	There goes another one. 	Вот и еще один полетел. 	['Вот', 'и', 'еще', 'один', 'полетел']	['There', 'goes', 'another', 'one']
56	"There are only five left now."" "	Теперь осталось только пять. 	['Теперь', 'осталось', 'только', 'пять']	['There', 'are', 'only', 'five', 'left', 'now']
57	"""Five what, dear. "	— Чего пять, милая? 	['—', 'Чего', 'пять', 'милая']	['Five', 'what', 'dear']
58	"Tell your Sudie."" "	Скажи своей Сьюди. 	['Скажи', 'своей', 'Сьюди']	['Tell', 'your', 'Sudie']
59	"""Leaves. "	— Листьев. 	['—', 'Листьев']	['Leaves']
60	On the ivy vine. 	На плюще. 	['На', 'плюще']	['On', 'the', 'ivy', 'vine']
61	When the last one falls I must go, too. 	Когда упадет последний лист, я умру. 	['Когда', 'упадет', 'последний', 'лист', 'я', 'умру']	['When', 'the', 'last', 'one', 'falls', 'I', 'must', 'go', 'too']
62	I've known that for three days. 	Я это знаю уже три дня. 	['Я', 'это', 'знаю', 'уже', 'три', 'дня']	"[""I've"", 'known', 'that', 'for', 'three', 'days']"
63	"Didn't the doctor tell you?"" "	Разве доктор не сказал тебе? 	['Разве', 'доктор', 'не', 'сказал', 'тебе']	"[""Didn't"", 'the', 'doctor', 'tell', 'you']"
64	"""Oh, I never heard of such nonsense,"" complained Sue, with magnificent scorn. "	— Первый раз слышу такую глупость! — с великолепным презрением отпарировала Сью. 	['—', 'Первый', 'раз', 'слышу', 'такую', 'глупость', '—', 'с', 'великолепным', 'презрением', 'отпарировала', 'Сью']	['Oh', 'I', 'never', 'heard', 'of', 'such', 'nonsense', 'complained', 'Sue', 'with', 'magnificent', 'scorn']
65	"""What have old ivy leaves to do with your getting well? "	— Какое отношение могут иметь листья на старом плюще к тому, что ты поправишься? 	['—', 'Какое', 'отношение', 'могут', 'иметь', 'листья', 'на', 'старом', 'плюще', 'к', 'тому', 'что', 'ты', 'поправишься']	['What', 'have', 'old', 'ivy', 'leaves', 'to', 'do', 'with', 'your', 'getting', 'well']
66	And you used to love that vine so, you naughty girl. 	А ты еще так любила этот плющ, гадкая девочка! 	['А', 'ты', 'еще', 'так', 'любила', 'этот', 'плющ', 'гадкая', 'девочка']	['And', 'you', 'used', 'to', 'love', 'that', 'vine', 'so', 'you', 'naughty', 'girl']
67	Don't be a goosey. 	Не будь глупышкой. 	['Не', 'будь', 'глупышкой']	"[""Don't"", 'be', 'a', 'goosey']"
68	Why, the doctor told me this morning that your chances for getting well real soon were—let's see exactly what he said—he said the chances were ten to one! 	Да ведь еще сегодня доктор говорил мне, что ты скоро выздоровеешь… позволь, как же это он сказал?.. что у тебя десять шансов против одного. 	['Да', 'ведь', 'еще', 'сегодня', 'доктор', 'говорил', 'мне', 'что', 'ты', 'скоро', 'выздоровеешь…', 'позволь', 'как', 'же', 'это', 'он', 'сказал', 'что', 'у', 'тебя', 'десять', 'шансов', 'против', 'одного']	"['Why', 'the', 'doctor', 'told', 'me', 'this', 'morning', 'that', 'your', 'chances', 'for', 'getting', 'well', 'real', 'soon', ""were—let's"", 'see', 'exactly', 'what', 'he', 'said—he', 'said', 'the', 'chances', 'were', 'ten', 'to', 'one']"
69	Why, that's almost as good a chance as we have in New York when we ride on the street cars or walk past a new building. 	А ведь это не меньше, чем у каждого из нас здесь в Нью-Йорке, когда едешь в трамвае или идешь мимо нового дома. 	['А', 'ведь', 'это', 'не', 'меньше', 'чем', 'у', 'каждого', 'из', 'нас', 'здесь', 'в', 'Нью-Йорке', 'когда', 'едешь', 'в', 'трамвае', 'или', 'идешь', 'мимо', 'нового', 'дома']	"['Why', ""that's"", 'almost', 'as', 'good', 'a', 'chance', 'as', 'we', 'have', 'in', 'New', 'York', 'when', 'we', 'ride', 'on', 'the', 'street', 'cars', 'or', 'walk', 'past', 'a', 'new', 'building']"
70	"Try to take some broth now, and let Sudie go back to her drawing, so she can sell the editor man with it, and buy port wine for her sick child, and pork chops for her greedy self."" "	Попробуй съесть немножко бульона и дай твоей Сьюди закончить рисунок, чтобы она могла сбыть его редактору и купить вина для своей больной девочки и свиных котлет для себя. 	['Попробуй', 'съесть', 'немножко', 'бульона', 'и', 'дай', 'твоей', 'Сьюди', 'закончить', 'рисунок', 'чтобы', 'она', 'могла', 'сбыть', 'его', 'редактору', 'и', 'купить', 'вина', 'для', 'своей', 'больной', 'девочки', 'и', 'свиных', 'котлет', 'для', 'себя']	['Try', 'to', 'take', 'some', 'broth', 'now', 'and', 'let', 'Sudie', 'go', 'back', 'to', 'her', 'drawing', 'so', 'she', 'can', 'sell', 'the', 'editor', 'man', 'with', 'it', 'and', 'buy', 'port', 'wine', 'for', 'her', 'sick', 'child', 'and', 'pork', 'chops', 'for', 'her', 'greedy', 'self']
71	"""You needn't get any more wine,"" said Johnsy, keeping her eyes fixed out the window. "	— Вина тебе покупать больше не надо, — отвечала Джонси, пристально глядя в окно. 	['—', 'Вина', 'тебе', 'покупать', 'больше', 'не', 'надо', '—', 'отвечала', 'Джонси', 'пристально', 'глядя', 'в', 'окно']	"['You', ""needn't"", 'get', 'any', 'more', 'wine', 'said', 'Johnsy', 'keeping', 'her', 'eyes', 'fixed', 'out', 'the', 'window']"
72	"""There goes another. "	— Вот и еще один полетел. 	['—', 'Вот', 'и', 'еще', 'один', 'полетел']	['There', 'goes', 'another']
73	No, I don't want any broth. 	Нет, бульона я не хочу. 	['Нет', 'бульона', 'я', 'не', 'хочу']	"['No', 'I', ""don't"", 'want', 'any', 'broth']"
74	That leaves just four. 	Значит, остается всего четыре. 	['Значит', 'остается', 'всего', 'четыре']	['That', 'leaves', 'just', 'four']
75	I want to see the last one fall before it gets dark. 	Я хочу видеть, как упадет последний лист. 	['Я', 'хочу', 'видеть', 'как', 'упадет', 'последний', 'лист']	['I', 'want', 'to', 'see', 'the', 'last', 'one', 'fall', 'before', 'it', 'gets', 'dark']
76	"Then I'll go, too."" "	Тогда умру и я. 	['Тогда', 'умру', 'и', 'я']	"['Then', ""I'll"", 'go', 'too']"
77	"""Johnsy, dear,"" said Sue, bending over her, ""will you promise me to keep your eyes closed, and not look out the window until I am done working? "	— Джонси, милая, — сказала Сью, наклоняясь над ней, — обещаешь ты мне не открывать глаз и не глядеть в окно, пока я не кончу работать? 	['—', 'Джонси', 'милая', '—', 'сказала', 'Сью', 'наклоняясь', 'над', 'ней', '—', 'обещаешь', 'ты', 'мне', 'не', 'открывать', 'глаз', 'и', 'не', 'глядеть', 'в', 'окно', 'пока', 'я', 'не', 'кончу', 'работать']	['Johnsy', 'dear', 'said', 'Sue', 'bending', 'over', 'her', 'will', 'you', 'promise', 'me', 'to', 'keep', 'your', 'eyes', 'closed', 'and', 'not', 'look', 'out', 'the', 'window', 'until', 'I', 'am', 'done', 'working']
78	I must hand those drawings in by to-morrow. 	Я должна сдать иллюстрацию завтра. 	['Я', 'должна', 'сдать', 'иллюстрацию', 'завтра']	['I', 'must', 'hand', 'those', 'drawings', 'in', 'by', 'to-morrow']
79	"I need the light, or I would draw the shade down."" "	Мне нужен свет, а то я спустила бы штору. 	['Мне', 'нужен', 'свет', 'а', 'то', 'я', 'спустила', 'бы', 'штору']	['I', 'need', 'the', 'light', 'or', 'I', 'would', 'draw', 'the', 'shade', 'down']
80	"""Couldn't you draw in the other room?"" asked Johnsy, coldly. "	— Разве ты не можешь рисовать в другой комнате? — холодно спросила Джонси. 	['—', 'Разве', 'ты', 'не', 'можешь', 'рисовать', 'в', 'другой', 'комнате', '—', 'холодно', 'спросила', 'Джонси']	"[""Couldn't"", 'you', 'draw', 'in', 'the', 'other', 'room', 'asked', 'Johnsy', 'coldly']"
81	"""I'd rather be here by you,"" said Sue. "	— Мне бы хотелось посидеть с тобой, — сказала Сью. 	['—', 'Мне', 'бы', 'хотелось', 'посидеть', 'с', 'тобой', '—', 'сказала', 'Сью']	"[""I'd"", 'rather', 'be', 'here', 'by', 'you', 'said', 'Sue']"
82	"""Besides I don't want you to keep looking at those silly ivy leaves."" "	— А кроме того, я не желаю, чтобы ты глядела на эти дурацкие листья. 	['—', 'А', 'кроме', 'того', 'я', 'не', 'желаю', 'чтобы', 'ты', 'глядела', 'на', 'эти', 'дурацкие', 'листья']	"['Besides', 'I', ""don't"", 'want', 'you', 'to', 'keep', 'looking', 'at', 'those', 'silly', 'ivy', 'leaves']"
83	"""Tell me as soon as you have finished,"" said Johnsy, closing her eyes, and lying white and still as a fallen statue, ""because I want to see the last one fall. "	— Скажи мне, когда кончишь, — закрывая глаза, произнесла Джонси, бледная и неподвижная, как поверженная статуя, — потому что мне хочется видеть, как упадет последний лист. 	['—', 'Скажи', 'мне', 'когда', 'кончишь', '—', 'закрывая', 'глаза', 'произнесла', 'Джонси', 'бледная', 'и', 'неподвижная', 'как', 'поверженная', 'статуя', '—', 'потому', 'что', 'мне', 'хочется', 'видеть', 'как', 'упадет', 'последний', 'лист']	['Tell', 'me', 'as', 'soon', 'as', 'you', 'have', 'finished', 'said', 'Johnsy', 'closing', 'her', 'eyes', 'and', 'lying', 'white', 'and', 'still', 'as', 'a', 'fallen', 'statue', 'because', 'I', 'want', 'to', 'see', 'the', 'last', 'one', 'fall']
84	I'm tired of waiting. 	Я устала ждать. 	['Я', 'устала', 'ждать']	"[""I'm"", 'tired', 'of', 'waiting']"
85	I'm tired of thinking. 	Я устала думать. 	['Я', 'устала', 'думать']	"[""I'm"", 'tired', 'of', 'thinking']"
86	"I went to turn loose my hold on everything, and go sailing down, down, just like one of those poor, tired leaves."" "	Мне хочется освободиться от всего, что меня держит, — лететь, лететь все ниже и ниже, как один из этих бедных, усталых листьев. 	['Мне', 'хочется', 'освободиться', 'от', 'всего', 'что', 'меня', 'держит', '—', 'лететь', 'лететь', 'все', 'ниже', 'и', 'ниже', 'как', 'один', 'из', 'этих', 'бедных', 'усталых', 'листьев']	['I', 'went', 'to', 'turn', 'loose', 'my', 'hold', 'on', 'everything', 'and', 'go', 'sailing', 'down', 'down', 'just', 'like', 'one', 'of', 'those', 'poor', 'tired', 'leaves']
87	"""Try to sleep,"" said Sue. "	— Постарайся уснуть, — сказала Сью. 	['—', 'Постарайся', 'уснуть', '—', 'сказала', 'Сью']	['Try', 'to', 'sleep', 'said', 'Sue']
88	"""I must call Behrman up to be my model for the old hermit miner. "	— Мне надо позвать Бермана, я хочу писать с него золотоискателя-отшельника. 	['—', 'Мне', 'надо', 'позвать', 'Бермана', 'я', 'хочу', 'писать', 'с', 'него', 'золотоискателя-отшельника']	['I', 'must', 'call', 'Behrman', 'up', 'to', 'be', 'my', 'model', 'for', 'the', 'old', 'hermit', 'miner']
89	I'll not be gone a minute. 	Я самое большее на минутку. 	['Я', 'самое', 'большее', 'на', 'минутку']	"[""I'll"", 'not', 'be', 'gone', 'a', 'minute']"
90	"Don't try to move 'till I come back."" "	Смотри же, не шевелись, пока я не приду. 	['Смотри', 'же', 'не', 'шевелись', 'пока', 'я', 'не', 'приду']	"[""Don't"", 'try', 'to', 'move', ""'till"", 'I', 'come', 'back']"
91	Old Behrman was a painter who lived on the ground floor beneath them. 	Старик Берман был художник, который жил в нижнем этаже под их студией. 	['Старик', 'Берман', 'был', 'художник', 'который', 'жил', 'в', 'нижнем', 'этаже', 'под', 'их', 'студией']	['Old', 'Behrman', 'was', 'a', 'painter', 'who', 'lived', 'on', 'the', 'ground', 'floor', 'beneath', 'them']
92	He was past sixty and had a Michael Angelo's Moses beard curling down from the head of a satyr along the body of an imp. 	Ему было уже за шестьдесят, и борода, вся в завитках, как у Моисея Микеланджело, спускалась у него с головы сатира на тело гнома. 	['Ему', 'было', 'уже', 'за', 'шестьдесят', 'и', 'борода', 'вся', 'в', 'завитках', 'как', 'у', 'Моисея', 'Микеланджело', 'спускалась', 'у', 'него', 'с', 'головы', 'сатира', 'на', 'тело', 'гнома']	"['He', 'was', 'past', 'sixty', 'and', 'had', 'a', 'Michael', ""Angelo's"", 'Moses', 'beard', 'curling', 'down', 'from', 'the', 'head', 'of', 'a', 'satyr', 'along', 'the', 'body', 'of', 'an', 'imp']"
93	Behrman was a failure in art. Forty years he had wielded the brush without getting near enough to touch the hem of his Mistress's robe. 	В искусстве Берман был неудачником. 	['В', 'искусстве', 'Берман', 'был', 'неудачником']	"['Behrman', 'was', 'a', 'failure', 'in', 'art', 'Forty', 'years', 'he', 'had', 'wielded', 'the', 'brush', 'without', 'getting', 'near', 'enough', 'to', 'touch', 'the', 'hem', 'of', 'his', ""Mistress's"", 'robe']"
94	He had been always about to paint a masterpiece, but had never yet begun it. 	Он все собирался написать шедевр, но даже и не начал его. 	['Он', 'все', 'собирался', 'написать', 'шедевр', 'но', 'даже', 'и', 'не', 'начал', 'его']	['He', 'had', 'been', 'always', 'about', 'to', 'paint', 'a', 'masterpiece', 'but', 'had', 'never', 'yet', 'begun', 'it']
95	For several years he had painted nothing except now and then a daub in the line of commerce or advertising. 	Уже несколько лет он не писал ничего, кроме вывесок, реклам и тому подобной мазни ради куска хлеба. 	['Уже', 'несколько', 'лет', 'он', 'не', 'писал', 'ничего', 'кроме', 'вывесок', 'реклам', 'и', 'тому', 'подобной', 'мазни', 'ради', 'куска', 'хлеба']	['For', 'several', 'years', 'he', 'had', 'painted', 'nothing', 'except', 'now', 'and', 'then', 'a', 'daub', 'in', 'the', 'line', 'of', 'commerce', 'or', 'advertising']
96	He earned a little by serving as a model to those young artists in the colony who could not pay the price of a professional. 	Он зарабатывал кое-что, позируя молодым художникам, которым профессионалы-натурщики оказывались не по карману. 	['Он', 'зарабатывал', 'кое-что', 'позируя', 'молодым', 'художникам', 'которым', 'профессионалы-натурщики', 'оказывались', 'не', 'по', 'карману']	['He', 'earned', 'a', 'little', 'by', 'serving', 'as', 'a', 'model', 'to', 'those', 'young', 'artists', 'in', 'the', 'colony', 'who', 'could', 'not', 'pay', 'the', 'price', 'of', 'a', 'professional']
97	He drank gin to excess, and still talked of his coming masterpiece. 	Он пил запоем, но все еще говорил о своем будущем шедевре. 	['Он', 'пил', 'запоем', 'но', 'все', 'еще', 'говорил', 'о', 'своем', 'будущем', 'шедевре']	['He', 'drank', 'gin', 'to', 'excess', 'and', 'still', 'talked', 'of', 'his', 'coming', 'masterpiece']
98	For the rest he was a fierce little old man, who scoffed terribly at softness in any one, and who regarded himself as especial mastiff-in-waiting to protect the two young artists in the studio above. 	А в остальном это был злющий старикашка, который издевался над всякой сентиментальностью и смотрел на себя, как на сторожевого пса, специально приставленного для охраны двух молодых художниц. 	['А', 'в', 'остальном', 'это', 'был', 'злющий', 'старикашка', 'который', 'издевался', 'над', 'всякой', 'сентиментальностью', 'и', 'смотрел', 'на', 'себя', 'как', 'на', 'сторожевого', 'пса', 'специально', 'приставленного', 'для', 'охраны', 'двух', 'молодых', 'художниц']	['For', 'the', 'rest', 'he', 'was', 'a', 'fierce', 'little', 'old', 'man', 'who', 'scoffed', 'terribly', 'at', 'softness', 'in', 'any', 'one', 'and', 'who', 'regarded', 'himself', 'as', 'especial', 'mastiff-in-waiting', 'to', 'protect', 'the', 'two', 'young', 'artists', 'in', 'the', 'studio', 'above']
99	Sue found Behrman smelling strongly of juniper berries in his dimly lighted den below. 	Сью застала Бермана, сильно пахнущего можжевеловыми ягодами, в его полутемной каморке нижнего этажа. 	['Сью', 'застала', 'Бермана', 'сильно', 'пахнущего', 'можжевеловыми', 'ягодами', 'в', 'его', 'полутемной', 'каморке', 'нижнего', 'этажа']	['Sue', 'found', 'Behrman', 'smelling', 'strongly', 'of', 'juniper', 'berries', 'in', 'his', 'dimly', 'lighted', 'den', 'below']
100	In one corner was a blank canvas on an easel that had been waiting there for twenty-five years to receive the first line of the masterpiece. 	В одном углу двадцать пять лет стояло на мольберте нетронутое полотно, готовое принять первые штрихи шедевра. 	['В', 'одном', 'углу', 'двадцать', 'пять', 'лет', 'стояло', 'на', 'мольберте', 'нетронутое', 'полотно', 'готовое', 'принять', 'первые', 'штрихи', 'шедевра']	['In', 'one', 'corner', 'was', 'a', 'blank', 'canvas', 'on', 'an', 'easel', 'that', 'had', 'been', 'waiting', 'there', 'for', 'twenty-five', 'years', 'to', 'receive', 'the', 'first', 'line', 'of', 'the', 'masterpiece']
