	en	ru	ru_tokens	en_tokens
396	“The best possible.” 	— Есть, и самые веские. 	['—', 'Есть', 'и', 'самые', 'веские']	['“The', 'best', 'possible.”']
397	Lord St. Simon sank into a chair and passed his hand over his forehead. 	Лорд Сент-Саймон опустился в кресло и провел рукой по лбу. 	['Лорд', 'Сент-Саймон', 'опустился', 'в', 'кресло', 'и', 'провел', 'рукой', 'по', 'лбу']	['Lord', 'St', 'Simon', 'sank', 'into', 'a', 'chair', 'and', 'passed', 'his', 'hand', 'over', 'his', 'forehead']
398	“What will the Duke say,” he murmured, “when he hears that one of the family has been subjected to such humiliation?” 	— Что скажет герцог! — прошептал он. — Что он скажет, когда услышит об унижении, которому подвергся один из членов его семьи! 	['—', 'Что', 'скажет', 'герцог', '—', 'прошептал', 'он', '—', 'Что', 'он', 'скажет', 'когда', 'услышит', 'об', 'унижении', 'которому', 'подвергся', 'один', 'из', 'членов', 'его', 'семьи']	['“What', 'will', 'the', 'Duke', 'say,”', 'he', 'murmured', '“when', 'he', 'hears', 'that', 'one', 'of', 'the', 'family', 'has', 'been', 'subjected', 'to', 'such', 'humiliation?”']
399	“It is the purest accident. 	— Но ведь тут чистейшая случайность. 	['—', 'Но', 'ведь', 'тут', 'чистейшая', 'случайность']	['“It', 'is', 'the', 'purest', 'accident']
400	I cannot allow that there is any humiliation.” 	Я никак не могу согласиться, что в этом есть что-нибудь унизительное. 	['Я', 'никак', 'не', 'могу', 'согласиться', 'что', 'в', 'этом', 'есть', 'что-нибудь', 'унизительное']	['I', 'cannot', 'allow', 'that', 'there', 'is', 'any', 'humiliation.”']
401	“Ah, you look on these things from another standpoint.” 	— Ах, вы смотрите на такие вещи с другой точки зрения! 	['—', 'Ах', 'вы', 'смотрите', 'на', 'такие', 'вещи', 'с', 'другой', 'точки', 'зрения']	['“Ah', 'you', 'look', 'on', 'these', 'things', 'from', 'another', 'standpoint.”']
402	“I fail to see that anyone is to blame. 	— Я решительно не вижу здесь ничьей вины. 	['—', 'Я', 'решительно', 'не', 'вижу', 'здесь', 'ничьей', 'вины']	['“I', 'fail', 'to', 'see', 'that', 'anyone', 'is', 'to', 'blame']
403	I can hardly see how the lady could have acted otherwise, though her abrupt method of doing it was undoubtedly to be regretted. Having no mother, she had no one to advise her at such a crisis.” 	Мне кажется, эта леди просто не могла поступить иначе. Конечно. она действовала чересчур стремительно, но ведь у нее нет матери — ей не с кем было посоветоваться в критическую минуту. 	['Мне', 'кажется', 'эта', 'леди', 'просто', 'не', 'могла', 'поступить', 'иначе', 'Конечно', 'она', 'действовала', 'чересчур', 'стремительно', 'но', 'ведь', 'у', 'нее', 'нет', 'матери', '—', 'ей', 'не', 'с', 'кем', 'было', 'посоветоваться', 'в', 'критическую', 'минуту']	['I', 'can', 'hardly', 'see', 'how', 'the', 'lady', 'could', 'have', 'acted', 'otherwise', 'though', 'her', 'abrupt', 'method', 'of', 'doing', 'it', 'was', 'undoubtedly', 'to', 'be', 'regretted', 'Having', 'no', 'mother', 'she', 'had', 'no', 'one', 'to', 'advise', 'her', 'at', 'such', 'a', 'crisis.”']
404	“It was a slight, sir, a public slight,” said Lord St. Simon, tapping his fingers upon the table. 	— Это оскорбление, сэр, публичное оскорбление! — сказал лорд Сент-Саймон, барабаня пальцами по столу. 	['—', 'Это', 'оскорбление', 'сэр', 'публичное', 'оскорбление', '—', 'сказал', 'лорд', 'Сент-Саймон', 'барабаня', 'пальцами', 'по', 'столу']	['“It', 'was', 'a', 'slight', 'sir', 'a', 'public', 'slight,”', 'said', 'Lord', 'St', 'Simon', 'tapping', 'his', 'fingers', 'upon', 'the', 'table']
405	“You must make allowance for this poor girl, placed in so unprecedented a position.” 	— Однако вы должны принять в расчет то исключительно положение, в котором оказалась бедная молодая девушка. 	['—', 'Однако', 'вы', 'должны', 'принять', 'в', 'расчет', 'то', 'исключительно', 'положение', 'в', 'котором', 'оказалась', 'бедная', 'молодая', 'девушка']	['“You', 'must', 'make', 'allowance', 'for', 'this', 'poor', 'girl', 'placed', 'in', 'so', 'unprecedented', 'a', 'position.”']
406	“I will make no allowance. 	— Я не собираюсь принимать в расчет что бы то ни было. 	['—', 'Я', 'не', 'собираюсь', 'принимать', 'в', 'расчет', 'что', 'бы', 'то', 'ни', 'было']	['“I', 'will', 'make', 'no', 'allowance']
407	I am very angry indeed, and I have been shamefully used.” 	Со мной поступили бесчестно. Я просто вне себя. 	['Со', 'мной', 'поступили', 'бесчестно', 'Я', 'просто', 'вне', 'себя']	['I', 'am', 'very', 'angry', 'indeed', 'and', 'I', 'have', 'been', 'shamefully', 'used.”']
408	“I think that I heard a ring,” said Holmes. 	— Кажется, звонят, — заметил Холмс. 	['—', 'Кажется', 'звонят', '—', 'заметил', 'Холмс']	['“I', 'think', 'that', 'I', 'heard', 'a', 'ring,”', 'said', 'Holmes']
409	“Yes, there are steps on the landing. If I cannot persuade you to take a lenient view of the matter, Lord St. Simon, I have brought an advocate here who may be more successful.” 	— Да, я слышу шаги на площадке… Что ж, если я не в силах убедить, вас, лорд Сент-Саймон, более снисходительно отнестись ко всему случившемуся, то, может быть, это скорее удастся адвокату, которого я пригласил. 	['—', 'Да', 'я', 'слышу', 'шаги', 'на', 'площадке…', 'Что', 'ж', 'если', 'я', 'не', 'в', 'силах', 'убедить', 'вас', 'лорд', 'Сент-Саймон', 'более', 'снисходительно', 'отнестись', 'ко', 'всему', 'случившемуся', 'то', 'может', 'быть', 'это', 'скорее', 'удастся', 'адвокату', 'которого', 'я', 'пригласил']	['“Yes', 'there', 'are', 'steps', 'on', 'the', 'landing', 'If', 'I', 'cannot', 'persuade', 'you', 'to', 'take', 'a', 'lenient', 'view', 'of', 'the', 'matter', 'Lord', 'St', 'Simon', 'I', 'have', 'brought', 'an', 'advocate', 'here', 'who', 'may', 'be', 'more', 'successful.”']
410	He opened the door and ushered in a lady and gentleman. 	Холмс распахнул дверь и впустил в комнату даму и господина. 	['Холмс', 'распахнул', 'дверь', 'и', 'впустил', 'в', 'комнату', 'даму', 'и', 'господина']	['He', 'opened', 'the', 'door', 'and', 'ushered', 'in', 'a', 'lady', 'and', 'gentleman']
411	“Lord St. Simon,” said he “allow me to introduce you to Mr. and Mrs. Francis Hay Moulton. 	— Лорд Сент-Саймон, — сказал он, — позвольте представить вас мистеру и миссис Фрэнсис Хей Маултон. 	['—', 'Лорд', 'Сент-Саймон', '—', 'сказал', 'он', '—', 'позвольте', 'представить', 'вас', 'мистеру', 'и', 'миссис', 'Фрэнсис', 'Хей', 'Маултон']	['“Lord', 'St', 'Simon,”', 'said', 'he', '“allow', 'me', 'to', 'introduce', 'you', 'to', 'Mr', 'and', 'Mrs', 'Francis', 'Hay', 'Moulton']
412	The lady, I think, you have already met.” 	С миссис Маултон вы, кажется, уже знакомы. 	['С', 'миссис', 'Маултон', 'вы', 'кажется', 'уже', 'знакомы']	['The', 'lady', 'I', 'think', 'you', 'have', 'already', 'met.”']
413	At the sight of these newcomers our client had sprung from his seat and stood very erect, with his eyes cast down and his hand thrust into the breast of his frock-coat, a picture of offended dignity. 	При виде новых посетителей наш клиент вскочил с места. Он стоял выпрямившись, опустив глаза, заложив руку за борт сюртука, — воплощение оскорбленного достоинства. 	['При', 'виде', 'новых', 'посетителей', 'наш', 'клиент', 'вскочил', 'с', 'места', 'Он', 'стоял', 'выпрямившись', 'опустив', 'глаза', 'заложив', 'руку', 'за', 'борт', 'сюртука', '—', 'воплощение', 'оскорбленного', 'достоинства']	['At', 'the', 'sight', 'of', 'these', 'newcomers', 'our', 'client', 'had', 'sprung', 'from', 'his', 'seat', 'and', 'stood', 'very', 'erect', 'with', 'his', 'eyes', 'cast', 'down', 'and', 'his', 'hand', 'thrust', 'into', 'the', 'breast', 'of', 'his', 'frock-coat', 'a', 'picture', 'of', 'offended', 'dignity']
414	The lady had taken a quick step forward and had held out her hand to him, but he still refused to raise his eyes. 	Дама подбежала к нему и протянула руку, но он упорно не поднимал глаз. 	['Дама', 'подбежала', 'к', 'нему', 'и', 'протянула', 'руку', 'но', 'он', 'упорно', 'не', 'поднимал', 'глаз']	['The', 'lady', 'had', 'taken', 'a', 'quick', 'step', 'forward', 'and', 'had', 'held', 'out', 'her', 'hand', 'to', 'him', 'but', 'he', 'still', 'refused', 'to', 'raise', 'his', 'eyes']
415	It was as well for his resolution, perhaps, for her pleading face was one which it was hard to resist. 	Так было, пожалуй, лучше для него, если он хотел остаться непреклонным: вряд ли кто-нибудь мог бы устоять перед ее умоляющим взглядом. 	['Так', 'было', 'пожалуй', 'лучше', 'для', 'него', 'если', 'он', 'хотел', 'остаться', 'непреклонным', 'вряд', 'ли', 'кто-нибудь', 'мог', 'бы', 'устоять', 'перед', 'ее', 'умоляющим', 'взглядом']	['It', 'was', 'as', 'well', 'for', 'his', 'resolution', 'perhaps', 'for', 'her', 'pleading', 'face', 'was', 'one', 'which', 'it', 'was', 'hard', 'to', 'resist']
416	“You’re angry, Robert,” said she. 	— Вы сердитесь, Роберт? — сказала она. 	['—', 'Вы', 'сердитесь', 'Роберт', '—', 'сказала', 'она']	['“You’re', 'angry', 'Robert,”', 'said', 'she']
417	“Well, I guess you have every cause to be.” 	— Что ж, я понимаю, вы не можете не сердиться. 	['—', 'Что', 'ж', 'я', 'понимаю', 'вы', 'не', 'можете', 'не', 'сердиться']	['“Well', 'I', 'guess', 'you', 'have', 'every', 'cause', 'to', 'be.”']
418	“Pray make no apology to me,” said Lord St. Simon bitterly. 	— Сделайте одолжение, не оправдывайтесь, — с горечью произнес лорд Сент-Саймон. 	['—', 'Сделайте', 'одолжение', 'не', 'оправдывайтесь', '—', 'с', 'горечью', 'произнес', 'лорд', 'Сент-Саймон']	['“Pray', 'make', 'no', 'apology', 'to', 'me,”', 'said', 'Lord', 'St', 'Simon', 'bitterly']
419	“Oh, yes, I know that I have treated you real bad and that I should have spoken to you before I went; but I was kind of rattled, and from the time when I saw Frank here again I just didn’t know what I was doing or saying. 	— Да, да, я знаю, я виновата, мне надо было поговорить с вами перед тем, как уйти, но я словно обезумела и с той самой минуты, как вдруг увидела Фрэнка, уже не сознавала, что делаю и что говорю. 	['—', 'Да', 'да', 'я', 'знаю', 'я', 'виновата', 'мне', 'надо', 'было', 'поговорить', 'с', 'вами', 'перед', 'тем', 'как', 'уйти', 'но', 'я', 'словно', 'обезумела', 'и', 'с', 'той', 'самой', 'минуты', 'как', 'вдруг', 'увидела', 'Фрэнка', 'уже', 'не', 'сознавала', 'что', 'делаю', 'и', 'что', 'говорю']	['“Oh', 'yes', 'I', 'know', 'that', 'I', 'have', 'treated', 'you', 'real', 'bad', 'and', 'that', 'I', 'should', 'have', 'spoken', 'to', 'you', 'before', 'I', 'went', 'but', 'I', 'was', 'kind', 'of', 'rattled', 'and', 'from', 'the', 'time', 'when', 'I', 'saw', 'Frank', 'here', 'again', 'I', 'just', 'didn’t', 'know', 'what', 'I', 'was', 'doing', 'or', 'saying']
420	I only wonder I didn’t fall down and do a faint right there before the altar.” 	Удивительно еще, как это я не упала в обморок перед алтарем! 	['Удивительно', 'еще', 'как', 'это', 'я', 'не', 'упала', 'в', 'обморок', 'перед', 'алтарем']	['I', 'only', 'wonder', 'I', 'didn’t', 'fall', 'down', 'and', 'do', 'a', 'faint', 'right', 'there', 'before', 'the', 'altar.”']
421	“Perhaps, Mrs. Moulton, you would like my friend and me to leave the room while you explain this matter?” 	— Быть может, сударыня, вам угодно, чтобы мы — я и мой друг удалились на то время, пока вы будете объясняться с лордом Сент-Саймоном? — спросил Холмс. 	['—', 'Быть', 'может', 'сударыня', 'вам', 'угодно', 'чтобы', 'мы', '—', 'я', 'и', 'мой', 'друг', 'удалились', 'на', 'то', 'время', 'пока', 'вы', 'будете', 'объясняться', 'с', 'лордом', 'Сент-Саймоном', '—', 'спросил', 'Холмс']	['“Perhaps', 'Mrs', 'Moulton', 'you', 'would', 'like', 'my', 'friend', 'and', 'me', 'to', 'leave', 'the', 'room', 'while', 'you', 'explain', 'this', 'matter?”']
422	“If I may give an opinion,” remarked the strange gentleman, “we’ve had just a little too much secrecy over this business already. 	— Если мне будет позволено выказать мое мнение, — вмешался мистер Маултон, — я скажу, что хватит делать тайну из этой истории. 	['—', 'Если', 'мне', 'будет', 'позволено', 'выказать', 'мое', 'мнение', '—', 'вмешался', 'мистер', 'Маултон', '—', 'я', 'скажу', 'что', 'хватит', 'делать', 'тайну', 'из', 'этой', 'истории']	['“If', 'I', 'may', 'give', 'an', 'opinion,”', 'remarked', 'the', 'strange', 'gentleman', '“we’ve', 'had', 'just', 'a', 'little', 'too', 'much', 'secrecy', 'over', 'this', 'business', 'already']
423	For my part, I should like all Europe and America to hear the rights of it.” 	Что до меня, так я бы хотел, чтобы вся Европа и вся Америка услышали наконец правду. 	['Что', 'до', 'меня', 'так', 'я', 'бы', 'хотел', 'чтобы', 'вся', 'Европа', 'и', 'вся', 'Америка', 'услышали', 'наконец', 'правду']	['For', 'my', 'part', 'I', 'should', 'like', 'all', 'Europe', 'and', 'America', 'to', 'hear', 'the', 'rights', 'of', 'it.”']
424	He was a small, wiry, sunburnt man, clean-shaven, with a sharp face and alert manner. 	Маултон был крепкий, загорелый молодой человек небольшого роста, с резкими чертами лица и быстрыми движениями. 	['Маултон', 'был', 'крепкий', 'загорелый', 'молодой', 'человек', 'небольшого', 'роста', 'с', 'резкими', 'чертами', 'лица', 'и', 'быстрыми', 'движениями']	['He', 'was', 'a', 'small', 'wiry', 'sunburnt', 'man', 'clean-shaven', 'with', 'a', 'sharp', 'face', 'and', 'alert', 'manner']
425	“Then I’ll tell our story right away,” said the lady. 	— Ну хорошо, тогда я расскажу, как было дело, — сказала его спутница. 	['—', 'Ну', 'хорошо', 'тогда', 'я', 'расскажу', 'как', 'было', 'дело', '—', 'сказала', 'его', 'спутница']	['“Then', 'I’ll', 'tell', 'our', 'story', 'right', 'away,”', 'said', 'the', 'lady']
426	“Frank here and I met in ’84, in McQuire’s camp, near the Rockies, where Pa was working a claim. 	— Мы с Фрэнком познакомились в 1881 году на прииске Мак-Квайра, близ Скалистых гор, где папа разрабатывал участок. 	['—', 'Мы', 'с', 'Фрэнком', 'познакомились', 'в', '1881', 'году', 'на', 'прииске', 'Мак-Квайра', 'близ', 'Скалистых', 'гор', 'где', 'папа', 'разрабатывал', 'участок']	['“Frank', 'here', 'and', 'I', 'met', 'in', '’84', 'in', 'McQuire’s', 'camp', 'near', 'the', 'Rockies', 'where', 'Pa', 'was', 'working', 'a', 'claim']
427	We were engaged to each other, Frank and I; but then one day father struck a rich pocket and made a pile, while poor Frank here had a claim that petered out and came to nothing. 	Мы дали друг другу слово. Но вот однажды папа напал на богатую золотоносную жилу и разбогател, а участок бедного Фрэнка все истощался и в конце концов совсем перестал что-либо давать. 	['Мы', 'дали', 'друг', 'другу', 'слово', 'Но', 'вот', 'однажды', 'папа', 'напал', 'на', 'богатую', 'золотоносную', 'жилу', 'и', 'разбогател', 'а', 'участок', 'бедного', 'Фрэнка', 'все', 'истощался', 'и', 'в', 'конце', 'концов', 'совсем', 'перестал', 'что-либо', 'давать']	['We', 'were', 'engaged', 'to', 'each', 'other', 'Frank', 'and', 'I', 'but', 'then', 'one', 'day', 'father', 'struck', 'a', 'rich', 'pocket', 'and', 'made', 'a', 'pile', 'while', 'poor', 'Frank', 'here', 'had', 'a', 'claim', 'that', 'petered', 'out', 'and', 'came', 'to', 'nothing']
428	The richer Pa grew the poorer was Frank; so at last Pa wouldn’t hear of our engagement lasting any longer, and he took me away to ’Frisco. 	Чем богаче становился папа, тем беднее становился Фрэнк. Папа теперь и слышать не хотел о нашем обручении и увез меня во Фриско. 	['Чем', 'богаче', 'становился', 'папа', 'тем', 'беднее', 'становился', 'Фрэнк', 'Папа', 'теперь', 'и', 'слышать', 'не', 'хотел', 'о', 'нашем', 'обручении', 'и', 'увез', 'меня', 'во', 'Фриско']	['The', 'richer', 'Pa', 'grew', 'the', 'poorer', 'was', 'Frank', 'so', 'at', 'last', 'Pa', 'wouldn’t', 'hear', 'of', 'our', 'engagement', 'lasting', 'any', 'longer', 'and', 'he', 'took', 'me', 'away', 'to', '’Frisco']
429	Frank wouldn’t throw up his hand, though; so he followed me there, and he saw me without Pa knowing anything about it. 	Но Фрэнк не сдавался. Он поехал за мной во Фриско, и мы продолжали видеться без ведома папы. 	['Но', 'Фрэнк', 'не', 'сдавался', 'Он', 'поехал', 'за', 'мной', 'во', 'Фриско', 'и', 'мы', 'продолжали', 'видеться', 'без', 'ведома', 'папы']	['Frank', 'wouldn’t', 'throw', 'up', 'his', 'hand', 'though', 'so', 'he', 'followed', 'me', 'there', 'and', 'he', 'saw', 'me', 'without', 'Pa', 'knowing', 'anything', 'about', 'it']
430	It would only have made him mad to know, so we just fixed it all up for ourselves. 	Папа страшно рассердился бы, если б узнал об этом, поэтому мы и решили все сами. 	['Папа', 'страшно', 'рассердился', 'бы', 'если', 'б', 'узнал', 'об', 'этом', 'поэтому', 'мы', 'и', 'решили', 'все', 'сами']	['It', 'would', 'only', 'have', 'made', 'him', 'mad', 'to', 'know', 'so', 'we', 'just', 'fixed', 'it', 'all', 'up', 'for', 'ourselves']
431	Frank said that he would go and make his pile, too, and never come back to claim me until he had as much as Pa. 	Фрэнк сказал, что он уедет и тоже наживет состояние и что приедет за мной только тогда, когда у него будет столько же денег, сколько у папы. 	['Фрэнк', 'сказал', 'что', 'он', 'уедет', 'и', 'тоже', 'наживет', 'состояние', 'и', 'что', 'приедет', 'за', 'мной', 'только', 'тогда', 'когда', 'у', 'него', 'будет', 'столько', 'же', 'денег', 'сколько', 'у', 'папы']	['Frank', 'said', 'that', 'he', 'would', 'go', 'and', 'make', 'his', 'pile', 'too', 'and', 'never', 'come', 'back', 'to', 'claim', 'me', 'until', 'he', 'had', 'as', 'much', 'as', 'Pa']
432	So then I promised to wait for him to the end of time and pledged myself not to marry anyone else while he lived. 	А я пообещала, что буду ждать его, сколько бы ни понадобилось, и не выйду замуж за другого, пока он жив. 	['А', 'я', 'пообещала', 'что', 'буду', 'ждать', 'его', 'сколько', 'бы', 'ни', 'понадобилось', 'и', 'не', 'выйду', 'замуж', 'за', 'другого', 'пока', 'он', 'жив']	['So', 'then', 'I', 'promised', 'to', 'wait', 'for', 'him', 'to', 'the', 'end', 'of', 'time', 'and', 'pledged', 'myself', 'not', 'to', 'marry', 'anyone', 'else', 'while', 'he', 'lived']
433	‘Why shouldn’t we be married right away, then,’ said he, ‘and then I will feel sure of you; and I won’t claim to be your husband until I come back?’ 	«Если так, — сказал мне Фрэнк, — почему бы нам не обвенчаться теперь же? 	['«Если', 'так', '—', 'сказал', 'мне', 'Фрэнк', '—', 'почему', 'бы', 'нам', 'не', 'обвенчаться', 'теперь', 'же']	['‘Why', 'shouldn’t', 'we', 'be', 'married', 'right', 'away', 'then,’', 'said', 'he', '‘and', 'then', 'I', 'will', 'feel', 'sure', 'of', 'you', 'and', 'I', 'won’t', 'claim', 'to', 'be', 'your', 'husband', 'until', 'I', 'come', 'back?’']
434	Well, we talked it over, and he had fixed it all up so nicely, with a clergyman all ready in waiting, that we just did it right there; and then Frank went off to seek his fortune, and I went back to Pa. 	Я буду уверен в тебе, а твоим мужем стану лишь тогда, когда вернусь». Так мы и решили. Он отлично все устроил, священник обвенчал нас, и Фрэнк уехал искать счастья, а я вернулась к папе. 	['Я', 'буду', 'уверен', 'в', 'тебе', 'а', 'твоим', 'мужем', 'стану', 'лишь', 'тогда', 'когда', 'вернусь»', 'Так', 'мы', 'и', 'решили', 'Он', 'отлично', 'все', 'устроил', 'священник', 'обвенчал', 'нас', 'и', 'Фрэнк', 'уехал', 'искать', 'счастья', 'а', 'я', 'вернулась', 'к', 'папе']	['Well', 'we', 'talked', 'it', 'over', 'and', 'he', 'had', 'fixed', 'it', 'all', 'up', 'so', 'nicely', 'with', 'a', 'clergyman', 'all', 'ready', 'in', 'waiting', 'that', 'we', 'just', 'did', 'it', 'right', 'there', 'and', 'then', 'Frank', 'went', 'off', 'to', 'seek', 'his', 'fortune', 'and', 'I', 'went', 'back', 'to', 'Pa']
