	en	ru	ru_tokens	en_tokens
278	“It is very good of Lord St. Simon to honour my head by putting it on a level with his own,” said Sherlock Holmes, laughing. 	Шерлок Холмс засмеялся: — Лорд Сент-Саймон оказал моей голове большую честь, поставив ее на один уровень со своей!.. 	['Шерлок', 'Холмс', 'засмеялся', '—', 'Лорд', 'Сент-Саймон', 'оказал', 'моей', 'голове', 'большую', 'честь', 'поставив', 'ее', 'на', 'один', 'уровень', 'со', 'своей']	['“It', 'is', 'very', 'good', 'of', 'Lord', 'St', 'Simon', 'to', 'honour', 'my', 'head', 'by', 'putting', 'it', 'on', 'a', 'level', 'with', 'his', 'own,”', 'said', 'Sherlock', 'Holmes', 'laughing']
279	“I think that I shall have a whisky and soda and a cigar after all this cross-questioning. 	Знаете что, я не прочь бы выпить виски с содовой и выкурить сигару после этого длительного допроса. 	['Знаете', 'что', 'я', 'не', 'прочь', 'бы', 'выпить', 'виски', 'с', 'содовой', 'и', 'выкурить', 'сигару', 'после', 'этого', 'длительного', 'допроса']	['“I', 'think', 'that', 'I', 'shall', 'have', 'a', 'whisky', 'and', 'soda', 'and', 'a', 'cigar', 'after', 'all', 'this', 'cross-questioning']
280	I had formed my conclusions as to the case before our client came into the room.” 	А заключение по данному делу сложилось у меня еще до того, как наш клиент вошел в комнату. 	['А', 'заключение', 'по', 'данному', 'делу', 'сложилось', 'у', 'меня', 'еще', 'до', 'того', 'как', 'наш', 'клиент', 'вошел', 'в', 'комнату']	['I', 'had', 'formed', 'my', 'conclusions', 'as', 'to', 'the', 'case', 'before', 'our', 'client', 'came', 'into', 'the', 'room.”']
281	“My dear Holmes!” 	— Полноте, Холмс! 	['—', 'Полноте', 'Холмс']	['“My', 'dear', 'Holmes!”']
282	“I have notes of several similar cases, though none, as I remarked before, which were quite as prompt. 	— В моих заметках есть несколько аналогичных случаев, хотя, как я уже говорил вам, ни одно из тех исчезновений не было столь скоропалительным. 	['—', 'В', 'моих', 'заметках', 'есть', 'несколько', 'аналогичных', 'случаев', 'хотя', 'как', 'я', 'уже', 'говорил', 'вам', 'ни', 'одно', 'из', 'тех', 'исчезновений', 'не', 'было', 'столь', 'скоропалительным']	['“I', 'have', 'notes', 'of', 'several', 'similar', 'cases', 'though', 'none', 'as', 'I', 'remarked', 'before', 'which', 'were', 'quite', 'as', 'prompt']
283	My whole examination served to turn my conjecture into a certainty. 	Беседа же с лордом Сент-Саймоном превратила мои предположения в уверенность. 	['Беседа', 'же', 'с', 'лордом', 'Сент-Саймоном', 'превратила', 'мои', 'предположения', 'в', 'уверенность']	['My', 'whole', 'examination', 'served', 'to', 'turn', 'my', 'conjecture', 'into', 'a', 'certainty']
284	Circumstantial evidence is occasionally very convincing, as when you find a trout in the milk, to quote Thoreau’s example.” 	Побочные обстоятельства бывают иногда так же красноречивы, как муха в молоке, — если вспомнить Торо *1. 	['Побочные', 'обстоятельства', 'бывают', 'иногда', 'так', 'же', 'красноречивы', 'как', 'муха', 'в', 'молоке', '—', 'если', 'вспомнить', 'Торо', '1']	['Circumstantial', 'evidence', 'is', 'occasionally', 'very', 'convincing', 'as', 'when', 'you', 'find', 'a', 'trout', 'in', 'the', 'milk', 'to', 'quote', 'Thoreau’s', 'example.”']
285	“But I have heard all that you have heard.” 	— Однако, Холмс, ведь я присутствовал при разговоре и слышал то же, что слышали и вы. 	['—', 'Однако', 'Холмс', 'ведь', 'я', 'присутствовал', 'при', 'разговоре', 'и', 'слышал', 'то', 'же', 'что', 'слышали', 'и', 'вы']	['“But', 'I', 'have', 'heard', 'all', 'that', 'you', 'have', 'heard.”']
286	“Without, however, the knowledge of pre-existing cases which serves me so well. 	— Да, но вы не знаете тех случаев, которые уже имели место и которые сослужили мне отличную службу. 	['—', 'Да', 'но', 'вы', 'не', 'знаете', 'тех', 'случаев', 'которые', 'уже', 'имели', 'место', 'и', 'которые', 'сослужили', 'мне', 'отличную', 'службу']	['“Without', 'however', 'the', 'knowledge', 'of', 'pre-existing', 'cases', 'which', 'serves', 'me', 'so', 'well']
287	There was a parallel instance in Aberdeen some years back, and something on very much the same lines at Munich the year after the Franco-Prussian War. 	Почти такая же история произошла несколько лет назад в Абердине и нечто очень похожее — в Мюнжене, на следующий год после франко-прусской войны. 	['Почти', 'такая', 'же', 'история', 'произошла', 'несколько', 'лет', 'назад', 'в', 'Абердине', 'и', 'нечто', 'очень', 'похожее', '—', 'в', 'Мюнжене', 'на', 'следующий', 'год', 'после', 'франко-прусской', 'войны']	['There', 'was', 'a', 'parallel', 'instance', 'in', 'Aberdeen', 'some', 'years', 'back', 'and', 'something', 'on', 'very', 'much', 'the', 'same', 'lines', 'at', 'Munich', 'the', 'year', 'after', 'the', 'Franco-Prussian', 'War']
288	It is one of these cases—but, hullo, here is Lestrade! 	Данный случай… А, вот и Лестрейд! 	['Данный', 'случай…', 'А', 'вот', 'и', 'Лестрейд']	['It', 'is', 'one', 'of', 'these', 'cases—but', 'hullo', 'here', 'is', 'Lestrade']
289	Good-afternoon, Lestrade! 	Здравствуйте, Лестрейд! 	['Здравствуйте', 'Лестрейд']	['Good-afternoon', 'Lestrade']
290	You will find an extra tumbler upon the sideboard, and there are cigars in the box.” 	Вон там, на буфете, вино, а здесь, в ящике, сигары. 	['Вон', 'там', 'на', 'буфете', 'вино', 'а', 'здесь', 'в', 'ящике', 'сигары']	['You', 'will', 'find', 'an', 'extra', 'tumbler', 'upon', 'the', 'sideboard', 'and', 'there', 'are', 'cigars', 'in', 'the', 'box.”']
291	The official detective was attired in a pea-jacket and cravat, which gave him a decidedly nautical appearance, and he carried a black canvas bag in his hand. 	Официальный сыщик Скотланд-Ярда был облачен в куртку и носил на шее шарф, что делало его похожим на моряка. В руке он держал черный парусиновый саквояж. 	['Официальный', 'сыщик', 'Скотланд-Ярда', 'был', 'облачен', 'в', 'куртку', 'и', 'носил', 'на', 'шее', 'шарф', 'что', 'делало', 'его', 'похожим', 'на', 'моряка', 'В', 'руке', 'он', 'держал', 'черный', 'парусиновый', 'саквояж']	['The', 'official', 'detective', 'was', 'attired', 'in', 'a', 'pea-jacket', 'and', 'cravat', 'which', 'gave', 'him', 'a', 'decidedly', 'nautical', 'appearance', 'and', 'he', 'carried', 'a', 'black', 'canvas', 'bag', 'in', 'his', 'hand']
292	With a short greeting he seated himself and lit the cigar which had been offered to him. 	Отрывисто поздоровавшись, он опустился на стул и закурил предложенную сигару. 	['Отрывисто', 'поздоровавшись', 'он', 'опустился', 'на', 'стул', 'и', 'закурил', 'предложенную', 'сигару']	['With', 'a', 'short', 'greeting', 'he', 'seated', 'himself', 'and', 'lit', 'the', 'cigar', 'which', 'had', 'been', 'offered', 'to', 'him']
293	“What’s up, then?” asked Holmes with a twinkle in his eye. 	— Ну, выкладывайте, что случилось? — спросил Холмс с лукавым огоньком в глазах. 	['—', 'Ну', 'выкладывайте', 'что', 'случилось', '—', 'спросил', 'Холмс', 'с', 'лукавым', 'огоньком', 'в', 'глазах']	['“What’s', 'up', 'then?”', 'asked', 'Holmes', 'with', 'a', 'twinkle', 'in', 'his', 'eye']
294	“You look dissatisfied.” 	— У вас недовольный вид. 	['—', 'У', 'вас', 'недовольный', 'вид']	['“You', 'look', 'dissatisfied.”']
295	“And I feel dissatisfied. 	— И я действительно недоволен. 	['—', 'И', 'я', 'действительно', 'недоволен']	['“And', 'I', 'feel', 'dissatisfied']
296	It is this infernal St. Simon marriage case. 	Черт бы побрал этого Сент-Саймона с его свадьбой! 	['Черт', 'бы', 'побрал', 'этого', 'Сент-Саймона', 'с', 'его', 'свадьбой']	['It', 'is', 'this', 'infernal', 'St', 'Simon', 'marriage', 'case']
297	I can make neither head nor tail of the business.” 	Ничего не могу понять. 	['Ничего', 'не', 'могу', 'понять']	['I', 'can', 'make', 'neither', 'head', 'nor', 'tail', 'of', 'the', 'business.”']
298	“Really! 	— Неужели? 	['—', 'Неужели']	['“Really']
299	You surprise me.” 	Вы удивляете меня. 	['Вы', 'удивляете', 'меня']	['You', 'surprise', 'me.”']
300	“Who ever heard of such a mixed affair? 	— В жизни не встречал более запутанной истории. 	['—', 'В', 'жизни', 'не', 'встречал', 'более', 'запутанной', 'истории']	['“Who', 'ever', 'heard', 'of', 'such', 'a', 'mixed', 'affair']
301	Every clue seems to slip through my fingers. 	Не найти никаких концов. 	['Не', 'найти', 'никаких', 'концов']	['Every', 'clue', 'seems', 'to', 'slip', 'through', 'my', 'fingers']
302	I have been at work upon it all day.” 	Сегодня я провозился с ней весь день. 	['Сегодня', 'я', 'провозился', 'с', 'ней', 'весь', 'день']	['I', 'have', 'been', 'at', 'work', 'upon', 'it', 'all', 'day.”']
303	“And very wet it seems to have made you,” said Holmes laying his hand upon the arm of the pea-jacket. 	— И, кажется, при этом изрядно промокли, — сказал Холмс, дотрагиваясь до рукава куртки. 	['—', 'И', 'кажется', 'при', 'этом', 'изрядно', 'промокли', '—', 'сказал', 'Холмс', 'дотрагиваясь', 'до', 'рукава', 'куртки']	['“And', 'very', 'wet', 'it', 'seems', 'to', 'have', 'made', 'you,”', 'said', 'Holmes', 'laying', 'his', 'hand', 'upon', 'the', 'arm', 'of', 'the', 'pea-jacket']
304	“Yes, I have been dragging the Serpentine.” 	— Да, я обшаривал дно Серпентайна *2. 	['—', 'Да', 'я', 'обшаривал', 'дно', 'Серпентайна', '2']	['“Yes', 'I', 'have', 'been', 'dragging', 'the', 'Serpentine.”']
305	“In heaven’s name, what for?” 	— О, Господи! Да зачем вам это понадобилось? 	['—', 'О', 'Господи', 'Да', 'зачем', 'вам', 'это', 'понадобилось']	['“In', 'heaven’s', 'name', 'what', 'for?”']
306	“In search of the body of Lady St. Simon.” 	— Чтобы найти тело леди Сент-Саймон. 	['—', 'Чтобы', 'найти', 'тело', 'леди', 'Сент-Саймон']	['“In', 'search', 'of', 'the', 'body', 'of', 'Lady', 'St', 'Simon.”']
307	Sherlock Holmes leaned back in his chair and laughed heartily. 	Шерлок Холмс откинулся на спинку кресла и от души расхохотался. 	['Шерлок', 'Холмс', 'откинулся', 'на', 'спинку', 'кресла', 'и', 'от', 'души', 'расхохотался']	['Sherlock', 'Holmes', 'leaned', 'back', 'in', 'his', 'chair', 'and', 'laughed', 'heartily']
308	“Have you dragged the basin of Trafalgar Square fountain?” he asked. 	— А бассейн фонтана на Трафальгард-сквер вы не забыли обшарить? — спросил он. 	['—', 'А', 'бассейн', 'фонтана', 'на', 'Трафальгард-сквер', 'вы', 'не', 'забыли', 'обшарить', '—', 'спросил', 'он']	['“Have', 'you', 'dragged', 'the', 'basin', 'of', 'Trafalgar', 'Square', 'fountain?”', 'he', 'asked']
309	“Why? 	— На Трафальгард-сквер? 	['—', 'На', 'Трафальгард-сквер']	['“Why']
310	What do you mean?” 	Что вы хотите этим сказать? 	['Что', 'вы', 'хотите', 'этим', 'сказать']	['What', 'do', 'you', 'mean?”']
311	“Because you have just as good a chance of finding this lady in the one as in the other.” 	— Да то, что у вас точно такие же шансы найти леди Сент-Саймон здесь, как и там. 	['—', 'Да', 'то', 'что', 'у', 'вас', 'точно', 'такие', 'же', 'шансы', 'найти', 'леди', 'Сент-Саймон', 'здесь', 'как', 'и', 'там']	['“Because', 'you', 'have', 'just', 'as', 'good', 'a', 'chance', 'of', 'finding', 'this', 'lady', 'in', 'the', 'one', 'as', 'in', 'the', 'other.”']
312	Lestrade shot an angry glance at my companion. 	Лестрейд бросил сердитый взгляд на моего друга. 	['Лестрейд', 'бросил', 'сердитый', 'взгляд', 'на', 'моего', 'друга']	['Lestrade', 'shot', 'an', 'angry', 'glance', 'at', 'my', 'companion']
313	“I suppose you know all about it,” he snarled. 	— Как видно, вы уже разобрались в этом деле? — насмешливо спросил он. 	['—', 'Как', 'видно', 'вы', 'уже', 'разобрались', 'в', 'этом', 'деле', '—', 'насмешливо', 'спросил', 'он']	['“I', 'suppose', 'you', 'know', 'all', 'about', 'it,”', 'he', 'snarled']
314	“Well, I have only just heard the facts, but my mind is made up.” 	— Мне только что рассказали о нем, но я уже пришел к определенному выводу. 	['—', 'Мне', 'только', 'что', 'рассказали', 'о', 'нем', 'но', 'я', 'уже', 'пришел', 'к', 'определенному', 'выводу']	['“Well', 'I', 'have', 'only', 'just', 'heard', 'the', 'facts', 'but', 'my', 'mind', 'is', 'made', 'up.”']
315	“Oh, indeed! 	— Неужели! 	['—', 'Неужели']	['“Oh', 'indeed']
316	Then you think that the Serpentine plays no part in the matter?” 	Так вы считаете, что Серпентайн тут ни при чем? 	['Так', 'вы', 'считаете', 'что', 'Серпентайн', 'тут', 'ни', 'при', 'чем']	['Then', 'you', 'think', 'that', 'the', 'Serpentine', 'plays', 'no', 'part', 'in', 'the', 'matter?”']
317	“I think it very unlikely.” 	— Полагаю, что так. 	['—', 'Полагаю', 'что', 'так']	['“I', 'think', 'it', 'very', 'unlikely.”']
318	“Then perhaps you will kindly explain how it is that we found this in it?” 	— В таком случае, прошу объяснить, каким образом мы могли найти в пруду вот это. 	['—', 'В', 'таком', 'случае', 'прошу', 'объяснить', 'каким', 'образом', 'мы', 'могли', 'найти', 'в', 'пруду', 'вот', 'это']	['“Then', 'perhaps', 'you', 'will', 'kindly', 'explain', 'how', 'it', 'is', 'that', 'we', 'found', 'this', 'in', 'it?”']
319	He opened his bag as he spoke, and tumbled onto the floor a wedding-dress of watered silk, a pair of white satin shoes and a bride’s wreath and veil, all discoloured and soaked in water. 	Он открыл саквояж и выбросил на пол шелковое подвенечное платье, пару белых атласных туфелек и веночек с вуалью — все грязное и совершенно мокрое. 	['Он', 'открыл', 'саквояж', 'и', 'выбросил', 'на', 'пол', 'шелковое', 'подвенечное', 'платье', 'пару', 'белых', 'атласных', 'туфелек', 'и', 'веночек', 'с', 'вуалью', '—', 'все', 'грязное', 'и', 'совершенно', 'мокрое']	['He', 'opened', 'his', 'bag', 'as', 'he', 'spoke', 'and', 'tumbled', 'onto', 'the', 'floor', 'a', 'wedding-dress', 'of', 'watered', 'silk', 'a', 'pair', 'of', 'white', 'satin', 'shoes', 'and', 'a', 'bride’s', 'wreath', 'and', 'veil', 'all', 'discoloured', 'and', 'soaked', 'in', 'water']
320	“There,” said he, putting a new wedding-ring upon the top of the pile. 	— Извольте! — сказал Лестрейд, кладя на эту кучу новенькое обручальное кольцо. 	['—', 'Извольте', '—', 'сказал', 'Лестрейд', 'кладя', 'на', 'эту', 'кучу', 'новенькое', 'обручальное', 'кольцо']	['“There,”', 'said', 'he', 'putting', 'a', 'new', 'wedding-ring', 'upon', 'the', 'top', 'of', 'the', 'pile']
321	“There is a little nut for you to crack, Master Holmes.” 	— Раскусите-ка этот орешек, мистер Холмс! 	['—', 'Раскусите-ка', 'этот', 'орешек', 'мистер', 'Холмс']	['“There', 'is', 'a', 'little', 'nut', 'for', 'you', 'to', 'crack', 'Master', 'Holmes.”']
322	“Oh, indeed!” said my friend, blowing blue rings into the air. 	— Вот оно что! — сказал Холмс, выпуская сизые кольца дыма. 	['—', 'Вот', 'оно', 'что', '—', 'сказал', 'Холмс', 'выпуская', 'сизые', 'кольца', 'дыма']	['“Oh', 'indeed!”', 'said', 'my', 'friend', 'blowing', 'blue', 'rings', 'into', 'the', 'air']
323	“You dragged them from the Serpentine?” 	— И все эти вещи вы выудили в пруду? 	['—', 'И', 'все', 'эти', 'вещи', 'вы', 'выудили', 'в', 'пруду']	['“You', 'dragged', 'them', 'from', 'the', 'Serpentine?”']
324	“No. They were found floating near the margin by a park-keeper. 	— Они плавали у самого берега, их нашел сторож парка. 	['—', 'Они', 'плавали', 'у', 'самого', 'берега', 'их', 'нашел', 'сторож', 'парка']	['“No', 'They', 'were', 'found', 'floating', 'near', 'the', 'margin', 'by', 'a', 'park-keeper']
325	They have been identified as her clothes, and it seemed to me that if the clothes were there the body would not be far off.” 	Родственники леди Сент- Саймон опознали и платье и все остальное. По-моему, если там была одежда, то где-нибудь поблизости найдется и тело. 	['Родственники', 'леди', 'Сент', 'Саймон', 'опознали', 'и', 'платье', 'и', 'все', 'остальное', 'По-моему', 'если', 'там', 'была', 'одежда', 'то', 'где-нибудь', 'поблизости', 'найдется', 'и', 'тело']	['They', 'have', 'been', 'identified', 'as', 'her', 'clothes', 'and', 'it', 'seemed', 'to', 'me', 'that', 'if', 'the', 'clothes', 'were', 'there', 'the', 'body', 'would', 'not', 'be', 'far', 'off.”']
326	“By the same brilliant reasoning, every man’s body is to be found in the neighbourhood of his wardrobe. 	— Если исходить из этой остроумной теории, тело каждого человека должно быть найдено рядом с его одеждой. 	['—', 'Если', 'исходить', 'из', 'этой', 'остроумной', 'теории', 'тело', 'каждого', 'человека', 'должно', 'быть', 'найдено', 'рядом', 'с', 'его', 'одеждой']	['“By', 'the', 'same', 'brilliant', 'reasoning', 'every', 'man’s', 'body', 'is', 'to', 'be', 'found', 'in', 'the', 'neighbourhood', 'of', 'his', 'wardrobe']
327	And pray what did you hope to arrive at through this?” 	Так чего же вы надеетесь добиться с помощью вещей леди Сент-Саймон, хотел бы я знать? 	['Так', 'чего', 'же', 'вы', 'надеетесь', 'добиться', 'с', 'помощью', 'вещей', 'леди', 'Сент-Саймон', 'хотел', 'бы', 'я', 'знать']	['And', 'pray', 'what', 'did', 'you', 'hope', 'to', 'arrive', 'at', 'through', 'this?”']
328	“At some evidence implicating Flora Millar in the disappearance.” 	— Какой-нибудь улики, доказывающей, что в ее исчезновении замешана Флора Миллар. 	['—', 'Какой-нибудь', 'улики', 'доказывающей', 'что', 'в', 'ее', 'исчезновении', 'замешана', 'Флора', 'Миллар']	['“At', 'some', 'evidence', 'implicating', 'Flora', 'Millar', 'in', 'the', 'disappearance.”']
329	“I am afraid that you will find it difficult.” 	— Боюсь, это будет нелегко. 	['—', 'Боюсь', 'это', 'будет', 'нелегко']	['“I', 'am', 'afraid', 'that', 'you', 'will', 'find', 'it', 'difficult.”']
330	“Are you, indeed, now?” cried Lestrade with some bitterness. 	— Боитесь? — с горечью вскричал Лестрейд. 	['—', 'Боитесь', '—', 'с', 'горечью', 'вскричал', 'Лестрейд']	['“Are', 'you', 'indeed', 'now?”', 'cried', 'Lestrade', 'with', 'some', 'bitterness']
331	“I am afraid, Holmes, that you are not very practical with your deductions and your inferences. 	— А я, Холмс, боюсь, что вы совсем оторвались от жизни с вашими вечными теориями и умозаключениями. 	['—', 'А', 'я', 'Холмс', 'боюсь', 'что', 'вы', 'совсем', 'оторвались', 'от', 'жизни', 'с', 'вашими', 'вечными', 'теориями', 'и', 'умозаключениями']	['“I', 'am', 'afraid', 'Holmes', 'that', 'you', 'are', 'not', 'very', 'practical', 'with', 'your', 'deductions', 'and', 'your', 'inferences']
332	You have made two blunders in as many minutes. This dress does implicate Miss Flora Millar.” 	За несколько минут вы сделали две грубые ошибки, Вот это самое платье, несомненно, уличает мисс Флору Миллар. 	['За', 'несколько', 'минут', 'вы', 'сделали', 'две', 'грубые', 'ошибки', 'Вот', 'это', 'самое', 'платье', 'несомненно', 'уличает', 'мисс', 'Флору', 'Миллар']	['You', 'have', 'made', 'two', 'blunders', 'in', 'as', 'many', 'minutes', 'This', 'dress', 'does', 'implicate', 'Miss', 'Flora', 'Millar.”']
333	“And how?” 	— Каким же образом? 	['—', 'Каким', 'же', 'образом']	['“And', 'how?”']
334	“In the dress is a pocket. 	— В платье есть карман. 	['—', 'В', 'платье', 'есть', 'карман']	['“In', 'the', 'dress', 'is', 'a', 'pocket']
335	In the pocket is a card-case. 	В кармане нашелся футляр для визитных карточек. 	['В', 'кармане', 'нашелся', 'футляр', 'для', 'визитных', 'карточек']	['In', 'the', 'pocket', 'is', 'a', 'card-case']
336	In the card-case is a note. 	А в футляре — записка. 	['А', 'в', 'футляре', '—', 'записка']	['In', 'the', 'card-case', 'is', 'a', 'note']
337	And here is the very note.” 	Вот она. 	['Вот', 'она']	['And', 'here', 'is', 'the', 'very', 'note.”']
338	He slapped it down upon the table in front of him. 	— Он расправил записку на столе. 	['—', 'Он', 'расправил', 'записку', 'на', 'столе']	['He', 'slapped', 'it', 'down', 'upon', 'the', 'table', 'in', 'front', 'of', 'him']
339	“Listen to this: 	— Сейчас я прочту ее вам: 	['—', 'Сейчас', 'я', 'прочту', 'ее', 'вам']	['“Listen', 'to', 'this']
