	en	ru	ru_tokens	en_tokens
239	Many wonderful and unbelievable things were reported of him, he had performed miracles, had overcome the devil, had spoken to the gods. 	Много чудного и невероятного рассказывалось о нем – будто он творит чудеса, будто он поборол дьявола и беседует с богами. 	['Много', 'чудного', 'и', 'невероятного', 'рассказывалось', 'о', 'нем', '–', 'будто', 'он', 'творит', 'чудеса', 'будто', 'он', 'поборол', 'дьявола', 'и', 'беседует', 'с', 'богами']	['Many', 'wonderful', 'and', 'unbelievable', 'things', 'were', 'reported', 'of', 'him', 'he', 'had', 'performed', 'miracles', 'had', 'overcome', 'the', 'devil', 'had', 'spoken', 'to', 'the', 'gods']
240	But his enemies and disbelievers said, this Gotama was a vain seducer, he would spent his days in luxury, scorned the offerings, was without learning, and knew neither exercises nor self-castigation. 	Враги же и неверующие говорили, что этот Гаутама – тщеславный совратитель, что он проводит свои дни в излишествах, презирает жертвоприношения, что он не обладает никакой ученостью, не признает подвижничества и истязания плоти. 	['Враги', 'же', 'и', 'неверующие', 'говорили', 'что', 'этот', 'Гаутама', '–', 'тщеславный', 'совратитель', 'что', 'он', 'проводит', 'свои', 'дни', 'в', 'излишествах', 'презирает', 'жертвоприношения', 'что', 'он', 'не', 'обладает', 'никакой', 'ученостью', 'не', 'признает', 'подвижничества', 'и', 'истязания', 'плоти']	['But', 'his', 'enemies', 'and', 'disbelievers', 'said', 'this', 'Gotama', 'was', 'a', 'vain', 'seducer', 'he', 'would', 'spent', 'his', 'days', 'in', 'luxury', 'scorned', 'the', 'offerings', 'was', 'without', 'learning', 'and', 'knew', 'neither', 'exercises', 'nor', 'self-castigation']
241	The myth of Buddha sounded sweet. The scent of magic flowed from these reports. 	Дивно звучала молва о Будде, какими‑то чарами веяло от рассказов о нем. 	['Дивно', 'звучала', 'молва', 'о', 'Будде', 'какими‑то', 'чарами', 'веяло', 'от', 'рассказов', 'о', 'нем']	['The', 'myth', 'of', 'Buddha', 'sounded', 'sweet', 'The', 'scent', 'of', 'magic', 'flowed', 'from', 'these', 'reports']
242	After all, the world was sick, life was hard to bear—and behold, here a source seemed to spring forth, here a messenger seemed to call out, comforting, mild, full of noble promises. 	Ведь мир в самом деле страдал недугом. Тяжелым бременем была жизнь, а тут, в этой молве, словно забил целебный родник, зазвучала благая весть, полная утешений и высоких обетовании. 	['Ведь', 'мир', 'в', 'самом', 'деле', 'страдал', 'недугом', 'Тяжелым', 'бременем', 'была', 'жизнь', 'а', 'тут', 'в', 'этой', 'молве', 'словно', 'забил', 'целебный', 'родник', 'зазвучала', 'благая', 'весть', 'полная', 'утешений', 'и', 'высоких', 'обетовании']	['After', 'all', 'the', 'world', 'was', 'sick', 'life', 'was', 'hard', 'to', 'bear—and', 'behold', 'here', 'a', 'source', 'seemed', 'to', 'spring', 'forth', 'here', 'a', 'messenger', 'seemed', 'to', 'call', 'out', 'comforting', 'mild', 'full', 'of', 'noble', 'promises']
243	Everywhere where the rumour of Buddha was heard, everywhere in the lands of India, the young men listened up, felt a longing, felt hope, and among the Brahmans' sons of the towns and villages every pilgrim and stranger was welcome, when he brought news of him, the exalted one, the Sakyamuni. 	Везде, куда только проникал слух о Будде, во всех странах Индии юноши приходили в возбуждение, сердца их наполнялись томлением и надеждой. В городах и селах сыновья брахманов радушно принимали всякого странника и пришельца, если он приносил какую‑нибудь весть о нем, о Возвышенном, о Шакьямуни. 	['Везде', 'куда', 'только', 'проникал', 'слух', 'о', 'Будде', 'во', 'всех', 'странах', 'Индии', 'юноши', 'приходили', 'в', 'возбуждение', 'сердца', 'их', 'наполнялись', 'томлением', 'и', 'надеждой', 'В', 'городах', 'и', 'селах', 'сыновья', 'брахманов', 'радушно', 'принимали', 'всякого', 'странника', 'и', 'пришельца', 'если', 'он', 'приносил', 'какую‑нибудь', 'весть', 'о', 'нем', 'о', 'Возвышенном', 'о', 'Шакьямуни']	"['Everywhere', 'where', 'the', 'rumour', 'of', 'Buddha', 'was', 'heard', 'everywhere', 'in', 'the', 'lands', 'of', 'India', 'the', 'young', 'men', 'listened', 'up', 'felt', 'a', 'longing', 'felt', 'hope', 'and', 'among', 'the', ""Brahmans'"", 'sons', 'of', 'the', 'towns', 'and', 'villages', 'every', 'pilgrim', 'and', 'stranger', 'was', 'welcome', 'when', 'he', 'brought', 'news', 'of', 'him', 'the', 'exalted', 'one', 'the', 'Sakyamuni']"
244	The myth had also reached the Samanas in the forest, and also Siddhartha, and also Govinda, slowly, drop by drop, every drop laden with hope, every drop laden with doubt. 	И к саманам в лесу, к Сиддхартхе и Говинде, проникла эта весть, – проникала медленно, по капле, но каждая капля была чревата надеждой, каждая капля была чревата сомнением. 	['И', 'к', 'саманам', 'в', 'лесу', 'к', 'Сиддхартхе', 'и', 'Говинде', 'проникла', 'эта', 'весть', '–', 'проникала', 'медленно', 'по', 'капле', 'но', 'каждая', 'капля', 'была', 'чревата', 'надеждой', 'каждая', 'капля', 'была', 'чревата', 'сомнением']	['The', 'myth', 'had', 'also', 'reached', 'the', 'Samanas', 'in', 'the', 'forest', 'and', 'also', 'Siddhartha', 'and', 'also', 'Govinda', 'slowly', 'drop', 'by', 'drop', 'every', 'drop', 'laden', 'with', 'hope', 'every', 'drop', 'laden', 'with', 'doubt']
245	They rarely talked about it, because the oldest one of the Samanas did not like this myth. 	Между собой оба друга мало говорили об этом, так как старейший из саман относился неприязненно к этой молве. 	['Между', 'собой', 'оба', 'друга', 'мало', 'говорили', 'об', 'этом', 'так', 'как', 'старейший', 'из', 'саман', 'относился', 'неприязненно', 'к', 'этой', 'молве']	['They', 'rarely', 'talked', 'about', 'it', 'because', 'the', 'oldest', 'one', 'of', 'the', 'Samanas', 'did', 'not', 'like', 'this', 'myth']
246	He had heard that this alleged Buddha used to be an ascetic before and had lived in the forest, but had then turned back to luxury and worldly pleasures, and he had no high opinion of this Gotama. 	Он слышал, что этот якобы Будда раньше был аскетом и жил в лесу, но потом вернулся к мирской жизни и наслаждениям, и это внушило ему дурное мнение о Гаутаме. 	['Он', 'слышал', 'что', 'этот', 'якобы', 'Будда', 'раньше', 'был', 'аскетом', 'и', 'жил', 'в', 'лесу', 'но', 'потом', 'вернулся', 'к', 'мирской', 'жизни', 'и', 'наслаждениям', 'и', 'это', 'внушило', 'ему', 'дурное', 'мнение', 'о', 'Гаутаме']	['He', 'had', 'heard', 'that', 'this', 'alleged', 'Buddha', 'used', 'to', 'be', 'an', 'ascetic', 'before', 'and', 'had', 'lived', 'in', 'the', 'forest', 'but', 'had', 'then', 'turned', 'back', 'to', 'luxury', 'and', 'worldly', 'pleasures', 'and', 'he', 'had', 'no', 'high', 'opinion', 'of', 'this', 'Gotama']
247	"""Oh Siddhartha,"" Govinda spoke one day to his friend. "	– О Сиддхартха, – сказал однажды Говинда своему другу, – я сегодня был в деревне, и один брахман предложил мне войти к нему в дом. 	['–', 'О', 'Сиддхартха', '–', 'сказал', 'однажды', 'Говинда', 'своему', 'другу', '–', 'я', 'сегодня', 'был', 'в', 'деревне', 'и', 'один', 'брахман', 'предложил', 'мне', 'войти', 'к', 'нему', 'в', 'дом']	['Oh', 'Siddhartha', 'Govinda', 'spoke', 'one', 'day', 'to', 'his', 'friend']
248	"""Today, I was in the village, and a Brahman invited me into his house, and in his house, there was the son of a Brahman from Magadha, who has seen the Buddha with his own eyes and has heard him teach. "	Там оказался сын брахмана из Магадхи, который видел Будду собственными глазами и слышал его проповедь. 	['Там', 'оказался', 'сын', 'брахмана', 'из', 'Магадхи', 'который', 'видел', 'Будду', 'собственными', 'глазами', 'и', 'слышал', 'его', 'проповедь']	['Today', 'I', 'was', 'in', 'the', 'village', 'and', 'a', 'Brahman', 'invited', 'me', 'into', 'his', 'house', 'and', 'in', 'his', 'house', 'there', 'was', 'the', 'son', 'of', 'a', 'Brahman', 'from', 'Magadha', 'who', 'has', 'seen', 'the', 'Buddha', 'with', 'his', 'own', 'eyes', 'and', 'has', 'heard', 'him', 'teach']
249	Verily, this made my chest ache when I breathed, and thought to myself: If only I would too, if only we both would too, Siddhartha and me, live to see the hour when we will hear the teachings from the mouth of this perfected man! 	Поистине, у меня дыхание сперлось в груди, и я подумал: «О, если бы и я, если бы мы оба, Сиддхартха и я, сподобились услышать учение из уст Того Совершенного!» 	['Поистине', 'у', 'меня', 'дыхание', 'сперлось', 'в', 'груди', 'и', 'я', 'подумал', '«О', 'если', 'бы', 'и', 'я', 'если', 'бы', 'мы', 'оба', 'Сиддхартха', 'и', 'я', 'сподобились', 'услышать', 'учение', 'из', 'уст', 'Того', 'Совершенного!»']	['Verily', 'this', 'made', 'my', 'chest', 'ache', 'when', 'I', 'breathed', 'and', 'thought', 'to', 'myself', 'If', 'only', 'I', 'would', 'too', 'if', 'only', 'we', 'both', 'would', 'too', 'Siddhartha', 'and', 'me', 'live', 'to', 'see', 'the', 'hour', 'when', 'we', 'will', 'hear', 'the', 'teachings', 'from', 'the', 'mouth', 'of', 'this', 'perfected', 'man']
250	"Speak, friend, wouldn't we want to go there too and listen to the teachings from the Buddha's mouth?"" "	Скажи, друг мой, не пойти ли и нам туда, чтобы слушать проповедь самого Будды? 	['Скажи', 'друг', 'мой', 'не', 'пойти', 'ли', 'и', 'нам', 'туда', 'чтобы', 'слушать', 'проповедь', 'самого', 'Будды']	"['Speak', 'friend', ""wouldn't"", 'we', 'want', 'to', 'go', 'there', 'too', 'and', 'listen', 'to', 'the', 'teachings', 'from', 'the', ""Buddha's"", 'mouth']"
251	Quoth Siddhartha: 	И ответил Сиддхартха: 	['И', 'ответил', 'Сиддхартха']	['Quoth', 'Siddhartha']
252	"""Always, oh Govinda, I had thought, Govinda would stay with the Samanas, always I had believed his goal was to live to be sixty and seventy years of age and to keep on practising those feats and exercises, which are becoming a Samana. "	– Я всегда, о Говинда, полагал, что ты останешься у саман, всегда думалось мне, что ты мечтаешь лишь о том, чтобы прожить свои шестьдесят или семьдесят лет, все более совершенствуясь в тех знаниях и подвигах, которые украшают саману. 	['–', 'Я', 'всегда', 'о', 'Говинда', 'полагал', 'что', 'ты', 'останешься', 'у', 'саман', 'всегда', 'думалось', 'мне', 'что', 'ты', 'мечтаешь', 'лишь', 'о', 'том', 'чтобы', 'прожить', 'свои', 'шестьдесят', 'или', 'семьдесят', 'лет', 'все', 'более', 'совершенствуясь', 'в', 'тех', 'знаниях', 'и', 'подвигах', 'которые', 'украшают', 'саману']	['Always', 'oh', 'Govinda', 'I', 'had', 'thought', 'Govinda', 'would', 'stay', 'with', 'the', 'Samanas', 'always', 'I', 'had', 'believed', 'his', 'goal', 'was', 'to', 'live', 'to', 'be', 'sixty', 'and', 'seventy', 'years', 'of', 'age', 'and', 'to', 'keep', 'on', 'practising', 'those', 'feats', 'and', 'exercises', 'which', 'are', 'becoming', 'a', 'Samana']
253	"But behold, I had not known Govinda well enough, I knew little of his heart. So now you, my faithful friend, want to take a new path and go there, where the Buddha spreads his teachings."" "	И что же? Оказывается, что я слишком мало знал Говинду, мало проникал в сердце, оказывается, что ты, дорогой, хочешь вступить на новую стезю и идти туда, где Будда возвещает свое учение. 	['И', 'что', 'же', 'Оказывается', 'что', 'я', 'слишком', 'мало', 'знал', 'Говинду', 'мало', 'проникал', 'в', 'сердце', 'оказывается', 'что', 'ты', 'дорогой', 'хочешь', 'вступить', 'на', 'новую', 'стезю', 'и', 'идти', 'туда', 'где', 'Будда', 'возвещает', 'свое', 'учение']	['But', 'behold', 'I', 'had', 'not', 'known', 'Govinda', 'well', 'enough', 'I', 'knew', 'little', 'of', 'his', 'heart', 'So', 'now', 'you', 'my', 'faithful', 'friend', 'want', 'to', 'take', 'a', 'new', 'path', 'and', 'go', 'there', 'where', 'the', 'Buddha', 'spreads', 'his', 'teachings']
254	Quoth Govinda: 	И сказал Говинда: 	['И', 'сказал', 'Говинда']	['Quoth', 'Govinda']
255	"""You're mocking me. Mock me if you like, Siddhartha! "	– Тебе угодно насмехаться надо мной – что ж, смейся. Сиддхартха! 	['–', 'Тебе', 'угодно', 'насмехаться', 'надо', 'мной', '–', 'что', 'ж', 'смейся', 'Сиддхартха']	"[""You're"", 'mocking', 'me', 'Mock', 'me', 'if', 'you', 'like', 'Siddhartha']"
256	"But have you not also developed a desire, an eagerness, to hear these teachings? And have you not at one time said to me, you would not walk the path of the Samanas for much longer?"" "	Но разве и в тебе не проснулось желание услышать это учение?… И не ты ли когда‑то говорил мне, что уже не долго будешь ходить по стезе саман? 	['Но', 'разве', 'и', 'в', 'тебе', 'не', 'проснулось', 'желание', 'услышать', 'это', 'учение?…', 'И', 'не', 'ты', 'ли', 'когда‑то', 'говорил', 'мне', 'что', 'уже', 'не', 'долго', 'будешь', 'ходить', 'по', 'стезе', 'саман']	['But', 'have', 'you', 'not', 'also', 'developed', 'a', 'desire', 'an', 'eagerness', 'to', 'hear', 'these', 'teachings', 'And', 'have', 'you', 'not', 'at', 'one', 'time', 'said', 'to', 'me', 'you', 'would', 'not', 'walk', 'the', 'path', 'of', 'the', 'Samanas', 'for', 'much', 'longer']
257	At this, Siddhartha laughed in his very own manner, in which his voice assumed a touch of sadness and a touch of mockery, and said: 	Тогда Сиддхартха засмеялся своим особенным, ему одному свойственным смехом, и голосом, в котором звучала и легкая печаль, и легкая насмешка, сказал: 	['Тогда', 'Сиддхартха', 'засмеялся', 'своим', 'особенным', 'ему', 'одному', 'свойственным', 'смехом', 'и', 'голосом', 'в', 'котором', 'звучала', 'и', 'легкая', 'печаль', 'и', 'легкая', 'насмешка', 'сказал']	['At', 'this', 'Siddhartha', 'laughed', 'in', 'his', 'very', 'own', 'manner', 'in', 'which', 'his', 'voice', 'assumed', 'a', 'touch', 'of', 'sadness', 'and', 'a', 'touch', 'of', 'mockery', 'and', 'said']
258	"""Well, Govinda, you've spoken well, you've remembered correctly. "	– Ты прав, Говинда. Верно то, что ты говоришь, и верно ты запомнил мои слова. 	['–', 'Ты', 'прав', 'Говинда', 'Верно', 'то', 'что', 'ты', 'говоришь', 'и', 'верно', 'ты', 'запомнил', 'мои', 'слова']	"['Well', 'Govinda', ""you've"", 'spoken', 'well', ""you've"", 'remembered', 'correctly']"
259	If you only remembered the other thing as well, you've heard from me, which is that I have grown distrustful and tired against teachings and learning, and that my faith in words, which are brought to us by teachers, is small. 	Но припомни и другое, сказанное мною тогда же – а именно: что я утратил веру во всякие учения и проповедь, что у меня мало доверия к словам, которые мы слышим от учителей. 	['Но', 'припомни', 'и', 'другое', 'сказанное', 'мною', 'тогда', 'же', '–', 'а', 'именно', 'что', 'я', 'утратил', 'веру', 'во', 'всякие', 'учения', 'и', 'проповедь', 'что', 'у', 'меня', 'мало', 'доверия', 'к', 'словам', 'которые', 'мы', 'слышим', 'от', 'учителей']	"['If', 'you', 'only', 'remembered', 'the', 'other', 'thing', 'as', 'well', ""you've"", 'heard', 'from', 'me', 'which', 'is', 'that', 'I', 'have', 'grown', 'distrustful', 'and', 'tired', 'against', 'teachings', 'and', 'learning', 'and', 'that', 'my', 'faith', 'in', 'words', 'which', 'are', 'brought', 'to', 'us', 'by', 'teachers', 'is', 'small']"
260	"But let's do it, my dear, I am willing to listen to these teachings—though in my heart I believe that we've already tasted the best fruit of these teachings."" "	Но все‑таки, милый, я готов услышать проповедь Будды, хотя сердце говорит мне, что лучший плод его учения мы уже вкусили. 	['Но', 'все‑таки', 'милый', 'я', 'готов', 'услышать', 'проповедь', 'Будды', 'хотя', 'сердце', 'говорит', 'мне', 'что', 'лучший', 'плод', 'его', 'учения', 'мы', 'уже', 'вкусили']	"['But', ""let's"", 'do', 'it', 'my', 'dear', 'I', 'am', 'willing', 'to', 'listen', 'to', 'these', 'teachings—though', 'in', 'my', 'heart', 'I', 'believe', 'that', ""we've"", 'already', 'tasted', 'the', 'best', 'fruit', 'of', 'these', 'teachings']"
261	Quoth Govinda: 	Говинда же сказал: 	['Говинда', 'же', 'сказал']	['Quoth', 'Govinda']
262	"""Your willingness delights my heart. "	– Твоя готовность радует мое сердце. 	['–', 'Твоя', 'готовность', 'радует', 'мое', 'сердце']	['Your', 'willingness', 'delights', 'my', 'heart']
263	But tell me, how should this be possible? 	Но скажи, как понять твои слова? 	['Но', 'скажи', 'как', 'понять', 'твои', 'слова']	['But', 'tell', 'me', 'how', 'should', 'this', 'be', 'possible']
264	"How should the Gotama's teachings, even before we have heard them, have already revealed their best fruit to us?"" "	Каким образом мы могли вкусить лучший плод от учения Гаутаиы еще раньше, чем услыхали самое учение? 	['Каким', 'образом', 'мы', 'могли', 'вкусить', 'лучший', 'плод', 'от', 'учения', 'Гаутаиы', 'еще', 'раньше', 'чем', 'услыхали', 'самое', 'учение']	"['How', 'should', 'the', ""Gotama's"", 'teachings', 'even', 'before', 'we', 'have', 'heard', 'them', 'have', 'already', 'revealed', 'their', 'best', 'fruit', 'to', 'us']"
265	Quoth Siddhartha: 	И сказал Сиддхартха: 	['И', 'сказал', 'Сиддхартха']	['Quoth', 'Siddhartha']
266	"""Let us eat this fruit and wait for the rest, oh Govinda! "	– Будем наслаждаться этим плодом и ждать дальнейшего, о Говинда! 	['–', 'Будем', 'наслаждаться', 'этим', 'плодом', 'и', 'ждать', 'дальнейшего', 'о', 'Говинда']	['Let', 'us', 'eat', 'this', 'fruit', 'and', 'wait', 'for', 'the', 'rest', 'oh', 'Govinda']
267	"But this fruit, which we already now received thanks to the Gotama, consisted in him calling us away from the Samanas! Whether he has also other and better things to give us, oh friend, let us await with calm hearts."" "	Плод же, которым мы и теперь уже обязаны учению Гаутамы, заключается в том, что оно побуждает нас покинуть саман… Даст ли оно нам еще иное и лучшее, о друг мой, покажет будущее – будем ждать этого со спокойным сердцем. 	['Плод', 'же', 'которым', 'мы', 'и', 'теперь', 'уже', 'обязаны', 'учению', 'Гаутамы', 'заключается', 'в', 'том', 'что', 'оно', 'побуждает', 'нас', 'покинуть', 'саман…', 'Даст', 'ли', 'оно', 'нам', 'еще', 'иное', 'и', 'лучшее', 'о', 'друг', 'мой', 'покажет', 'будущее', '–', 'будем', 'ждать', 'этого', 'со', 'спокойным', 'сердцем']	['But', 'this', 'fruit', 'which', 'we', 'already', 'now', 'received', 'thanks', 'to', 'the', 'Gotama', 'consisted', 'in', 'him', 'calling', 'us', 'away', 'from', 'the', 'Samanas', 'Whether', 'he', 'has', 'also', 'other', 'and', 'better', 'things', 'to', 'give', 'us', 'oh', 'friend', 'let', 'us', 'await', 'with', 'calm', 'hearts']
268	On this very same day, Siddhartha informed the oldest one of the Samanas of his decision, that he wanted to leave him. 	В тот же день Сиддхартха сообщил старшему из саман, что они порешили уйти от них. 	['В', 'тот', 'же', 'день', 'Сиддхартха', 'сообщил', 'старшему', 'из', 'саман', 'что', 'они', 'порешили', 'уйти', 'от', 'них']	['On', 'this', 'very', 'same', 'day', 'Siddhartha', 'informed', 'the', 'oldest', 'one', 'of', 'the', 'Samanas', 'of', 'his', 'decision', 'that', 'he', 'wanted', 'to', 'leave', 'him']
