	en	ru	ru_tokens	en_tokens
333	"""You have heard the teachings well, it has come to you well. "	– Вы слышали учение, слышали, чего оно требует. 	['–', 'Вы', 'слышали', 'учение', 'слышали', 'чего', 'оно', 'требует']	['You', 'have', 'heard', 'the', 'teachings', 'well', 'it', 'has', 'come', 'to', 'you', 'well']
334	"Thus join us and walk in holiness, to put an end to all suffering."" "	Придите же к нам и живите в святости, дабы положить конец всякому страданию. 	['Придите', 'же', 'к', 'нам', 'и', 'живите', 'в', 'святости', 'дабы', 'положить', 'конец', 'всякому', 'страданию']	['Thus', 'join', 'us', 'and', 'walk', 'in', 'holiness', 'to', 'put', 'an', 'end', 'to', 'all', 'suffering']
335	Behold, then Govinda, the shy one, also stepped forward and spoke: 	И тут – о диво – выступил Говинда, всегда такой робкий, и со словами: 	['И', 'тут', '–', 'о', 'диво', '–', 'выступил', 'Говинда', 'всегда', 'такой', 'робкий', 'и', 'со', 'словами']	['Behold', 'then', 'Govinda', 'the', 'shy', 'one', 'also', 'stepped', 'forward', 'and', 'spoke']
336	"""I also take my refuge in the exalted one and his teachings,"" and he asked to accepted into the community of his disciples and was accepted. "	«И я прибегаю к Возвышенному и его учению», – попросил принять его в среду учеников, и был принят. 	['«И', 'я', 'прибегаю', 'к', 'Возвышенному', 'и', 'его', 'учению»', '–', 'попросил', 'принять', 'его', 'в', 'среду', 'учеников', 'и', 'был', 'принят']	['I', 'also', 'take', 'my', 'refuge', 'in', 'the', 'exalted', 'one', 'and', 'his', 'teachings', 'and', 'he', 'asked', 'to', 'accepted', 'into', 'the', 'community', 'of', 'his', 'disciples', 'and', 'was', 'accepted']
337	Right afterwards, when the Buddha had retired for the night, Govinda turned to Siddhartha and spoke eagerly: 	Вслед за тем, как Будда удалился для ночного отдыха, Говинда горячо обратился к Сиддхартхе: 	['Вслед', 'за', 'тем', 'как', 'Будда', 'удалился', 'для', 'ночного', 'отдыха', 'Говинда', 'горячо', 'обратился', 'к', 'Сиддхартхе']	['Right', 'afterwards', 'when', 'the', 'Buddha', 'had', 'retired', 'for', 'the', 'night', 'Govinda', 'turned', 'to', 'Siddhartha', 'and', 'spoke', 'eagerly']
338	"""Siddhartha, it is not my place to scold you. "	– Сиддхартха, не подобает мне делать тебе упреки. 	['–', 'Сиддхартха', 'не', 'подобает', 'мне', 'делать', 'тебе', 'упреки']	['Siddhartha', 'it', 'is', 'not', 'my', 'place', 'to', 'scold', 'you']
339	We have both heard the exalted one, we have both perceived the teachings. 	Оба мы слышали Возвышенного, слышали его учение. 	['Оба', 'мы', 'слышали', 'Возвышенного', 'слышали', 'его', 'учение']	['We', 'have', 'both', 'heard', 'the', 'exalted', 'one', 'we', 'have', 'both', 'perceived', 'the', 'teachings']
340	Govinda has heard the teachings, he has taken refuge in it. 	Говинда внял ему и стал его учеником. 	['Говинда', 'внял', 'ему', 'и', 'стал', 'его', 'учеником']	['Govinda', 'has', 'heard', 'the', 'teachings', 'he', 'has', 'taken', 'refuge', 'in', 'it']
341	But you, my honoured friend, don't you also want to walk the path of salvation? 	Ты же, столь почитаемый мною, неужели не хочешь идти по стезе спасения? 	['Ты', 'же', 'столь', 'почитаемый', 'мною', 'неужели', 'не', 'хочешь', 'идти', 'по', 'стезе', 'спасения']	"['But', 'you', 'my', 'honoured', 'friend', ""don't"", 'you', 'also', 'want', 'to', 'walk', 'the', 'path', 'of', 'salvation']"
342	"Would you want to hesitate, do you want to wait any longer?"" "	Неужели ты еще колеблешься, хочешь обождать? 	['Неужели', 'ты', 'еще', 'колеблешься', 'хочешь', 'обождать']	['Would', 'you', 'want', 'to', 'hesitate', 'do', 'you', 'want', 'to', 'wait', 'any', 'longer']
343	Siddhartha awakened as if he had been asleep, when he heard Govinda's words. For a long tome, he looked into Govinda's face. 	Сиддхартха словно пробудился от сна, услыхав слова Говинды, Долго глядел он в лицо друга. 	['Сиддхартха', 'словно', 'пробудился', 'от', 'сна', 'услыхав', 'слова', 'Говинды', 'Долго', 'глядел', 'он', 'в', 'лицо', 'друга']	"['Siddhartha', 'awakened', 'as', 'if', 'he', 'had', 'been', 'asleep', 'when', 'he', 'heard', ""Govinda's"", 'words', 'For', 'a', 'long', 'tome', 'he', 'looked', 'into', ""Govinda's"", 'face']"
344	Then he spoke quietly, in a voice without mockery: 	Потом тихо, без малейшей насмешки в голосе, произнес: 	['Потом', 'тихо', 'без', 'малейшей', 'насмешки', 'в', 'голосе', 'произнес']	['Then', 'he', 'spoke', 'quietly', 'in', 'a', 'voice', 'without', 'mockery']
345	"""Govinda, my friend, now you have taken this step, now you have chosen this path. "	– Говинда, друг мои, наконец‑то ты сделал решительный шаг, наконец‑то сам избрал свой путь. 	['–', 'Говинда', 'друг', 'мои', 'наконец‑то', 'ты', 'сделал', 'решительный', 'шаг', 'наконец‑то', 'сам', 'избрал', 'свой', 'путь']	['Govinda', 'my', 'friend', 'now', 'you', 'have', 'taken', 'this', 'step', 'now', 'you', 'have', 'chosen', 'this', 'path']
346	Always, oh Govinda, you've been my friend, you've always walked one step behind me. 	Всегда, о Говинда, ты был лишь моим другом, всегда шел только следом за мной. 	['Всегда', 'о', 'Говинда', 'ты', 'был', 'лишь', 'моим', 'другом', 'всегда', 'шел', 'только', 'следом', 'за', 'мной']	"['Always', 'oh', 'Govinda', ""you've"", 'been', 'my', 'friend', ""you've"", 'always', 'walked', 'one', 'step', 'behind', 'me']"
347	Often I have thought: Won't Govinda for once also take a step by himself, without me, out of his own soul? 	Часто думалось мне: неужели Говинда никогда не сделает шага самостоятельно, без меня, по собственному почину? 	['Часто', 'думалось', 'мне', 'неужели', 'Говинда', 'никогда', 'не', 'сделает', 'шага', 'самостоятельно', 'без', 'меня', 'по', 'собственному', 'почину']	"['Often', 'I', 'have', 'thought', ""Won't"", 'Govinda', 'for', 'once', 'also', 'take', 'a', 'step', 'by', 'himself', 'without', 'me', 'out', 'of', 'his', 'own', 'soul']"
348	Behold, now you've turned into a man and are choosing your path for yourself. 	И вот ты возмужал наконец и сам избираешь свой путь. 	['И', 'вот', 'ты', 'возмужал', 'наконец', 'и', 'сам', 'избираешь', 'свой', 'путь']	"['Behold', 'now', ""you've"", 'turned', 'into', 'a', 'man', 'and', 'are', 'choosing', 'your', 'path', 'for', 'yourself']"
349	"I wish that you would go it up to its end, oh my friend, that you shall find salvation!"" "	Да обретешь ты на нем спасение! 	['Да', 'обретешь', 'ты', 'на', 'нем', 'спасение']	['I', 'wish', 'that', 'you', 'would', 'go', 'it', 'up', 'to', 'its', 'end', 'oh', 'my', 'friend', 'that', 'you', 'shall', 'find', 'salvation']
350	Govinda, not completely understanding it yet, repeated his question in an impatient tone: 	Но Говинда, не совсем поняв слова, повторил свой вопрос тоном нетерпения: 	['Но', 'Говинда', 'не', 'совсем', 'поняв', 'слова', 'повторил', 'свой', 'вопрос', 'тоном', 'нетерпения']	['Govinda', 'not', 'completely', 'understanding', 'it', 'yet', 'repeated', 'his', 'question', 'in', 'an', 'impatient', 'tone']
351	"""Speak up, I beg you, my dear! "	– Отвечай же, прошу тебя, мой милый. 	['–', 'Отвечай', 'же', 'прошу', 'тебя', 'мой', 'милый']	['Speak', 'up', 'I', 'beg', 'you', 'my', 'dear']
352	"Tell me, since it could not be any other way, that you also, my learned friend, will take your refuge with the exalted Buddha!"" "	Скажи мне, хотя иначе и быть не может, что и ты, мой ученый друг, изберешь своим прибежищем Возвышенного Будду. 	['Скажи', 'мне', 'хотя', 'иначе', 'и', 'быть', 'не', 'может', 'что', 'и', 'ты', 'мой', 'ученый', 'друг', 'изберешь', 'своим', 'прибежищем', 'Возвышенного', 'Будду']	['Tell', 'me', 'since', 'it', 'could', 'not', 'be', 'any', 'other', 'way', 'that', 'you', 'also', 'my', 'learned', 'friend', 'will', 'take', 'your', 'refuge', 'with', 'the', 'exalted', 'Buddha']
353	Siddhartha placed his hand on Govinda's shoulder: 	Тогда Сиддхартха положил свою руку на плечо Говинды: 	['Тогда', 'Сиддхартха', 'положил', 'свою', 'руку', 'на', 'плечо', 'Говинды']	"['Siddhartha', 'placed', 'his', 'hand', 'on', ""Govinda's"", 'shoulder']"
354	"""You failed to hear my good wish for you, oh Govinda. "	– Ты не расслышал моего напутственного пожелания, о Говинда. 	['–', 'Ты', 'не', 'расслышал', 'моего', 'напутственного', 'пожелания', 'о', 'Говинда']	['You', 'failed', 'to', 'hear', 'my', 'good', 'wish', 'for', 'you', 'oh', 'Govinda']
355	"I'm repeating it: I wish that you would go this path up to its end, that you shall find salvation!"" "	Я повторю его. Да удастся тебе пройти этот путь до конца! Да обретешь ты на нем спасение! 	['Я', 'повторю', 'его', 'Да', 'удастся', 'тебе', 'пройти', 'этот', 'путь', 'до', 'конца', 'Да', 'обретешь', 'ты', 'на', 'нем', 'спасение']	"[""I'm"", 'repeating', 'it', 'I', 'wish', 'that', 'you', 'would', 'go', 'this', 'path', 'up', 'to', 'its', 'end', 'that', 'you', 'shall', 'find', 'salvation']"
356	In this moment, Govinda realized that his friend had left him, and he started to weep. 	Тут только понял Говинда, что друг покинул его, и залился слезами. 	['Тут', 'только', 'понял', 'Говинда', 'что', 'друг', 'покинул', 'его', 'и', 'залился', 'слезами']	['In', 'this', 'moment', 'Govinda', 'realized', 'that', 'his', 'friend', 'had', 'left', 'him', 'and', 'he', 'started', 'to', 'weep']
357	"""Siddhartha!"" he exclaimed lamentingly. "	– Сиддхартха! – жалобно воскликнул он. 	['–', 'Сиддхартха', '–', 'жалобно', 'воскликнул', 'он']	['Siddhartha', 'he', 'exclaimed', 'lamentingly']
358	Siddhartha kindly spoke to him: 	Сиддхартха же ласково сказал ему: 	['Сиддхартха', 'же', 'ласково', 'сказал', 'ему']	['Siddhartha', 'kindly', 'spoke', 'to', 'him']
359	"""Don't forget, Govinda, that you are now one of the Samanas of the Buddha! "	– Не забывай, Говинда, что ты отныне принадлежишь к саманам Будды. 	['–', 'Не', 'забывай', 'Говинда', 'что', 'ты', 'отныне', 'принадлежишь', 'к', 'саманам', 'Будды']	"[""Don't"", 'forget', 'Govinda', 'that', 'you', 'are', 'now', 'one', 'of', 'the', 'Samanas', 'of', 'the', 'Buddha']"
360	You have renounced your home and your parents, renounced your birth and possessions, renounced your free will, renounced all friendship. 	Ты отрекся от родины и родных, от своего сословия и собственности, отрекся от собственной воли, отрекся от дружбы. 	['Ты', 'отрекся', 'от', 'родины', 'и', 'родных', 'от', 'своего', 'сословия', 'и', 'собственности', 'отрекся', 'от', 'собственной', 'воли', 'отрекся', 'от', 'дружбы']	['You', 'have', 'renounced', 'your', 'home', 'and', 'your', 'parents', 'renounced', 'your', 'birth', 'and', 'possessions', 'renounced', 'your', 'free', 'will', 'renounced', 'all', 'friendship']
361	This is what the teachings require, this is what the exalted one wants. 	Так требует устав, так требует Возвышенный. 	['Так', 'требует', 'устав', 'так', 'требует', 'Возвышенный']	['This', 'is', 'what', 'the', 'teachings', 'require', 'this', 'is', 'what', 'the', 'exalted', 'one', 'wants']
362	This is what you wanted for yourself. 	Ты сам захотел этого! 	['Ты', 'сам', 'захотел', 'этого']	['This', 'is', 'what', 'you', 'wanted', 'for', 'yourself']
363	"Tomorrow, oh Govinda, I'll leave you."" "	Завтра, о Говинда, я расстанусь с тобой. 	['Завтра', 'о', 'Говинда', 'я', 'расстанусь', 'с', 'тобой']	"['Tomorrow', 'oh', 'Govinda', ""I'll"", 'leave', 'you']"
364	For a long time, the friends continued walking in the grove; for a long time, they lay there and found no sleep. 	Долго еще оба друга ходили по роще, долго лежали они, не находя сна. 	['Долго', 'еще', 'оба', 'друга', 'ходили', 'по', 'роще', 'долго', 'лежали', 'они', 'не', 'находя', 'сна']	['For', 'a', 'long', 'time', 'the', 'friends', 'continued', 'walking', 'in', 'the', 'grove', 'for', 'a', 'long', 'time', 'they', 'lay', 'there', 'and', 'found', 'no', 'sleep']
365	And over and over again, Govinda urged his friend, he should tell him why he would not want to seek refuge in Gotama's teachings, what fault he would find in these teachings. 	И снова и снова Говинда умолял друга сказать ему, почему он не хочет обратиться к учению Гаутамы, какой недостаток он находит в этом учении. 	['И', 'снова', 'и', 'снова', 'Говинда', 'умолял', 'друга', 'сказать', 'ему', 'почему', 'он', 'не', 'хочет', 'обратиться', 'к', 'учению', 'Гаутамы', 'какой', 'недостаток', 'он', 'находит', 'в', 'этом', 'учении']	"['And', 'over', 'and', 'over', 'again', 'Govinda', 'urged', 'his', 'friend', 'he', 'should', 'tell', 'him', 'why', 'he', 'would', 'not', 'want', 'to', 'seek', 'refuge', 'in', ""Gotama's"", 'teachings', 'what', 'fault', 'he', 'would', 'find', 'in', 'these', 'teachings']"
366	But Siddhartha turned him away every time and said: 	Сиддхартха же на все просьбы отвечал словами: 	['Сиддхартха', 'же', 'на', 'все', 'просьбы', 'отвечал', 'словами']	['But', 'Siddhartha', 'turned', 'him', 'away', 'every', 'time', 'and', 'said']
367	"""Be content, Govinda! Very good are the teachings of the exalted one, how could I find a fault in them?"" "	– Успокойся, Говинда, учение Возвышенного превосходно, как могу я находить в нем недостатки? 	['–', 'Успокойся', 'Говинда', 'учение', 'Возвышенного', 'превосходно', 'как', 'могу', 'я', 'находить', 'в', 'нем', 'недостатки']	['Be', 'content', 'Govinda', 'Very', 'good', 'are', 'the', 'teachings', 'of', 'the', 'exalted', 'one', 'how', 'could', 'I', 'find', 'a', 'fault', 'in', 'them']
368	Very early in the morning, a follower of Buddha, one of his oldest monks, went through the garden and called all those to him who had as novices taken their refuge in the teachings, to dress them up in the yellow robe and to instruct them in the first teachings and duties of their position. 	Рано утром один из старейших монахов, последователей Будды, обходил парк, сзывая всех новопоступивших учеников, чтобы облачить их в желтые рясы и наставить в первых правилах и обязанностях их нового звания. 	['Рано', 'утром', 'один', 'из', 'старейших', 'монахов', 'последователей', 'Будды', 'обходил', 'парк', 'сзывая', 'всех', 'новопоступивших', 'учеников', 'чтобы', 'облачить', 'их', 'в', 'желтые', 'рясы', 'и', 'наставить', 'в', 'первых', 'правилах', 'и', 'обязанностях', 'их', 'нового', 'звания']	['Very', 'early', 'in', 'the', 'morning', 'a', 'follower', 'of', 'Buddha', 'one', 'of', 'his', 'oldest', 'monks', 'went', 'through', 'the', 'garden', 'and', 'called', 'all', 'those', 'to', 'him', 'who', 'had', 'as', 'novices', 'taken', 'their', 'refuge', 'in', 'the', 'teachings', 'to', 'dress', 'them', 'up', 'in', 'the', 'yellow', 'robe', 'and', 'to', 'instruct', 'them', 'in', 'the', 'first', 'teachings', 'and', 'duties', 'of', 'their', 'position']
369	Then Govinda broke loose, embraced once again his childhood friend and left with the novices. 	Тогда Говинда сделал над собою усилие, еще раз обнял своего друга молодости и присоединился к шествию послушников. 	['Тогда', 'Говинда', 'сделал', 'над', 'собою', 'усилие', 'еще', 'раз', 'обнял', 'своего', 'друга', 'молодости', 'и', 'присоединился', 'к', 'шествию', 'послушников']	['Then', 'Govinda', 'broke', 'loose', 'embraced', 'once', 'again', 'his', 'childhood', 'friend', 'and', 'left', 'with', 'the', 'novices']
370	But Siddhartha walked through the grove, lost in thought. 	Сиддхартха в глубокой задумчивости стал прохаживаться по роще. 	['Сиддхартха', 'в', 'глубокой', 'задумчивости', 'стал', 'прохаживаться', 'по', 'роще']	['But', 'Siddhartha', 'walked', 'through', 'the', 'grove', 'lost', 'in', 'thought']
371	Then he happened to meet Gotama, the exalted one, and when he greeted him with respect and the Buddha's glance was so full of kindness and calm, the young man summoned his courage and asked the venerable one for the permission to talk to him. 	Тут навстречу ему попался Гаутама, и после почтительного приветствия, ободренный взглядом Будды, полным доброты и кротости, юноша попросил у Возвышенного позволения говорить с ним. 	['Тут', 'навстречу', 'ему', 'попался', 'Гаутама', 'и', 'после', 'почтительного', 'приветствия', 'ободренный', 'взглядом', 'Будды', 'полным', 'доброты', 'и', 'кротости', 'юноша', 'попросил', 'у', 'Возвышенного', 'позволения', 'говорить', 'с', 'ним']	"['Then', 'he', 'happened', 'to', 'meet', 'Gotama', 'the', 'exalted', 'one', 'and', 'when', 'he', 'greeted', 'him', 'with', 'respect', 'and', 'the', ""Buddha's"", 'glance', 'was', 'so', 'full', 'of', 'kindness', 'and', 'calm', 'the', 'young', 'man', 'summoned', 'his', 'courage', 'and', 'asked', 'the', 'venerable', 'one', 'for', 'the', 'permission', 'to', 'talk', 'to', 'him']"
372	Silently the exalted one nodded his approval. 	Безмолвным наклонением головы тот выразил согласие. 	['Безмолвным', 'наклонением', 'головы', 'тот', 'выразил', 'согласие']	['Silently', 'the', 'exalted', 'one', 'nodded', 'his', 'approval']
373	Quoth Siddhartha: 	Тогда Сиддхартха сказал: 	['Тогда', 'Сиддхартха', 'сказал']	['Quoth', 'Siddhartha']
374	"""Yesterday, oh exalted one, I had been privileged to hear your wondrous teachings. "	– Вчера, о Возвышенный, я имел счастье слушать твое дивное учение. 	['–', 'Вчера', 'о', 'Возвышенный', 'я', 'имел', 'счастье', 'слушать', 'твое', 'дивное', 'учение']	['Yesterday', 'oh', 'exalted', 'one', 'I', 'had', 'been', 'privileged', 'to', 'hear', 'your', 'wondrous', 'teachings']
375	Together with my friend, I had come from afar, to hear your teachings. 	Вместе с моим другом я прибыл издалека, чтобы услышать его. 	['Вместе', 'с', 'моим', 'другом', 'я', 'прибыл', 'издалека', 'чтобы', 'услышать', 'его']	['Together', 'with', 'my', 'friend', 'I', 'had', 'come', 'from', 'afar', 'to', 'hear', 'your', 'teachings']
376	And now my friend is going to stay with your people, he has taken his refuge with you. 	И вот мой друг остается с твоими учениками, он принял твое учение. 	['И', 'вот', 'мой', 'друг', 'остается', 'с', 'твоими', 'учениками', 'он', 'принял', 'твое', 'учение']	['And', 'now', 'my', 'friend', 'is', 'going', 'to', 'stay', 'with', 'your', 'people', 'he', 'has', 'taken', 'his', 'refuge', 'with', 'you']
377	"But I will again start on my pilgrimage."" "	Я же снова отправляюсь в странствие. 	['Я', 'же', 'снова', 'отправляюсь', 'в', 'странствие']	['But', 'I', 'will', 'again', 'start', 'on', 'my', 'pilgrimage']
378	"""As you please,"" the venerable one spoke politely. "	– Как тебе угодно, – учтиво заметил Возвышенный. 	['–', 'Как', 'тебе', 'угодно', '–', 'учтиво', 'заметил', 'Возвышенный']	['As', 'you', 'please', 'the', 'venerable', 'one', 'spoke', 'politely']
379	"""Too bold is my speech,"" Siddhartha continued, ""but I do not want to leave the exalted one without having honestly told him my thoughts. "	– Слишком смела моя речь, – продолжал Сиддхартха, – но мне не хотелось бы уходить от Возвышенного, не высказав перед ним с полной искренностью своих мыслей. 	['–', 'Слишком', 'смела', 'моя', 'речь', '–', 'продолжал', 'Сиддхартха', '–', 'но', 'мне', 'не', 'хотелось', 'бы', 'уходить', 'от', 'Возвышенного', 'не', 'высказав', 'перед', 'ним', 'с', 'полной', 'искренностью', 'своих', 'мыслей']	['Too', 'bold', 'is', 'my', 'speech', 'Siddhartha', 'continued', 'but', 'I', 'do', 'not', 'want', 'to', 'leave', 'the', 'exalted', 'one', 'without', 'having', 'honestly', 'told', 'him', 'my', 'thoughts']
380	"Does it please the venerable one to listen to me for one moment longer?"" "	Соблаговолит ли Достопочтенный уделить мне еще минуту внимания? 	['Соблаговолит', 'ли', 'Достопочтенный', 'уделить', 'мне', 'еще', 'минуту', 'внимания']	['Does', 'it', 'please', 'the', 'venerable', 'one', 'to', 'listen', 'to', 'me', 'for', 'one', 'moment', 'longer']
381	Silently, the Buddha nodded his approval. 	Будда молча кивнул головой в знак согласия. 	['Будда', 'молча', 'кивнул', 'головой', 'в', 'знак', 'согласия']	['Silently', 'the', 'Buddha', 'nodded', 'his', 'approval']
382	Quoth Siddhartha: 	– Одно, о Возвышенный, – продолжал Сиддхартха, – в особенности восхищает меня в твоем учении. 	['–', 'Одно', 'о', 'Возвышенный', '–', 'продолжал', 'Сиддхартха', '–', 'в', 'особенности', 'восхищает', 'меня', 'в', 'твоем', 'учении']	['Quoth', 'Siddhartha']
