	en	ru
0	RAY BRADBURY  FAHRENHEIT 451  This one, with gratitude, is for DON CONGDON.  FAHRENHEIT 451:  The temperature at which book-paper catches fire and burns 	"Рэй Брэдбери. 451 градус по Фаренгейту --------------------------------------------------------------- Перевод Т. Шинкарь Изд: Рэй  Брэдбери ""О скитаниях вечных и о Земле"". Изд. ""Правда"", 1987. OCR: Петр Лоскутов (peter@mail.ur.ru) --------------------------------------------------------------- 451o по Фаренгейту - температура, при которой воспламеняется и горит бумага. ДОНУ КОНГДОНУ С БЛАГОДАРНОСТЬЮ Если тебе дадут линованную бумагу, пиши поперек. Хуан Рамон Хименес "
1	PART I  IT WAS A PLEASURE TO BURN  IT was a special pleasure to see things eaten, to see things blackened and changed. 	Часть 1. ОЧАГ И САЛАМАНДРА Жечь  было наслаждением. Какое-то особое наслаждение видеть, как  огонь пожирает  вещи, как они чернеют и  меняются. 
2	With the brass nozzle in his fists, with this great python spitting its venomous  kerosene upon the world, the blood pounded in his head, and his hands were the  hands of some amazing conductor playing all the symphonies of blazing and burning  to bring down the tatters and charcoal ruins of history. 	Медный  наконечник  брандспойта зажат в кулаках, громадный питон  изрыгает на  мир  ядовитую струю керосина, кровь  стучит  в  висках,  а  руки  кажутся   руками  диковинного  дирижера, исполняющего симфонию огня  и  разрушения,  превращая  в  пепел  изорванные, обуглившиеся страницы истории. 
3	With his symbolic helmet  numbered 451 on his stolid head, and his eyes all orange flame with the thought of  what came next, he flicked the igniter and the house jumped up in a gorging fire that  burned the evening sky red and yellow and black. 	Символический  шлем,  украшенный цифрой 451, низко  надвинут на лоб, глаза сверкают  оранжевым пламенем  при мысли о том, что должно сейчас произойти:  он  нажимает  воспламенитель  -  и огонь жадно бросается на  дом,  окрашивая вечернее небо в багрово-желто-черные тона. 
4	He strode in a swarm of fireflies. He wanted above all, like the old joke, to shove a marshmallow on a stick in the  furnace, while the flapping pigeon-winged books died on the porch and lawn of the  house. While the books went up in sparkling whirls and blew away on a wind turned  dark with burning. 	Он шагает в рое огненно-красных светляков,  и больше всего  ему хочется сделать сейчас то, чем он  так часто забавлялся в  детстве,- сунуть в огонь прутик с леденцом, пока книги, как  голуби, шелестя крыльями-страницами,  умирают  на крыльце и на лужайке перед домом, они взлетают в огненном вихре, и черный от копоти ветер уносит их прочь. 
5	Montag grinned the fierce grin of all men singed and driven back by flame. 	Жесткая  улыбка  застыла  на  лице  Монтэга,  улыбка-гримаса,   которая появляется  на  губах  у  человека,  когда  его  вдруг  опалит  огнем  и  он стремительно отпрянет назад от его жаркого прикосновения. 
6	He knew that when he returned to the firehouse, he might wink at himself, a minstrel  man, burnt-corked, in the mirror. 	Он знал, что, вернувшись в пожарное депо, он, менестрель огня, взглянув в зеркало, дружески подмигнет своему  обожженному, измазанному сажей лицу. 
7	Later, going to sleep, he would feel the fiery smile  still gripped by his face muscles, in the dark. 	И позже  в  темноте,  уже  засыпая,  он  все  еще  будет чувствовать на  губах застывшую  судорожную улыбку. 
8	It never went away, that. smile, it never  ever went away, as long as he remembered. 	Она  никогда  не покидала  его лица,  никогда, сколько он себя помнит. 
9	He hung up his black-beetle-coloured helmet and shined it, he hung his flameproof  jacket neatly; he showered luxuriously, and then, whistling, hands in pockets, walked  across the upper floor of the fire station and fell down the hole. 	Он тщательно вытер и повесил на гвоздь черный блестящий шлем, аккуратно повесил рядом брезентовую куртку, с наслаждением вымылся  под сильной струей душа и, насвистывая,  сунув руки в карманы, пересек площадку верхнего  этажа пожарной станции и скользнул в люк. 
10	At the last moment,  when disaster seemed positive, he pulled his hands from his pockets and broke his  fall by grasping the golden pole. He slid to a squeaking halt, the heels one inch from  the concrete floor downstairs. 	В  последнюю  секунду, когда  катастрофа уже казалась неизбежной,  он  выдернул руки из карманов,  обхватил блестящий бронзовый  шест  и со  скрипом затормозил  за  миг до  того,  как  его  ноги коснулись цементного пола нижнего этажа. 
11	He walked out of the fire station and along the midnight street toward the subway  where the silent, air-propelled train slid soundlessly down its lubricated flue in the  earth and let him out with a great puff of warm air an to the cream-tiled escalator  rising to the suburb. 	Выйдя  на  пустынную  ночную улицу, он  направился  к  метро. Бесшумный пневматический поезд поглотил его, пролетел, как челнок, по хорошо смазанной трубе подземного туннеля и вместе с сильной  струей теплого воздуха выбросил на  выложенный желтыми плитками эскалатор, ведущий на поверхность в одном из пригородов. 
12	Whistling, he let the escalator waft him into the still night air. 	Насвистывая,  Монтэг поднялся на эскалаторе навстречу ночной тишине. 
13	He walked toward the  comer, thinking little at all about nothing in particular. 	Не думая ни  о чем,  во  всяком случае, ни о  чем  в  особенности,  он дошел до поворота. 
14	Before he reached the corner,  however, he slowed as if a wind had sprung up from nowhere, as if someone had  called his name. 	Но еще  раньше,  чем  выйти на угол,  он вдруг замедлил  шаги, как будто ветер, налетев откуда-то, ударил ему в лицо или кто-то окликнул его по имени. 
15	The last few nights he had had the most uncertain feelings about the sidewalk just  around the corner here, moving in the starlight toward his house. 	Уже  несколько   раз,  приближаясь  вечером  к  повороту,  за   которым освещенный звездами  тротуар  вел  к  его дому,  он  испытывал это  странное чувство. 
16	He had felt that a  moment before his making the turn, someone had been there. 	Ему казалось, что за мгновение до того, как ему повернуть, за углом кто-то стоял. 
17	The air seemed  charged with a special calm as if someone had waited there, quietly, and only a  moment before he came, simply turned to a shadow and let him through. 	В  воздухе  была  какая-то особая тишина,  словно там, в  двух шагах, кто-то  притаился и  ждал и лишь за  секунду  до его  появления вдруг превратился в тень и пропустил его сквозь себя. 
18	Perhaps his  nose detected a faint perfume, perhaps the skin on the backs of his hands, on his  face, felt the temperature rise at this one spot where a person's standing might raise the immediate atmosphere ten degrees for an instant. 	Может быть, его ноздри улавливали слабый аромат, может быть, кожей лица и рук  он ощущал чуть заметное  повышение температуры вблизи того места, где стоял  кто-то  невидимый, согревая воздух  своим  теплом. 
19	There was no understanding it. 	Понять  это  было невозможно. 
20	Each time he made the turn, he saw only the white, unused, buckling sidewalk, with  perhaps, on one night, something vanishing swiftly across a lawn before he could  focus his eyes or speak. 	Однако,  завернув за угол, он всякий раз видел лишь  белые плиты пустынного  тротуара. Только  однажды  ему показалось,  будто  чья-то  тень мелькнула через лужайку, но все  исчезло,  прежде чем он смог вглядеться или произнести хоть слово. 
21	But now, tonight, he slowed almost to a stop. 	Сегодня  же у поворота  он так замедлил шаги,  что  почти  остановился. 
22	His inner mind, reaching out to turn the  corner for him, had heard the faintest whisper. 	Мысленно он  уже был за углом - и  уловил слабый шорох. 
23	Breathing? 	Чье-то  дыхание? 
24	Or was the atmosphere  compressed merely by someone standing very quietly there, waiting? 	Или движение  воздуха, вызванное  присутствием  кого-то,  кто очень тихо стоял и ждал? 
25	He turned the corner. 	Он завернул за угол. 
26	The autumn leaves blew over the moonlit pavement in such a way as to make the girl  who was moving there seem fixed to a sliding walk, letting the motion of the wind and  the leaves carry her forward. 	По  залитому  лунным  светом  тротуару  ветер  гнал  осенние листья,  и казалось, что идущая навстречу девушка не переступает по плитам, а  скользит над ними, подгоняемая ветром и листвой. 
27	Her head was half bent to watch her shoes stir the  circling leaves. 	Слегка нагнув голову,  она смотрела, как носки ее туфель задевают кружащуюся  листву. 
28	Her face was slender and milk-white, and in it was a kind of gentle  hunger that touched over everything with tireless curiosity. 	Ее тонкое  матовой белизны лицо  светилось  ласковым,  неутолимым  любопытством. Оно  выражало  легкое удивление. 
29	It was a look, almost, of  pale surprise; the dark eyes were so fixed to the world that no move escaped them. 	Темные глаза так пытливо смотрели на мир, что, казалось, ничто не могло от них ускользнуть. 
30	Her dress was white and it whispered. 	На ней было белое  платье, оно шелестело. 
31	He almost thought he heard the motion of her  hands as she walked, and the infinitely small sound now, the white stir of her face  turning when she discovered she was a moment away from a man who stood in the  middle of the pavement waiting. 	Монтэгу чудилось, что он слышит каждое движение  ее рук в такт шагам, что он услышал даже тот легчайший,  неуловимый  для слуха  звук -  светлый  трепет ее лица, когда, подняв голову, она увидела  вдруг,  что лишь несколько шагов отделяют ее от мужчины, стоящего посреди тротуара. 
32	The trees overhead made a great sound of letting down their dry rain. 	Ветви  над их  головами, шурша,  роняли  сухой  дождь  листьев. 
33	The girl  stopped and looked as if she might pull back in surprise, but instead stood regarding  Montag with eyes so dark and shining and alive, that he felt he had said something  quite wonderful. 	Девушка остановилась. Казалось, она готова была отпрянуть назад, но  вместо того она пристально  поглядела на  Монтэга, и  ее темные, лучистые, живые  глаза  так просияли, как будто  он сказал ей что-то необыкновенно  хорошее. 
34	But he knew his mouth had only moved to say hello, and then when  she seemed hypnotized by the salamander on his arm and the phoenix-disc on his  chest, he spoke again. 	Но он знал, что его губы  произнесли лишь простое приветствие. Потом, видя, что девушка, как завороженная, смотрит на изображение саламандры, на рукаве его тужурки и на диск с фениксом, приколотый к груди, он заговорил: 
35	"""Of course,"" he said, ""you're a new neighbour, aren't you?"" "	- Вы, очевидно, наша новая соседка? 
36	"""And you must be""-she raised her eyes from his professional symbols-""the fireman."" "	- А  вы, должно быть...-  она  наконец оторвала  глаза  от  эмблем  его профессии,- пожарник? 
37	Her voice trailed off. 	- Голос ее замер. 
38	"""How oddly you say that."" "	- Как вы странно это сказали. 
39	"""I'd-I'd have known it with my eyes shut,"" she said, slowly. "	- Я... я догадалась бы даже с закрытыми глазами,- тихо проговорила она. 
40	"""What-the smell of kerosene? "	- Запах керосина, да? 
41	"My wife always complains,"" he laughed. ""You never  wash it off completely."" "	Моя жена всегда на это жалуется.- Он засмеялся.- Дочиста его ни за что не отмоешь. 
42	"""No, you don't,"" she said, in awe. "	- Да. Не отмоешь,- промолвила она, и в голосе ее прозвучал страх. 
43	He felt she was walking in a circle about him, turning him end for end, shaking him  quietly, and emptying his pockets, without once moving herself. 	Монтэгу казалось, будто она  кружится  вокруг него,  вертит его во  все стороны, легонько встряхивает, выворачивает карманы, хотя она не двигалась с места. 
44	"""Kerosene,"" he said, because the silence had lengthened, ""is nothing but perfume to  me."" "	-  Запах керосина,- сказал он, чтобы прервать затянувшееся молчание.- А для меня он все равно, что духи. 
45	"""Does it seem like that, really?"" "	- Неужели правда? 
46	"""Of course. "	- Конечно. 
47	"Why not?"" "	Почему бы и нет? 
48	She gave herself time to think of it. 	Она подумала, прежде чем ответить: 
49	"""I don't know."" She turned to face the sidewalk  going toward their homes. ""Do you mind if I walk back with you? "	- Не знаю.- Потом она оглянулась назад, туда, где были их дома.- Можно, я пойду с вами? 
50	"I'm Clarisse  McClellan."" "	Меня зовут Кларисса Маклеллан. 
51	"""Clarisse. "	-  Кларисса... 
52	Guy Montag. 	А меня  - Гай Монтэг. 
53	Come along. 	Ну что  ж, идемте. 
54	What are you doing out so late wandering  around? 	А что вы  тут делаете одна и так поздно? 
55	"How old are you?"" "	Сколько вам лет? 
56	They walked in the warm-cool blowing night on the silvered pavement and there was  the faintest breath of fresh apricots and strawberries in the air, and he looked around  and realized this was quite impossible, so late in the year. 	Теплой  ветреной  ночью  они шли  по серебряному от  луны  тротуару,  и Монтэгу чудилось,  будто вокруг  веет тончайшим ароматом  свежих абрикосов и земляники. Он оглянулся и понял, что это невозможно - ведь на дворе осень. Нет,  ничего  этого  не было. 
57	There was only the girl walking with him now, her face bright as snow in the  moonlight, and he knew she was working his questions around, seeking the best  answers she could possibly give. 	Была  только девушка, идущая  рядом, и в лунном свете лицо ее сияло, как снег. Он знал, что сейчас она обдумывает его вопросы, соображает, как лучше ответить на них. 
58	"""Well,"" she said, ""I'm seventeen and I'm crazy. "	- Ну  вот,- сказала она,-  мне семнадцать лет, и я помешанная. 
59	My uncle says the two always go  together. 	Мой дядя утверждает,  что  одно  неизбежно  сопутствует  другому. 
60	When people ask your age, he said, always say seventeen and insane. 	Он  говорит:  если спросят,  сколько  тебе  лет,  отвечай,  что  тебе   семнадцать   и  что  ты сумасшедшая. 
61	Isn't this a nice time of night to walk? 	Хорошо гулять ночью, правда? 
62	"I like to smell things and look at things, and  sometimes stay up all night, walking, and watch the sun rise."" "	Я люблю смотреть на  вещи, вдыхать их запах, и  бывает, что я брожу вот так всю ночь напролет и встречаю восход солнца. 
63	They walked on again in silence and finally she said, thoughtfully, 	Некоторое время они шли молча. Потом она сказала задумчиво: 
64	"""You know, I'm not  afraid of you at all."" "	- Знаете, я совсем вас не боюсь. 
65	"He was surprised. ""Why should you be?"" "	- А почему вы должны меня бояться? - удивленно спросил он. 
66	"""So many people are. "	- Многие боятся вас. 
67	Afraid of firemen, I mean. 	Я хочу сказать, боятся  пожарников. 
68	"But you're just a man, after all..."" "	Но ведь  вы, в конце концов, такой же человек... 
69	He saw himself in her eyes, suspended in two shining drops of bright water, himself  dark and tiny, in fine detail, the lines about his mouth, everything there, as if her eyes  were two miraculous bits of violet amber that might capture and hold him intact. 	В ее глазах, как  в двух блестящих капельках прозрачной воды, он увидел свое  отражение, темное и крохотное, но до мельчайших подробностей  точное - даже складки у  рта,- как  будто ее глаза были  двумя  волшебными  кусочками лилового янтаря, навеки заключившими в себе его  образ. 
70	Her  face, turned to him now, was fragile milk crystal with a soft and constant light in it. 	Ее  лицо, обращенное теперь к нему, казалось хрупким, матово-белым кристаллом, светящимся изнутри ровным,  немеркнущим  светом. 
71	It  was not the hysterical light of electricity but-what? But the strangely comfortable and  rare and gently flattering light of the candle. 	То был не электрический  свет, пронзительный и резкий, а странно успокаивающее, мягкое мерцание свечи. 
72	One time, when he was a child, in a  power-failure, his mother had found and lit a last candle and there had been a brief  hour of rediscovery, of such illumination that space lost its vast dimensions and drew  comfortably around them, and they, mother and son, alone, transformed, hoping that  the power might not come on again too soon .... 	Как-то раз, когда он был ребенком, погасло электричество, и его мать отыскала и зажгла  последнюю свечу. Этот короткий час,  пока  горела свеча, был часом  чудесных открытий: мир изменился,  пространство  перестало  быть  огромным  и уютно  сомкнулось вокруг них. Мать и сын сидели вдвоем, странно преображенные, искренне желая, чтобы электричество не включалось как можно дольше. 
73	And then Clarisse McClellan said: 	Вдруг Кларисса сказала: 
74	"""Do you mind if I ask? "	- Можно спросить вас?.. 
75	"How long have you worked at being a fireman?"" "	Вы давно работаете пожарником? 
76	"""Since I was twenty, ten years ago."" "	- С тех пор как мне исполнилось двадцать. Вот уже десять лет. 
77	"""Do you ever read any of the books you bum?"" "	- А вы когда-нибудь читаете книги, которые сжигаете? 
78	He laughed. 	Он рассмеялся. 
79	"""That's against the law!"" "	- Это карается законом. 
80	"""Oh. "	- Да-а... 
81	"Of course."" "	Конечно. 
82	"""It's fine work. "	- Это неплохая работа. 
83	Monday bum Millay, Wednesday Whitman, Friday Faulkner, burn 'em  to ashes, then bum the ashes. 	В понедельник жечь книги Эдны Миллей, в среду  - Уитмена, в  пятницу -  Фолкнера. Сжигать  в пепел,  затем  сжечь даже пепел. 
84	"That's our official slogan."" "	Таков наш профессиональный девиз. 
85	They walked still further and the girl said, 	Они прошли еще немного. 
86	"""Is it true that long ago firemen put fires out  instead of going to start them?"" "	Вдруг девушка спросила: - Правда  ли,  что  когда-то,  давно,  пожарники  тушили пожары,  а  не разжигали их? 
87	"""No. "	- Нет. 
88	"Houses. have always been fireproof, take my word for it."" "	Дома всегда были несгораемыми. Поверьте моему слову. 
89	"""Strange. "	- Странно. 
90	"I heard once that a long time ago houses used to burn by accident and  they needed firemen to stop the flames."" "	Я слыхала, что было время, когда дома загорались сами собой, от какой-нибудь неосторожности. И тогда  пожарные  были нужны, чтобы тушить огонь. 
91	He laughed. 	Он рассмеялся. 
92	She glanced quickly over. 	Девушка быстро вскинула на него глаза. 
93	"""Why are you laughing?"" "	- Почему вы смеетесь? 
94	"""I don't know."" He started to laugh again and stopped ""Why?"" "	- Не знаю.- Он снова засмеялся, но вдруг умолк.- А что? 
