	en	ru
2030	The  only way I could possibly listen to you would be if somehow the fireman structure  itself could be burnt. 	Другое дело, если бы можно было уничтожить саму систему  пожарных. 
2031	"Now if you suggest that we print extra books and arrange to  have them hidden in firemen's houses all over the country, so that seeds of suspicion  would be sown among these arsonists, bravo, I'd say!"" "	Вот  если бы вы предложили отпечатать  несколько книг и спрятать их в домах у пожарных так, чтобы  посеять семена  сомнения  среди  самих поджигателей, я сказал бы вам: браво! 
2032	"""Plant the books, turn in an alarm, and see the firemen's houses bum, is that what  you mean?"" "	- Подбросить книги, дать  сигнал тревоги и смотреть, как огонь пожирает дома пожарных? Вы это хотите сказать? 
2033	Faber raised his brows and looked at Montag as if he were seeing a new man. 	Фабер поднял брови и посмотрел на Монтэга, словно видел его впервые. 
2034	"""I was  joking."" "	- Я пошутил. 
2035	"""If you thought it would be a plan worth trying, I'd have to take your word it would  help."" "	- Вы считаете, что  это  дельный план? Стоит попытаться? Но  мне нужно знать наверное, что от этого будет толк. 
2036	"""You can't guarantee things like that! "	- Этого вам никто не может гарантировать. 
2037	After all, when we had all the books we needed,  we still insisted on finding the highest cliff to jump off. 	Ведь когда-то книг у нас было сколько угодно, а мы все-таки только и делали, что искали самый крутой утес, чтобы с него прыгнуть. 
2038	But we do need a breather. 	Тут достоверно только одно: да, нам необходимо дышать полной грудью. 
2039	We  do need knowledge. 	Да, нам нужны знания. 
2040	And perhaps in a thousand years we might pick smaller cliffs to  jump off. 	И, может быть, лет этак через тысячу мы научимся выбирать для прыжков менее  крутые утесы. 
2041	The books are to remind us what asses and fools we are. 	Ведь книги существуют для того,  чтобы  напоминать нам, какие  мы  дураки  и  упрямые  ослы. 
2042	They're Caesar's  praetorian guard, whispering as the parade roars down the avenue, `Remember,  Caesar, thou art mortal.' 	"Они  как преторианская стража  Цезаря,  которая  нашептывала  ему  во  время триумфа: ""Помни, Цезарь,  что  и  ты  смертей"". "
2043	Most of us can't rush around, talking to everyone, know all  the cities of the world, we haven't time, money or that many friends. 	Большинство  из нас  не  может всюду побывать,  со всеми  поговорить,  посетить  все  города  мира. У нас нет ни времени,  ни денег, ни такого количества друзей. 
2044	The things you're  looking for, Montag, are in the world, but the only way the average chap will ever see  ninety-nine per cent of them is in a book. 	Все, что  вы ищете, Монтэг, существует в мире, но простой человек разве только одну сотую может  увидеть своими  глазами, а  остальные  девяносто  девять  процентов он познает через книгу. 
2045	Don't ask for guarantees. 	Не требуйте  гарантий. 
2046	And don't look to  be saved in any one thing, person, machine, or library. 	И  не ждите спасения от  чего-то  одного - от человека, или машины, или библиотеки. 
2047	"Do your own bit of saving,  and if you drown, at least die knowing you were headed for shore."" "	Сами создавайте то, что может  спасти мир, - и если утонете по дороге, так хоть будете знать, что плыли к берегу. 
2048	Faber got up and began to pace the room. 	Фабер встал и начал ходить по комнате. 
2049	"""Well?"" asked Montag. "	- Ну? - спросил Монтэг. 
2050	"""You're absolutely serious?"" "	- Вы это серьезно - насчет пожарных? 
2051	"""Absolutely."" "	- Абсолютно. 
2052	"""It's an insidious plan, if I do say so myself."" Faber glanced nervously at his bedroom  door. "	- Коварный план, ничего не  скажешь, - Фабер нервно покосился  на дверь спальни. 
2053	"""To see the firehouses burn across the land, destroyed as hotbeds of treason. "	- Видеть, как по всей стране пылают дома пожарных, гибнут эти очаги предательства! 
2054	The salamander devours his tail! 	Саламандра, пожирающая свой собственный хвост! 
2055	"Ho, God! "" "	Ух! Здорово! 
2056	"""I've a list of firemen's residences everywhere. "	-  У  меня  есть  адреса всех  пожарных. 
2057	"With some sort of underground "" "	Если у нас  будет своего  рода тайное... 
2058	"""Can't trust people, that's the dirty part. "	- Людям нельзя доверять, в этом весь ужас. 
2059	"You and I and who else will set the fires?"" "	Вы да я, а кто еще? 
2060	"""Aren't there professors like yourself, former writers, historians, linguists . . .?"" "	-  Разве  не осталось профессоров,  таких,  как  вы? Бывших писателей, историков, лингвистов?.. 
2061	"""Dead or ancient."" "	- Умерли или уже очень стары. 
2062	"""The older the better; they'll go unnoticed. "	- Чем старше, тем лучше. Меньше вызовут подозрений. 
2063	"You know dozens, admit it ! "" "	Вы же знаете таких, и, наверно, не один десяток. Признайтесь! 
2064	"""Oh, there are many actors alone who haven't acted Pirandello or Shaw or  Shakespeare for years because their plays are too aware of the world. "	-  Да,  пожалуй. Есть,  например,  актеры,  которым  уже  много лет  не приходилось  играть  в пьесах  Пиранделло,  Шоу  и Шекспира, ибо  эти  пьесы слишком верно отражают жизнь. 
2065	We could use  their anger. 	Можно бы  использовать их гнев. 
2066	And we could use the honest rage of those historians who haven't written  a line for forty years. 	И  благородное возмущение историков, не написавших ни одной строчки за последние сорок лет. 
2067	"True, we might form classes in thinking and reading."" "	Это верно, мы могли бы создать школу и сызнова учить людей читать и мыслить. 
2068	"""Yes! "" "	- Да! 
2069	"""But that would just nibble the edges. "	-  Но все  это  капля в море. 
2070	The whole culture's shot through. 	Вся наша культура мертва. 
2071	The skeleton  needs melting and re-shaping. 	Самый  остов ее надо переплавить и отлить в новую форму. 
2072	Good God, it isn't as simple as just picking up a book  you laid down half a century ago. 	Но это не так-то  просто! Дело ведь не только в том, чтобы снова взять в руки книгу,  которую ты отложил полвека назад. 
2073	Remember, the firemen are rarely necessary. 	Вспомните, что надобность в пожарных возникает не так уж часто. 
2074	The  public itself stopped reading of its own accord. 	Люди сами  перестали читать  книги, по  собственной  воле. 
2075	You firemen provide a circus now and  then at which buildings are set off and crowds gather for the pretty blaze, but it's a  small sideshow indeed, and hardly necessary to keep things in line. 	Время от  времени  вы, пожарники, устраиваете  для нас цирковые представления -  поджигаете  дома и развлекаете  толпу. Но  это так  -  дивертисмент, и вряд  ли  на  этом  все держится. 
2076	So few want to  be rebels any more. 	Охотников бунтовать в наше время осталось очень немного. 
2077	And out of those few, most, like myself, scare easily. 	А из этих немногих большинство легко  запугать. Как меня, например. 
2078	Can you  dance faster than the White Clown, shout louder than `Mr. Gimmick' and the parlour  `families'? 	"Можете вы  плясать быстрее,  чем  Белый  клоун, или  кричать громче, чем сам  господин  Главный Фокусник и все  гостиные ""родственники""? "
2079	If you can, you'll win your way, Montag. 	Если можете, то, пожалуй, добьетесь своего. 
2080	In any event, you're a fool. 	А в  общем, Монтэг, вы, конечно,  глупец. 
2081	"People  are having fun"" "	Люди-то ведь действительно веселятся. 
2082	"""Committing suicide! "	- Кончая жизнь самоубийством? 
2083	"Murdering!"" "	Убивая друг друга? 
2084	A bomber flight had been moving east all the time they talked, and only now did the  two men stop and listen, feeling the great jet sound tremble inside themselves. 	Пока они говорили, над домом проносились эскадрильи бомбардировщиков, держа курс  на восток. Только сейчас  они заметили  это и умолкли, прислушиваясь к мощному реву реактивных моторов, чувствуя, как от него все сотрясается у них внутри. 
2085	"""Patience, Montag. "	- Потерпите, Монтэг. 
2086	Let the war turn off the `families.' 	Вот будет война - и все  наши гостиные сами  собой умолкнут. 
2087	Our civilization is flinging itself  to pieces. 	Наша цивилизация несется  к гибели. 
2088	"Stand back from the centrifuge."" "	Отойдите в сторону, чтобы вас не задело колесом. 
2089	"""There has to be someone ready when it blows up."" "	- Но ведь кто-то должен быть наготове, чтобы строить, когда все рухнет? 
2090	"""What? "	-  Кто  же? 
2091	Men quoting Milton? 	Те, кто  может  наизусть цитировать  Мильтона? 
2092	Saying, I remember Sophocles? 	"Кто  может сказать: ""А  я еще помню Софокла""? "
2093	Reminding the  survivors that man has his good side, too? 	Да  и  что они  станут делать? Напоминать уцелевшим, что у человека есть также и хорошие стороны? 
2094	They will only gather up their stones to  hurl at each other. 	Эти уцелевшие только о том будут думать, как  бы  набрать камней да запустить  ими друг в  друга. 
2095	Montag, go home. 	Идите домой, Монтэг. 
2096	Go to bed. 	Ложитесь спать. 
2097	"Why waste your final hours racing  about your cage denying you're a squirrel?"" "	Зачем тратить  свои последние часы  на то, чтобы кружиться по клетке и уверять себя, что ты не белка в колесе? 
2098	"""Then you don't care any more?"" "	- Значит, вам уже все равно? 
2099	"""I care so much I'm sick."" "	- Нет, мне не все равно. Мне до такой степени не все равно, что я прямо болен от этого. 
2100	"""And you won't help me?"" "	- И вы не хотите помочь мне? 
2101	"""Good night, good night."" "	- Спокойной ночи. Спокойной ночи. 
2102	Montag's hands picked up the Bible. 	Руки Монтэга протянулись к библии. 
2103	He saw what his hands had done and he looked  surprised. 	Он сам удивился тому, что вдруг сделали его руки. 
2104	"""Would you like to own this?"" "	- Хотели бы вы иметь эту книгу? 
2105	"Faber said, ""I'd give my right arm."" "	- Правую руку отдал бы за это,- сказал Фабер. 
2106	Montag stood there and waited for the next thing to happen. 	Монтэг стоял и ждал, что  будут делать дальше его  руки. 
2107	His hands, by  themselves, like two men working together, began to rip the pages from the book. 	И  они, помимо его воли и желания, словно два живых существа, охваченных одним стремлением, стали вырывать страницы. 
2108	The hands tore the flyleaf and then the first and then the second page. 	Оторвали титульный лист, первую страницу, вторую. 
2109	"""Idiot, what're you doing!"" "	-  Сумасшедший! 
2110	Faber sprang up, as if he had been struck. 	Что вы  делаете?-  Фабер подскочил  как  от  удара. 
2111	He fell, against  Montag. Montag warded him off and let his hands continue. 	Он бросился к Монтэгу,  но тот  отстранил его. Руки  Монтэга  продолжали  рвать книгу. 
2112	Six more pages fell to  the floor. 	Еще шесть страниц упали на пол. 
2113	He picked them up and wadded the paper under Faber's gaze. 	Монтэг поднял их и на глазах у Фабера скомкал в руке. 
2114	"""Don't, oh, don't ! "" said the old man. "	- Не надо! Прошу вас, не надо!- воскликнул старик. 
2115	"""Who can stop me? "	- А кто мне помешает? 
2116	I'm a fireman. 	Я пожарный. 
2117	"I can bum you!"" "	Я могу сжечь вас. 
2118	The old man stood looking at him. 	Старик взглянул на него. 
2119	"""You wouldn't."" "	- Вы этого не сделаете! 
2120	"""I could ! "" "	- Могу сделать, если захочу. 
2121	"""The book. Don't tear it any more."" "	- Эта книга... не рвите ее! 
2122	Faber sank into a chair, his face very white, his  mouth trembling. 	Фабер опустился на стул. Лицо его побелело как полотно, губы дрожали. 
2123	"""Don't make me feel any more tired. "	- Я устал. Не мучайте меня. 
2124	"What do you want?"" "	Чего вы хотите? 
2125	"""I need you to teach me."" "	- Я хочу, чтобы вы научили меня. 
2126	"""All right, all right."" "	- Хорошо. Хорошо. 
2127	Montag put the book down. 	Монтэг  положил книгу. 
2128	He began to unwad the crumpled paper and flatten it out  as the old man watched tiredly. 	Руки  его начали разглаживать  смятые страницы. Старик устало следил за ним. 
2129	Faber shook his head as if he were waking up. 	Тряхнув головой, словно сбрасывая с себя оцепенение, Фабер спросил: 
2130	"""Montag, have you some money?"" "	- У вас есть деньги, Монтэг? 
2131	"""Some. "	- Есть. Немного. 
2132	Four, five hundred dollars. 	Четыреста или пятьсот долларов. 
2133	"Why?"" "	Почему вы спрашиваете? 
2134	"""Bring it. "	- Принесите мне. 
2135	I know a man who printed our college paper half a century ago. 	Я знаю  человека,  который полвека тому назад  печатал газету нашего колледжа. 
2136	That was  the year I came to class at the start of the new semester and found only one student  to sign up for Drama from Aeschylus to O'Neill. 	Это было в тот самый год, когда, придя в аудиторию в начале нового семестра, я обнаружил, что на курс лекций по истории драмы, от Эсхила   до   Юджина  О'Нила,  записался  всего  один   студент. 
2137	You see? 	Понимаете? 
2138	How like a beautiful statue  of ice it was, melting in the sun. 	Впечатление было  такое,  будто прекрасная статуя изо  льда тает у  тебя  на глазах под  палящими  лучами  солнца. 
2139	I remember the newspapers dying like huge moths. 	Я  помню,  как одна за другой  умирали газеты,  словно бабочки на огне. 
2140	No one wanted them back. 	Никто не  пытался их  воскресить. 
2141	No one missed them. 	Никто  не жалел о  них. 
2142	And the Government, seeing how  advantageous it was to have people reading only about passionate lips and the fist in  the stomach, circled the situation with your fire-eaters. 	И  тогда, поняв, насколько будет  спокойнее, если  люди  будут читать  только  о страстных поцелуях и жестоких драках,  наше  правительство подвело итог, призвав вас,  пожирателей огня. 
2143	So, Montag, there's this  unemployed printer. 	Так вот, Монтэг, у нас, стало быть, имеется  безработный  печатник. 
2144	We might start a few books, and wait on the war to break the  pattern and give us the push we need. 	Мы можем  отпечатать несколько книг  и ждать,  пока не начнется  война, которая  разрушит нынешний  порядок вещей и даст нам нужный толчок. 
2145	A few bombs and the `families' in the walls of  all the houses, like harlequin rats, will shut up! 	"Несколько бомб - и все эти ""родственники"", обитающие в  стенах  гостиных,  вся  эта  шутовская  свора  умолкнет  навсегда! "
2146	"In silence, our stage-whisper might  carry."" "	И  в наступившей  тишине, может быть,  станет слышен наш шепот. 
2147	They both stood looking at the book on the table. 	Глаза обоих  были устремлены на книгу, лежащую на столе. 
2148	"""I've tried to remember,"" said Montag. "	- Я  пытался  запомнить, -  сказал  Монтэг. 
2149	"""But, hell, it's gone when I turn my head. "	-  Но, черт! Стоит  отвести глаза, и я уже  все  забыл. 
2150	God,  how I want something to say to the Captain. 	Господи,  как  бы  мне  хотелось  поговорить  с брандмейстером Битти! 
2151	He's read enough so he has all the  answers, or seems to have. 	Он много читал, у него на все есть ответ, или  так, по крайней  мере, кажется. 
2152	His voice is like butter. 	Голос у него, как масло. 
2153	I'm afraid he'll talk me back the  way I was. 	Я  только  боюсь,  что  он уговорит  меня  и я опять стану  прежним. 
2154	"Only a week ago, pumping a kerosene hose, I thought: God, what fun!"" "	Ведь  всего неделю назад, наполняя шланг керосином, я думал: черт возьми, до чего же здорово! 
2155	The old man nodded. 	Старик кивнул головой: 
2156	"""Those who don't build must burn. "	- Кто  не  созидает,  должен разрушать. 
2157	"It's as old as history and  juvenile delinquents."" "	Это  старо как  мир. Психология малолетних преступников. 
2158	"""So that's what I am."" "	- Так вот, значит, кто я такой' 
2159	"""There's some of it in all of us."" "	- В каждом из нас это есть. 
2160	Montag moved towards the front door. 	Монтэг сделал несколько шагов к выходу. 
2161	"""Can you help me in any way tonight, with the  Fire Captain? "	-  Вы  не можете как-нибудь мне помочь,  когда я  •сегодня вечером буду разговаривать  с брандмейстером Битти? 
2162	I need an umbrella to keep off the rain. 	Мне  нужна поддержка. 
2163	"I'm so damned afraid I'll drown  if he gets me again."" "	А то как бы мне не захлебнуться, когда он станет изливать на меня потоки своих речей. 
2164	The old man said nothing, but glanced once more nervously, at his bedroom. 	Старик ничего  не ответил и снова  бросил  беспокойный  взгляд на дверь спальни. 
2165	Montag  caught the glance. 	Монтэг заметил это. 
2166	"""Well?"" "	- Ну так как же? 
2167	The old man took a deep breath, held it, and let it out. 	Старик  глубоко вздохнул. 
2168	He took another, eyes closed,  his mouth tight, and at last exhaled. 	Закрыв глаза и плотно сжав губы, он еще раз с усилием перевел дыхание. 
2169	"""Montag..."" "	С его губ слетело имя Монтэга. 
2170	The old man turned at last and said, 	Наконец, повернувшись к Монтэгу, он сказал: 
2171	"""Come along. "	- Пойдемте. 
2172	I would actually have let you walk  right out of my house. 	Я чуть  было не позволил вам уйти. 
2173	"I am a cowardly old fool."" "	Я в самом  деле трус. И старый дурак. 
2174	Faber opened the bedroom door and led Montag into a small chamber where stood a  table upon which a number of metal tools lay among a welter of microscopic wirehairs, tiny coils, bobbins, and crystals. 	Он  растворил дверь спальни. Следом  за  ним Монтэг вошел  в  небольшую комнату,  где стоял  стол,  заваленный инструментами, мотками тончайшей, как паутина, проволоки, крошечными пружинками, катушками, кристалликами. 
2175	"""What's this?"" asked Montag. "	- Что это?- спросил Монтэг. 
2176	"""Proof of my terrible cowardice. "	- Свидетельство моей  страшной  трусости. 
2177	I've lived alone so many years, throwing images on  walls with my imagination. 	Я столько лет жил один в этих стенах, наедине со  своими  мыслями. 
2178	Fiddling with electronics, radio-transmission, has been my  hobby. 	Возиться с  электрическими  приборами и радиоприемниками стало моей страстью. 
2179	"My cowardice is of such a passion, complementing the revolutionary spirit  that lives in its shadow, I was forced to design this."" "	Именно эта трусость и  в  то же  время мятежный дух, подспудно живущий во мне, побудили меня изобрести вот это. 
2180	He picked up a small green-metal object no larger than a .22 bullet. 	Он взял со стола  маленький металлический  предмет зеленоватого  цвета, напоминающий пулю небольшого калибра. 
2181	"""I paid for all this-how? "	-  Откуда я взял на это средства,  спросите  вы? 
2182	Playing the stock-market, of course, the last refuge in the  world for the dangerous intellectual out of a job. 	Ну, понятно, играл на бирже. Это  ведь  последнее  прибежище  для  опасномыслящих  интеллигентов, оставшихся без работы. 
