	en	ru
2901	He searched his pockets, the money was there, and in his other pocket he found the  usual Seashell upon which the city was talking to itself in the cold black morning. 	"Он пошарил в карманах - деньги были тут. В другом кармане он  наткнулся на обыкновенную радио ""Ракушку"",  по которой в это  холодное,  хмурое  утро город разговаривал сам с собой. "
2902	"""Police Alert. "	- Внимание! Внимание! 
2903	Wanted: Fugitive in city. 	Полиция  разыскивает беглеца. 
2904	Has committed murder and crimes against the  State. 	Совершил убийство и ряд преступлений против государства. 
2905	Name: Guy Montag. 	Имя: Гай Монтэг. 
2906	Occupation: Fireman. 	Профессия: пожарник. 
2907	"Last seen . . ."" "	В последний раз его видели... 
2908	He ran steadily for six blocks, in the alley, and then the alley opened out on to a wide  empty thoroughfare ten lanes wide. It seemed like a boatless river frozen there in the raw light of the high white arc-lamps; you could drown trying to cross it, he felt; it was  too wide, it was too open. 	Кварталов шесть он бежал не останавливаясь. Потом переулок вывел его на бульвары -  на  широкую  автостраду,  раз в десять шире обыкновенной  улицы, залитая  ярким  светом фонарей, она напоминала застывшую пустынную реку. Он понимал, как опасно сейчас переходить через нее: слишком она широка, слишком пустынна. 
2909	It was a vast stage without scenery, inviting him to run  across, easily seen in the blazing illumination, easily caught, easily shot down. 	Она была похожа на голую сцену, без декораций, и она предательски заманивала его на это пустое  пространство, где при ярком свете фонарей  так легко было  заметить  беглеца,  так легко  поймать,  так легко прицелиться и застрелить. 
2910	"The Seashell hummed in his ear.  ""... watch for a man running ... watch for the running man . . . watch for a man alone,  on foot . . . watch..."" "	"""Ракушка"" жужжала в ухе. - ...Следите за бегущим человеком... следите за бегущим человеком... он один, пеший... следите... "
2911	Montag pulled back into the shadows. Directly ahead lay a gas station, a great chunk  of porcelain snow shining there, and two silver beetles pulling in to fill up. 	Монтэг попятился  в тень-  Прямо перед ним была заправочная  станция  - огромная   белая  глыба,   сверкающая   глазурью  кафелей. Два  серебристых жука-автомобиля остановились возле нее, чтобы заправиться горючим... 
2912	Now he  must be clean and presentable if he wished, to walk, not run, stroll calmly across that  wide boulevard. 	Нет, если  ты  хочешь без  риска пересечь этот широкий  бульвар, нельзя бежать, надо идти спокойно, не спеша, как будто гуляешь. Но для этого у тебя должен быть  опрятный и приличный вид. 
2913	It would give him an extra margin of safety if he washed up and  combed his hair before he went on his way to get where . . . ? 	Больше будет шансов спастись, если ты умоешься и причешешь волосы, прежде  чем продолжить  свой путь... 
2914	Yes, he thought, where am I running? 	Путь куда? Да, спросил он себя, куда же я бегу? 
2915	Nowhere. 	Никуда. 
2916	There was nowhere to go, no friend to turn to, really. 	Ему некуда было бежать, у него не было друзей, к которым он мог бы  обратиться. 
2917	Except Faber. 	Кроме  Фабера. 
2918	And  then he realized that he was indeed, running toward Faber's house, instinctively. 	И   тогда  он  понял,  что  все  это  время инстинктивно бежал по  направлению  к  дому  Фабера. 
2919	But  Faber couldn't hide him; it would be suicide even to try. 	Но ведь Фабер не  может спрятать  его,  даже  попытка сделать это граничила бы с самоубийством! 
2920	But he knew that he would go  to see Faber anyway, for a few short minutes. 	Все равно он должен  повидаться с Фабером,  хотя бы  на  несколько  минут. 
2921	Faber's would be the place where he  might refuel his fast draining belief in his own ability to survive. 	Фабер поддержит  в нем  быстро  иссякающую  веру  в  возможность спастись, выжить. 
2922	He just wanted to  know that there was a man like Faber in the world. He wanted to see the man alive  and not burned back there like a body shelled in another body. 	Только  бы  повидать  его, убедиться в том,  что существует  на свете  такой человек,  как Фабер,  только бы знать, что Фабер  жив, а  не обуглился  и не сгорел где-то  там,  вместе с  другим  обуглившимся  телом. 
2923	And some of the  money must be left with Faber, of course, to be spent after Montag ran on his way. 	Кроме того, надо оставить ему часть денег, чтобы он мог  использовать их после,  когда Монтэг пойдет дальше  своим  путем. 
2924	Perhaps he could make the open country and live on or near the rivers and near the  highways, in the fields and hills. 	Может быть, ему удастся выбраться из города, он спрячется в окрестностях, будет жить возле реки, вблизи больших дорог, среди полей и холмов... 
2925	A great whirling whisper made him look to the sky. 	Сильный свистящий шум в воздухе заставил его поднять глаза. 
2926	The police helicopters were rising so far away that it seemed someone had blown the  grey head off a dry dandelion flower. 	В  небо  один за другим  поднимались полицейские  геликоптеры. Их было много,  казалось,  кто-то сдул пушистую  сухую головку одуванчика. 
2927	Two dozen of them flurried, wavering,  indecisive, three miles off, like butterflies puzzled by autumn, and then they were  plummeting down to land, one by one, here, there, softly kneading the streets where,  turned back to beetles, they shrieked along the boulevards or, as suddenly, leapt  back into the sir, continuing their search. 	Не меньше двух  десятков их  парило в  воздухе  мили  за три от  Монтэга, нерешительно колеблясь на месте,  словно мотыльки,  вялые от  осеннего холода. Затем  они стали  опускаться:  тут  один,  там  другой  -  они  садились  на  улицу  и, превратившись  в  жуков-автомобилей,  с  ревом  мчались  по бульварам, чтобы немного погодя опять подняться в воздух и продолжать поиски. 
2928	And here was the gas station, its attendants busy now with customers. 	Перед  ним была заправочная станция. Служащих  нигде не видно. Заняты с клиентами. 
2929	Approaching  from the rear, Montag entered the men's washroom. 	Обогнув  здание сзади,  Монтэг  вошел  в  туалетную комнату  для мужчин. 
2930	Through the aluminium wall he  heard a radio voice saying, 	Через алюминиевую перегородку до него донесся голос  диктора: 
2931	"""War has been declared."" "	"""Война объявлена"". "
2932	The gas was being pumped  outside. 	Снаружи  у  колонки  накачивали  бензин. 
2933	The men in the beetles were talking and the attendants were talking about  the engines, the gas, the money owed. 	Сидящие в автомобилях переговаривались  со служащими станции - что-то о моторах, о бензине, о том, сколько надо заплатить. 
2934	Montag stood trying to make himself feel the  shock of the quiet statement from the radio, but nothing would happen. 	Монтэг стоял, пытаясь осознать всю значимость только что услышанного по радио лаконичного сообщения, и не мог. 
2935	The war  would have to wait for him to come to it in his personal file, an hour, two hours from  now. 	Ладно. Пусть война подождет. Для него она начнется позже, через час или два. 
2936	He washed his hands and face and towelled himself dry, making little sound. 	Он вымыл руки и лицо, вытерся полотенцем,  стараясь не шуметь. 
2937	He  came out of the washroom and shut the door carefully and walked into the darkness  and at last stood again on the edge of the empty boulevard. 	Выйдя из умывальной, он тщательно прикрыл за собой дверь  и шагнул  в  темноту. Через минуту он уже стоял на углу пустынного бульвара. 
2938	There it lay, a game for him to win, a vast bowling alley in the cool morning. 	Вот  она  -   игра,  которую  он   должен  выиграть:  широкая  площадка кегельбана,  над которой  веет  прохладный предутренний  ветер. 
2939	The  boulevard was as clean as the surface of an arena two minutes before the  appearance of certain unnamed victims and certain unknown killers. 	Бульвар  был чист, как гладиаторская арена за минуту до появления на ней безвестных жертв и безыменных убийц. 
2940	The air over and  above the vast concrete river trembled with the warmth of Montag's body alone; it  was incredible how he felt his temperature could cause the whole immediate world to  vibrate. 	Воздух над широкой асфальтовой рекой дрожал и вибрировал от тепла, излучаемого телом Монтэга,- поразительно, что жар в  его теле  мог заставить  так колебаться окружающий  его  мир. 
2941	He was a phosphorescent target; he knew it, he felt it. 	Он, Монтэг, был  светящейся мишенью,  он знал, он чувствовал это. 
2942	And now he must  begin his little walk. 	А теперь ему еще  предстояло проделать этот короткий путь через улицу. 
2943	Three blocks away a few headlights glared. 	Квартала  за три  от  него  сверкнули  огни автомобиля. 
2944	Montag drew a deep breath. 	Монтэг  глубоко втянул в  себя  воздух. 
2945	His lungs  were like burning brooms in his chest. 	В  легких царапнуло,  словно горячей  щеткой. 
2946	His mouth was sucked dry from running. His  throat tasted of bloody iron and there was rusted steel in his feet. 	Горло пересохло  от  бега,  во  рту  неприятный  металлический  вкус,   ноги,  как свинцовые... 
2947	What about those lights there? 	Огни  автомобиля... 
2948	Once you started walking you'd have to gauge how  fast those beetles could make it down here. 	Если  начать  переходить  улицу  сейчас,  то  надо рассчитать, когда этот автомобиль будет здесь. 
2949	Well, how far was it to the other curb? 	Далеко ли до противоположного тротуара? 
2950	It  seemed like a hundred yards. 	Должно  быть, ярдов  сто. 
2951	Probably not a hundred, but figure for that anyway,  figure that with him going very slowly, at a nice stroll, it might take as much as thirty  seconds, forty seconds to walk all the way. 	Нет, меньше, но  все  равно, пусть будет сто. Если идти медленно, спокойным шагом, то, чтобы покрыть это расстояние, понадобится тридцать - сорок секунд. 
2952	The beetles? 	А мчащийся автомобиль? 
2953	Once started, they could  leave three blocks behind them in about fifteen seconds. 	Набрав скорость, он  пролетит эти  три  квартала  за  пятнадцать секунд. 
2954	So, even if halfway across  he started to run . . . ? 	Значит, даже  если, добравшись до середины, пуститься бегом... 
2955	He put his right foot out and then his left foot and then his right. 	Он ступил правой ногой,  потом левой,  потом опять правой. 
2956	He walked on the  empty avenue. 	Он пересекал пустынную улицу. 
2957	Even if the street were entirely empty, of course, you couldn't be sure of a safe  crossing, for a car could appear suddenly over the rise four blocks further on and be  on and past you before you had taken a dozen breaths. 	Даже   если   улица  совершенно  пуста,   никогда   нельзя   сказать  с уверенностью, что перейдешь благополучно. Машина может внезапно появиться на подъеме  шоссе, за четыре квартала отсюда, и не успеешь оглянуться,  как она налетит на тебя - налетит и промчится дальше... 
2958	He decided not to count his steps. 	Он решил не  считать шагов. 
2959	He looked neither to left nor right. 	Он не глядел по сторонам - ни  направо,  ни налево. 
2960	The light from  the overhead lamps seemed as bright and revealing as the midday sun and just as  hot. 	Свет уличных фонарей казался  таким же предательски ярким и так  же обжигал, как лучи полуденного солнца. 
2961	He listened to the sound of the car picking up speed two blocks away on his right. 	Он прислушивался к  шуму мчащейся машины: шум  слышался справа, в  двух кварталах  от него. 
2962	Its  movable headlights jerked back and forth suddenly, and caught at Montag. 	Огни фар то ярко вспыхивали, то гасли и наконец осветили Монтэга. 
2963	Keep going. 	Иди-иди, не останавливайся! 
2964	Montag faltered, got a grip on the books, and forced himself not to freeze. 	Монтэг замешкался  на  мгновение. Потом  покрепче сжал в руках книги  и заставил себя двинуться вперед. 
2965	Instinctively he took a few quick, running steps then talked out loud to himself and  pulled up to stroll again. 	Ноги его невольно заторопились, побежали, но он  вслух пристыдил  себя  и снова  перешел на спокойный шаг. 
2966	He was now half across the street, but the roar from the  beetle's engines whined higher as it put on speed. 	Он  был уже на середине улицы,  но и рев  мотора становился все  громче  - машина  набирала скорость. 
2967	The police, of course. 	Полиция, конечно. 
2968	They see me. 	Заметили  меня. 
2969	But slow now; slow, quiet, don't turn, don't look,  don't seem concerned. 	Все равно,  спокойней,  спокойней, не оборачивайся, не смотри по сторонам, не подавай вида, что тебя это тревожит! 
2970	Walk, that's it, walls, walk. 	Шагай, шагай, вот и все. 
2971	The beetle was rushing. The beetle was roaring. The beetle raised its speed. 	Машина мчалась, машина ревела, машина увеличивала скорость. 
2972	The  beetle was whining. The beetle was in high thunder. The beetle came skimming. The  beetle came in a single whistling trajectory, fired from an invisible rifle. 	Она  выла и грохотала, она летела,  едва касаясь земли, она неслась как пуля, выпущенная из невидимого  ружья. 
2973	It was up to  120 m.p.h. 	Сто  двадцать миль в  час. 
2974	It was up to 130 at least. 	Сто тридцать  миль  в час. 
2975	Montag clamped his jaws. 	Монтэг  стиснул  зубы. 
2976	The heat of the racing  headlights burnt his cheeks, it seemed, and jittered his eye-lids and flushed the sour  sweat out all over his body. 	Казалось,  свет горящих фар  обжигает  лицо, от него дергаются веки, липким потом покрывается тело. 
2977	He began to shuffle idiotically and talk to himself and then he broke and just ran. 	Ноги  Монтэга  нелепо волочились, он  начал разговаривать сам  с собой, затем'вдруг не выдержал и побежал. 
2978	He  put out his legs as far as they would go and down and then far out again and down  and back and out and down and back. 	Он старался как можно  дальше выбрасывать ноги,  вперед, вперед,  вот  так,  так! 
2979	God ! 	Господи! 
2980	God! 	Господи! 
2981	He dropped a book, broke pace,  almost turned, changed his mind, plunged on, yelling in concrete emptiness, the  beetle scuttling after its running food, two hundred, one hundred feet away, ninety,  eighty, seventy, Montag gasping, flailing his hands, legs up down out, up down out,  closer, closer, hooting, calling, his eyes burnt white now as his head jerked about to  confront the flashing glare, now the beetle was swallowed in its own light, now it was  nothing but a torch hurtling upon him; all sound, all blare. Now-almost on top of him ! 	Он уронил книгу, остановился, чуть не  повернул обратно, но передумал и снова ринулся вперед, крича в  каменную  пустоту, а жук-автомобиль несся  за  своей  добычей  - их разделяло двести  футов,  потом  сто, девяносто,  восемьдесят,  семьдесят... Монтэг задыхался, нелепо размахивал руками, высоко вскидывал  ноги, а машина все ближе, ближе,  она гудела, она подавала  сигналы. Монтэг вдруг  повернул голову, белый огонь фар опалил ему глаза -  не было машины, только  слепящий сноп  света, пылающий  факел,  со страшной  силой брошенный в Монтэга,  рев, пламя - сейчас, сейчас она налетит!.. 
2982	He stumbled and fell. 	Монтэг споткнулся и упал. 
2983	I'm done! 	Я погиб! 
2984	It's over! 	Все кончено! 
2985	But the falling made a difference. 	Но падение спасло его. 
2986	An instant before reaching him the wild beetle cut  and swerved out. It was gone. 	За  секунду  до  того,  как наскочить на Монтэга,  бешеный  жук  вдруг круто свернул,  объехал  его и  исчез. 
2987	Montag lay flat, his head down. 	Монтэг лежал, распластавшись на  мостовой, лицом вниз. 
2988	Wisps of laughter  trailed back to him with the blue exhaust from the beetle. 	Вместе с синим  дымком  выхлопных газов до него долетели обрывки смеха. 
2989	His right hand was extended above him, flat. 	Его  правая рука  была выброшена далеко вперед. 
2990	Across the extreme tip of his middle  finger, he saw now as he lifted that hand, a faint sixteenth of an inch of black tread  where tyre had touched in passing. 	Он  поднял ее. На самом кончике  среднего  пальца  темнела  узенькая  полоска   -   след  от  колеса промчавшейся машины. 
2991	He looked at that black line with disbelief, getting  to his feet. 	Он медленно встал на  ноги,  глядя  на эту  полоску, не смея поверить своим глазам. 
2992	That wasn't the police, he thought. 	Значит, это была не полиция? 
2993	He looked down the boulevard. 	Он глянул  вдоль  бульвара. 
2994	It was clear now. 	Пусто. 
2995	A carful of children, all ages, God  knew, from twelve to sixteen, out 124  FAHRENHEIT 451  whistling, yelling, hurrahing, had seen a man, a very extraordinary sight, a man  strolling, a rarity, and simply said, 	Нет,  это  была  не полиция, просто машина,  полная подростков,  - сколько  им могло быть лет? От  двенадцати до шестнадцати? Шумная, крикливая  орава детей отправилась на прогулку, увидели человека,  идущего  пешком,-  странное зрелище,  диковинка  в наши дни!  - и решили: 
2996	"""Let's get him,"" not knowing he was the fugitive Mr.  Montag, simply a,number of children out for a long night of roaring five or six hundred  miles in a few moonlit hours, their faces icy with wind, and coming home or not  coming at dawn, alive or not alive, that made the adventure. "	"""А ну, сшибем его!""  -  даже не подозревая, что это тот самый мистер Монтэг, которого по всему  городу разыскивает полиция. Да, всего лишь шумная компания подростков,  вздумавших прокатиться лунной ночью,  промчаться  миль пятьсот  - шестьсот  на  такой  скорости, что  лицо  коченеет  от ветра. На рассвете они то ли вернутся домой, то ли  нет, то ли будут живы, то ли нет - ведь в этом и была для них острота таких прогулок. "
2997	They would have killed me, thought Montag, swaying, the air still torn and stirring  about him in dust, touching his bruised cheek. 	"""Они  хотели  убить  меня"",- подумал Монтэг. Он стоял  пошатываясь. В потревоженном  воздухе  оседала пыль. Он  ощупал ссадину  на  щеке. "
2998	For no reason at all in the world they  would have killed me. 	"""Да, они хотели убить меня, просто так, ни с того ни с  сего, не задумываясь над тем, что делают"". "
2999	He walked toward the far kerb telling each foot to go and keep going. 	Монтэг побрел ко все еще далекому тротуару, приказывая ослабевшим ногам двигаться. 
3000	Somehow he  had picked up the spilled books; he didn't remember bending or touching them. 	Каким-то образом он подобрал рассыпанные книги, но он не помнил, как  нагибался  и собирал их. 
