	en	ru
0	A guard came to the prison shoe-shop, where Jimmy Valentine was assiduously stitching uppers, and escorted him to the front office. 	Надзиратель вошел в сапожную мастерскую, где Джимми Валентайн усердно тачал заготовки, и повел его в тюремную канцелярию. 
1	There the warden handed Jimmy his pardon, which had been signed that morning by the governor. 	Там смотритель тюрьмы вручил Джимми помилование, подписанное губернатором в это утро. 
2	Jimmy took it in a tired kind of way. 	Джимми взял его с утомленным видом. 
3	He had served nearly ten months of a four year sentence. 	Он отбыл почти десять месяцев из четырехлетнего срока, хотя рассчитывал просидеть не больше трех месяцев. 
4	"He expected to stay only about three months, at the longest. When a man with as many friends on the outside as Jimmy Valentine had is received in the ""stir"" it is hardly worth while to cut his hair. "	Когда у арестованного столько друзей на воле, сколько у Джимми Валентайна, едва ли стоит даже брить ему голову. 
5	"""Now, Valentine,"" said the warden, ""you'll go out in the morning. "	— Ну, Валентайн, — сказал смотритель, — завтра утром вы выходите на свободу. 
6	Brace up, and make a man of yourself. 	Возьмите себя в руки, будьте человеком. 
7	You're not a bad fellow at heart. 	В душе вы парень неплохой. 
8	"Stop cracking safes, and live straight."" "	Бросьте взламывать сейфы, живите честно. 
9	"""Me?"" said Jimmy, in surprise. "	— Это вы мне? — удивленно спросил Джимми. 
10	"""Why, I never cracked a safe in my life."" "	— Да я в жизни не взломал ни одного сейфа. 
11	"""Oh, no,"" laughed the warden. ""Of course not. "	— Ну да, — улыбнулся смотритель, — разумеется. 
12	Let's see, now. 	Посмотрим все-таки. 
13	How was it you happened to get sent up on that Springfield job? 	Как же это вышло, что вас посадили за кражу в Спрингфилде? 
14	Was it because you wouldn't prove an alibi for fear of compromising somebody in extremely high-toned society? 	Может, вы не захотели доказывать свое алиби из боязни скомпрометировать какую-нибудь даму из высшего общества? 
15	Or was it simply a case of a mean old jury that had it in for you? 	А может, присяжные подвели вас по злобе? 
16	"It's always one or the other with you innocent victims."" "	Ведь с вами, невинными жертвами, иначе не бывает. 
17	"""Me?"" said Jimmy, still blankly virtuous. "	— Я? — спросил Джимми в добродетельном недоумении. 
18	"""Why, warden, I never was in Springfield in my life!"" "	— Да что вы! Я и в Спрингфилде никогда не бывал! 
19	"""Take him back, Cronin!"" said the warden, ""and fix him up with outgoing clothes. "	— Отведите его обратно, Кронин, — улыбнулся смотритель, — и оденьте как полагается. 
20	Unlock him at seven in the morning, and let him come to the bull-pen. 	Завтра в семь утра вы его выпустите и приведете сюда. 
21	"Better think over my advice, Valentine."" "	А вы лучше обдумайте мой совет, Валентайн. 
22	At a quarter past seven on the next morning Jimmy stood in the warden's outer office. 	На следующее утро, в четверть восьмого, Джимми стоял в тюремной канцелярии. 
23	He had on a suit of the villainously fitting, ready-made clothes and a pair of the stiff, squeaky shoes that the state furnishes to its discharged compulsory guests. 	На нем был готовый костюм отвратительного покроя и желтые скрипучие сапоги, какими государство снабжает всех своих подневольных гостей, расставаясь с ними. 
24	The clerk handed him a railroad ticket and the five-dollar bill with which the law expected him to rehabilitate himself into good citizenship and prosperity. 	Письмоводитель вручил ему железнодорожный билет и бумажку в пять долларов, которые, как полагал закон, должны были вернуть Джимми права гражданства и благосостояние. 
25	The warden gave him a cigar, and shook hands. 	Смотритель пожал ему руку и угостил его сигарой. 
26	Valentine, 9762, was chronicled on the books, 	Валентайн, N 9762, был занесен в книгу под рубрикой 
27	"""Pardoned by Governor,"" and Mr. James Valentine walked out into the sunshine. "	«Помилован губернатором», и на солнечный свет вышел мистер Джеймс Валентайн. 
28	Disregarding the song of the birds, the waving green trees, and the smell of the flowers, Jimmy headed straight for a restaurant. 	Не обращая внимания на пение птиц, волнующуюся листву деревьев и запах цветов, Джимми направился прямо в ресторан. 
29	There he tasted the first sweet joys of liberty in the shape of a broiled chicken and a bottle of white wine—followed by a cigar a grade better than the one the warden had given him. 	Здесь он вкусил первых радостей свободы в виде жаренного цыпленка и бутылки белого вина. За ними последовала сигара сортом выше той, которую он получил от смотрителя. 
30	From there he proceeded leisurely to the depot. 	Оттуда он, не торопясь, проследовал на станцию железной дороги. 
31	He tossed a quarter into the hat of a blind man sitting by the door, and boarded his train. 	Бросив четверть доллара слепому, сидевшему у дверей вокзала, он сел на поезд. 
32	Three hours set him down in a little town near the state line. 	Через три часа Джимми высадился в маленьком городке, недалеко от границы штата. 
33	He went to the cafe of one Mike Dolan and shook hands with Mike, who was alone behind the bar. 	Войдя в кафе некоего Майка Долана, он пожал руку хозяину, в одиночестве дежурившему за стойкой. 
34	"""Sorry we couldn't make it sooner, Jimmy, me boy,"" said Mike. "	— Извини, что мы не могли сделать этого раньше, Джимми, сынок, сказал Долан. 
35	"""But we had that protest from Springfield to buck against, and the governor nearly balked. "	— Но из Спрингфилда поступил протест, и губернатор было заартачился. 
36	"Feeling all right?"" "	Как ты себя чувствуешь? 
37	"""Fine,"" said Jimmy. "	— Отлично, — сказал Джимми. 
38	"""Got my key?"" "	— Мой ключ у тебя? 
39	He got his key and went upstairs, unlocking the door of a room at the rear. 	Он взял ключ и, поднявшись наверх, отпер дверь комнаты в глубине дома. 
40	Everything was just as he had left it. 	Все было так, как он оставил уходя. 
41	There on the floor was still Ben Price's collar-button that had been torn from that eminent detective's shirt-band when they had overpowered Jimmy to arrest him. 	На полу еще валялась запонка от воротничка Бена Прайса, сорванная с рубашки знаменитого сыщика в ту минуту, когда полиция набросилась на Джимми и арестовала его. 
42	Pulling out from the wall a folding-bed, Jimmy slid back a panel in the wall and dragged out a dust-covered suit-case. 	Оттащив от стены складную кровать, Джимми сдвинул в сторону одну филенку и достал запыленный чемоданчик. 
43	He opened this and gazed fondly at the finest set of burglar's tools in the East. 	Он открыл его и любовно окинул взглядом лучший набор отмычек в Восточных штатах. 
44	It was a complete set, made of specially tempered steel, the latest designs in drills, punches, braces and bits, jimmies, clamps, and augers, with two or three novelties, invented by Jimmy himself, in which he took pride. 	Это был полный набор, сделанный из стали особого закала: последнего образца сверла, резцы, перки, отмычки, клещи, буравчики и еще две-три новинки, изобретенные самим Джимми, которыми он очень гордился. 
45	Over nine hundred dollars they had cost him to have made at ----, a place where they make such things for the profession. 	Больше девятисот долларов стоило ему изготовить этот набор в… словом, там, где фабрикуются такие вещи для людей его профессии. 
46	In half an hour Jimmy went down stairs and through the cafe. 	Через полчаса Джимми спустился вниз и прошел через кафе. 
47	He was now dressed in tasteful and well-fitting clothes, and carried his dusted and cleaned suit-case in his hand. 	Теперь он был одет со вкусом, в отлично сшитый костюм, и нес в руке вычищенный чемоданчик. 
48	"""Got anything on?"" asked Mike Dolan, genially. "	— Что-нибудь наклевывается? — сочувственно спросил Майк Долан. 
49	"""Me?"" said Jimmy, in a puzzled tone. "	— У меня? — удивленно переспросил Джимми. 
50	"""I don't understand. "	— Не понимаю. 
51	"I'm representing the New York Amalgamated Short Snap Biscuit Cracker and Frazzled Wheat Company."" "	Я представитель Объединенной нью-йоркской компании рассыпчатых сухарей и дробленой пшеницы. 
52	This statement delighted Mike to such an extent that Jimmy had to take a seltzer-and-milk on the spot. 	Это заявление привело Майка в такой восторг, что Джимми непременно должен был выпить стакан содовой с молоком. 
53	"He never touched ""hard"" drinks. "	Он в рот не брал спиртных напитков. 
54	A week after the release of Valentine, 9762, there was a neat job of safe-burglary done in Richmond, Indiana, with no clue to the author. 	Через неделю после того, как выпустили заключенного Валентайна, N 9762, было совершено чрезвычайно ловкое ограбление сейфа в Ричмонде, штат Индиана, причем виновник не оставил после себя никаких улик. 
55	A scant eight hundred dollars was all that was secured. 	Украли всего-навсего каких-то восемьсот долларов. 
56	Two weeks after that a patented, improved, burglar-proof safe in Logansport was opened like a cheese to the tune of fifteen hundred dollars, currency; securities and silver untouched. 	Через две недели был без труда очищен патентованный, усовершенствованный, застрахованный от взлома сейф в Логанспорте на сумму в полторы тысячи долларов звонкой монетой; ценные бумаги и серебро остались нетронутыми. 
57	That began to interest the rogue-catchers. 	Тогда делом начали интересоваться ищейки. 
58	Then an old-fashioned bank-safe in Jefferson City became active and threw out of its crater an eruption of bank-notes amounting to five thousand dollars. 	После этого произошло вулканическое извержение старого банковского сейфа в Джефферсон-сити, причем из кратера вылетело пять тысяч долларов бумажками. 
59	The losses were now high enough to bring the matter up into Ben Price's class of work. 	Убытки теперь были настолько велики, что дело оказалось достойным Бена Прайса. 
60	By comparing notes, a remarkable similarity in the methods of the burglaries was noticed. 	Путем сравления было установлено поразительное сходство методов во всех этих случаях. 
61	Ben Price investigated the scenes of the robberies, and was heard to remark: 	Бен Прайс, побывав на местах преступления, объявил во всеуслышание: 
62	"""That's Dandy Jim Valentine's autograph. "	— Это почерк Франта — Джимми Валентайна. 
63	He's resumed business. 	Опять взялся за свое. 
64	Look at that combination knob—jerked out as easy as pulling up a radish in wet weather. 	Посмотрите на этот секретный замок — выдернут легко, как редиска в сырую погоду. 
65	He's got the only clamps that can do it. 	Только у него есть такие клещи, которыми можно это сделать. 
66	And look how clean those tumblers were punched out! 	А взгляните, как чисто пробиты задвижки! 
67	Jimmy never has to drill but one hole. 	Джимми никогда не сверлит больше одного отверстия. 
68	Yes, I guess I want Mr. Valentine. 	Да, конечно, это мистер Валентайн. 
69	"He'll do his bit next time without any short-time or clemency foolishness."" "	На этот раз он отсидит сколько полагается, без всяких дострочных освобождений и помилований. Дурака валять нечего! 
70	Ben Price knew Jimmy's habits. 	Бену Прайсу были известны привычки Джимми. 
71	He had learned them while working on the Springfield case. 	Он изучил их, расследуя спрингфилдское дело. 
72	Long jumps, quick get-aways, no confederates, and a taste for good society—these ways had helped Mr. Valentine to become noted as a successful dodger of retribution. 	Дальние переезды, быстрые исчезновения, отсутствие сообщников и вкус к хорошему обществу — все это помогало Джимми Валентайну ускользать от возмездия. 
73	It was given out that Ben Price had taken up the trail of the elusive cracksman, and other people with burglar-proof safes felt more at ease. 	Разнесся слух, что по следам неуловимого взломщика пустился Бен Прайс, и остальные владельцы сейфов, застрахованных от взлома, вздохнули свободнее. 
74	One afternoon Jimmy Valentine and his suit-case climbed out of the mail-hack in Elmore, a little town five miles off the railroad down in the black-jack country of Arkansas. 	В один прекрасный день Джимми Валентайн со своим чемоданчиком вышел из почтовой кареты в Элморе, маленьком городке в пяти милях от железной дороги, в глубине штата Арканзас, среди зарослей карликового дуба. 
75	Jimmy, looking like an athletic young senior just home from college, went down the board side-walk toward the hotel. 	Джимми, похожий на студента-спортсмена, приехавшего домой на каникулы, шел по дощатому тротуару, направляясь к гостинице. 
76	A young lady crossed the street, passed him at the corner and entered a door over which was the sign, 	Молодая девушка пересекла улицу, обогнала Джимми на углу и вошла в дверь, над которой висела вывеска, 
77	"""The Elmore Bank."" "	«Городской банк». 
78	Jimmy Valentine looked into her eyes, forgot what he was, and became another man. 	Джимми Валентайн заглянул ей в глаза, забыл, кто он такой, и стал другим человеком. 
79	She lowered her eyes and coloured slightly. 	Девушка опустила глаза и слегка покраснела. 
80	Young men of Jimmy's style and looks were scarce in Elmore. 	В Элморе не часто встречались солодые люди с манерами и внешностью Джимми. 
81	Jimmy collared a boy that was loafing on the steps of the bank as if he were one of the stockholders, and began to ask him questions about the town, feeding him dimes at intervals. 	Джимми схватил за шиворот мальчишку, который слонялся у подъезда банка, словно акционер, и начал расспрашивать о городе, время от времени скармливая ему десятицентовые монетки. 
82	By and by the young lady came out, looking royally unconscious of the young man with the suit-case, and went her way. 	Вскоре молодая девушка опять появилась в дверях банка и пошла по своим делам, намеренно игнорируя существование молодого человека с чемоданчиком. 
83	"""Isn' that young lady Polly Simpson?"" asked Jimmy, with specious guile. "	— Это, кажется, мисс Полли Симпсон? — спросил Джимми, явно хитря. 
84	"""Naw,"" said the boy. ""She's Annabel Adams. "	— Да нет, — ответил мальчишка, — это Аннабел Адамс. 
85	Her pa owns this bank. 	Ее папа банкир. 
86	Why'd you come to Elmore for? 	А вы зачем приехали в Элмор? 
87	Is that a gold watch-chain? 	Это у вас золотая цепочка? 
88	I'm going to get a bulldog. 	Мне скоро подарят бульдога. 
89	"Got any more dimes?"" "	А еще десять центов у вас есть? 
90	Jimmy went to the Planters' Hotel, registered as Ralph D. Spencer, and engaged a room. 	Джимми пошел а «Отель плантаторов», записался там под именем Ральфа Д.Спенсера и взял номер. 
91	He leaned on the desk and declared his platform to the clerk. 	Облокотившись на конторку он сообщил регистратору о своих намерениях. 
92	He said he had come to Elmore to look for a location to go into business. 	Он приехал в Элмор на жительство, хочет заняться коммерцией. 
93	How was the shoe business, now, in the town? 	Как теперь у них в городе с обувью? 
94	He had thought of the shoe business. 	Он подумывает насчет обувной торговли. 
95	Was there an opening? 	Есть какие-нибудь шансы? 
96	The clerk was impressed by the clothes and manner of Jimmy. 	Костюм и манеры Джимми произвели впечатление на конторщика. 
97	He, himself, was something of a pattern of fashion to the thinly gilded youth of Elmore, but he now perceived his shortcomings. 	Он сам был законодателем мод для не густо позолоченной молодежи Элмора, но теперь понял, чего ему не хватает. 
98	While trying to figure out Jimmy's manner of tying his four-in-hand he cordially gave information. 	Стараясь сообразить, как именно Джимми завязывает свой галстук, он почтительно давал ему информацию. 
99	Yes, there ought to be a good opening in the shoe line. 	Да, по обувной части шансы должны быть. 
100	There wasn't an exclusive shoe-store in the place. 	В городе нет магазина обуви. 
101	The dry-goods and general stores handled them. Business in all lines was fairly good. 	Ею торгуют универсальные и мануфактурные магазины. 
102	Hoped Mr. Spencer would decide to locate in Elmore. 	Нужно надеяться, что мистер Спенсер решит поселиться в Элморе. 
103	He would find it a pleasant town to live in, and the people very sociable. 	Он сам увидит, что у них в гроде жить приятно, народ здесь очень общительный. 
104	Mr. Spencer thought he would stop over in the town a few days and look over the situation. 	Мистер Спенсер решил остановиться в городе на несколько дней и осмотреться для начала. 
105	No, the clerk needn't call the boy. 	Нет, звать мальчика не нужно. 
106	He would carry up his suit-case, himself; it was rather heavy. 	Чемодан довольно тяжелый, он донесет его сам. 
107	Mr. Ralph Spencer, the phoenix that arose from Jimmy Valentine's ashes—ashes left by the flame of a sudden and alterative attack of love—remained in Elmore, and prospered. 	Мистер Ральф Спенсер, феникс, возникший из пепла Джимми Валентайна, охваченного огнем внезапно вспыхнувшей и преобразившей его любви, остался в Элморе и преуспел. 
108	He opened a shoe-store and secured a good run of trade. 	Он открыл магазин обуви и обзавелся клиентурой. 
109	Socially he was also a success, and made many friends. 	В обществе он тоже имел успех и приобрел много знакомых. 
110	And he accomplished the wish of his heart. 	И того, к чему стремилось его сердце, он сумел добиться. 
111	He met Miss Annabel Adams, and became more and more captivated by her charms. 	Он познакомился с мисс Аннабел Адамс и с каждым днем все больше пленялся ею. 
112	At the end of a year the situation of Mr. Ralph Spencer was this: he had won the respect of the community, his shoe-store was flourishing, and he and Annabel were engaged to be married in two weeks. 	К концу года положение мистера Ральфа Спенсера было таково: он приобрел уважение общества, его торговля обувью процветала, через две недели он должен был жениться на мисс Аннабел Адамс. 
113	Mr. Adams, the typical, plodding, country banker, approved of Spencer. 	Мистер Адамс, типичный провинциальный банкир, благоволил к Спенсеру. 
114	Annabel's pride in him almost equalled her affection. 	Аннабел гордилась им не меньше, чем любила его. 
115	He was as much at home in the family of Mr. Adams and that of Annabel's married sister as if he were already a member. 	В доме у мистера Адамса и у замужней сестры Аннабел он стал своим человеком, как будто уже вошел в семью. 
