	en	ru
0	Orson Scott Card 	Орсон Скотт Кард. 
1	SEVENTH SON 	Седьмой сын Посвящается Эмили Джен, вся необходимая магия уже ведома ей 
2	Chapter One—Bloody Mary 	1. Злюка Мэри 
3	Little Peggy was very careful with the eggs. 	Малышка Пэгги была очень осторожна и внимательна, когда собирала яйца. 
4	She rooted her hand through the straw till her fingers bumped something hard and heavy. 	Вот и сейчас, запустив руку в солому, она потихоньку двигала ее вперед, пока пальцы не уткнулись во что-то твердое и тяжелое. 
5	She gave no never mind to the chicken drips. 	На следы куриной деятельности она просто не обращала внимания. 
6	After all, when folk with babies stayed at the roadhouse, Mama never even crinkled her face at their most spetackler diapers. 	В их гостинице частенько останавливались семьи с маленькими детьми, и мама малышки Пэгги никогда не кривилась при виде самых замызганных пеленок, а Пэгги старалась походить на нее. 
7	Even when the chicken drips were wet and stringy and made her fingers stick together, little Peggy gave no never mind. 	Пусть даже куриный помет был липким и неприятным на ощупь, склеивал пальцы, малышка не замечала этого. 
8	She just pushed the straw apart, wrapped her hand around the egg, and lifted it out of the brood box. 	Она раздвинула солому, нежно ухватила яйцо и достала из коробки, где сидела наседка. 
9	All this while standing tiptoe on a wobbly stool, reaching high above her head. 	Все это приходилось проделывать, стоя на цыпочках на качающейся скамеечке, пока рука шарила в гнезде. 
10	Mama said she was too young for egging, but little Peggy showed her. 	Мама сначала говорила, что Пэгги еще слишком мала, чтобы собирать яйца, но малышка Пэгги быстро доказала обратное. 
11	Every day she felt in every brood box and brought in every egg, every single one, that's what she did. 	Каждый день она заглядывала в куриные гнезда и приносила домой яйца – все до единого, не пропустив ни наседки. 
12	Every one, she said in her mind, over and over. I got to reach into every one. 	«Все до единого, – твердила она про себя. – Я должна собрать все яйца до единого». 
13	Then little Peggy looked back into the northeast corner, the darkest place in the whole coop, and there sat Bloody Mary in her brood box, looking like the devil's own bad dream, hatefulness shining out of her nasty eyes, saying come here little girl and give me nips. 	Еще раз повторив это, малышка Пэгги оглянулась, кинув настороженный взгляд в северо-восточный угол сарая, который был самым темным местом в курятнике. 
14	I want nips of finger and nips of thumb and if you come real close and try to take my egg I'll get a nip of eye from you. 	Там в своей коробке восседала Злюка Мэри собственной персоной. 
15	Most animals didn't have much heartfire, but Bloody Mary's was strong and made a poison smoke. 	Эта курица выглядела как настоящее порождение ада в перьях, ненависть так и сочилась из ее противных маленьких глазок, которые как бы говорили: «Ну, иди, иди сюда, девчонка, дай-ка я клюну тебя побольнее. Клюну в тот пальчик, в другой, а если ты посмеешь подойти совсем близко, то и до глаз твоих доберусь». Большинство животных лишены внутреннего пламени, но Злюка Мэри так и полыхала, так и коптила ядовитым дымом. 
16	Nobody else could see it, but little Peggy could. 	Этого не видел никто, но малышка Пэгги умела различать внутренний огонь, пламя сердца. 
17	Bloody Mary dreamed of death for all folks, but most specially for a certain little girl five years old, and little Peggy had the marks on her fingers to prove it. 	Злюка Мэри мечтала о том, чтобы все люди на земле умерли, и особенно она жаждала смерти некой маленькой девочки пяти лет от роду – пальцы Пэгги были изукрашены маленькими шрамиками от клюва курицы. 
18	At least one mark, anyway, and even if Papa said he couldn't see it, little Peggy remembered how she got it and nobody could blame her none if she sometimes forgot to reach under Bloody Mary who sat there like a bushwhacker waiting to kill the first folks that just tried to come by. 	Ну, может, не изукрашены, но одна отметина точно виднелась. Пусть даже папа сказал, что девочка все придумала и ничего у нее на пальце нет, малышка Пэгги прекрасно помнила, как курица клюнула ее, поэтому никто не смеет винить малышку в том, что порой она забывала заглянуть в гнездышко Злюки Мэри, которая сидела, будто разбойник в кустах, намеревающийся убить первого встречного. 
19	Nobody'd get mad if she just sometimes forgot to look there. 	Да и что такого, если иногда малышка Пэгги забудет вытащить яйцо из-под Злюки Мэри? 
20	I forgot. 	«Я просто забыла. 
21	I looked in every brood box, every one, and if one got missed then I forgot forgot forgot. 	Заглянула во все коробки, в каждой посмотрела, а туда – забыла, забыла, забыла». 
22	Everybody knew Bloody Mary was a lowdown chicken and too mean to give any eggs that wasn't rotten anyway. 	Все и так знали, что Злюка Мэри слишком коварна и злобна и те яйца, которые она несет, тут же тухнут. 
23	I forgot. 	«Я забыла». 
24	She got the egg basket inside before Mama even had the fire het, and Mama was so pleased she let little Peggy put the eggs one by one into the cold water. 	Мама только-только успела развести огонь в очаге, как малышка Пэгги уже внесла корзинку с яйцами в дом. 
25	Then Mama put the pot on the hook and swung it right on over the fire. 	Под одобрительным взглядом матери Пэгги осторожно опустила яйца в холодную воду, после чего мама повесила котелок на крюк прямо над занявшимися дровами. 
26	Boiling eggs you didn't have to wait for the fire to slack, you could do it smoke and all. 	Варящиеся яйца не терпят слабого пламени, так они только прокоптятся, и все. 
27	"""Peg,"" said Papa. "	– Пэг, – окликнул папа. 
28	That was Mama's name, but Papa didn't say it in his Mama voice. 	Маму тоже звали Пэг, но ее папа звал другим голосом – сейчас он словно хотел сказать: 
29	He said it in his little-Peggy-you're-in-dutch voice, and little Peggy knew she was completely found out, and so she turned right around and yelled what she'd been planning to say all along. 	«Пэгги, дрянная девчонка». Малышка Пэгги сразу поняла, что ее преступление раскрылось. Резко развернувшись, она громко выкрикнула то, что давно хотела сказать: 
30	"""I forgot, Papa!"" "	– Папа, я забыла! 
31	Mama turned and looked at little Peggy in surprise. 	Мама удивленно оглянулась на малышку Пэгги. 
32	Papa wasn't surprised though. 	Хотя папа был вовсе не удивлен. 
33	He just raised an eyebrow. 	Он лишь вопросительно поднял бровь. 
34	He was holding his hand behind his back. 	Руку он держал за спиной. 
35	Little Peggy knew there was an egg in that hand. 	Малышка Пэгги знала, что в руке у него было зажато яйцо. 
36	Bloody Mary's nasty egg. 	Яйцо этой противной Злюки Мэри. 
37	"""What did you forget, little Peggy?"" asked Papa, talking soft. "	– И о чем же ты, Пэгги, забыла? – тихим, почти сочувствующим голосом спросил отец. 
38	Right that minute little Peggy reckoned she was the stupidest girl ever born on the face of the earth. 	Тут-то Пэгги и осознала свою ошибку – такой глупой девчонки земля еще не родила на свет. 
39	Here she was denying before anybody accused her of anything. 	Она с самого начала принялась отрицать все и вся, хотя никто ее ни в чем не обвинял. 
40	But she wasn't going to give up, not right off like that. 	Но сдаваться она все равно не собиралась, во всяком случае так просто. 
41	She couldn't stand to have them mad at her and she just wanted them to let her go away and live in England. 	Она не выносила, когда родители злились на нее, в такие минуты она хотела убежать из дому, уехать в Англию и остаться там навсегда. 
42	So she put on her innocent face and said, 	Поэтому она напустила на себя невинный вид и сказала: 
43	"""I don't know, Papa."" "	– Не знаю, папа. 
44	She figgered England was the best place to go live, cause England had a Lord Protector. 	Как она рассудила, в Англии жить лучше всего, потому что там есть лорд-протектор. 
45	From the look in Papa's eye, a Lord Protector was pretty much what she needed just now. 	Судя по мрачному взгляду папы, заступничество лорда-протектора совсем не помешало бы малышке Пэгги. 
46	"""What did you forget?"" Papa asked again. "	– Так о чем же ты забыла? – еще раз задал свой вопрос папа. 
47	"""Just say it and be done, Horace,"" said Mama. "	– Ладно, Гораций, не тяни, – вмешалась мама. – Если она в чем-то провинилась, с этим ничего не поделаешь. 
48	"""If she's done wrong then she's done wrong."" ""I forgot one time, Papa,"" said little Peggy. ""She's a mean old chicken and she hates me."" "	– Пап, я забыла-то всего один-единственный раз, – сказала малышка Пэгги. – Эта старая злобная курица ненавидит меня. 
49	"Papa answered soft and slow. ""One time,"" he said. "	– Один-единственный раз, – медленно и тихо протянул папа. 
50	Then he took his hand from behind him. 	После чего вытащил руку из-за спины. 
51	Only it wasn't no single egg he held, it was a whole basket. 	Только в ней было зажато не яйцо, а целая корзина. 
52	And that basket was filled with a clot of straw—most likely all the straw from Bloody Mary's box—and that straw was mashed together and glued tight with dried-up raw egg and shell bits, mixed up with about three or four chewed-up baby chicken bodies. 	И корзина та была битком набита грязной соломой из гнезда Злюки Мэри, откуда же еще. Сухие стебли травы были крепко-накрепко склеены вытекшим и засохшим желтком, в котором виднелись осколки скорлупы, а посреди этого месива лежало три или четыре исклеванных, мертвых цыпленка. 
53	"""Did you have to bring that in the house before breakfast, Horace?"" said Mama. "	– Обязательно тащить эту пакость в дом прямо перед завтраком? – осведомилась мама. 
54	"""I don't know what makes me madder,"" said Horace. ""What she done wrong or her studying up to lie about it."" "	– Даже не знаю, что меня больше злит, – сказал Гораций. – Ее проступок или ее вранье. Быстро она научилась врать. 
55	"""I didn't study and I didn't lie!"" shouted little Peggy. "	– Ничему я не училась, и ничего я не вру! – выкрикнула малышка Пэгги. 
56	Or anyways she meant to shout. 	Или собиралась выкрикнуть, но вовремя прикусила язык. 
57	What came out sounded espiciously like crying even though little Peggy had decided only yesterday that she was done with crying for the rest of her life. 	Поэтому тот звук, что она издала, подозрительно смахивал на всхлип, хотя малышка Пэгги только вчера поклялась, что в жизни больше не будет плакать. 
58	"""See?"" said Mama. ""She already feels bad."" "	– Вот видишь? – произнесла мама. – Она раскаивается. 
59	"""She feels bad being caught,"" said Horace. ""You're too slack on her, Peg. "	– Она раскаивается потому, что ее поймали, – поправил Гораций. – Ты слишком мягка с ней, Пэг. 
60	She's got a lying spirit. 	В ней начала проявляться лживая натура. 
61	I don't want my daughter growing up wicked. 	Я не хочу, чтобы моя дочь выросла испорченной девчонкой. 
62	"I'd rather see her dead like her baby sisters before I see her grow up wicked."" "	Уж лучше бы она умерла еще крошкой, как и ее сестры, – мне не пришлось бы стыдиться ее. 
63	Little Peggy saw Mama's heartfire flare up with memory, and in front of her eyes she could see a baby laid out pretty in a little box, and then another one only not so pretty cause it was the second baby Missy, the one what died of pox so nobody'd touch her but her own mama, who was still so feeble from the pox herself that she couldn't do much. 	Малышка Пэгги увидела, как сердце мамы полыхнуло при воспоминании о мертвых дочерях. Внутренним взором Пэгги увидела маленькую девочку, ухоженную и лежащую в колыбельке, а потом еще одну, совсем крошку, но уже не такую ухоженную, – вторая дочка, ее звали Мисси, умерла от оспы, и никто, кроме ее собственной матери, которая сама едва оправилась от страшной болезни и еле-еле ходила, не осмеливался прикоснуться к ней. 
64	Little Peggy saw that scene, and she knew Papa had made a mistake to say what he said cause Mama's face went cold even though her heartfire was hot. 	Малышка Пэгги увидела эту страшную картину и поняла, что папа совершил большую ошибку, упомянув об умерших девочках. 
65	"""That's the wickedest thing anybody ever said in my presence,"" said Mama. "	Несмотря на то что сердце палило жарким огнем, лицо матери превратилось в сам лед. 
66	Then she took up the basket of corruption from the table and carried it outside. 	– Такой гадости еще никто не говорил мне в лицо, – произнесла мама. Подняв с обеденного стола набитую тухлой соломой корзину, она понесла ее во двор. 
67	"""Bloody Mary bites my hand,"" said little Peggy. "	– Злюка Мэри больно клюется, – попыталась оправдаться малышка Пэгги. 
68	"""We'll see what bites,"" said Papa. ""For leaving the eggs I give you one whack, because I reckon that lunatic hen looks fearsome to a frog-size girl like you. "	– Бывает и хуже, а чтобы доказать это, я преподам тебе один урок, – перебил ее отец. – За то, что ты оставляла яйца в гнезде, я не стану тебя строго наказывать. Эта чокнутая курица и взрослого напугает, не то что такого лягушонка, как ты. Поэтому за эту провинность ты получишь всего один удар прутом. 
69	"But for telling lies I give you ten whacks."" "	Но за ложь ты получишь десять ударов. 
70	Little Peggy cried in earnest at that news. 	Услышав это, малышка Пэгги от души разревелась. 
71	Papa gave an honest count and full measure in everything, but most especially in whacks. 	Папа никогда не изменял своему слову и отсчитывал все сполна – особенно когда дело касалось порки. 
72	Papa took the hazel rod off the high shelf. 	Протянув руку, папа достал с высокой полки зачищенную ветвь орешника. 
73	He kept it up there ever since little Peggy put the old one in the fire and burnt it right up. 	С тех пор как Пэгги нашла старый прут и благополучно сожгла его в очаге, орудие наказания хранилось подальше от девочки. 
74	"""I'd rather hear a thousand hard and bitter truths from you, Daughter, than one soft and easy lie,"" said he, and then he bent over and laid on with the rod across her thighs. "	– Я бы лучше выслушал от тебя, дочка, тысячу горьких, но правдивых слов, чем одно, но лживое, – сказал он, наклонился и прошелся прутом по ее попе. 
75	Whick whick whick, she counted every one, they stung her to the heart, each one of them, they were so full of anger. 	«Вжик-вжик-вжик», – отсчитывала она про себя. Каждый удар жалил ее, боль впивалась в самое сердце – с таким гневом двигалась рука отца. 
76	Worst of all she knew it was all unfair because his heartfire raged for a different cause altogether, and it always did. 	Но самое страшное – она понимала, что наказание ею не заслужено. Ярость вызвал вовсе не проступок малышки Пэгги, была другая причина, но доставалось всегда Пэгги. 
77	Papa's hate for wickedness always came from his most secret memory. 	Отец стал страстно ненавидеть ложь после одного давнего случая, о котором он никогда и никому не рассказывал. 
78	Little Peggy didn't understand it all, because it was twisted up and confused and Papa didn't remember it right well himself. 	Малышка Пэгги не могла объяснить, что за проступок совершил папа, поскольку воспоминание было путаным и неясным – он сам не помнил все подробности. 
79	All little Peggy ever saw plain was that it was a lady and it wasn't Mama. 	Пэгги поняла лишь одно: причина крылась в женщине, и это была не мама. 
80	Papa thought of that lady whenever something went wrong. 	Стоило случиться чему-то плохому, как папа сразу вспоминал о той леди. 
81	When baby Missy died of nothing at all, and then the next baby also named Missy died of pox, and then the barn burnt down once, and a cow died, everything that went wrong made him think of that lady and he began to talk about how much he hated wickedness and at those times the hazel rod flew hard and sharp. 	Когда ни с того ни с сего умерла крошка Мисси, когда следующая девочка, которую тоже назвали Мисси, умерла от оспы, когда сгорел амбар, когда пала корова – каждый раз, когда случалась какая-нибудь неприятность, папа вспоминал о той леди и тут же принимался твердить, как он ненавидит испорченность и ложь. Тогда ореховый прут жалил особенно больно. 
82	I'd rather hear a thousand hard and bitter truths, that's what he said, but little Peggy knew that there was one truth he didn't ever want to hear, and so she kept it to herself. 	«Я бы лучше выслушал от тебя тысячу горьких, но правдивых слов», – сказал он, но малышка Пэгги знала, что существует на свете одна правда, о которой он не хотел бы слышать, поэтому девочка верно хранила его секрет. 
83	She'd never shout it at him, even if it made him break the hazel rod, cause whenever she thought of saying aught about that lady, she kept picturing her father dead, and that was a thing she never hoped to see for real. 	Даже в приступе гнева она не кинет ему в лицо эти слова, хотя от ярости он наверняка сломает прут. Откуда-то малышка Пэгги знала, что, расскажи она папе о той леди, он умрет на месте, а она не желала ему смерти. 
84	Besides, the lady that haunted his heartfire, she didn't have no clothes on, and little Peggy knew that she'd be whipped for sure if she talked about people being naked. 	Кроме того, леди, которая поселилась в огне его сердца, почему-то была совсем без одежды, а маленькой Пэгги из личного опыта было известно: стоит ей хоть словом заикнуться о том, что происходит, когда люди остаются голыми, как ее мгновенно выпорют. 
85	So she took the whacks and cried till she could taste that her nose was running. 	Рыдая и шмыгая носом, она снесла положенные одиннадцать ударов. 
86	Papa left the room right away, and Mama came back to fix up breakfast for the blacksmith and the visitors and the hands, but neither one said boo to her, just as if they didn't even notice. 	После этого папа сразу ушел из комнаты, а мама вернулась и принялась готовить завтрак для кузнеца, постояльцев и работников, но даже она не утешила малышку Пэгги, как будто девочки и не было в доме. 
87	She cried even harder and louder for a minute, but it didn't help. 	Пэгги, повысив голос, порыдала минутку-другую, но это тоже не помогло. 
