	en	ru
1255	Al opened his eyes, and all his dread turned into terror, for now he saw that what he feared was real. 	Эл открыл глаза, и его опасения обратились в настоящий ужас. Он увидел, что не зря боялся. 
1256	There was a man standing at the foot of his bed, a man shining as if he was made of sunlight. 	В ногах стоял человек, человек, сияющий так, словно был сотворен из солнечного света. 
1257	The light in the room was coming from his skin, from his chest where his shirt was tore open, from his face, and from his hands. 	Сияние, наполнившее комнату, исходило от его кожи, от его груди, где рубашка была порвана, от его лица и рук. 
1258	And in one of those hands, a knife, a sharp steel knife. 	В одной из рук человек сжимал нож, острый стальной нож. 
1259	I am going to die, thought Al. 	«Я сейчас умру», – подумал Эл. 
1260	Just like Anne promised me, only there wasn't no way his sisters could conjure up such an awful apparition as this one. 	Все случилось так, как обещала Энн, только вряд ли его сестры могли вызвать это ужасное явление. 
1261	This bright Shining Man had come on his own, that was sure, and planned to kill Alvin Junior for his own sins and not cause somebody else had set him on. 	Сияющий Человек пришел сам, это было ясно, и теперь намеревался убить нагрешившего Элвина-младшего. Элвин сам виноват, никто не натравливал этого человека. 
1262	Then it was like as if the light from the man pushed right through Alvin's skin and came inside him, and the fear just went right out of him. 	Затем свет, исходящий от человека, будто бы пробился сквозь кожу Элвина и наполнил его изнутри, изгнав страх. 
1263	The Shining Man might have him a knife, and he might've snuck on into the room without so much as opening a door, but he didn't mean no harm to Alvin. 	Пусть у Сияющего Человека был в руках нож, пусть он проник в комнату не через дверь, но он вовсе не хотел причинить Элвину зло. 
1264	So Alvin relaxed a little and wriggled up in his bed till he was mostly sitting, leaning up against the wall, watching the Shining Man, waiting to see what all he'd do. 	Поэтому Элвин немного расслабился и поудобней устроился на кровати. Приподнявшись на руках, он оперся спиной о стену и принялся наблюдать за Сияющим Человеком, ожидая, что тот будет делать дальше. 
1265	The Shining Man took his bright steel knife and brought the blade against his other palm—and cut. 	Сияющий Человек поднес острое лезвие стального ножа к своей ладони – и резко провел им по коже. 
1266	Alvin saw the gleaming crimson blood flow from the wound in the Shining Man's hand, stream down his forearm, and drip from his elbow onto the floor. 	Элвин увидел, как из руки человека брызнула мерцающая пурпурная кровь, потекла по запястью, закапала с локтя на половицы. 
1267	He hadn't seen four drops, though, before he came to see a vision in his mind. 	Однако и четырех капель не успело упасть, как явилось видение. 
1268	He could see his sisters' room, he knew the place, but it was different. 	Элвин увидел комнату сестер, он не раз бывал в ней, но теперь она показалась ему какой-то другой, необычной. 
1269	The beds were up high, and his sisters were giants, so all he could see clear was big old feet and legs. 	Кровати уходили в небеса, а сестры превратились в великанш, поэтому, как он ни задирал голову, видны были лишь ступни и колени. 
1270	Then he realized he was seeing a little creature's view of the room. 	Тут он понял, что смотрит на комнату глазами какого-то маленького существа. 
1271	A roach's view. 	Глазами таракана. 
1272	In his vision he was scurrying, filled with hunger, absolutely fearless, knowing that if he could get up onto those feet, those legs, there'd be food, all the food he'd ever want. 	И он спешил, торопился, терзаемый голодом и не боящийся абсолютно ничего. Ведь когда он залезет на эти ноги, перед ним откроются бескрайние просторы еды, он получит любые кушанья, какие только пожелает. 
1273	So he rushed, he climbed, he scurried, searching. 	Поэтому он так спешил, карабкался, бежал, искал. 
1274	But there wasn't no food, not a speck of it, and now huge hands reached and swept him off, and then a great huge shadow loomed over him, and he felt the hard sharp crushing agony of death. 	Но еды не было, он ни крошки не нашел, зато появились огромные руки, которые смахнули его, как пушинку. Затем над ним нависла чудовищная гигантская ладонь, и он испытал невыносимую, кошмарную, сокрушительную агонию смерти. 
1275	Not once, but many times, dozens of times, the hope of food, the confidence that no harm would come; then disappointment—nothing to eat, nothing at all—and after disappointment, terror and injury and death. Each small trusting life, betrayed, crushed, battered. 	Он испытал ее не один и не два раза – все начиналось сызнова, снова надежда на еду, уверенность, что ничего страшного не случится; после чего наступало разочарование – ни крошки, нет ни крошки, вообще ничего нет, – а разочарование в свою очередь сменялось ужасом, болью и смертью. Сотни маленьких доверчивых существ были преданы, раздавлены, размазаны, растерты в порошок. 
1276	And then in his vision he was one who lived, one who got away from the looming, stomping boots, under the beds, into the cracks in the walls. 	Неожиданно для себя он проник в сознание таракана, который умудрился выжить, который удрал от жутких топчущих башмаков, пробрался под кроватями и скрылся в щели в стенке. 
1277	He fled from the room of death, but not into the old place, not into the safe room, because now that was no longer safe. 	Он сбежал из комнаты смерти, но обратно, на старое место, возвращаться не собирался, потому что там было больше небезопасно. 
1278	That was where the lies came from. 	Прежнюю безопасную комнату теперь переполняла ложь. 
1279	That was the place of the betrayer, the liar, the killer who had sent them into this place to die. 	Там жил предатель, лжец, убийца, который послал их на верную гибель. 
1280	There were no words in this vision, of course. 	Только выражались эти чувства не словами. 
1281	There could be no words, no clarity of thought in a roach's brain. 	Слов и не могло быть, поскольку тараканий мозг слишком мал, слишком затуманен, чтобы создавать ясные мысли. 
1282	But Al had words and thoughts, and he knew more than any roach what the roaches had learned. 	Зато Эл знал нужные слова и умел думать, поэтому понял куда больше, чем спасшийся таракан. 
1283	They had been promised something about the world, they had been made sure of it, and then it was a lie. 	Он осознал, чему научились тараканы. Им пообещали нечто великое, они поверили, а потом все обернулось ложью. 
1284	Death was a fearful thing, yes, flee that room; but in the other room, there was worse than death—there the world had gone crazy, it was a place where anything could happen, where nothing could be trusted, where nothing was certain. 	Да, смерть – ужасная штука, из комнаты пришлось спасаться бегством, но в другой комнате поселилось нечто более страшное, чем смерть, – там мир сошел с ума, там теперь могло произойти все на свете, там ничему нельзя верить, ибо все стало обманом. 
1285	A terrible place. 	Ужаснейшее место. 
1286	The worst place. 	Самое страшное место во всем мире. 
1287	Then the vision ended. 	Видение оборвалось. 
1288	Alvin sat there, his hands pressed against his eyes, sobbing desperately. 	Элвин сидел на кровати, руки прижаты к глазам, пальцы размазывали текущие по щекам слезы. 
1289	They suffered, he cried out silently, they suffered, and I did it to them, I betrayed them. 	«Им было больно, – молча плакал он, – им было больно, и эту боль причинил им я, я предал их. 
1290	That's what the Shining Man came to show me. 	Вот почему пришел Сияющий Человек, он явился, чтобы показать мне это. 
1291	I made the roaches trust me, but then I cheated them and sent them to die. 	Я заставил тараканов поверить, а потом обманул и послал на смерть. 
1292	I've done murder. 	Я совершил убийство». 
1293	No, not murder! 	Нет, какое убийство! 
1294	Who ever heard of roach-killing being murder? 	Раздавить таракана – разве это можно назвать убийством? 
1295	Nobody in the whole world would call it that. 	Да никто на белом свете так не считает. 
1296	But it didn't matter what other folks thought of it, Al knew that. 	Но кому какое дело, как это называется? 
1297	The Shining Man had come to show him that murder was murder. 	Сияющий Человек пришел, чтобы объяснить Элвину, что убийство всегда остается убийством, как его ни назови. 
1298	And now the Shining Man was gone. 	Вдруг Сияющий Человек пропал. 
1299	The light was gone from the room, and when Al opened his eyes, there was no one in the room but Cally, fast asleep. 	Свет потух, а когда Эл открыл глаза, в комнате никого не осталось, кроме крепко спящего Кэлли. 
1300	Too late even to beg forgiveness. 	Слишком поздно, чтобы просить прощения. 
1301	In pure misery Al Junior closed his eyes and cried some more. 	В отчаянии Эл-младший закрыл глаза и снова разрыдался. 
1302	How long was it? 	Сколько прошло времени? 
1303	A few seconds? 	Несколько секунд? 
1304	Or did Alvin doze off and not notice the passage of a much longer time? 	Или Элвин задремал и не заметил, как пролетели часы? 
1305	Never mind how long—the light came back. 	Хотя неважно – свет опять вернулся. 
1306	Once again it came into him, not just through his eyes, but piercing clear to his heart, whispering to him, calming him. 	Снова он проник в его тело, пронзив до самого сердца, шепча ему, успокаивая. 
1307	Again Alvin opened his eyes and looked at the face of the Shining Man, waiting for him to speak. 	Элвин вновь открыл глаза и взглянул в лицо Сияющего Человека, ожидая, что тот заговорит. 
1308	When he said nothing, Alvin thought it was his turn, and so he stammered out the words, so weak compared to the feelings in his heart. 	Когда тот ничего не сказал, Элвин подумал, что говорить нужно ему, поэтому начал давить из себя слова, слова, которые не могли выразить чувств, которые бушевали в его душе. 
1309	"""I'm sorry, I'll never do it again, I'll—"" "	– Извините, я больше никогда не буду, я… 
1310	He was babbling, he knew it, couldn't even hear himself speak he was so upset. 	Он мямлил, что-то лепетал, но не слышал себя – настолько был расстроен. 
1311	But the light grew brighter for a moment, and he felt a question in his mind. 	Однако свет на секунду стал ярче, и он почувствовал, как в его голове возник вопрос. 
1312	Not a word was spoke, mind you, but he knew that the Shining Man wanted him to say what it was he was sorry for. 	Не было произнесено ни слова, но он понял: Сияющий Человек спрашивает, в чем именно раскаивается Элвин. 
1313	And when he thought about it, Alvin wasn't altogether sure what all was wrong. 	Задумавшись, Элвин сообразил, что сам не знает, в чем виноват. 
1314	Sure it wasn't the killing itself—you could starve to death if you didn't slaughter a pig now and then, and it wasn't hardly murder when a weasel killed himself a mouse, was it? 	Здесь дело было не в убийстве – можно умереть от голода, если не убивать свиней, да и когда хорек убивает себе на ужин мышку, разве можно назвать это убийством? 
1315	Then the light pushed at him again, and he saw another vision. 	Тут свет снова подтолкнул его, и ему явилось еще одно видение. 
1316	Not roaches this time. 	Только на этот раз в тельце таракана он не переселялся. 
1317	Now he saw the image of a Red man, kneeling before a deer, calling it to come and die; the deer came, all trembling and its eyes wide, the way they are when they're scared. 	Он увидел краснокожего человека, вставшего на колени перед оленем, призывая того прийти и умереть. И олень, весь дрожа, пришел, его большие глаза дрожали от страха. 
1318	It knew it was coming to die. 	Он знал, что идет на верную смерть. 
1319	The Red loosed him an arrow, and there it stood, quivering in the doe's flank. 	Краснокожий выпустил стрелу, и, воткнувшись в бок животного, она затрепетала. 
1320	Her legs wobbled. 	Ноги оленя подогнулись. 
1321	She fell. 	Он упал. 
1322	And Alvin knew that in this vision there wasn't no sin at all, because dying and killing, they were both just a part of life. 	И Элвин понял, что в этом убийстве греха не было, потому что смерть и убийство – всего лишь часть жизни. 
1323	The Red was doing right, and so was the deer, both acting according to their natural law. 	Краснокожий поступил правильно, так же правильно поступил олень – человек и животное следовали законам природы. 
1324	So if the evil he done wasn't the death of the roaches, what was it? 	Но если причина крылась не в смерти тараканов, то где ж тогда? 
1325	The power he had? 	В силе, которой он обладал? 
1326	His knack for making things go just where he wanted, making them break just in the right place, understanding how things ought to be and helping them get that way? 	Он имел дар управлять животными, которые шли туда, куда он пожелает, он мог управляться с деревом, разделяя его там, где оно ломалось легче всего. 
1327	He'd found that right useful, as he made and fixed the things a boy makes and fixes in a rough country household. 	Он понимал, как устроено все на земле, и следовал этим законам. Этот дар оказался очень полезным по хозяйству. 
1328	He could fit the two pieces of a broken hoe handle, fit them so tight that they joined forever without glue or tack. 	К примеру, Элвин мог сложить две половинки сломанной рукояти мотыги и без клея соединить их так крепко, что инструмент служил вечно. 
1329	Or two pieces of torn leather, he didn't even have to stitch them; and when he tied a knot in string or rope, it stayed tied. 	То же самое он мог проделать с двумя кусочками порванной кожи – ему вовсе не обязательно было сшивать их; а когда он завязывал узел на нитке или веревке, никакая сила на свете не могла развязать его. 
1330	It was the same knack he used with the roaches. 	Свой дар он использовал и в общении с тараканами. 
1331	Making them understand how things was supposed to be, and then they did what he wanted. 	Он дал им понять, как должно быть, и они поступили согласно его желаниям. 
1332	Was that his sin, that knack of his? 	Значит, грех заключен в его даре? 
1333	The Shining Man heard his question before he even found words for it. 	Сияющий Человек услышал вопрос до того, как Элвин успел сформулировать его. 
1334	Here came the push of light, and another vision. 	Последовала вспышка света, за которой явилось еще одно видение. 
1335	This time he saw himself pressing his hands against a stone, and the stone melted like butter under his hands, came out in just the shape he wanted, smooth and whole, fell from the side of the mountain and rolled away, a perfect ball, a perfect sphere, growing and growing until it was a whole world, shaped just the way his hands had made it, with trees and grass springing up on its face, and animals running and leaping and flying and swimming and crawling and burrowing on and above and within the ball of stone that he had made. 	Он увидел себя самого, прижавшего руки к камню, который таял, как масло, под его ладонями. Камень изначально возник таким, каким пожелал его увидеть Элвин, – отделился от горного склона, гладкий и ровный, и скатился вниз, совершенный шар, идеально ровная сфера, которая вдруг принялась расти, пока не приняла вид огромного мира, созданного руками маленького мальчика. На нем появились деревья, пробилась трава, по нему, внутри его, над ним побежали, запрыгали, залетали, заплавали, заползали всевозможные животные. То был каменный шарик, сотворенный Элвином. 
1336	No, it wasn't a terrible power, it was a glorious one, if he only knew how to use it. 	И эта сила, правильно использованная, не ужасала, а приводила в восхищенный трепет. 
1337	Well if it ain't the dying and it ain't the knack, what did I do wrong? 	Но если убийство и мой дар тут ни при чем, что же я сделал не так? 
1338	This time the Shining Man didn't show him a thing. 	В этот раз Сияющий Человек ничего ему не показал. 
1339	This time Alvin didn't see no burst of light, there wasn't a vision at all. 	В этот раз Элвин не увидел вспышки света и видение ему не явилось. 
1340	Instead the answer just came, not from the Shining Man but from inside his own self. 	Ответ возник сам собой, но пришел не от Сияющего Человека – поднялся из глубин самого Элвина. 
1341	One second he felt too stupid ever to understand his own wickedness, and then the next second he saw it all as clear as could be. 	Не видеть собственного проступка – что может быть глупее? Так думал он, когда глаза его прояснились и все встало на свои места. 
1342	It wasn't the roaches dying, and it wasn't the fact he made them do it. 	Дело было не в погибших тараканах и не в том, что он отправил насекомых на бойню. 
1343	It was the fact that he made them do it just to suit his own pleasure. 	Его вина заключалась в том, что он сделал это ради собственного удовольствия. 
1344	He told them it was for their own good, but it wasn't so, it was for Alvin's benefit alone. 	Он сказал, что в соседней комнате их ждет нечто очень хорошее, а на самом деле все было не так, и выиграл от этого только Элвин. 
1345	Harming his sisters, more than harming the roaches, and all so Alvin could lie in his bed shaking with laughter because he got even—The Shining Man heard the thoughts of Alvin's heart, yes sir, and Al Junior saw a fire leap from his gleaming eye and strike him in the heart. 	Он навредил сестрам, навредил – если это можно так назвать – тараканам, после чего принялся кататься со смеху по кровати, радуясь, что поквитался… Сияющий Человек услышал мысли, пришедшие из сердца Элвина, и Эл-младший увидел, как из переливающегося глаза пришельца вырвался огонь и ударил его прямо в грудь. 
1346	He had guessed it. 	Он угадал. 
1347	He was right. 	Он был прав. 
1348	So Alvin made the most solemn promise of his whole life, right then and there. 	И не сходя с места Элвин принес самую важную клятву в своей жизни. 
1349	He had a knack, and he'd use it, but there was rules in things like that, rules that he would follow even if it killed him. 	Он обладал даром и умел использовать его, но существовали правила – правила, которым он будет непреклонно следовать, даже если это убьет его. 
1350	"""I'll never use it for myself again,"" said Alvin Junior. "	– Я никогда не воспользуюсь своим даром ради собственной выгоды, – поклялся Элвин-младший. 
1351	And when he said the words he felt like his heart was on fire, it burned so hot inside. 	И когда слова слетели с его губ, он почувствовал, как сердце охватил огонь, пылающий и жгущий изнутри. 
