	en	ru
2557	Alvin Junior hated Sunday mornings. 	Элвин-младший ненавидел воскресное утро. 
2558	He hated getting all dressed up, so he couldn't set on the ground or kneel in the grass or even bend over without something getting messed up and Mama telling him to have some respect for the Lord's day. 	Он ненавидел одеваться во все чистое и праздничное, потому что в этой одежде он не мог ни на землю упасть, ни встать на колени в траве, нагнуться – и то толком не мог, потому что рубашка сразу вылезала, и мама принималась отчитывать его, советуя проявить к Господнему дню побольше почтения. 
2559	He hated having to tiptoe around the house all morning because it was the Sabbath and there wasn't to be no playing or making noise on the Sabbath. 	Он ненавидел ходить целое утро на цыпочках, потому что когда-то давным-давно утром воскрес Иисус, а играть и шуметь в воскресенье запрещено. 
2560	Worst of all he hated the thought of sitting on a hard bench down front, with Reverend Thrower looking him in the eye while he preached about the fires of hell that were waiting for the ungodly who despised the true religion and put their faith in the feeble understanding of man. 	Но больше всего он ненавидел сидеть на жесткой церковной скамье, когда прямо на него таращится преподобный Троуэр и вещает об огнях ада, которые ждут всякого грешника, посмевшего отречься от истинной веры и уверовавшего в жалкие силы человеческие. 
2561	Every Sunday, it seemed like. 	Каждое воскресенье повторялось одно и то же. 
2562	And it wasn't that Alvin really despised religion. 	Не то чтобы Элвин с презрением относился к религии. 
2563	He just despised Reverend Thrower. 	Он презирал преподобного Троуэра. 
2564	It was all those hours in school, now that harvest was over. 	Урожай собран, и теперь целыми днями Элвину приходилось торчать в школе. 
2565	Alvin Junior was a good reader, and he got right answers most of the time in his ciphering. But that wasn't enough for old Thrower. 	Элвин-младший хорошо читал и справлялся почти со всеми задачками по арифметике, но зануде Троуэру все было мало. 
2566	He also had to teach religion right along with it. 	Всюду ему надо было приплести свою религию. 
2567	The other children—the Swedes and Knickerbockers from upriver, the Scotch and English from down—only got a licking when they sassed or got three wrong answers in a row. 	Другие дети – шведы и прочие европейцы с верховий реки, шотландцы и англичане с низовий – получали легкую взбучку, когда ошибались или выдавали по три неправильных ответа в одной домашней работе. 
2568	But Thrower took his cane to Alvin Junior every chance he got, it seemed like, and it wasn't over book-learning, it was always about religion. 	Но Элвина-младшего Троуэр драл как Сидорову козу по любому поводу. И всякий раз дело упиралось не в чтение и не в арифметику, а в религию. 
2569	Of course it didn't help much that the Bible kept striking Alvin funny at all the wrong times. 	Что Элвин может поделать, если Библия постоянно смешит его в самый неподходящий момент? 
2570	That's what Measure said, the time that Alvin ran away from school and hid in David's house till Measure found him nigh onto suppertime. 	Однажды Элвин даже удрал из школы и спрятался в доме у Дэвида – его обнаружили только к вечеру. Нашедший его Мера потрепал мальчика по голове и сказал лишь: 
2571	"""If you just didn't laugh when he reads from the Bible, you wouldn't get whupped so much."" "	– Если б ты не хохотал так громко, когда он читает Библию, он бы тебя и пальцем не тронул. 
2572	But it was funny. 	Но ведь смешно же! 
2573	When Jonathan shot all those arrows in the sky and they missed. When Jeroboam didn't shoot enough arrows out his window. 	Взять, к примеру, тот случай, когда Ионафан, опытный воин, делал вид, что с трех стрел не может попасть в цель, гоняя собирать их отрока 28. 
2574	When Pharaoh kept finding tricky ways to keep the Israelites from leaving. 	Когда фараон упорно не отпускал колена израильские из страны 29. 
2575	When Samson was so dumb he told his secret to Delilah after she already betrayed him twice. 	Да и неужели Самсон был настолько туп, что с готовностью раскрыл тайну своей силы Далиле, когда она успела предать его аж трижды? 30 
2576	"""How can I keep from laughing?"" "	– Но я не могу удержаться от смеха! 
2577	"""Just think about getting blisters on your butt,"" said Measure. ""That ought to take the smile off your face."" "	– А ты каждый раз вспоминай о багровых рубцах на заднице, – посоветовал Мера. – Смех как рукой снимет. 
2578	"""But I never remember till after I already laughed."" "	– Не получается. Я вспоминаю о них, когда уже рассмеюсь. 
2579	"""Then you'll probably never need a chair till you're fifteen years old,"" said Measure. ""Cause Mama won't ever let you out of that school, and Thrower won't ever let up on you, and you can't hide in David's house forever."" "	– Что ж, это проблема. Значит, лет до пятнадцати на стул тебе не садиться, – посочувствовал Мера. – Потому что бросить школу тебе не разрешит мама, да и Троуэр тебя так просто не отпустит, а у Дэвида ты вечно прятаться не можешь. 
2580	"""Why not?"" "	– Почему? 
2581	"""Because hiding from your enemy is the same as letting him win."" "	– Потому что прятаться от врага – все равно что заранее признавать свое поражение. 
2582	So Measure wouldn't keep him safe, and he had to go back—and take a licking from Pa, too, for scaring everybody by running away and hiding so long. 	Если даже Мера не мог защитить его, Элвину ничего не оставалось делать, как вернуться домой, где он получил хорошую взбучку не только от мамы, но и от папы за то, что перепугал всех до смерти своим побегом. 
2583	Still, Measure had helped him. 	Однако Мера помог ему. 
2584	It was a comfort to know that somebody else was willing to say that Thrower was his enemy. 	Элвин немного утешился, узнав, что не один он мнит Троуэра своим врагом. 
2585	All the others were so full of how wonderful and godly and educated Thrower was, and how kind he was to teach the children from his fount of wisdom, that it like to made Alvin puke. 	Всех остальных переполнял восторг: ах, какой замечательный этот Троуэр, какой благовоспитанный, образованный и набожный, как он добр, что взялся обучать детей. От таких речей Элвину блевать хотелось. 
2586	Even though Alvin mostly kept his face under control during school, and so got less lickings, Sunday was the most terrible struggle of all, because he sat there on that hard bench listening to Thrower, half the time wanting to bust out laughing till he fell on the floor, and half the time wanting to stand up and shout, 	Все же Элвин научился держать себя в руках во время посещений школы – соответственно, уменьшились и наказания. Но самым страшным испытанием был воскресный день, потому что приходилось сидеть на жесткой скамье прямо перед Троуэром и делать вид, что внимательно его слушаешь, хотя иногда Элвину хотелось смеяться до упаду, а иногда встать и закричать: 
2587	"""That's just about the stupidest thing I ever heard a growed man say!"" "	«Вы только послушайте! Взрослый человек, а мелет глупости!» 
2588	He even had a feeling Pa wouldn't lick him very hard for saying that to Thrower, since Pa never had much of an opinion of the man. 	Элвину почему-то казалось, что папа не очень сильно отругает его за такой поступок, поскольку папа никогда не испытывал восторга от Троуэра. 
2589	But Mama—she'd never forgive him for doing blasphemy in the house of the Lord. 	Но мама – она не простит ему подобного святотатства в доме Господнем. 
2590	Sunday morning, he decided, is designed to let sinners have a sample of the first day of eternity in hell. 	Воскресное утро, решил Элвин, специально придумано, чтобы показать всем грешникам, каков будет их первый день в аду. 
2591	Probably Mama wouldn't even let Taleswapper tell so much as the tiniest story today, lessen it came from the Bible. 	Наверное, сегодня о рассказах и речи быть не может: мама слова Сказителю не даст вымолвить, если только тот не заговорит о Библии. 
2592	And since Taleswapper never seemed to tell stories from the Bible, Alvin Junior guessed that nothing good would come today. 	А поскольку Сказитель вроде бы не знал библейских историй, Элвин-младший окончательно уверился, что сегодняшний день для жизни потерян. 
2593	Mama's voice blasted up the stairs. 	Снизу раздался громкий голос мамы: 
2594	"""Alvin Junior, I'm so sick and tired of you taking three hours to get dressed on Sunday morning that I'm about to take you to church naked!"" "	– Элвин-младший, я устала от того, что каждое воскресенье ты одеваешься три часа кряду. Отправлю в церковь голышом – тогда попляшешь! 
2595	"""I ain't naked!"" Alvin shouted down. "	– Вовсе я не голый! – крикнул в ответ Элвин. 
2596	But since what he was wearing was his nightgown, it was probably worse than being naked. 	То, что на нем была надета ночная рубашка, ничуть не умаляло его вины, а наоборот, усугубляло. 
2597	He shucked off the flannel nightgown, hung it on a peg, and started dressing as fast as he could. 	Он стянул фланелевую рубашку, повесил ее на колышек и принялся как можно быстрее облачаться в воскресный костюм. 
2598	It was funny. 	Смешно. 
2599	On any other day, he only had to reach out for his clothes without even thinking, and they'd be there, just the piece he wanted. Shirt, trousers, stockings, shoes. 	В любой другой день стоило ему руку протянуть, как рубашка или штаны, носки или башмаки, что бы он ни пожелал, мигом оказывались у него в пальцах. 
2600	Always there in his hand when he reached. 	Всегда находились под рукой. 
2601	But on Sunday morning, it was like the clothes ran away from his hand. 	Но в воскресное утро одежда словно убегала и пряталась от него. 
2602	He'd go for his shirt and come back with his pants. 	Он шел за рубашкой – возвращался со штанами. 
2603	He'd reach for a sock and come up with a shoe, time after time. 	Тянулся за носком – доставал башмак. И так раз за разом. 
2604	It was like as if the clothes didn't want to get put on his body any more than he wanted them there. 	Похоже, Элвин и воскресный костюм испытывали друг к другу взаимную неприязнь: одежда не хотела надеваться на него, а он вовсе не жаждал облачаться в эту гадость. 
2605	So when Mama banged open the door, it wasn't altogether Alvin's fault that he didn't even have his pants on yet. 	Поэтому, когда стукнула о стену распахнувшаяся дверь, отворенная разъяренной мамой, Элвин был ничуть не виноват в том, что даже штаны еще не успел надеть. 
2606	"""You've missed breakfast! "	– Ты пропустил завтрак! 
2607	You're still half-naked! 	И до сих пор шляешься полуголым! 
2608	"If you think I'm going to make the whole family parade into church late on account of you, you've got—"" "	Если ты считаешь, что все будут ждать тебя одного и в конце концов опоздают в церковь, то ты… 
2609	"""Another think coming,"" said Alvin. "	– Жестоко заблуждаешься, – закончил за нее Элвин. 
2610	It wasn't his fault that she always said the same thing. 	Не его вина, что каждое воскресенье она говорила одно и то же. 
2611	But she got mad at him as if he should have pretended to be surprised to hear her say it for the ninetieth time since summer. 	Но она разозлилась на него так, будто он должен был изумиться и испугаться фразы, которую она повторяла, наверное, в сотый раз. 
2612	Oh, she was all set to give him a licking, all right, or call for Pa to do it even worse, when there was Taleswapper, come to save him. 	Все, головомойка ему обеспечена, может быть, она папу позовет, а это еще хуже. Но на помощь к нему пришел Сказитель. 
2613	"""Goody Faith,"" said Taleswapper, ""I'd be glad to see to it he comes to church, if you want to go on ahead with the others."" "	– Достопочтенная Вера, – сказал он. – Я с радостью приведу его в церковь. Вы можете никуда не торопиться. 
2614	The minute Taleswapper spoke, Mama whirled around and tried to hide how mad she'd been. 	В ту секунду, когда Сказитель заговорил, мама быстренько повернулась к нему, попытавшись скрыть кипящую ярость. 
2615	Alvin right away started doing a calming on her—with his right hand, where she couldn't see it, since if she saw him doing a spell on her, she'd break his arm, and that was one threat Alvin Junior truly believed. 	Элвин сразу наслал на нее заклятие спокойствия – правой рукой, которую она не видела. Если б она заметила, что он насылает на нее чары, то переломала бы ему руки-ноги. Этой маминой угрозе Элвин-младший искренне верил. 
2616	A calming didn't work so well without touching, but since she was trying so hard to look calm in front of Taleswapper, it worked all right. 	Конечно, заклятие лучше сработало бы, если б он коснулся ее, но… Впрочем, она так старалась прикинуться спокойной, что все и без того прошло гладко. 
2617	"""I hate to put you to any trouble,"" said Mama. "	– Мне не хотелось бы доставлять тебе беспокойство, – сказала мама. 
2618	"""No trouble, Goody Faith,"" said Taleswapper. ""I do little enough to repay your kindness to me."" "	– Никакого беспокойства, тетушка Вера, – запротестовал Сказитель. – Эта услуга ничтожно мала по сравнению с добротой, которую вы проявляете ко мне. 
2619	"""Little enough!"" The fretfulness was almost gone from Mama's voice now. ""Why, my husband says you do the work of two grown men. "	– Ничтожно мала! – Голос мамы понизился до нормального уровня. – Напротив, мой муж говорит, что ты работаешь за двоих. 
2620	"And when you tell stories to the little ones I get more peace and quiet in this house than I've had since—since ever."" She turned back to Alvin, but now her anger was more an act than real. ""Will you do what Taleswapper tells you, and come to church right quick?"" "	А когда ты рассказываешь свои истории детишкам, в доме воцаряется такой мир и покой, каких не было тут со времен… со времен… да, в общем, никогда. – Она повернулась к Элвину и вновь напустилась на него, впрочем, гнев ее был скорее притворным. – Будешь слушаться Сказителя? Обещаешь поспешить в церковь? 
2621	"""Yes, Mama,"" said Alvin Junior. ""Quick as I can."" "	– Да, мама, – ответил Элвин. – Постараюсь управиться как можно быстрее. 
2622	"""All right then. "	– Значит, договорились. 
2623	Thank you kindly, Taleswapper. 	Благодарю тебя от всего сердца, Сказитель. 
2624	"If you can get that boy to obey, that's more than anybody else has managed since he learned to talk."" "	Если тебе удастся заставить этого мальчишку слушаться, ты достигнешь большего, чем кто-либо. Научившись спорить, он стал сущим наказанием. 
2625	"""He's a real brat,"" said Mary, from the hallway outside. "	– Мелкое отродье, – обозвалась стоящая в коридоре Мэри. 
2626	"""Shut your mouth, Mary,"" Mama said, ""or I'll stuff your lower lip up your nose and tack it there to keep it shut."" "	– А ты заткни рот, Мэри, – немедленно приказала мама, – иначе я натяну твою нижнюю губу тебе на нос и так оставлю. 
2627	Alvin sighed in relief. 	Элвин с облегчением вздохнул. 
2628	When Mama made impossible threats it meant she wasn't all that angry anymore. 	Когда мама начинала сыпать неправдоподобными угрозами, это означало, что она больше не сердится. 
2629	Mary put her nose in the air and flounced down the hall, but Alvin didn't even bother with it. 	Мэри задрала нос к небу и гордо прошествовала вниз по лестнице. Однако Элвин этого не заметил. 
2630	He just grinned at Taleswapper, and Taleswapper grinned at him. 	Он улыбнулся Сказителю, а Сказитель улыбнулся в ответ. 
2631	"""Having trouble getting dressed for church, lad?"" asked Taleswapper. "	– Что, парень, никак не можешь надеть свой воскресный костюм? – спросил Сказитель. 
2632	"""I'd rather dress myself in lard and walk through a herd of hungry bears,"" said Alvin Junior. "	– Да я лучше мешок на голову нацеплю и пройду через стаю голодных медведей, – сказал Элвин-младший. 
2633	"""More people live through church than survive encounters with bears."" "	– Ну, я немало людей знаю, которые всю жизнь ходили в церковь и остались живы-здоровы. 
2634	"""Not by much, though."" "	Зато ни разу не видел человека, который умудрился бы уцелеть в схватке с выводком взбесившихся медведей. – Можешь посмотреть. Я уцелею. 
2635	Soon enough he got dressed. 	Вскоре Элвин оделся. 
2636	But he was able to talk Taleswapper into taking the shortcut, which meant walking through the woods up over the hill behind the house, instead of going around by way of the road. 	Кроме того, ему удалось уговорить Сказителя немного срезать путь и пройти через лес за домом, чем обходить холм по кружной дороге. 
2637	Since it was right cold outside, and hadn't rained in a while, and wasn't about to snow yet, there'd be no mud and Mama'd probably not even guess. 	Погода стояла не такая уж холодная, дождей несколько дней не было, впрочем, как и снега, а значит, не было и грязи – стало быть, мама не узнает. 
2638	And what Mama didn't know wouldn't hurt him. 	Так что за это Элвина не накажут. 
2639	"""I noticed,"" said Taleswapper as they climbed up the leaf-covered slope, ""that your father didn't go with your mother and Cally and the girls."" "	– Я заметил, – заговорил Сказитель, когда они начали подниматься по усеянному опавшей листвой склону, – что твой отец не пошел вместе с мамой, Кэлли и девочками. 
2640	"""He doesn't go to that church,"" said Alvin. ""He says Reverend Thrower is a jackass. "	– Он не ходит в церковь, – кивнул Элвин. – Говорит, что преподобный Троуэр – осел. 
2641	"Course, he don't say that where Mama can hear."" "	Не при маме, разумеется. 
2642	"""I suppose not,"" said Taleswapper. "	– Естественно, – усмехнулся Сказитель. 
2643	They stood at the top of the hill, looking down across open meadowland toward the church. 	Они стояли на вершине холма, оглядывая распростершийся у ног широкий луг. 
2644	The church's own hill hid the town of Vigor Church from view. 	Возвышенность, на которой был возведен собор, закрывала собой город Церкви Вигора. 
2645	The frost was just beginning to melt off the brown autumn grass, so that the church looked to be the whitest thing in a world of whiteness, and the sun flashed on it like it was another sun. 	Утренний иней еще не успел оттаять с побуревшей осенней травы, поэтому церковь выглядела ярчайшим белым пятном посреди мира белизны, и отражающиеся от ее чистых стен солнечные лучи превращали здание в новое светило. 
2646	Alvin could see wagons still pulling into place, and horses being tied to the posts on the meadow. 	Элвин разглядел подъезжающие к ней телеги и лошадей, привязанных к столбикам на лугу. 
