	en	ru
4048	But he hardly noticed the weight of his leg, or the dizziness. 	Но ни веса ноги, ни головокружения Элвин не замечал. 
4049	The pain was his enemy, throbs and stabs of it taking his mind away from the task that Taleswapper had set him: to heal himself. 	Его врагом была боль, постоянные приступы мешали сосредоточиться на задаче, поставленной перед ним Сказителем: излечить себя. 
4050	Yet the pain was his friend, too. 	И в то же самое время боль была ему другом. 
4051	It built a wall around him so he scarce knew he was in a house, in a roof, on a bed. 	Она возвела вокруг него настолько высокие стены, что он даже не осознавал, где находится, – лишь краем разума он продолжал отмечать, что лежит в каком-то доме, в какой-то комнате, в какой-то постели. 
4052	The outside world could burn up and turn to ash and he'd never notice it. 	Внешний мир мог гореть ярким пламенем, рассыпаться в прах – он бы этого не заметил. 
4053	It was the world inside that he was exploring now. 	Сейчас Элвин исследовал внутренний мир. 
4054	Taleswapper didn't know half what he was talking about. 	Сказитель и половины не знал из того, о чем говорил. 
4055	It wasn't a matter of making pictures in his mind. 	Нарисовать в уме картинку – мало. 
4056	His leg wouldn't get better from just pretending it was all healed up. 	Его нога не излечится, если он притворится, будто бы с ней все нормально. 
4057	But Taleswapper still had the right idea. 	И все же Сказитель подкинул ему одну верную мысль. 
4058	If Alvin could feel his way through the rock, could find the weak and strong places and teach them where to break and where to hold firm, why couldn't he do it with skin and bone? 	Если Элвин умел чувствовать сквозь скалу, мог находить в камне слабые и сильные стороны и учить его, где ломаться, а где держаться крепко, то почему бы ему не проделать то же самое с кожей и костью? 
4059	Trouble was, skin and bone was all mixed up. 	Сложность заключалась в том, что кость и кожа были неотделимы друг от друга. 
4060	The rock was pretty much the same thing through and through, but the skin changed with every layer, and it wasn't no easy trick figuring where everything went. 	Скала отдаленно напоминала человеческое тело, но кожа слой за слоем менялась, поэтому разобраться, что откуда, оказалось вовсе не легко. 
4061	He lay there with his eyes closed, looking into his own flesh for the first time. 	Он лежал с закрытыми глазами и впервые в жизни заглядывал в собственную плоть. 
4062	At first he tried following the pain, but that didn't get nowhere, just led him to where everything was mashed and cut and messed up so he couldn't tell up from down. 	Сначала он пытался следовать за болью, но эта тропа никуда его не привела, он добрался лишь до места, где все было разрублено, раздавлено и перемешано – верх от низа не отличить. 
4063	After a long while he tried a different tack. 	Спустя некоторое время он предпринял другую попытку. 
4064	He listened to his heart beating. 	Он прислушался к биению сердца. 
4065	At first the pain kept tearing him away, but after a while he closed in on that sound. 	Сначала отвлекала боль, но вскоре он полностью замкнулся на мерном стуке. 
4066	If there was noise in the world outside he didn't know about it, because the pain shut all that out. 	Если что-то и происходило в окружающем мире, он не знал этого, потому что боль отсекла все звуки. 
4067	And the rhythm of the heartbeat, that shut out the pain, or mostly, anyway. 	А ритм ударов сердца заслонил собой боль – не полностью, но большей частью. 
4068	He followed the tracks of his blood, the big strong stream, the little streams. 	Элвин пустился в путь по венам, следуя широкими, сильными потоками, затем ручейками. 
4069	Sometimes he got lost. 	Несколько раз он сбивался с дороги. 
4070	Sometimes a stab from his leg just broke in and demanded to be heard. 	Иногда в сознание врывался особо сильный укол боли в ноге и требовал внимания. 
4071	But by and by he found his way to healthy skin and bone in the other leg. 	Но постепенно, начиная снова и снова, он нашел тропку, ведущую к здоровой коже и кости левой ноги. 
4072	The blood wasn't half so strong there, but it led him where he wanted to go. 	Там кровь неслась не так стремительно и вскоре привела его туда, куда нужно. 
4073	He found all the layers, like the skin of an onion. 	Он рассмотрел слои кожи, напомнившие ему луковицу. 
4074	He learned their order, saw how the muscle was tied together, how the tiny veins linked up, how the skin stretched taut and bonded tight. 	Он изучил и запомнил их порядок, узнал, как связываются друг с другом мускулы, как крепятся крошечные вены, как вытягивается и облегает кость кожа. 
4075	Only then did he find his way to the bad leg. 	После этого он снова пробрался в больную ногу. 
4076	The patch of skin Mama sewed on was pretty much dead, just turning to rot. 	Лоскут кожи, который пришила мама, большей частью отмер, начав загнивать. 
4077	Alvin Junior knew what it needed, though, if any part of it was to live. 	Однако Элвин-младший уже знал, как можно спасти его – не весь, но хотя бы часть. 
4078	He found the mashed-off ends of the arteries around the wound, and began to urge them to grow, just the way he made cracks travel through stone. 	Он нащупал раздавленные концы артерий вокруг раны и начал принуждать их срастись, точно так же, как когда-то проделывал трещинки в скале. 
4079	The stone was easy, compared to this—to make a crack, it just had to let go, that's all. 	С камнем, впрочем, было неизмеримо легче: чтобы создать трещинку, нужно было чуть-чуть поднажать, вот и все. 
4080	The living flesh was slower to do what he wanted, and pretty soon he gave up on all but the strongest artery. 	С живой плотью дело шло медленнее, чем ему бы хотелось, поэтому он отказался от попыток залечить все разом и сосредоточился на одной, основной артерии. 
4081	He began to see how it was using bits and pieces of this and that to build with. 	Он стал изучать, каким образом она использует кусочки того, кусочки сего, как и чем восстанавливается. 
4082	A lot was happening that was far too small and fast and complicated for Alvin to get hold of with his mind. 	Большей частью происходящее было слишком сложно для восприятия Элвина. 
4083	But he could get his body to free up what the artery needed in order to grow. 	Миниатюрные комочки стремительно сновали то туда, то сюда. 
4084	He could send it where it was needed, and after a while the artery linked up with the rotted tissue. 	Однако он сумел заставить тело освободиться от оков и позволить артерии зарасти самой. 
4085	It took some doing, but he finally found the end of a shriveled artery and linked them up, and sent the blood flowing into the sewn-on patch. 	Он посылал ей все необходимое, и довольно скоро она приросла к загнившей коже. Потратив немножко времени на поиски, он наконец обнаружил концы раздавленной артерии, совместил их и послал кровь по вновь возведенному мостику. 
4086	Too soon, too fast. 	И поспешил. 
4087	He felt the heat on his leg from blood pouring out of the dead flesh at a dozen points; it couldn't hold in all the blood he sent. 	Он почувствовал, как по ноге разлилось волной тепло – из-под мертвой кожи забил десяток фонтанчиков крови: артерия не сумела вместить всю кровь, которую он протолкнул. 
4088	Slow, slow, slow. 	Медленнее, медленнее, медленнее. 
4089	He followed the blood, now seeping instead of pumping, and again linked up blood vessels, arteries to veins, trying to match it, as best he could, to the other leg. 	Он проследовал за кровью, которая теперь сочилась, а не била, и заново принялся сращивать кровяные сосуды, артерии с венами, пытаясь следовать образцу, который видел в левой ноге. 
4090	Finally it was done, or well enough. 	Наконец с этим было покончено – более или менее. 
4091	The normal flow of blood could be contained. 	Кровь мерно текла по венам. 
4092	Many parts of the patch of skin came back to life as the blood returned. 	С ее возвращением ожили частички кожи. 
4093	Other parts stayed dead. 	Но часть лоскута все равно оставалась мертвой. 
4094	Alvin kept going around and around with the blood, stripping away the dead parts, breaking them up into bits and pieces too small for him to recognize. 	Элвин кружил и кружил по своей ноге вместе с кровью, обрывая мертвые кусочки и разбивая их на мелкие части, которые и глазом не видно. 
4095	But the living parts recognized them well enough, took them up, put them to work. 	Зато живая кожа сразу узнавала их, принимала и перестраивала. 
4096	Wherever Alvin explored, he made the flesh grow. 	Там, где проходил Элвин, начинала расти здоровая плоть. 
4097	Until he was so weary in his mind from thinking so small and working so hard that he fell asleep in spite of himself. 	В конце концов кропотливое складывание по частичкам настолько утомило его, что он сам не заметил, как заснул. 
4098	"""I don't want to wake him."" "	– Я не хочу будить его. 
4099	"""No way to change the bandage without touching it, Faith."" "	– Иначе бинты не сменить, Вера. 
4100	"""All right, then—oh, be careful, Alvin! "	– Ну, ладно, хорошо… ой, осторожнее ты, Элвин! 
4101	"No, let me!"" "	Нет, дай лучше я! 
4102	"""I've done this before—"" "	– Я не раз менял бинты… 
4103	"""On cows, Alvin, not on little boys!"" "	– На коровах, Элвин, а не на маленьких мальчиках! 
4104	Alvin Junior felt pressure on his leg. 	Элвин-младший почувствовал, как на ногу что-то надавило. 
4105	Something pulling at the skin there. 	Что-то тянуло за кожу. 
4106	The pain wasn't as bad as yesterday. 	Хотя было не так больно, как вчера. 
4107	But he was still too tired even to open his eyes. 	Но он слишком устал, чтобы открыть глаза. 
4108	Even to make a sound to let them know he was awake, he could hear them. 	Он не мог даже звука издать, чтобы дать понять родителям, что не спит, хотя отчетливо слышал их беседу. 
4109	"""Good laws, Faith, he must have bled something awful in the night."" "	– Боже мой. Вера, у него ночью, наверное, кровотечение открылось. 
4110	"""Mama, Mary says I have to—"" "	– Мама, Мэри говорит, я должен… 
4111	"""Hush up and get on out of here, Cally! "	– Тихо, Кэлли! Убирайся отсюда! 
4112	"Can't you see your ma's worried about—"" "	Разве ты не видишь, что мама занята… 
4113	"""No need to yell at the boy, Alvin. "	– Не надо кричать на мальчика, Элвин. 
4114	"He's only seven."" "	Ему всего семь лет. 
4115	"""Seven's old enough to keep his mouth shut and leave grown-ups alone when we've got things to—look at that."" "	– Он достаточно вырос, чтобы научиться держать рот закрытым и не вмешиваться в дела взрослых… ты только посмотри. 
4116	"""I can hardly believe it."" "	– Глазам своим не верю. 
4117	"""I thought to see pus coming out like cream from a cow's tit."" "	– Я-то думал, гной сочится, как сливки из коровьего вымени… 
4118	"""Clean as can be."" "	– А тут все чисто. 
4119	"""And skin growing back, will you look at that? "	– И кожа приросла, смотри, смотри! 
4120	"Your sewing must've took."" "	Правильно ты сделала, что пришила ее. 
4121	"""I hardly dared to hope that skin would live."" "	– Я и не надеялась, что она приживется. 
4122	"""Can't even see no bone under there."" "	– Кости совсем не видно. 
4123	"""The Lord is blessing us. "	– Господь благословляет нас. 
4124	"I prayed all night, Alvin, and look what God has done."" "	Я молилась всю ночь, Элвин, и посмотри, что сотворил Господь. 
4125	"""Well, you should've prayed harder, then, and got it healed up tight. "	– Ну, может, если бы ты молилась чуточку поупорнее, он бы вообще всю рану залечил. 
4126	"I need this boy for chores."" "	Тогда бы я отдал мальчика в церковный хор. 
4127	"""Don't you get blasphemous with me, Alvin Miller."" "	– Не святотатствуй, Элвин Миллер. 
4128	"""It just gripes me hollow, the way God always sneaks in to take the credit. "	– Да нет, просто мне иногда бывает обидно при виде того, насколько ловко Господь умеет подвернуться под руку и присвоить чужую славу. 
4129	"Maybe Alvin's just a good healer, you ever think of that?"" "	Может, Элвин сам себя залечил, ты об этом не подумала? 
4130	"""Look, your nastiness is waking the boy."" "	– Посмотри, твои грязные речи разбудили малыша. 
4131	"""See if he wants a drink of water."" "	– Спроси, не хочет ли он воды. 
4132	"""He's getting one whether he wants it or not."" "	– Он ее выпьет, хочет или нет. 
4133	Alvin wanted it badly. 	Элвину очень хотелось пить. 
4134	His body was dry, not just his mouth; it needed to make back what it lost in blood. 	У него не только рот пересох, все тело жаждало воды: она была нужна, чтобы восстановить потерянную кровь. 
4135	So he swallowed as much as he could, from a tin cup held to his mouth. 	Поэтому он пил и не мог напиться, с жадностью глотая из жестяной чашки, поднесенной рукой мамы к его губам. 
4136	A lot of it spilled around his face and neck but he didn't hardly notice that. 	Большей частью вода проливалась на лицо, текла по шее, но он не замечал этого. 
4137	It was the water that trickled into his belly that mattered. 	Важна была та влага, что плескалась сейчас у него в животе. 
4138	He lay back and tried to find out from the inside how his wound was doing. 	Он откинулся на подушку и попытался заглянуть внутрь себя, чтобы проверить, как поживает рана. 
4139	But it was too hard to get back there, too hard to concentrate. 	Но это ему не удалось: слишком много сил потребовалось. 
4140	He dropped off before he was halfway there. 	Он провалился в сон, не добравшись и до половины пути. 
4141	He woke again, and thought it must be night again, or maybe the curtains were drawn. 	Проснувшись снова, он решил, что на улице опять ночь, – а может, занавески были задернуты. 
4142	He couldn't find out cause it was too hard to open his eyes, and the pain was back, fierce again, and something maybe even worse: the wound was a-tickling till he could hardly keep himself from reaching down to scratch. 	Проверить он не мог, потому что слишком уж невыносимо было открывать глаза. Кроме того, вернулась прежняя боль, с новой яростью впиваясь в его тело, а нога ужасно чесалась, и он едва удерживался от того, чтобы не дотянуться до нее и не начать драть ногтями. 
4143	After a while, though, he was able to find the wound and once again help the layers to grow. 	Сосредоточившись, он проник в область раны и вновь принялся помогать коже расти. 
4144	By the time he slept, there was a thin, complete layer of skin over the whole wound. 	За время сна открытая плоть успела затянуться тонкой пленкой. 
4145	Underneath, the body was still working to renew the ravaged muscles and knit the broken bones. 	Под ней тело все еще трудилось, восстанавливая порванные мускулы, сращивая сломанные кости. 
4146	But there'd be no more loss of blood, no more open wound to get infected. 	Но потеря крови больше Элвину не грозила, как, впрочем, и заражение. 
4147	"""Look at this, Taleswapper. "	– Взгляни, Сказитель. 
4148	"You ever seen the like of this?"" "	Ты когда-нибудь видел подобное? 
4149	"""Skin like a newborn baby."" "	– Кожа как у новорожденного. 
4150	"""Maybe I'm crazy, but except for the splint I can't see no reason to leave this leg bound up no more."" "	– Может, я свихнулся, но если б не перелом, бинты можно было бы снять. 
4151	"""Not a sign of a wound. "	– Да, раны как не бывало. 
4152	"No, you're right, there's no need for a bandage now."" "	Ты прав, бинты действительно больше не нужны. 
4153	"""Maybe my wife is right, Taleswapper. "	– Наверное, моя жена правду говорила, Сказитель. 
4154	"Maybe God just rared back and passed a miracle on my boy."" "	Может быть, это Господь решил поступиться принципами и сотворил чудо с моим мальчиком. 
4155	"""Can't prove anything. "	– Доказательств тому нет. 
4156	"When the boy wakes up, maybe he'll know something about it."" "	Когда малыш проснется, возможно, он нам что-нибудь объяснит. 
4157	"""Not a chance of that. He hasn't even opened his eyes this whole time."" "	– Вряд ли он что-нибудь понимает – за все время даже глаз не открыл. 
4158	"""One thing's certain, Mr. Miller. "	– Одно несомненно, мистер Миллер. 
4159	The boy isn't about to die. 	Угроза смерти миновала. 
4160	"That's more than I could have guessed yesterday."" "	Хотя вчера я думал совсем наоборот. 
4161	"""I was set to build him a box to hold him underground, that I was. "	– А я вообще собрался сколачивать ему гробик, чтоб в землицу опустить, вот так вот. 
4162	I didn't see no chance him living. 	Даже представить не мог, что он выживет. 
4163	Will you look at how healthy he is? 	А ты посмотри, каким здоровым он выглядит сейчас! 
4164	"I want to know what's protecting him, or who."" "	Интересно все же, что его защищает – или кто? 
4165	"""Whatever is protecting him, Mr. Miller, the boy is stronger. "	– Кто бы его ни защищал, мистер Миллер, мальчик куда сильнее. 
4166	That's something to think about. 	Тут есть над чем поразмыслить. 
4167	"His protector split that stone, but Al Junior put it back together and not a thing his protector could do about it."" "	Его защитник разломил камень, но Эл-младший срастил его обратно, и покровитель не смог помешать ему. 
4168	"""Reckon he even knew what he was doing?"" "	– Думаешь, он знал, что делает? 
4169	"""He must have some notion of his powers. "	– Да, ему кое-что известно о таящихся внутри силах. 
4170	"He knew what he could do with the stone."" "	Он мог сотворить с камнем что угодно. 
4171	"""I never heard of a knack like this, to tell you straight. "	– Сказать прямо, никогда не слышал о подобном даре. 
4172	I told Faith what he did with that stone, dressing it on the backside without ever laying on a tool, and she starts reading from the Book of Daniel and crying about fulfilment of the prophecy. 	Я рассказал Вере о том, как он обтесал камень, нанеся нарезку без всякого инструмента, так она сразу принялась читать мне Книгу Пророка Даниила и что-то верещать о исполнившемся пророчестве. 
4173	Wanted to rush in here and warn the boy about clay feet. 	Хотела бежать к мальчику в комнату и предупредить о железных и глиняных ногах 41, но я ее остановил. 
4174	Don't that beat all? 	Разве не глупо? 
4175	Religion makes them crazy. 	Религия превращает людей в буйнопомешанных. 
4176	"Not a woman I ever met wasn't crazy with religion."" "	Я ни разу не встречал женщины, которая бы не сходила с ума по религии. 
4177	The door opened. 	Дверь открылась. 
4178	"""Get out of here! "	– А ну вон отсюда! 
4179	Are you so dumb I have to tell you twenty times, Cally? 	Ты что, настолько туп, Кэлли, что тебе двадцать раз повторять приходится? 
4180	"Where's his mother, can't she keep one seven-year-old boy away from—"" "	Так, где мать, неужели она не может держать семилетнего пацана подальше от… 
