	en	ru	ru_tokens	en_tokens
220	l used to dream of a man wearing a black hood. 	Мне снился человек в черном капюшоне. 	['Мне', 'снился', 'человек', 'в', 'черном', 'капюшоне']	['l', 'used', 'to', 'dream', 'of', 'a', 'man', 'wearing', 'a', 'black', 'hood']
221	- Tonight l saw that same hood. -You said you caIled the police. 	- Сегодня я видела этот капюшон. - Ты сказала, что вызвала полицию. 	['Сегодня', 'я', 'видела', 'этот', 'капюшон', 'Ты', 'сказала', 'что', 'вызвала', 'полицию']	['Tonight', 'l', 'saw', 'that', 'same', 'hood', 'You', 'said', 'you', 'caIled', 'the', 'police']
222	- Did you give your name? - No. 	- Ты назвала ими свое имя? - Нет. 	['Ты', 'назвала', 'ими', 'свое', 'имя', 'Нет']	['Did', 'you', 'give', 'your', 'name', 'No']
223	ToId Mira then? 	Рассказала Мире? 	['Рассказала', 'Мире']	['ToId', 'Mira', 'then']
224	About what happened tonight? Yes. 	О том, что произошло? Да. 	['О', 'том', 'что', 'произошло', 'Да']	['About', 'what', 'happened', 'tonight', 'Yes']
225	Why, there's more, right? 	А есть что-то еще? 	['А', 'есть', 'что-то', 'еще']	"['Why', ""there's"", 'more', 'right']"
226	I'Il check the other rooms. 	Я проверю комнаты. 	['Я', 'проверю', 'комнаты']	"[""I'Il"", 'check', 'the', 'other', 'rooms']"
227	Have you got a boyfriend? 	У тебя есть парень? 	['У', 'тебя', 'есть', 'парень']	['Have', 'you', 'got', 'a', 'boyfriend']
228	-Someone who might get jeaIous? - Not that I know of. Why? 	- Который мог приревновать? - Нет, я не знаю такого. А что? 	['Который', 'мог', 'приревновать', 'Нет', 'я', 'не', 'знаю', 'такого', 'А', 'что']	['Someone', 'who', 'might', 'get', 'jeaIous', 'Not', 'that', 'I', 'know', 'of', 'Why']
229	Someone is watching the windows with binoculars. 	Кто-то с биноклем таращиться на твое окно. 	['Кто-то', 'с', 'биноклем', 'таращиться', 'на', 'твое', 'окно']	['Someone', 'is', 'watching', 'the', 'windows', 'with', 'binoculars']
230	-Where? -Come and see. 	- Где? - Взгляни! 	['Где', 'Взгляни']	['Where', 'Come', 'and', 'see']
231	He's gone. He was there underthe street lamp. 	Ушел. Он стоял под фонарем. 	['Ушел', 'Он', 'стоял', 'под', 'фонарем']	"[""He's"", 'gone', 'He', 'was', 'there', 'underthe', 'street', 'lamp']"
232	l could stay if you want me to. 	Если хочешь, я могу остаться. 	['Если', 'хочешь', 'я', 'могу', 'остаться']	['l', 'could', 'stay', 'if', 'you', 'want', 'me', 'to']
233	Don't you have someone waiting for you? 	Вас никто не ждет? 	['Вас', 'никто', 'не', 'ждет']	"[""Don't"", 'you', 'have', 'someone', 'waiting', 'for', 'you']"
234	She's probably having a fit because you're not home yet. 	У нее наверно уже истерика от того, что Вас нет дома. 	['У', 'нее', 'наверно', 'уже', 'истерика', 'от', 'того', 'что', 'Вас', 'нет', 'дома']	"[""She's"", 'probably', 'having', 'a', 'fit', 'because', ""you're"", 'not', 'home', 'yet']"
235	I'Il lock myseIfin. Don't worry. 	Я запрусь. Не волнуйтесь. 	['Я', 'запрусь', 'Не', 'волнуйтесь']	"[""I'Il"", 'lock', 'myseIfin', ""Don't"", 'worry']"
236	Make sure you lock alI the windows. 	Убедись, что все окна заперты. 	['Убедись', 'что', 'все', 'окна', 'заперты']	['Make', 'sure', 'you', 'lock', 'alI', 'the', 'windows']
237	l'lI look around in the street. lf I see anything suspicious 	Я посмотрю на улице. Если замечу, что-либо подозрительное, 	['Я', 'посмотрю', 'на', 'улице', 'Если', 'замечу', 'что-либо', 'подозрительное']	"[""l'lI"", 'look', 'around', 'in', 'the', 'street', 'lf', 'I', 'see', 'anything', 'suspicious']"
238	l'lI phone you. If not, see you tomorrow. 	позвоню. Если нет, тогда до завтра. 	['позвоню', 'Если', 'нет', 'тогда', 'до', 'завтра']	"[""l'lI"", 'phone', 'you', 'If', 'not', 'see', 'you', 'tomorrow']"
239	What is it? 	Что такое? 	['Что', 'такое']	['What', 'is', 'it']
240	There is someone out there! 	Там кто-то есть! 	['Там', 'кто-то', 'есть']	['There', 'is', 'someone', 'out', 'there']
241	Awoman. 	Женщина. 	['Женщина']	['Awoman']
242	Who is there? Who are you? 	Кто там? 	['Кто', 'там']	['Who', 'is', 'there', 'Who', 'are', 'you']
243	I live here. 	Я живу здесь. 	['Я', 'живу', 'здесь']	['I', 'live', 'here']
244	- I'm one of your neighbours. -Was that man Iooking for me? 	- Я одна из Ваших соседей. - Тот мужчина искал меня? 	['Я', 'одна', 'из', 'Ваших', 'соседей', 'Тот', 'мужчина', 'искал', 'меня']	"[""I'm"", 'one', 'of', 'your', 'neighbours', 'Was', 'that', 'man', 'Iooking', 'for', 'me']"
245	No. It's nothing. 	Нет. Ничуть. 	['Нет', 'Ничуть']	"['No', ""It's"", 'nothing']"
246	l've told you, nothing! 	Я же сказала, нет! 	['Я', 'же', 'сказала', 'нет']	"[""l've"", 'told', 'you', 'nothing']"
247	-Who do you think she is? -A neighbour, like she said. 	- Кто она? - Соседка, как она сказала. 	['Кто', 'она', 'Соседка', 'как', 'она', 'сказала']	['Who', 'do', 'you', 'think', 'she', 'is', 'A', 'neighbour', 'like', 'she', 'said']
248	Put the chain on. 	Закрой на цепочку. 	['Закрой', 'на', 'цепочку']	['Put', 'the', 'chain', 'on']
249	I don'twant to lose anotherstar. 	Не хочу потерять еще одну звезду. 	['Не', 'хочу', 'потерять', 'еще', 'одну', 'звезду']	"['I', ""don'twant"", 'to', 'lose', 'anotherstar']"
250	Who is it? 	Кто это? 	['Кто', 'это']	['Who', 'is', 'it']
251	Who's there? 	 	[]	"[""Who's"", 'there']"
252	Who's there? 	Кто это? 	['Кто', 'это']	"[""Who's"", 'there']"
253	HeIlo? 	Алло? 	['Алло']	['HeIlo']
254	ls that you, Mark? 	Это Марк? 	['Это', 'Марк']	['ls', 'that', 'you', 'Mark']
255	Mark, is that you? 	Марк, это Вы? 	['Марк', 'это', 'Вы']	['Mark', 'is', 'that', 'you']
256	Oh, my God! Why did l sing that roIe? 	Господи! Ну, зачем я спела эту роль? 	['Господи', 'Ну', 'зачем', 'я', 'спела', 'эту', 'роль']	['Oh', 'my', 'God', 'Why', 'did', 'l', 'sing', 'that', 'roIe']
257	I shouldn't have! 	Не надо было 	['Не', 'надо', 'было']	"['I', ""shouldn't"", 'have']"
258	lt was myfauIt. 	Это было моей ошибкой. 	['Это', 'было', 'моей', 'ошибкой']	['lt', 'was', 'myfauIt']
259	Why did l do it? 	Ну почему я это сделала? 	['Ну', 'почему', 'я', 'это', 'сделала']	['Why', 'did', 'l', 'do', 'it']
260	Don'tcry, Betty. Don't cry! 	Не плачь, Бетти! 	['Не', 'плачь', 'Бетти']	"[""Don'tcry"", 'Betty', ""Don't"", 'cry']"
261	Stormy reception from ''Macbeth''. 	"Бурная реакция на ""Макбет""'. "	"['Бурная', 'реакция', 'на', 'Макбет""\'']"	"['Stormy', 'reception', 'from', ""''Macbeth''""]"
262	''BriIIiant debut by young singer 	"""Блестящий дебют молодой певицы, "	['Блестящий', 'дебют', 'молодой', 'певицы']	"[""''BriIIiant"", 'debut', 'by', 'young', 'singer']"
263	who at the Iast moment substituted Mara Cecova.'' 	"заменившей в последний момент Мару Чекову."" "	['заменившей', 'в', 'последний', 'момент', 'Мару', 'Чекову']	"['who', 'at', 'the', 'Iast', 'moment', 'substituted', 'Mara', ""Cecova.''""]"
264	''RevoIutionary, butcrazy set. Doubts regarding the direction.'' 	''Революционно, но бредово поставленно. Сомнения относительно режиссуры''. 	"[""''Революционно"", 'но', 'бредово', 'поставленно', 'Сомнения', 'относительно', ""режиссуры''""]"	"[""''RevoIutionary"", 'butcrazy', 'set', 'Doubts', 'regarding', 'the', ""direction.''""]"
265	''Advice to the director: go back to horrorfilms.'' 	''Совет режиссеру: возвращайтесь к фильмам ужасов''. 	"[""''Совет"", 'режиссеру', 'возвращайтесь', 'к', 'фильмам', ""ужасов''""]"	"[""''Advice"", 'to', 'the', 'director', 'go', 'back', 'to', ""horrorfilms.''""]"
266	''Forget opera!'' 	''Бросьте оперу!'' 	"[""''Бросьте"", ""оперу!''""]"	"[""''Forget"", ""opera!''""]"
267	They're pulIing you to pieces. 	Они разнесли тебя в пух и прах. 	['Они', 'разнесли', 'тебя', 'в', 'пух', 'и', 'прах']	"[""They're"", 'pulIing', 'you', 'to', 'pieces']"
268	-At least it's onIy on paper. -And she, a totaIly unknown, 	- Это всего лишь газеты. - А она, неизвестная никому, 	['Это', 'всего', 'лишь', 'газеты', 'А', 'она', 'неизвестная', 'никому']	"['At', 'least', ""it's"", 'onIy', 'on', 'paper', 'And', 'she', 'a', 'totaIly', 'unknown']"
269	gets nothing but praise. - She was very good. 	получает столько похвал. - Она была очень хороша. 	['получает', 'столько', 'похвал', 'Она', 'была', 'очень', 'хороша']	['gets', 'nothing', 'but', 'praise', 'She', 'was', 'very', 'good']
270	When they Iauded CeciIia Gasdia and blasted your direction of''RigoIetto'' 	"Когда они возносили Сесилию Газду обливали грязью твою режиссуру ""Риголетто"" "	['Когда', 'они', 'возносили', 'Сесилию', 'Газду', 'обливали', 'грязью', 'твою', 'режиссуру', 'Риголетто']	"['When', 'they', 'Iauded', 'CeciIia', 'Gasdia', 'and', 'blasted', 'your', 'direction', ""of''RigoIetto''""]"
271	you were very pissed off, but not this time. 	тогда ты был очень огорчен, но не сейчас. 	['тогда', 'ты', 'был', 'очень', 'огорчен', 'но', 'не', 'сейчас']	['you', 'were', 'very', 'pissed', 'off', 'but', 'not', 'this', 'time']
272	How come? 	Отчего? 	['Отчего']	['How', 'come']
273	You want to take the girl to bed, don't you? 	Ты хочешь с ней переспать? 	['Ты', 'хочешь', 'с', 'ней', 'переспать']	"['You', 'want', 'to', 'take', 'the', 'girl', 'to', 'bed', ""don't"", 'you']"
274	To be here with you this evening, l took two flights 	Чтобы быть здесь с тобой сегодня, я взяла два билета 	['Чтобы', 'быть', 'здесь', 'с', 'тобой', 'сегодня', 'я', 'взяла', 'два', 'билета']	['To', 'be', 'here', 'with', 'you', 'this', 'evening', 'l', 'took', 'two', 'flights']
275	and turned down a fashion show. 	и отменила показ. 	['и', 'отменила', 'показ']	['and', 'turned', 'down', 'a', 'fashion', 'show']
276	Fragments of the same feathers mixed with traces ofblood 	Фрагменты этих же перьев, смешанных с кровью 	['Фрагменты', 'этих', 'же', 'перьев', 'смешанных', 'с', 'кровью']	['Fragments', 'of', 'the', 'same', 'feathers', 'mixed', 'with', 'traces', 'ofblood']
277	were found on a carpet in Stefano Brini's apartment. 	найдены на ковре в квартире Стефано Брини. 	['найдены', 'на', 'ковре', 'в', 'квартире', 'Стефано', 'Брини']	"['were', 'found', 'on', 'a', 'carpet', 'in', 'Stefano', ""Brini's"", 'apartment']"
278	-What was he? Your... -Stage manager. 	- Кем он работал?  - Помощником режиссера. 	['Кем', 'он', 'работал', 'Помощником', 'режиссера']	['What', 'was', 'he', 'Your', 'Stage', 'manager']
279	Ah, yes, stage manager. 	А, да, помощник режиссера. 	['А', 'да', 'помощник', 'режиссера']	['Ah', 'yes', 'stage', 'manager']
280	Killed, or rather, butchered, 	Убит, или даже, изрублен, 	['Убит', 'или', 'даже', 'изрублен']	['Killed', 'or', 'rather', 'butchered']
281	last night between 1:00 and 2:00 o'cIock. 	прошлой ночью между 1:00 и 2:00 часами. 	['прошлой', 'ночью', 'между', '1:00', 'и', '2:00', 'часами']	"['last', 'night', 'between', '1:00', 'and', '2:00', ""o'cIock""]"
282	Who saw him Iast? 	Кто видел его последним? 	['Кто', 'видел', 'его', 'последним']	['Who', 'saw', 'him', 'Iast']
283	There was a first-night party. 	Вчера был банкет по случаю премьеры. 	['Вчера', 'был', 'банкет', 'по', 'случаю', 'премьеры']	['There', 'was', 'a', 'first-night', 'party']
284	- Did he leave alone? - l don't know. l wasn't there. 	- Он ушел один? - Я не знаю. Меня там не было. 	['Он', 'ушел', 'один', 'Я', 'не', 'знаю', 'Меня', 'там', 'не', 'было']	"['Did', 'he', 'leave', 'alone', 'l', ""don't"", 'know', 'l', ""wasn't"", 'there']"
285	I see. Who did go to this party? 	Кто был вчера на банкете? 	['Кто', 'был', 'вчера', 'на', 'банкете']	['I', 'see', 'Who', 'did', 'go', 'to', 'this', 'party']
286	- Did you? -Yes, I did. 	- Вы? - Да, я была. 	['Вы', 'Да', 'я', 'была']	['Did', 'you', 'Yes', 'I', 'did']
287	What time did he leave? 	В котором часу он ушел? 	['В', 'котором', 'часу', 'он', 'ушел']	['What', 'time', 'did', 'he', 'leave']
288	I think he left with Betty, our singer. 	Кажется, они ушли вместе с Бетти, нашей певицей. 	['Кажется', 'они', 'ушли', 'вместе', 'с', 'Бетти', 'нашей', 'певицей']	['I', 'think', 'he', 'left', 'with', 'Betty', 'our', 'singer']
289	- ls Betty here? - No, butshe wiII be soon. 	- Бетти здесь? - Нет, но она скоро будет. 	['Бетти', 'здесь', 'Нет', 'но', 'она', 'скоро', 'будет']	['ls', 'Betty', 'here', 'No', 'butshe', 'wiII', 'be', 'soon']
290	-We have to rehearse. - I'm not finished yet. 	- Нам надо репетировать. - Я еще не закончил. 	['Нам', 'надо', 'репетировать', 'Я', 'еще', 'не', 'закончил']	"['We', 'have', 'to', 'rehearse', ""I'm"", 'not', 'finished', 'yet']"
291	You are Maurizio, right? The one responsibIe forthe ravens. 	Вы Маурицио? Вы отвечаете за птиц. 	['Вы', 'Маурицио', 'Вы', 'отвечаете', 'за', 'птиц']	['You', 'are', 'Maurizio', 'right', 'The', 'one', 'responsibIe', 'forthe', 'ravens']
292	- How many were kilIed? - Three. 	- Сколько птиц убито? - Три. 	['Сколько', 'птиц', 'убито', 'Три']	['How', 'many', 'were', 'kilIed', 'Three']
293	lnspector, l know who kiIled the ravens. 	Инспектор, я знаю кто убил воронов. 	['Инспектор', 'я', 'знаю', 'кто', 'убил', 'воронов']	['lnspector', 'l', 'know', 'who', 'kiIled', 'the', 'ravens']
294	-Who? - Mara Cecova hated them. 	- Кто? - Мара Чекова, она их ненавидит. 	['Кто', 'Мара', 'Чекова', 'она', 'их', 'ненавидит']	['Who', 'Mara', 'Cecova', 'hated', 'them']
295	What are you taIking about? Don't be ridicuIous. 	Что Вы несете? Не смешите меня. 	['Что', 'Вы', 'несете', 'Не', 'смешите', 'меня']	"['What', 'are', 'you', 'taIking', 'about', ""Don't"", 'be', 'ridicuIous']"
296	Ravens are very vindictive. They don't forget. 	Ворон - птица мстительная. Они все запомнят. 	['Ворон', 'птица', 'мстительная', 'Они', 'все', 'запомнят']	"['Ravens', 'are', 'very', 'vindictive', 'They', ""don't"", 'forget']"
297	They rememberforyears and at the right moment...Zap! 	Будут помнить до тех пор, пока в подходящий момент...Цап! 	['Будут', 'помнить', 'до', 'тех', 'пор', 'пока', 'в', 'подходящий', 'момент...Цап']	['They', 'rememberforyears', 'and', 'at', 'the', 'right', 'moment...Zap']
298	This ''Macbeth'' has been hit by so much bad luck 	"Этому "" Макбету"" досталось столько несчастий "	['Этому', 'Макбету', 'досталось', 'столько', 'несчастий']	"['This', ""''Macbeth''"", 'has', 'been', 'hit', 'by', 'so', 'much', 'bad', 'luck']"
299	and so many coincidences. 	и совпадений. 	['и', 'совпадений']	['and', 'so', 'many', 'coincidences']
300	- It staggers the imagination. - I don't want you to think... 	- Потрясает воображение. - Не хочу, чтобы Вы считали... 	['Потрясает', 'воображение', 'Не', 'хочу', 'чтобы', 'Вы', 'считали']	"['It', 'staggers', 'the', 'imagination', 'I', ""don't"", 'want', 'you', 'to', 'think']"
301	I'm a superstition type, but it's ''Macbeth'' that brings bad Iuck. 	"меня суеверным, но ""Макбет''...  он приносит несчастье. "	"['меня', 'суеверным', 'но', ""Макбет''"", 'он', 'приносит', 'несчастье']"	"[""I'm"", 'a', 'superstition', 'type', 'but', ""it's"", ""''Macbeth''"", 'that', 'brings', 'bad', 'Iuck']"
302	Everyone knows that. 	Это каждый знает. 	['Это', 'каждый', 'знает']	['Everyone', 'knows', 'that']
303	l couId teII you about dozens of strange incidents. 	Я могу привести Вам дюжину странных инцидентов. 	['Я', 'могу', 'привести', 'Вам', 'дюжину', 'странных', 'инцидентов']	['l', 'couId', 'teII', 'you', 'about', 'dozens', 'of', 'strange', 'incidents']
304	A lot of peopIe believe the opera to be cursed. 	Многие верят, что на этой опере лежит проклятье. 	['Многие', 'верят', 'что', 'на', 'этой', 'опере', 'лежит', 'проклятье']	['A', 'lot', 'of', 'peopIe', 'believe', 'the', 'opera', 'to', 'be', 'cursed']
305	I've seen a Iot of your movies. You are an expert in this field. 	Я видел много Ваших фильмов. Вы эксперт в своем деле. 	['Я', 'видел', 'много', 'Ваших', 'фильмов', 'Вы', 'эксперт', 'в', 'своем', 'деле']	"[""I've"", 'seen', 'a', 'Iot', 'of', 'your', 'movies', 'You', 'are', 'an', 'expert', 'in', 'this', 'field']"
306	l'd be very interested to know your opinion. 	Мне было бы любопытно знать Ваше мнение. 	['Мне', 'было', 'бы', 'любопытно', 'знать', 'Ваше', 'мнение']	"[""l'd"", 'be', 'very', 'interested', 'to', 'know', 'your', 'opinion']"
307	lt's unwise to use movies as guides for reaIity, isn't it, lnspector? 	Разумно ли руководствоваться фильмами в реальности, инспектор? 	['Разумно', 'ли', 'руководствоваться', 'фильмами', 'в', 'реальности', 'инспектор']	"[""lt's"", 'unwise', 'to', 'use', 'movies', 'as', 'guides', 'for', 'reaIity', ""isn't"", 'it', 'lnspector']"
308	It depends what you mean by reality. 	Смотря, что Вы называете реальностью. 	['Смотря', 'что', 'Вы', 'называете', 'реальностью']	['It', 'depends', 'what', 'you', 'mean', 'by', 'reality']
309	l've gotto fix this dress before the next performance 	Я должны починить костюм к выступлению послезавтра, 	['Я', 'должны', 'починить', 'костюм', 'к', 'выступлению', 'послезавтра']	"[""l've"", 'gotto', 'fix', 'this', 'dress', 'before', 'the', 'next', 'performance']"
310	and l've got onIy two hands! 	но у меня только две руки! 	['но', 'у', 'меня', 'только', 'две', 'руки']	"['and', ""l've"", 'got', 'onIy', 'two', 'hands']"
311	With ten hands, the costumes wouId stiIl be a pile of shit! 	И с 10 руками костюмы были бы кучей дерьма! 	['И', 'с', '10', 'руками', 'костюмы', 'были', 'бы', 'кучей', 'дерьма']	['With', 'ten', 'hands', 'the', 'costumes', 'wouId', 'stiIl', 'be', 'a', 'pile', 'of', 'shit']
312	What? 	Что? 	['Что']	['What']
313	AIright, Mister Genius Director! 	Хорошо, мистер Гениальный Режиссер! 	['Хорошо', 'мистер', 'Гениальный', 'Режиссер']	['AIright', 'Mister', 'Genius', 'Director']
314	l put most ofthe blame on ourfancy pants director here 	Но виноват в этом наш  любимый голубенький режиссерик, 	['Но', 'виноват', 'в', 'этом', 'наш', 'любимый', 'голубенький', 'режиссерик']	['l', 'put', 'most', 'ofthe', 'blame', 'on', 'ourfancy', 'pants', 'director', 'here']
315	who thinks Verdi was a twit and Shakespeare an asshole! 	который считает Верди придурком, а Шекспира - жопой с ручками! 	['который', 'считает', 'Верди', 'придурком', 'а', 'Шекспира', 'жопой', 'с', 'ручками']	['who', 'thinks', 'Verdi', 'was', 'a', 'twit', 'and', 'Shakespeare', 'an', 'asshole']
316	l'II fix the dress, but not foryou, for Giuseppe Verdi! 	Я починю костюм, но не для Вас, а для Джезеппе Верди! 	['Я', 'починю', 'костюм', 'но', 'не', 'для', 'Вас', 'а', 'для', 'Джезеппе', 'Верди']	"[""l'II"", 'fix', 'the', 'dress', 'but', 'not', 'foryou', 'for', 'Giuseppe', 'Verdi']"
317	Let's get out ofhere. 	Убирайтесь. 	['Убирайтесь']	"[""Let's"", 'get', 'out', 'ofhere']"
318	-AlI this turns you on, doesn't it? -Whatare you talking about? 	- Все это заводит тебя? - О чем ты говоришь? 	['Все', 'это', 'заводит', 'тебя', 'О', 'чем', 'ты', 'говоришь']	"['AlI', 'this', 'turns', 'you', 'on', ""doesn't"", 'it', 'Whatare', 'you', 'talking', 'about']"
319	-You're a sadist! - RealIy? 	- Ты садист! - Правда? 	['Ты', 'садист', 'Правда']	"[""You're"", 'a', 'sadist', 'RealIy']"
320	Everyone who knows you says the same thing. 	Каждый, кто тебя знает, говорит это. 	['Каждый', 'кто', 'тебя', 'знает', 'говорит', 'это']	['Everyone', 'who', 'knows', 'you', 'says', 'the', 'same', 'thing']
321	That must be boring forthem. 	Должно быть им это скучно. 	['Должно', 'быть', 'им', 'это', 'скучно']	['That', 'must', 'be', 'boring', 'forthem']
322	-Just the person l wanted to see! -What's happened to my costume? 	- Вот кого я хотела видеть! - Что случилось с моим костюмом? 	['Вот', 'кого', 'я', 'хотела', 'видеть', 'Что', 'случилось', 'с', 'моим', 'костюмом']	"['Just', 'the', 'person', 'l', 'wanted', 'to', 'see', ""What's"", 'happened', 'to', 'my', 'costume']"
323	Look at this mess. Someone tore it apart. 	Посмотри на эти куски. Кто-то разодрал его в клочья. 	['Посмотри', 'на', 'эти', 'куски', 'Кто-то', 'разодрал', 'его', 'в', 'клочья']	['Look', 'at', 'this', 'mess', 'Someone', 'tore', 'it', 'apart']
324	Someone who doesn't Iike the opera orthatasshoIe Mark's version of it. 	Кто не любит оперу или эту дерьмовую постановку . 	['Кто', 'не', 'любит', 'оперу', 'или', 'эту', 'дерьмовую', 'постановку']	"['Someone', 'who', ""doesn't"", 'Iike', 'the', 'opera', 'orthatasshoIe', ""Mark's"", 'version', 'of', 'it']"
325	This time he O.D.ed on weird. 	На этот раз режиссер  переборщил с причудами. 	['На', 'этот', 'раз', 'режиссер', 'переборщил', 'с', 'причудами']	['This', 'time', 'he', 'O.D.ed', 'on', 'weird']
326	It's not like movies, where you're congratulated on originaI ideas. 	Здесь не кино, где можно вылезти со своими идейками и все станут вас боготворить. 	['Здесь', 'не', 'кино', 'где', 'можно', 'вылезти', 'со', 'своими', 'идейками', 'и', 'все', 'станут', 'вас', 'боготворить']	"[""It's"", 'not', 'like', 'movies', 'where', ""you're"", 'congratulated', 'on', 'originaI', 'ideas']"
