	en	ru	ru_tokens	en_tokens
943	Hi. Nice to meet you. This is my stepmother Helen. 	Приятно познакомиться. Моя мачеха Хелен. 	['Приятно', 'познакомиться', 'Моя', 'мачеха', 'Хелен']	['Hi', 'Nice', 'to', 'meet', 'you', 'This', 'is', 'my', 'stepmother', 'Helen']
944	Hi. Harry Dunne. Pleasure to meet you both. 	Гарри Данн. Приятно с вами познакомиться. 	['Гарри', 'Данн', 'Приятно', 'с', 'вами', 'познакомиться']	['Hi', 'Harry', 'Dunne', 'Pleasure', 'to', 'meet', 'you', 'both']
945	Mm-hmm. Well, I saw you come in. 	Надеялась, что мне представится 	['Надеялась', 'что', 'мне', 'представится']	['Mm-hmm', 'Well', 'I', 'saw', 'you', 'come', 'in']
946	I was hoping I'd get a chance to meet you. 	возможность с вами познакомиться. 	['возможность', 'с', 'вами', 'познакомиться']	"['I', 'was', 'hoping', ""I'd"", 'get', 'a', 'chance', 'to', 'meet', 'you']"
947	- You were? Really? - Yes! That tuxedo, it's fabulous! 	Надеялись? Правда? Ваш смокинг. Это что-то! 	['Надеялись', 'Правда', 'Ваш', 'смокинг', 'Это', 'что-то']	"['You', 'were', 'Really', 'Yes', 'That', 'tuxedo', ""it's"", 'fabulous']"
948	Really. I love a man with a sense of humor, 	Обожаю людей с чувством юмора. 	['Обожаю', 'людей', 'с', 'чувством', 'юмора']	['Really', 'I', 'love', 'a', 'man', 'with', 'a', 'sense', 'of', 'humor']
949	and so does Mary. It's hysterical! 	И Мэри тоже. Просто отпад. 	['И', 'Мэри', 'тоже', 'Просто', 'отпад']	"['and', 'so', 'does', 'Mary', ""It's"", 'hysterical']"
950	- Really? - Oh, yes. 	Правда? Да. 	['Правда', 'Да']	['Really', 'Oh', 'yes']
951	Oh. Anyway, um, about my friend... 	По поводу моего друга... 	['По', 'поводу', 'моего', 'друга']	['Oh', 'Anyway', 'um', 'about', 'my', 'friend']
952	What are you doing tomorrow? I believe that Mary 	Что вы делаете завтра? Полагаю, Мэри ищет кого-нибудь, 	['Что', 'вы', 'делаете', 'завтра', 'Полагаю', 'Мэри', 'ищет', 'кого-нибудь']	['What', 'are', 'you', 'doing', 'tomorrow', 'I', 'believe', 'that', 'Mary']
953	is looking for someone to hit the slopes with. 	чтобы на лыжах вместе покататься. 	['чтобы', 'на', 'лыжах', 'вместе', 'покататься']	['is', 'looking', 'for', 'someone', 'to', 'hit', 'the', 'slopes', 'with']
954	She... what? Huh? 	Чего? 	['Чего']	['She', 'what', 'Huh']
955	Helen, you're embarrassing me. 	Ты меня ставишь в неловкое положение. 	['Ты', 'меня', 'ставишь', 'в', 'неловкое', 'положение']	"['Helen', ""you're"", 'embarrassing', 'me']"
956	Well, you are. I mean, after all, 	Да, но так и есть. 	['Да', 'но', 'так', 'и', 'есть']	['Well', 'you', 'are', 'I', 'mean', 'after', 'all']
957	the snow's going to be gone in a couple of weeks. 	Через пару недель снег растает. 	['Через', 'пару', 'недель', 'снег', 'растает']	"['the', ""snow's"", 'going', 'to', 'be', 'gone', 'in', 'a', 'couple', 'of', 'weeks']"
958	And, well, this may be your last chance. 	Может, это ваш последний шанс. 	['Может', 'это', 'ваш', 'последний', 'шанс']	['And', 'well', 'this', 'may', 'be', 'your', 'last', 'chance']
959	Poor thing, she never gets a chance to get out. 	Она такая домоседка. 	['Она', 'такая', 'домоседка']	['Poor', 'thing', 'she', 'never', 'gets', 'a', 'chance', 'to', 'get', 'out']
960	Well, what do you say, Mr. Dunne? Are you available? 	Ну что, мистер Данн. Вы сможете? 	['Ну', 'что', 'мистер', 'Данн', 'Вы', 'сможете']	['Well', 'what', 'do', 'you', 'say', 'Mr', 'Dunne', 'Are', 'you', 'available']
961	Well, I don't know. See, my friend... 	Мой приятель... 	['Мой', 'приятель']	"['Well', 'I', ""don't"", 'know', 'See', 'my', 'friend']"
962	Oh, forget your friend for one day. 	Забудьте на денек о своем приятеле. 	['Забудьте', 'на', 'денек', 'о', 'своем', 'приятеле']	['Oh', 'forget', 'your', 'friend', 'for', 'one', 'day']
963	I think you kids'll have a wonderful time. What do you say? 	Думаю, вы чудесно проведете время. Что скажете? 	['Думаю', 'вы', 'чудесно', 'проведете', 'время', 'Что', 'скажете']	"['I', 'think', 'you', ""kids'll"", 'have', 'a', 'wonderful', 'time', 'What', 'do', 'you', 'say']"
964	Well, you know, I don't know, you know. 	Не знаю. Дело в том... 	['Не', 'знаю', 'Дело', 'в', 'том']	"['Well', 'you', 'know', 'I', ""don't"", 'know', 'you', 'know']"
965	You know, the thing... part of... sure. 	Конечно. 	['Конечно']	['You', 'know', 'the', 'thing', 'part', 'of', 'sure']
966	What time? Ahem... 	Во сколько? 	['Во', 'сколько']	['What', 'time', 'Ahem']
967	How come you didn't bring her over? 	Ты почему без нее пришел? 	['Ты', 'почему', 'без', 'нее', 'пришел']	"['How', 'come', 'you', ""didn't"", 'bring', 'her', 'over']"
968	Relax. You're golden. 	Успокойся. Ты получаешь приз. 	['Успокойся', 'Ты', 'получаешь', 'приз']	"['Relax', ""You're"", 'golden']"
969	- I got you a date with her tomorrow. - Oh. 	У тебя с ней свидание завтра. 	['У', 'тебя', 'с', 'ней', 'свидание', 'завтра']	['I', 'got', 'you', 'a', 'date', 'with', 'her', 'tomorrow', 'Oh']
970	- (stammers) What... I... this... - Yeah. 	Что? Поверить не... 	['Что', 'Поверить', 'не']	['stammers', 'What', 'I', 'this', 'Yeah']
971	- I love you, man. - Okay okay. 	Я тебя люблю. 	['Я', 'тебя', 'люблю']	['I', 'love', 'you', 'man', 'Okay', 'okay']
972	- You're kissing me. - I love you. 	Ладно тебе, ты ж меня целуешь. - Я люблю тебя. 	['Ладно', 'тебе', 'ты', 'ж', 'меня', 'целуешь', 'Я', 'люблю', 'тебя']	"[""You're"", 'kissing', 'me', 'I', 'love', 'you']"
973	- I love you! - You're kissing me. Lloyd! 	Я люблю тебя. Ты поцеловал меня, Ллойд. 	['Я', 'люблю', 'тебя', 'Ты', 'поцеловал', 'меня', 'Ллойд']	"['I', 'love', 'you', ""You're"", 'kissing', 'me', 'Lloyd']"
974	This calls for a little of the bubbly! 	Такое полагается вспрыснуть шампусиком. 	['Такое', 'полагается', 'вспрыснуть', 'шампусиком']	['This', 'calls', 'for', 'a', 'little', 'of', 'the', 'bubbly']
975	- You're going to be my best man, Harr. - Oh, good. 	Ты будешь моим шафером. Ладно, хорошо. 	['Ты', 'будешь', 'моим', 'шафером', 'Ладно', 'хорошо']	"[""You're"", 'going', 'to', 'be', 'my', 'best', 'man', 'Harr', 'Oh', 'good']"
976	- I promise. - Thank you. 	Я обещаю. Спасибо. 	['Я', 'обещаю', 'Спасибо']	['I', 'promise', 'Thank', 'you']
977	You have just earned yourself a seat 	Ты только что заработал место во главе стола. 	['Ты', 'только', 'что', 'заработал', 'место', 'во', 'главе', 'стола']	['You', 'have', 'just', 'earned', 'yourself', 'a', 'seat']
978	at the head table, pal. And we already got the tuxes. 	Смокинги у нас уже есть. 	['Смокинги', 'у', 'нас', 'уже', 'есть']	['at', 'the', 'head', 'table', 'pal', 'And', 'we', 'already', 'got', 'the', 'tuxes']
979	- (loud thud) - (owl squawks) - Woman: Gracious sakes! - (crowd murmuring) - Man: Good grief! - Boy, this party really died. 	Блин, вечеринка выдохлась совсем. 	['Блин', 'вечеринка', 'выдохлась', 'совсем']	['loud', 'thud', 'owl', 'squawks', 'Woman', 'Gracious', 'sakes', 'crowd', 'murmuring', 'Man', 'Good', 'grief', 'Boy', 'this', 'party', 'really', 'died']
980	Hey, maybe it was a coincidence. (mimics) Hey, maybe it was a coincidence. 	Может, это совпадение. 	['Может', 'это', 'совпадение']	['Hey', 'maybe', 'it', 'was', 'a', 'coincidence', 'mimics', 'Hey', 'maybe', 'it', 'was', 'a', 'coincidence']
981	It was a message, Shay, pure and simple. 	Это был намек, Шэй. Ясный и понятный. 	['Это', 'был', 'намек', 'Шэй', 'Ясный', 'и', 'понятный']	['It', 'was', 'a', 'message', 'Shay', 'pure', 'and', 'simple']
982	I mean, we killed their bird. 	Мы убили их птичку, 	['Мы', 'убили', 'их', 'птичку']	['I', 'mean', 'we', 'killed', 'their', 'bird']
983	Now they killed one of ours. 	а они убили одну из наших. 	['а', 'они', 'убили', 'одну', 'из', 'наших']	['Now', 'they', 'killed', 'one', 'of', 'ours']
984	How could anybody whack a bird with a cork? 	Как вообще кто-то может мочкануть птицу пробкой? 	['Как', 'вообще', 'кто-то', 'может', 'мочкануть', 'птицу', 'пробкой']	['How', 'could', 'anybody', 'whack', 'a', 'bird', 'with', 'a', 'cork']
985	These guys aren't just anybody. 	Эти ребята не кто-то. 	['Эти', 'ребята', 'не', 'кто-то']	"['These', 'guys', ""aren't"", 'just', 'anybody']"
986	They're good. 	Они молодцы. 	['Они', 'молодцы']	"[""They're"", 'good']"
987	Mary Christmas. 	Мэри Христмас. 	['Мэри', 'Христмас']	['Mary', 'Christmas']
988	Mrs. Mary Christmas. 	Миссис Мэри Христмас. 	['Миссис', 'Мэри', 'Христмас']	['Mrs', 'Mary', 'Christmas']
989	- Kinda catchy, huh, Harr? - Yeah yeah, that sounds nice. 	- Неплохо звучит? - Да, ничего. 	['Неплохо', 'звучит', 'Да', 'ничего']	['Kinda', 'catchy', 'huh', 'Harr', 'Yeah', 'yeah', 'that', 'sounds', 'nice']
990	But, Lloyd, don't you think you might be jumping the gun a little bit? 	Но, Ллойд ты торопишься, всякое ведь может случится. 	['Но', 'Ллойд', 'ты', 'торопишься', 'всякое', 'ведь', 'может', 'случится']	"['But', 'Lloyd', ""don't"", 'you', 'think', 'you', 'might', 'be', 'jumping', 'the', 'gun', 'a', 'little', 'bit']"
991	I mean, you know, who knows? 	Ты понимаешь, о чем я? 	['Ты', 'понимаешь', 'о', 'чем', 'я']	['I', 'mean', 'you', 'know', 'who', 'knows']
992	You know, maybe, once you get to know her 	Может когда ты её узнаешь получше, 	['Может', 'когда', 'ты', 'её', 'узнаешь', 'получше']	['You', 'know', 'maybe', 'once', 'you', 'get', 'to', 'know', 'her']
993	you'll find out that she's not your type. 	Ты поймешь что она не в твоем вкусе. 	['Ты', 'поймешь', 'что', 'она', 'не', 'в', 'твоем', 'вкусе']	"[""you'll"", 'find', 'out', 'that', ""she's"", 'not', 'your', 'type']"
994	Hey! Don't you ever say that again! 	Никогда не произноси этого больше. 	['Никогда', 'не', 'произноси', 'этого', 'больше']	"['Hey', ""Don't"", 'you', 'ever', 'say', 'that', 'again']"
995	She is the love of my life! 	Она любовь всей моей жизни, 	['Она', 'любовь', 'всей', 'моей', 'жизни']	['She', 'is', 'the', 'love', 'of', 'my', 'life']
996	The blood in my veins! 	пульсирующая в венах! 	['пульсирующая', 'в', 'венах']	['The', 'blood', 'in', 'my', 'veins']
997	We belong together... 	Мы должны быть вместе, 	['Мы', 'должны', 'быть', 'вместе']	['We', 'belong', 'together']
998	till the mountains fall into the sea, 	До тех пор пока горы не скроет океан. 	['До', 'тех', 'пор', 'пока', 'горы', 'не', 'скроет', 'океан']	['till', 'the', 'mountains', 'fall', 'into', 'the', 'sea']
999	till the heavens collide! 	Пока небеса не разломятся пополам. 	['Пока', 'небеса', 'не', 'разломятся', 'пополам']	['till', 'the', 'heavens', 'collide']
1000	Or until I get sick of her and need to move on. 	Или до тех пор пока я не вставлю в неё. 	['Или', 'до', 'тех', 'пор', 'пока', 'я', 'не', 'вставлю', 'в', 'неё']	['Or', 'until', 'I', 'get', 'sick', 'of', 'her', 'and', 'need', 'to', 'move', 'on']
1001	- You hear me?! - Okay okay okay okay. Just calm down. 	Ты слышишь меня. Хорошо, успокойся. 	['Ты', 'слышишь', 'меня', 'Хорошо', 'успокойся']	['You', 'hear', 'me', 'Okay', 'okay', 'okay', 'okay', 'Just', 'calm', 'down']
1002	Just calm down. 	Просто успокойся. 	['Просто', 'успокойся']	['Just', 'calm', 'down']
1003	(panting) Okay. 	Хорошо. 	['Хорошо']	['panting', 'Okay']
1004	Now... 	А сейчас... 	['А', 'сейчас']	['Now']
1005	let me get this straight. 	Давай проясним одну вещь. 	['Давай', 'проясним', 'одну', 'вещь']	['let', 'me', 'get', 'this', 'straight']
1006	Lobby bar in the lobby. 	Бар в вестибюле, правильно? 	['Бар', 'в', 'вестибюле', 'правильно']	['Lobby', 'bar', 'in', 'the', 'lobby']
1007	Yeah, and that's what she said. 	Да, она сказала, 	['Да', 'она', 'сказала']	"['Yeah', 'and', ""that's"", 'what', 'she', 'said']"
1008	She'll meet you there at 10:00 sharp. 	Что встретится с тобой ровно в десять. 	['Что', 'встретится', 'с', 'тобой', 'ровно', 'в', 'десять']	"[""She'll"", 'meet', 'you', 'there', 'at', '10:00', 'sharp']"
1009	- Okay. - Okay. 	Хорошо. 	['Хорошо']	['Okay', 'Okay']
1010	Where're you going in that get-up? 	Куда это ты собрался в таком прикиде? 	['Куда', 'это', 'ты', 'собрался', 'в', 'таком', 'прикиде']	"[""Where're"", 'you', 'going', 'in', 'that', 'get-up']"
1011	Oh. I... you know, I just thought, you know, 	О... ты знаешь... 	['О', 'ты', 'знаешь']	['Oh', 'I', 'you', 'know', 'I', 'just', 'thought', 'you', 'know']
1012	when you'd be off making your love connection 	Пока ты будешь устраивать свою личную жизнь. 	['Пока', 'ты', 'будешь', 'устраивать', 'свою', 'личную', 'жизнь']	"['when', ""you'd"", 'be', 'off', 'making', 'your', 'love', 'connection']"
1013	I'd be out trying my luck on the slopes. 	Я попробую на горных лыжах покататься. 	['Я', 'попробую', 'на', 'горных', 'лыжах', 'покататься']	"[""I'd"", 'be', 'out', 'trying', 'my', 'luck', 'on', 'the', 'slopes']"
1014	You mean you're gonna go out in public dressed in tights? 	Ты что действительно появишься на людях в этом трико в этом трико? 	['Ты', 'что', 'действительно', 'появишься', 'на', 'людях', 'в', 'этом', 'трико', 'в', 'этом', 'трико']	"['You', 'mean', ""you're"", 'gonna', 'go', 'out', 'in', 'public', 'dressed', 'in', 'tights']"
1015	Oh no, these aren't tights, Lloyd. 	Нет, Ллойд это не трико, 	['Нет', 'Ллойд', 'это', 'не', 'трико']	"['Oh', 'no', 'these', ""aren't"", 'tights', 'Lloyd']"
1016	These are fashionable Euro-trash ski trousers. 	Это моднющий европейский горнолыжный костюм. 	['Это', 'моднющий', 'европейский', 'горнолыжный', 'костюм']	['These', 'are', 'fashionable', 'Euro-trash', 'ski', 'trousers']
1017	Pretty revealing. 	Очень откровенно. 	['Очень', 'откровенно']	['Pretty', 'revealing']
1018	Really? 	Правда? 	['Правда']	['Really']
1019	Yeah, but it's just a tiny lump. 	Но выпуклость все равно маленькая, 	['Но', 'выпуклость', 'все', 'равно', 'маленькая']	"['Yeah', 'but', ""it's"", 'just', 'a', 'tiny', 'lump']"
1020	No one'll notice. 	Никто его незаметит. 	['Никто', 'его', 'незаметит']	"['No', ""one'll"", 'notice']"
1021	"You're right. I can't go out dressed like this. (""New Age Girl"" playing) "	Ты прав. Я не могу ходить в этом. 	['Ты', 'прав', 'Я', 'не', 'могу', 'ходить', 'в', 'этом']	"[""You're"", 'right', 'I', ""can't"", 'go', 'out', 'dressed', 'like', 'this', 'New', 'Age', 'Girl', 'playing']"
1022	"(""New Age Girl"" playing) # Rah! # - # I've got a New Age girl # - # Tell us what she's like # - # Environmentalist girl # - # Does she ride a bike? # - # She has a crystal necklace... # - Hey! "	Привет! Уже иду! 	['Привет', 'Уже', 'иду']	"['New', 'Age', 'Girl', 'playing', 'Rah', ""I've"", 'got', 'a', 'New', 'Age', 'girl', 'Tell', 'us', 'what', ""she's"", 'like', 'Environmentalist', 'girl', 'Does', 'she', 'ride', 'a', 'bike', 'She', 'has', 'a', 'crystal', 'necklace', 'Hey']"
1023	- Coming! - # She spend a lot of cash? # # Though her vibes are rather reckless # - # Heading for the crash... # - Hey! Man: Nice going, buddy! # ... and she wonders about knowing, where did we begin? # # Mary Moon # 	Отлично ходишь, приятель. 	['Отлично', 'ходишь', 'приятель']	['Coming', 'She', 'spend', 'a', 'lot', 'of', 'cash', 'Though', 'her', 'vibes', 'are', 'rather', 'reckless', 'Heading', 'for', 'the', 'crash', 'Hey', 'Man', 'Nice', 'going', 'buddy', 'and', 'she', 'wonders', 'about', 'knowing', 'where', 'did', 'we', 'begin', 'Mary', 'Moon']
1024	- # She's a vegetarian # - # Mary Moon, Mary Moon, Mary Moon # # Mary Moon will help with all the septuagenarians... # - # Mary Moon, Mary Moon, Mary Moon. - Ma'am. # Mary Moon, she's an intellectual... # Beautiful outfit, sir. 	Отличный костюм, сэр. 	['Отличный', 'костюм', 'сэр']	"[""She's"", 'a', 'vegetarian', 'Mary', 'Moon', 'Mary', 'Moon', 'Mary', 'Moon', 'Mary', 'Moon', 'will', 'help', 'with', 'all', 'the', 'septuagenarians', 'Mary', 'Moon', 'Mary', 'Moon', 'Mary', 'Moon', ""Ma'am"", 'Mary', 'Moon', ""she's"", 'an', 'intellectual', 'Beautiful', 'outfit', 'sir']"
1025	There you go. 	Держи. 	['Держи']	['There', 'you', 'go']
1026	# Mary Moon, despite that fact, remains quite sexual # # Mary Moon, Mary Moon, Mary Moon. # Hey. How you doin'? 	Как дела? 	['Как', 'дела']	"['Mary', 'Moon', 'despite', 'that', 'fact', 'remains', 'quite', 'sexual', 'Mary', 'Moon', 'Mary', 'Moon', 'Mary', 'Moon', 'Hey', 'How', 'you', ""doin'""]"
1027	You're a little early. 	А вы рановато. 	['А', 'вы', 'рановато']	"[""You're"", 'a', 'little', 'early']"
1028	We don't open for about 45 minutes. 	Мы закрыты еще 45 минут. 	['Мы', 'закрыты', 'еще', '45', 'минут']	"['We', ""don't"", 'open', 'for', 'about', '45', 'minutes']"
1029	I'm meeting someone here. 	У меня здесь встреча кое с кем. 	['У', 'меня', 'здесь', 'встреча', 'кое', 'с', 'кем']	"[""I'm"", 'meeting', 'someone', 'here']"
1030	- Mind if I wait at the bar? - No. Come on in. 	Ничего, если я в баре подожду? Ничего. Проходите. 	['Ничего', 'если', 'я', 'в', 'баре', 'подожду', 'Ничего', 'Проходите']	['Mind', 'if', 'I', 'wait', 'at', 'the', 'bar', 'No', 'Come', 'on', 'in']
1031	It's a beautiful day, huh, Harry? 	Прекрасный денек, да? 	['Прекрасный', 'денек', 'да']	"[""It's"", 'a', 'beautiful', 'day', 'huh', 'Harry']"
1032	Yes yes, I've had a wonderful time so far. Thank you. 	Да, я очень давно не проводил время так замечательно. 	['Да', 'я', 'очень', 'давно', 'не', 'проводил', 'время', 'так', 'замечательно']	"['Yes', 'yes', ""I've"", 'had', 'a', 'wonderful', 'time', 'so', 'far', 'Thank', 'you']"
1033	God, it feels so good to get up here. 	Боже, какое чувство, когда сюда поднимаешься. 	['Боже', 'какое', 'чувство', 'когда', 'сюда', 'поднимаешься']	['God', 'it', 'feels', 'so', 'good', 'to', 'get', 'up', 'here']
1034	I haven't been outside that much in the last couple weeks. 	В последнее время я все больше дома сижу. 	['В', 'последнее', 'время', 'я', 'все', 'больше', 'дома', 'сижу']	"['I', ""haven't"", 'been', 'outside', 'that', 'much', 'in', 'the', 'last', 'couple', 'weeks']"
1035	Oh, yeah? Why not? 	Правда? Почему? 	['Правда', 'Почему']	['Oh', 'yeah', 'Why', 'not']
1036	Um, there's been some family problems, 	Кое-какие... семейные проблемы. 	['Кое-какие', 'семейные', 'проблемы']	"['Um', ""there's"", 'been', 'some', 'family', 'problems']"
1037	but I don't want to bore you with those. 	Не хочу вам этим докучать. 	['Не', 'хочу', 'вам', 'этим', 'докучать']	"['but', 'I', ""don't"", 'want', 'to', 'bore', 'you', 'with', 'those']"
1038	Thanks. 	Спасибо. 	['Спасибо']	['Thanks']
1039	Oh, look. Frost. 	Ой, смотрите, иней. 	['Ой', 'смотрите', 'иней']	['Oh', 'look', 'Frost']
1040	- Harry? - (grunting) 	Гарри? 	['Гарри']	['Harry', 'grunting']
1041	- Are you okay? - (muffled) Oh, yeah, 	Вы в порядке? Да. 	['Вы', 'в', 'порядке', 'Да']	['Are', 'you', 'okay', 'muffled', 'Oh', 'yeah']
1042	I do this all the time. 	Я фсе флемя так делаю. 	['Я', 'фсе', 'флемя', 'так', 'делаю']	['I', 'do', 'this', 'all', 'the', 'time']
1043	Let's go to the top this time. 	Давайте подниматься. 	['Давайте', 'подниматься']	"[""Let's"", 'go', 'to', 'the', 'top', 'this', 'time']"
1044	- Hi, there. - Ugh... 	Ждарова. 	['Ждарова']	['Hi', 'there', 'Ugh']
1045	Say, kids, 	Детиски... 	['Детиски']	['Say', 'kids']
1046	you wouldn't happen to have 	А у вас слуцяйно нет 	['А', 'у', 'вас', 'слуцяйно', 'нет']	"['you', ""wouldn't"", 'happen', 'to', 'have']"
1047	a cup of warm water, would you? (slurps) Yuck. 	цясецки теплой водицки? 	['цясецки', 'теплой', 'водицки']	['a', 'cup', 'of', 'warm', 'water', 'would', 'you', 'slurps', 'Yuck']
1048	Excuse me. 	Извините. 	['Извините']	['Excuse', 'me']
1049	Is it 10:00 A.M. Yet? 	Уже есть десять? 	['Уже', 'есть', 'десять']	['Is', 'it', '10:00', 'A.M', 'Yet']
1050	It's 1:00. 	Уже час. 	['Уже', 'час']	"[""It's"", '1:00']"
1051	That's what I have too. Thought maybe it was fast. 	И на моих тоже. Думал, может спешат. 	['И', 'на', 'моих', 'тоже', 'Думал', 'может', 'спешат']	"[""That's"", 'what', 'I', 'have', 'too', 'Thought', 'maybe', 'it', 'was', 'fast']"
1052	She's running late, huh? 	Она опаздывает? 	['Она', 'опаздывает']	"[""She's"", 'running', 'late', 'huh']"
1053	Just a couple hours. You know girls. 	Всего на пару часов. Ну вы знаете этих девчонок. 	['Всего', 'на', 'пару', 'часов', 'Ну', 'вы', 'знаете', 'этих', 'девчонок']	['Just', 'a', 'couple', 'hours', 'You', 'know', 'girls']
1054	When they're excited about something, 	Вобьют себе в голову что-нибудь… 	['Вобьют', 'себе', 'в', 'голову', 'что-нибудь…']	"['When', ""they're"", 'excited', 'about', 'something']"
1055	everything has to be perfect. 	И все у них должно быть идеально. 	['И', 'все', 'у', 'них', 'должно', 'быть', 'идеально']	['everything', 'has', 'to', 'be', 'perfect']
1056	This one's on me. Yippee. 	Это за мой счет. Ура. 	['Это', 'за', 'мой', 'счет', 'Ура']	"['This', ""one's"", 'on', 'me', 'Yippee']"
1057	Chablis, please. 	Шабли, пожалуйста. 	['Шабли', 'пожалуйста']	['Chablis', 'please']
1058	Hello. 	Здравствуйте. 	['Здравствуйте']	['Hello']
1059	(belching) Bad day, huh? 	День не сложился, да? 	['День', 'не', 'сложился', 'да']	['belching', 'Bad', 'day', 'huh']
1060	Me too. 	У меня тоже. 	['У', 'меня', 'тоже']	['Me', 'too']
1061	'Course everything's been bad 	Все не клеится, с тех пор, 	['Все', 'не', 'клеится', 'с', 'тех', 'пор']	"[""'Course"", ""everything's"", 'been', 'bad']"
1062	since I broke up with my boyfriend. 	как я с приятелем порвала. 	['как', 'я', 'с', 'приятелем', 'порвала']	['since', 'I', 'broke', 'up', 'with', 'my', 'boyfriend']
