	en	ru	ru_tokens	en_tokens
0	Excuse me. 	Извините. 	['Извините']	['Excuse', 'me']
1	Could you tell me how to get to the medical school? 	Как проехать к медицинскому колледжу? 	['Как', 'проехать', 'к', 'медицинскому', 'колледжу']	['Could', 'you', 'tell', 'me', 'how', 'to', 'get', 'to', 'the', 'medical', 'school']
2	I'm supposed to be doing a lecture in about 20 minutes, 	Мне лекцию через 20 минут читать, 	['Мне', 'лекцию', 'через', '20', 'минут', 'читать']	"[""I'm"", 'supposed', 'to', 'be', 'doing', 'a', 'lecture', 'in', 'about', '20', 'minutes']"
3	and my driver's a bit lost. 	а мой водитель заблудился. 	['а', 'мой', 'водитель', 'заблудился']	"['and', 'my', ""driver's"", 'a', 'bit', 'lost']"
4	(Austrian accent) You go straight ahead, 	Езжайте прямо, 	['Езжайте', 'прямо']	['Austrian', 'accent', 'You', 'go', 'straight', 'ahead']
5	and, uh, you make a left over the bridge. 	и после моста поверните налево. 	['и', 'после', 'моста', 'поверните', 'налево']	['and', 'uh', 'you', 'make', 'a', 'left', 'over', 'the', 'bridge']
6	That's a lovely accent you have. 	Какой приятный у вас акцент. 	['Какой', 'приятный', 'у', 'вас', 'акцент']	"[""That's"", 'a', 'lovely', 'accent', 'you', 'have']"
7	- New Jersey? - Austria. 	Нью-Джерси? Австрия? 	['Нью-Джерси', 'Австрия']	['New', 'Jersey', 'Austria']
8	Austria! Ha ha! Well, then... 	Австрия. Ну-Ну... 	['Австрия', 'Ну-Ну']	['Austria', 'Ha', 'ha', 'Well', 'then']
9	(Australian accent) G'day, mate. 	'Привет, подруга.' 	"[""'Привет"", ""подруга.'""]"	"['Australian', 'accent', ""G'day"", 'mate']"
10	Let's put another shrimp on the barbie. 	Давай подбросим еще креветочку на барбекю.' 	"['Давай', 'подбросим', 'еще', 'креветочку', 'на', ""барбекю.'""]"	"[""Let's"", 'put', 'another', 'shrimp', 'on', 'the', 'barbie']"
11	"Let's not. Oh. (""Boom shack-a-lak"" playing) # Boom shack-a-lak-a, what the people want # # Women them a flex and the men them a chant # # 'Ca' the '60s style, it have fe come back # # Draw fe bell-bottom, block heel and frock # # Boom shak-a-lak, rude boy # # Here when we tell them now, sir # # Wine your body, wriggle your belly # "	Давай не будем. 	['Давай', 'не', 'будем']	"[""Let's"", 'not', 'Oh', 'Boom', 'shack-a-lak', 'playing', 'Boom', 'shack-a-lak-a', 'what', 'the', 'people', 'want', 'Women', 'them', 'a', 'flex', 'and', 'the', 'men', 'them', 'a', 'chant', ""'Ca'"", 'the', ""'60s"", 'style', 'it', 'have', 'fe', 'come', 'back', 'Draw', 'fe', 'bell-bottom', 'block', 'heel', 'and', 'frock', 'Boom', 'shak-a-lak', 'rude', 'boy', 'Here', 'when', 'we', 'tell', 'them', 'now', 'sir', 'Wine', 'your', 'body', 'wriggle', 'your', 'belly']"
12	# Dip and go down-ee in the new stylee # # Wine and go up, wine and go down # # Bubble and a rocka to the new style around # # You fe line it up, you fe wine it up # # Do the Boom shak-a-lak till the dance hall fill up # # I say the Boom shack-a-lak are the brand new style # # Wicked say it wicked, jah jah, no say it wild # # Ragamuffin style fe the discipline child # # Dip and go downa 'ca' it well versatile # # You fe move fe your waist, move fe your back # # Wine and go down, do the shack-a-lak-a-lak # # Get in a groove 'ca' you are the top notch # # Bubble and a wine gal right 'pon the spot. # Now, who's got the wiener schnitzel? (dog barks) 	Кому сосиску венскую? 	['Кому', 'сосиску', 'венскую']	"['Dip', 'and', 'go', 'down-ee', 'in', 'the', 'new', 'stylee', 'Wine', 'and', 'go', 'up', 'wine', 'and', 'go', 'down', 'Bubble', 'and', 'a', 'rocka', 'to', 'the', 'new', 'style', 'around', 'You', 'fe', 'line', 'it', 'up', 'you', 'fe', 'wine', 'it', 'up', 'Do', 'the', 'Boom', 'shak-a-lak', 'till', 'the', 'dance', 'hall', 'fill', 'up', 'I', 'say', 'the', 'Boom', 'shack-a-lak', 'are', 'the', 'brand', 'new', 'style', 'Wicked', 'say', 'it', 'wicked', 'jah', 'jah', 'no', 'say', 'it', 'wild', 'Ragamuffin', 'style', 'fe', 'the', 'discipline', 'child', 'Dip', 'and', 'go', 'downa', ""'ca'"", 'it', 'well', 'versatile', 'You', 'fe', 'move', 'fe', 'your', 'waist', 'move', 'fe', 'your', 'back', 'Wine', 'and', 'go', 'down', 'do', 'the', 'shack-a-lak-a-lak', 'Get', 'in', 'a', 'groove', ""'ca'"", 'you', 'are', 'the', 'top', 'notch', 'Bubble', 'and', 'a', 'wine', 'gal', 'right', ""'pon"", 'the', 'spot', 'Now', ""who's"", 'got', 'the', 'wiener', 'schnitzel', 'dog', 'barks']"
13	Beautiful. There you go, Dolf. 	Прекрасно. Держи, Дольф. 	['Прекрасно', 'Держи', 'Дольф']	['Beautiful', 'There', 'you', 'go', 'Dolf']
14	There you go, buddy. Yeah. 	Держи, дружище. Наслаждайся 	['Держи', 'дружище', 'Наслаждайся']	['There', 'you', 'go', 'buddy', 'Yeah']
15	Let's see. 	Посмотрим… 	['Посмотрим…']	"[""Let's"", 'see']"
16	Next, we got roast beef au jus. (dog whines) 	дальше у нас ростбиф «а жю». 	['дальше', 'у', 'нас', 'ростбиф', '«а', 'жю»']	['Next', 'we', 'got', 'roast', 'beef', 'au', 'jus', 'dog', 'whines']
17	Who's got the roast beef au jus? 	Кому ростбиф «а жю»? 	['Кому', 'ростбиф', '«а', 'жю»']	"[""Who's"", 'got', 'the', 'roast', 'beef', 'au', 'jus']"
18	Stella, beautiful. Bon appetit, Stella. Oui oui, yeah. 	Стелла, отлично. Бон аппетит 	['Стелла', 'отлично', 'Бон', 'аппетит']	['Stella', 'beautiful', 'Bon', 'appetit', 'Stella', 'Oui', 'oui', 'yeah']
19	Walk away. Go on. Go on. 	Все, давай вали. Вали. 	['Все', 'давай', 'вали', 'Вали']	['Walk', 'away', 'Go', 'on', 'Go', 'on']
20	Last but not least... foot-long! 	И последний в списке, но не по значению 	['И', 'последний', 'в', 'списке', 'но', 'не', 'по', 'значению']	['Last', 'but', 'not', 'least', 'foot-long']
21	- Who's got the foot-long? - (whimpering) 	Полметровый, кому полметровый? 	['Полметровый', 'кому', 'полметровый']	"[""Who's"", 'got', 'the', 'foot-long', 'whimpering']"
22	There you... very funny, rascal. 	Кому... очень смешно... Барбос. 	['Кому', 'очень', 'смешно', 'Барбос']	['There', 'you', 'very', 'funny', 'rascal']
23	Very funny. In your dreams. 	Очень смешно. Размечтался. 	['Очень', 'смешно', 'Размечтался']	['Very', 'funny', 'In', 'your', 'dreams']
24	Man: Harry, why haven't you dropped those dogs off at the show yet? 	Гарри, Почему собаки до сих пор не на шоу? 	['Гарри', 'Почему', 'собаки', 'до', 'сих', 'пор', 'не', 'на', 'шоу']	"['Man', 'Harry', 'why', ""haven't"", 'you', 'dropped', 'those', 'dogs', 'off', 'at', 'the', 'show', 'yet']"
25	Uh, sir, I didn't want to send them 	Не хотел, чтобы они выступали 	['Не', 'хотел', 'чтобы', 'они', 'выступали']	"['Uh', 'sir', 'I', ""didn't"", 'want', 'to', 'send', 'them']"
26	to a performance on an empty stomach, sir. 	на голодный желудок, сэр. 	['на', 'голодный', 'желудок', 'сэр']	['to', 'a', 'performance', 'on', 'an', 'empty', 'stomach', 'sir']
27	- Get a move on it! - Yes, sir. 	- Живее! - Да, сэр. 	['Живее', 'Да', 'сэр']	['Get', 'a', 'move', 'on', 'it', 'Yes', 'sir']
28	Mutt cutts. 10-4. (all whining) (horn honks) (honks) (tires screech) 	Есть, сэр. Матт Каттс. 	['Есть', 'сэр', 'Матт', 'Каттс']	['Mutt', 'cutts', '10-4', 'all', 'whining', 'horn', 'honks', 'honks', 'tires', 'screech']
29	Whew. 	Вас понял. 	['Вас', 'понял']	['Whew']
30	Suck me sideways. Hello. How are you? 	Отсоси у меня сбоку. 	['Отсоси', 'у', 'меня', 'сбоку']	['Suck', 'me', 'sideways', 'Hello', 'How', 'are', 'you']
31	(romantic pop music playing) Uh-uh-uh... uh... uh-uh-uh... I'll be out in one minute. (mumbles) Ow. 	Здравствуйте. Как дела? 	['Здравствуйте', 'Как', 'дела']	"['romantic', 'pop', 'music', 'playing', 'Uh-uh-uh', 'uh', 'uh-uh-uh', ""I'll"", 'be', 'out', 'in', 'one', 'minute', 'mumbles', 'Ow']"
32	(inhales) (exhales) 	Буду готова через минуту. 	['Буду', 'готова', 'через', 'минуту']	['inhales', 'exhales']
33	Why are you going to the airport? 	А зачем вам в аэропорт? 	['А', 'зачем', 'вам', 'в', 'аэропорт']	['Why', 'are', 'you', 'going', 'to', 'the', 'airport']
34	Flying somewhere? 	Куда-нибудь летите? 	['Куда-нибудь', 'летите']	['Flying', 'somewhere']
35	How'd you guess? 	Как вы догадались? 	['Как', 'вы', 'догадались']	"[""How'd"", 'you', 'guess']"
36	I saw your luggage. 	Я видел ваш багаж. 	['Я', 'видел', 'ваш', 'багаж']	['I', 'saw', 'your', 'luggage']
37	Then when I noticed the airline ticket, 	А когда заметил билет на самолет, 	['А', 'когда', 'заметил', 'билет', 'на', 'самолет']	['Then', 'when', 'I', 'noticed', 'the', 'airline', 'ticket']
38	I put two and two together. 	то прикинул одно к другому. 	['то', 'прикинул', 'одно', 'к', 'другому']	['I', 'put', 'two', 'and', 'two', 'together']
39	So where're you headed? 	И куда же вас несет? 	['И', 'куда', 'же', 'вас', 'несет']	"['So', ""where're"", 'you', 'headed']"
40	Aspen. 	В Аспен. 	['В', 'Аспен']	['Aspen']
41	Mmm... California. 	Ммм... Калифорния! 	['Ммм', 'Калифорния']	['Mmm', 'California']
42	Beautiful. 	Прекрасно. 	['Прекрасно']	['Beautiful']
43	Name's Christmas, Lloyd Christmas. 	Меня зовут Кристмас, Ллойд Кристмас. 	['Меня', 'зовут', 'Кристмас', 'Ллойд', 'Кристмас']	"[""Name's"", 'Christmas', 'Lloyd', 'Christmas']"
44	I'm Mary Swanson. 	А меня Мэри Свонсон. 	['А', 'меня', 'Мэри', 'Свонсон']	"[""I'm"", 'Mary', 'Swanson']"
45	This isn't my real job, you know. 	Вообще-то это не моя настоящая работа. 	['Вообще-то', 'это', 'не', 'моя', 'настоящая', 'работа']	"['This', ""isn't"", 'my', 'real', 'job', 'you', 'know']"
46	- No? - Nope, my friend Harry and I 	Правда? Мы с моим другом Гарри 	['Правда', 'Мы', 'с', 'моим', 'другом', 'Гарри']	['No', 'Nope', 'my', 'friend', 'Harry', 'and', 'I']
47	are saving up our money to open our own pet store. 	копим деньги На зоомагазин. 	['копим', 'деньги', 'На', 'зоомагазин']	['are', 'saving', 'up', 'our', 'money', 'to', 'open', 'our', 'own', 'pet', 'store']
48	That's nice. 	Как мило. 	['Как', 'мило']	"[""That's"", 'nice']"
49	- I got worms. - I beg your pardon? 	'У меня полно червей. ' Прошу прощения? 	"[""'У"", 'меня', 'полно', 'червей', ""'"", 'Прошу', 'прощения']"	['I', 'got', 'worms', 'I', 'beg', 'your', 'pardon']
50	That's what we're going to call it... I Got Worms. 	Это его название: «У меня полно червей». 	['Это', 'его', 'название', '«У', 'меня', 'полно', 'червей»']	"[""That's"", 'what', ""we're"", 'going', 'to', 'call', 'it', 'I', 'Got', 'Worms']"
51	We're going to specialize in selling worm farms, 	Будем продавать фермы с червями. 	['Будем', 'продавать', 'фермы', 'с', 'червями']	"[""We're"", 'going', 'to', 'specialize', 'in', 'selling', 'worm', 'farms']"
52	you know, like ant farms. 	Ну, знаете, как муравьиные фермы. 	['Ну', 'знаете', 'как', 'муравьиные', 'фермы']	['you', 'know', 'like', 'ant', 'farms']
53	What's the matter? 	Что такое? 	['Что', 'такое']	"[""What's"", 'the', 'matter']"
54	A little tense about the flight? 	Немножко волнуемся насчет полета? 	['Немножко', 'волнуемся', 'насчет', 'полета']	['A', 'little', 'tense', 'about', 'the', 'flight']
55	Something like that. 	Что-то вроде этого. 	['Что-то', 'вроде', 'этого']	['Something', 'like', 'that']
56	There's really nothing to worry about, Mary. 	Волноваться не о чем. 	['Волноваться', 'не', 'о', 'чем']	"[""There's"", 'really', 'nothing', 'to', 'worry', 'about', 'Mary']"
57	Statistically, they say you're more likely 	По статистике, больше шансов погибнуть... 	['По', 'статистике', 'больше', 'шансов', 'погибнуть']	"['Statistically', 'they', 'say', ""you're"", 'more', 'likely']"
58	to get killed on the way to the airport, 	в аварии по пути в аэропорт... 	['в', 'аварии', 'по', 'пути', 'в', 'аэропорт']	['to', 'get', 'killed', 'on', 'the', 'way', 'to', 'the', 'airport']
59	you know, like in a head-on crash or flying off a cliff 	можно лоб в лоб врезаться, со скалы слететь 	['можно', 'лоб', 'в', 'лоб', 'врезаться', 'со', 'скалы', 'слететь']	['you', 'know', 'like', 'in', 'a', 'head-on', 'crash', 'or', 'flying', 'off', 'a', 'cliff']
60	or getting trapped under a gas truck... 	или под бензовоз попасть. 	['или', 'под', 'бензовоз', 'попасть']	['or', 'getting', 'trapped', 'under', 'a', 'gas', 'truck']
61	That's the worst. I have this cousin... 	Вот это хуже всего. У меня есть двоюродный брат 	['Вот', 'это', 'хуже', 'всего', 'У', 'меня', 'есть', 'двоюродный', 'брат']	"[""That's"", 'the', 'worst', 'I', 'have', 'this', 'cousin']"
62	well, I had this cousin. 	Был двоюродный брат... 	['Был', 'двоюродный', 'брат']	['well', 'I', 'had', 'this', 'cousin']
63	Lloyd, could you keep your eyes on the road, please? 	Вы не могли бы смотреть на дорогу? 	['Вы', 'не', 'могли', 'бы', 'смотреть', 'на', 'дорогу']	['Lloyd', 'could', 'you', 'keep', 'your', 'eyes', 'on', 'the', 'road', 'please']
64	Oh. Yeah. 	Ах, да. 	['Ах', 'да']	['Oh', 'Yeah']
65	Good thinking. 	Правильная мысль. 	['Правильная', 'мысль']	['Good', 'thinking']
66	Can't be too careful. 	Осторожность не повредит. 	['Осторожность', 'не', 'повредит']	"[""Can't"", 'be', 'too', 'careful']"
67	A lot of bad drivers out there. (tires screeching) 	Здесь столько чайников за рулем. 	['Здесь', 'столько', 'чайников', 'за', 'рулем']	['A', 'lot', 'of', 'bad', 'drivers', 'out', 'there', 'tires', 'screeching']
68	Hey, watch it! (dogs whimpering) (tires screech) Okay, gang, you know the rules... 	Правила вы знаете: 	['Правила', 'вы', 'знаете']	['Hey', 'watch', 'it', 'dogs', 'whimpering', 'tires', 'screech', 'Okay', 'gang', 'you', 'know', 'the', 'rules']
69	no humping, no pushing, no sniffing heinies. 	Не трахаться, не толкаться, под хвостом не нюхать. 	['Не', 'трахаться', 'не', 'толкаться', 'под', 'хвостом', 'не', 'нюхать']	['no', 'humping', 'no', 'pushing', 'no', 'sniffing', 'heinies']
70	Where have you been? My dogs were supposed to be here 40 minutes ago! 	Где вас носит? Собаки должны были прибыть еще 40 минут назад. 	['Где', 'вас', 'носит', 'Собаки', 'должны', 'были', 'прибыть', 'еще', '40', 'минут', 'назад']	['Where', 'have', 'you', 'been', 'My', 'dogs', 'were', 'supposed', 'to', 'be', 'here', '40', 'minutes', 'ago']
71	Now I hardly have any time to primp them. 	У меня совсем времени нет привести их в порядок. 	['У', 'меня', 'совсем', 'времени', 'нет', 'привести', 'их', 'в', 'порядок']	['Now', 'I', 'hardly', 'have', 'any', 'time', 'to', 'primp', 'them']
72	Don't worry about a thing, Mrs. Neugy-burger. 	Не волнуйтесь, миссис Нюгибургер. 	['Не', 'волнуйтесь', 'миссис', 'Нюгибургер']	"[""Don't"", 'worry', 'about', 'a', 'thing', 'Mrs', 'Neugy-burger']"
73	- Neugeboren! - Neug-neug-neug... 	- Нюгиборен! - Ню.. нюг…нюги... 	['Нюгиборен', 'Ню', 'нюг…нюги']	['Neugeboren', 'Neug-neug-neug']
74	- Boren! - Boren. 	Борен! 	['Борен']	['Boren', 'Boren']
75	These pooches aren't going to need any primping. 	Собачек не нужно приводить в порядок. И знаете почему? 	['Собачек', 'не', 'нужно', 'приводить', 'в', 'порядок', 'И', 'знаете', 'почему']	"['These', 'pooches', ""aren't"", 'going', 'to', 'need', 'any', 'primping']"
76	You know why? I'll tell you why. 	И знаете почему? 	['И', 'знаете', 'почему']	"['You', 'know', 'why', ""I'll"", 'tell', 'you', 'why']"
77	Because I bathed them and I clipped them myself. 	Потому, что я их искупал и постриг. 	['Потому', 'что', 'я', 'их', 'искупал', 'и', 'постриг']	['Because', 'I', 'bathed', 'them', 'and', 'I', 'clipped', 'them', 'myself']
78	And I stand by my performance. 	И я держу свою марку. 	['И', 'я', 'держу', 'свою', 'марку']	['And', 'I', 'stand', 'by', 'my', 'performance']
79	(whimpering) 	Хотя, с другой стороны, 	['Хотя', 'с', 'другой', 'стороны']	['whimpering']
80	You know, on second thought, you might just want to run a comb through 'em. Male voice: The white zone is for the immediate Male voice: The white zone is for the immediate 	можно их немножко и причесать. 	['можно', 'их', 'немножко', 'и', 'причесать']	"['You', 'know', 'on', 'second', 'thought', 'you', 'might', 'just', 'want', 'to', 'run', 'a', 'comb', 'through', ""'em"", 'Male', 'voice', 'The', 'white', 'zone', 'is', 'for', 'the', 'immediate', 'Male', 'voice', 'The', 'white', 'zone', 'is', 'for', 'the', 'immediate']"
81	loading and unloading of passengers only. No parking. 	Спасибо. Можете уезжать. 	['Спасибо', 'Можете', 'уезжать']	['loading', 'and', 'unloading', 'of', 'passengers', 'only', 'No', 'parking']
82	Thanks. Here you go. 	О нет, Мэри. 	['О', 'нет', 'Мэри']	['Thanks', 'Here', 'you', 'go']
83	Oh no, Mary. 	Я ни в коем случае не могу этого принять, 	['Я', 'ни', 'в', 'коем', 'случае', 'не', 'могу', 'этого', 'принять']	['Oh', 'no', 'Mary']
84	I couldn't possibly accept that, 	После всего того, что было между нами. 	['После', 'всего', 'того', 'что', 'было', 'между', 'нами']	"['I', ""couldn't"", 'possibly', 'accept', 'that']"
85	not after all we've been through. 	Спасибо, Ллойд. 	['Спасибо', 'Ллойд']	"['not', 'after', 'all', ""we've"", 'been', 'through']"
86	Thank you, Lloyd. 	И удачи вам с червями. 	['И', 'удачи', 'вам', 'с', 'червями']	['Thank', 'you', 'Lloyd']
87	- Uh, good luck with your worms. - Yeah. 	Эй. 	['Эй']	['Uh', 'good', 'luck', 'with', 'your', 'worms', 'Yeah']
88	Hey. How about a hug? The white zone is for the immediate loading and unloading of passengers only. 	А обняться? 	['А', 'обняться']	['Hey', 'How', 'about', 'a', 'hug', 'The', 'white', 'zone', 'is', 'for', 'the', 'immediate', 'loading', 'and', 'unloading', 'of', 'passengers', 'only']
89	No parking. Oh. I hate goodbyes. (chuckles) Oh. 	Ненавижу прощания. 	['Ненавижу', 'прощания']	['No', 'parking', 'Oh', 'I', 'hate', 'goodbyes', 'chuckles', 'Oh']
90	(groans) Uh, Lloyd... Shh! (whispers) Just go. 	Просто иди. 	['Просто', 'иди']	['groans', 'Uh', 'Lloyd', 'Shh', 'whispers', 'Just', 'go']
91	(romantic pop music playing) (voice wavering) Be strong. (sighs) Woman over PA: Mr. Dan Mitchell, please pick up the white courtesy phone. Mr. Dan Mitchell, please pick up the white courtesy phone... 	Мужайся. 	['Мужайся']	['romantic', 'pop', 'music', 'playing', 'voice', 'wavering', 'Be', 'strong', 'sighs', 'Woman', 'over', 'PA', 'Mr', 'Dan', 'Mitchell', 'please', 'pick', 'up', 'the', 'white', 'courtesy', 'phone', 'Mr', 'Dan', 'Mitchell', 'please', 'pick', 'up', 'the', 'white', 'courtesy', 'phone']
92	She's gonna leave the briefcase near the escalator. 	Она оставит чемоданчик у эскалатора. 	['Она', 'оставит', 'чемоданчик', 'у', 'эскалатора']	"[""She's"", 'gonna', 'leave', 'the', 'briefcase', 'near', 'the', 'escalator']"
93	- You make the pickup. - Piece of cake. # Goodbye, my lo... # ugh! 	Ты его подберешь. Раз плюнуть. 	['Ты', 'его', 'подберешь', 'Раз', 'плюнуть']	['You', 'make', 'the', 'pickup', 'Piece', 'of', 'cake', 'Goodbye', 'my', 'lo', 'ugh']
94	(laughs) Hi! Passenger Maura Tadge, please pick up the white courtesy phone. You have a message. Passenger Maura Tadge. (yells) Agh! Mary! 	О, Мэри. 	['О', 'Мэри']	['laughs', 'Hi', 'Passenger', 'Maura', 'Tadge', 'please', 'pick', 'up', 'the', 'white', 'courtesy', 'phone', 'You', 'have', 'a', 'message', 'Passenger', 'Maura', 'Tadge', 'yells', 'Agh', 'Mary']
95	Man: There's our payday. 	А вот и наша зарплата. 	['А', 'вот', 'и', 'наша', 'зарплата']	"['Man', ""There's"", 'our', 'payday']"
96	She left it. Let's go. 	Она оставила его. Идем. 	['Она', 'оставила', 'его', 'Идем']	"['She', 'left', 'it', ""Let's"", 'go']"
97	Lloyd: Excuse me! Coming through! 	Простите, поберегитесь. 	['Простите', 'поберегитесь']	['Lloyd', 'Excuse', 'me', 'Coming', 'through']
98	Move it or lose it, sister! Hey! (panting) 	Отходи, сестричка, зашибу! 	['Отходи', 'сестричка', 'зашибу']	['Move', 'it', 'or', 'lose', 'it', 'sister', 'Hey', 'panting']
99	Eenie... 	Эники, 	['Эники']	['Eenie']
100	meenie... minie... 	Беники, 	['Беники']	['meenie', 'minie']
101	mo! 	Ели, Вареники! 	['Ели', 'Вареники']	['mo']
102	Hold that plane! 	Задержите самолет! 	['Задержите', 'самолет']	['Hold', 'that', 'plane']
103	Sir, you can't go in there! 	Сэр, туда нельзя! 	['Сэр', 'туда', 'нельзя']	"['Sir', 'you', ""can't"", 'go', 'in', 'there']"
104	It's okay! 	Все в порядке! 	['Все', 'в', 'порядке']	"[""It's"", 'okay']"
105	I'm a limo driver! - Agh! - (thuds) Whew... (moaning) (tires screech) (sirens blaring in distance) 	Я водитель лимузина! 	['Я', 'водитель', 'лимузина']	"[""I'm"", 'a', 'limo', 'driver', 'Agh', 'thuds', 'Whew', 'moaning', 'tires', 'screech', 'sirens', 'blaring', 'in', 'distance']"
106	Hi, Lloyd. 	Привет, Ллойд. 	['Привет', 'Ллойд']	['Hi', 'Lloyd']
107	Hi, Harry. 	Привет, Гарри. 	['Привет', 'Гарри']	['Hi', 'Harry']
108	- How was your day? - Not bad. 	Как ты сегодня? Неплохо. 	['Как', 'ты', 'сегодня', 'Неплохо']	['How', 'was', 'your', 'day', 'Not', 'bad']
109	Fell off the jetway again. 	Опять в аэропорту выпал. 	['Опять', 'в', 'аэропорту', 'выпал']	['Fell', 'off', 'the', 'jetway', 'again']
110	Who the hell you figure 	Как думаешь, 	['Как', 'думаешь']	['Who', 'the', 'hell', 'you', 'figure']
111	this guy's working for, anyway? 	на кого эти парни работают? 	['на', 'кого', 'эти', 'парни', 'работают']	"['this', ""guy's"", 'working', 'for', 'anyway']"
112	I don't know. 	Не знаю, 	['Не', 'знаю']	"['I', ""don't"", 'know']"
113	We sure as hell better find out. 	но уж лучше нам это выяснить. 	['но', 'уж', 'лучше', 'нам', 'это', 'выяснить']	['We', 'sure', 'as', 'hell', 'better', 'find', 'out']
114	The ulcer? 	Язва? 	['Язва']	['The', 'ulcer']
115	I'll live. (bird chirping) 	Жить буду. 	['Жить', 'буду']	"[""I'll"", 'live', 'bird', 'chirping']"
116	- So you got fired again, huh? - Oh, yeah. 	Значит, тебя опять уволили? Ага. 	['Значит', 'тебя', 'опять', 'уволили', 'Ага']	['So', 'you', 'got', 'fired', 'again', 'huh', 'Oh', 'yeah']
