	en	ru	ru_tokens	en_tokens
0	Do you find me sadistic? 	Ты думаешь, я - садист? 	['Ты', 'думаешь', 'я', 'садист']	['Do', 'you', 'find', 'me', 'sadistic']
1	You know, I'll bet I could fry an egg on your head right now. 	Держу пари, сейчас я мог бы сварить яйцо на твоем личике... 	['Держу', 'пари', 'сейчас', 'я', 'мог', 'бы', 'сварить', 'яйцо', 'на', 'твоем', 'личике']	"['You', 'know', ""I'll"", 'bet', 'I', 'could', 'fry', 'an', 'egg', 'on', 'your', 'head', 'right', 'now']"
2	If I wanted to. 	если бы захотел. 	['если', 'бы', 'захотел']	['If', 'I', 'wanted', 'to']
3	You know, kiddo... 	Знаешь, крошка... 	['Знаешь', 'крошка']	['You', 'know', 'kiddo']
4	I'd like to believe you're aware enough, even now, 	Мне хочется верить, даже в сложившейся ситуации, тебе известно достаточно... 	['Мне', 'хочется', 'верить', 'даже', 'в', 'сложившейся', 'ситуации', 'тебе', 'известно', 'достаточно']	"[""I'd"", 'like', 'to', 'believe', ""you're"", 'aware', 'enough', 'even', 'now']"
5	to know that there's nothing sadistic in my actions. 	чтобы согласиться - в моих действиях нет и следа садизма. 	['чтобы', 'согласиться', 'в', 'моих', 'действиях', 'нет', 'и', 'следа', 'садизма']	"['to', 'know', 'that', ""there's"", 'nothing', 'sadistic', 'in', 'my', 'actions']"
6	Well, maybe towards those other jokers. 	Может быть и есть, по отношению ко всем этим клоунам, 	['Может', 'быть', 'и', 'есть', 'по', 'отношению', 'ко', 'всем', 'этим', 'клоунам']	['Well', 'maybe', 'towards', 'those', 'other', 'jokers']
7	But not you. 	но никак не к тебе. 	['но', 'никак', 'не', 'к', 'тебе']	['But', 'not', 'you']
8	No, kiddo. 	Знаешь, малышка, с этого момента... 	['Знаешь', 'малышка', 'с', 'этого', 'момента']	['No', 'kiddo']
9	At this moment... This is me at my most masochistic. 	никому не будет до этого дела. Только я и мое самое лучшее. 	['никому', 'не', 'будет', 'до', 'этого', 'дела', 'Только', 'я', 'и', 'мое', 'самое', 'лучшее']	['At', 'this', 'moment', 'This', 'is', 'me', 'at', 'my', 'most', 'masochistic']
10	Bill, it's your baby. 	Билл, это твой ребенок. 	['Билл', 'это', 'твой', 'ребенок']	"['Bill', ""it's"", 'your', 'baby']"
11	"# I was 5 and he was 6 # # We rode on horses made of sticks # # He wore black and I wore white # # He would always win the fight # # Bang bang # # He shot me down # # Bang bang # # I hit the ground # # Bang bang # # That awful sound # # Bang bang # # My baby shot me down # # Seasons came and changed the time # # When I grew up, I called him mine # # He would always laugh and say # # ""Remember when we used to play?"" # # Bang bang # # I shot you down # # Bang bang # # You hit the ground # # Bang bang # # That awful sound # # Bang bang # "	4-ый фильм Квентина Тарантино Ума Турман 	['4-ый', 'фильм', 'Квентина', 'Тарантино', 'Ума', 'Турман']	['I', 'was', '5', 'and', 'he', 'was', '6', 'We', 'rode', 'on', 'horses', 'made', 'of', 'sticks', 'He', 'wore', 'black', 'and', 'I', 'wore', 'white', 'He', 'would', 'always', 'win', 'the', 'fight', 'Bang', 'bang', 'He', 'shot', 'me', 'down', 'Bang', 'bang', 'I', 'hit', 'the', 'ground', 'Bang', 'bang', 'That', 'awful', 'sound', 'Bang', 'bang', 'My', 'baby', 'shot', 'me', 'down', 'Seasons', 'came', 'and', 'changed', 'the', 'time', 'When', 'I', 'grew', 'up', 'I', 'called', 'him', 'mine', 'He', 'would', 'always', 'laugh', 'and', 'say', 'Remember', 'when', 'we', 'used', 'to', 'play', 'Bang', 'bang', 'I', 'shot', 'you', 'down', 'Bang', 'bang', 'You', 'hit', 'the', 'ground', 'Bang', 'bang', 'That', 'awful', 'sound', 'Bang', 'bang']
12	# I used to shoot you down # # Music played and people sang # # Just for me the church bells rang # # Now he's gone # # I don't know why # # And till this day, sometimes I cry # # He didn't even say goodbye # # He didn't take the time to lie # # Bang bang # # He shot me down # # Bang bang # # I hit the ground # # Bang bang # # That awful sound # # Bang bang # 	УБИТЬ БИЛЛА. Часть 1. 	['УБИТЬ', 'БИЛЛА', 'Часть', '1']	"['I', 'used', 'to', 'shoot', 'you', 'down', 'Music', 'played', 'and', 'people', 'sang', 'Just', 'for', 'me', 'the', 'church', 'bells', 'rang', 'Now', ""he's"", 'gone', 'I', ""don't"", 'know', 'why', 'And', 'till', 'this', 'day', 'sometimes', 'I', 'cry', 'He', ""didn't"", 'even', 'say', 'goodbye', 'He', ""didn't"", 'take', 'the', 'time', 'to', 'lie', 'Bang', 'bang', 'He', 'shot', 'me', 'down', 'Bang', 'bang', 'I', 'hit', 'the', 'ground', 'Bang', 'bang', 'That', 'awful', 'sound', 'Bang', 'bang']"
13	# My baby shot me down # 	ГЛАВА ПЕРВАЯ Номер два Город Пасадена, штат Калифорния 	['ГЛАВА', 'ПЕРВАЯ', 'Номер', 'два', 'Город', 'Пасадена', 'штат', 'Калифорния']	['My', 'baby', 'shot', 'me', 'down']
14	Coming! 	Входите. 	['Входите']	['Coming']
15	Sarah, I cannot believe you are early. 	Кэрол, не могу поверить, что ты так рано! 	['Кэрол', 'не', 'могу', 'поверить', 'что', 'ты', 'так', 'рано']	['Sarah', 'I', 'cannot', 'believe', 'you', 'are', 'early']
16	What you gonna do now, huh? What you got? 	Давай, сука. 	['Давай', 'сука']	['What', 'you', 'gonna', 'do', 'now', 'huh', 'What', 'you', 'got']
17	I got your ass! Remember that? Huh? Remember? Okay. Come on, bitch. Come on. Bring it on. 	Давай. 	['Давай']	['I', 'got', 'your', 'ass', 'Remember', 'that', 'Huh', 'Remember', 'Okay', 'Come', 'on', 'bitch', 'Come', 'on', 'Bring', 'it', 'on']
18	Mommy, I'm home. 	Мамочка, я уже дома! 	['Мамочка', 'я', 'уже', 'дома']	"['Mommy', ""I'm"", 'home']"
19	Hey, baby. How was school? 	Привет, малышка, как дела в школе? 	['Привет', 'малышка', 'как', 'дела', 'в', 'школе']	['Hey', 'baby', 'How', 'was', 'school']
20	Mommy, what happened to you and the TV room? 	Мамочка, что случилось с тобой и с комнатой? 	['Мамочка', 'что', 'случилось', 'с', 'тобой', 'и', 'с', 'комнатой']	['Mommy', 'what', 'happened', 'to', 'you', 'and', 'the', 'TV', 'room']
21	Oh. That good-for-nothing dog of yours got his ass in the living room and acted a damn fool. 	О, этот твой песик, пробрался в гостиную и набезобразничал. 	['О', 'этот', 'твой', 'песик', 'пробрался', 'в', 'гостиную', 'и', 'набезобразничал']	['Oh', 'That', 'good-for-nothing', 'dog', 'of', 'yours', 'got', 'his', 'ass', 'in', 'the', 'living', 'room', 'and', 'acted', 'a', 'damn', 'fool']
22	- That's what happened, baby. - Barney did this? Baby, now, you can't come in here. 	Вот что случилось, малышка. Это натворил Барни? 	['Вот', 'что', 'случилось', 'малышка', 'Это', 'натворил', 'Барни']	"[""That's"", 'what', 'happened', 'baby', 'Barney', 'did', 'this', 'Baby', 'now', 'you', ""can't"", 'come', 'in', 'here']"
23	There's broken glass everywhere, and you could cut yourself. 	Нет, детка, тебе сюда нельзя. Тут стекло разбитое повсюду. Ты можешь пораниться. 	['Нет', 'детка', 'тебе', 'сюда', 'нельзя', 'Тут', 'стекло', 'разбитое', 'повсюду', 'Ты', 'можешь', 'пораниться']	"[""There's"", 'broken', 'glass', 'everywhere', 'and', 'you', 'could', 'cut', 'yourself']"
24	This is an old friend of mommy's I ain't seen in a long time. 	Это мамочкина старая подруга, я давно с нею не виделась. 	['Это', 'мамочкина', 'старая', 'подруга', 'я', 'давно', 'с', 'нею', 'не', 'виделась']	"['This', 'is', 'an', 'old', 'friend', 'of', ""mommy's"", 'I', ""ain't"", 'seen', 'in', 'a', 'long', 'time']"
25	Hi, honey. I'm 	Привет, малышка. Я [б-и-и-п], а как тебя зовут? 	['Привет', 'малышка', 'Я', 'б-и-и-п', 'а', 'как', 'тебя', 'зовут']	"['Hi', 'honey', ""I'm""]"
26	What's your name? 	Ее зовут Никки. 	['Ее', 'зовут', 'Никки']	"[""What's"", 'your', 'name']"
27	Her name is Nikki. Nikki. Such a pretty name for such a pretty girl. 	Никки. Какое прекрасное имя для такой чудесной девочки. 	['Никки', 'Какое', 'прекрасное', 'имя', 'для', 'такой', 'чудесной', 'девочки']	['Her', 'name', 'is', 'Nikki', 'Nikki', 'Such', 'a', 'pretty', 'name', 'for', 'such', 'a', 'pretty', 'girl']
28	How old are you, Nikki? 	Сколько тебе лет, Никки? 	['Сколько', 'тебе', 'лет', 'Никки']	['How', 'old', 'are', 'you', 'Nikki']
29	Nikki, asked you a question. 	Никки, [б-и-и-п] задала тебе вопрос. 	['Никки', 'б-и-и-п', 'задала', 'тебе', 'вопрос']	['Nikki', 'asked', 'you', 'a', 'question']
30	I'm 4. 	Мне четыре. 	['Мне', 'четыре']	"[""I'm"", '4']"
31	4 years old, eh? 	Четыре годика значит. 	['Четыре', 'годика', 'значит']	['4', 'years', 'old', 'eh']
32	You know, I had a little girl once. 	А знаешь, у меня тоже когда-то была маленькая девочка. 	['А', 'знаешь', 'у', 'меня', 'тоже', 'когда-то', 'была', 'маленькая', 'девочка']	['You', 'know', 'I', 'had', 'a', 'little', 'girl', 'once']
33	She'd be about 4 now. 	Сейчас ей бы исполнилось четыре. 	['Сейчас', 'ей', 'бы', 'исполнилось', 'четыре']	"[""She'd"", 'be', 'about', '4', 'now']"
34	Now, baby, me and Mommy's friend got some grown-up talk to talk about. 	Малышка, мне с моей подругой есть, о чем поговорить. 	['Малышка', 'мне', 'с', 'моей', 'подругой', 'есть', 'о', 'чем', 'поговорить']	"['Now', 'baby', 'me', 'and', ""Mommy's"", 'friend', 'got', 'some', 'grown-up', 'talk', 'to', 'talk', 'about']"
35	You can go in your room now. 	Ступай к себе в комнату, оставь меня с ней наедине. 	['Ступай', 'к', 'себе', 'в', 'комнату', 'оставь', 'меня', 'с', 'ней', 'наедине']	['You', 'can', 'go', 'in', 'your', 'room', 'now']
36	And I want you to leave us alone till I tell you to come out. Okay? 	Я скажу, когда тебе можно будет выйти. 	['Я', 'скажу', 'когда', 'тебе', 'можно', 'будет', 'выйти']	['And', 'I', 'want', 'you', 'to', 'leave', 'us', 'alone', 'till', 'I', 'tell', 'you', 'to', 'come', 'out', 'Okay']
37	Nikkia! In your room. Now. 	Никки иди в свою комнату сейчас же. 	['Никки', 'иди', 'в', 'свою', 'комнату', 'сейчас', 'же']	['Nikkia', 'In', 'your', 'room', 'Now']
38	You want some coffee? 	Хочешь кофе? 	['Хочешь', 'кофе']	['You', 'want', 'some', 'coffee']
39	Yeah. Sure. 	Да, пожалуй. 	['Да', 'пожалуй']	['Yeah', 'Sure']
40	This Pasadena homemaker's name is Jeanne Bell. 	Это домохозяйка из Пасадены, ее зовут Джинни Белл. 	['Это', 'домохозяйка', 'из', 'Пасадены', 'ее', 'зовут', 'Джинни', 'Белл']	"['This', 'Pasadena', ""homemaker's"", 'name', 'is', 'Jeanne', 'Bell']"
41	Her husband is Dr. Lawrence Bell. 	Ее муж - доктор Лоренс Белл. 	['Ее', 'муж', 'доктор', 'Лоренс', 'Белл']	['Her', 'husband', 'is', 'Dr', 'Lawrence', 'Bell']
42	But back when we were acquainted, four years ago, her name was Vernita Green. 	Но, когда меня с ней познакомили, четыре года назад, она представилась Вернитой Грин. 	['Но', 'когда', 'меня', 'с', 'ней', 'познакомили', 'четыре', 'года', 'назад', 'она', 'представилась', 'Вернитой', 'Грин']	['But', 'back', 'when', 'we', 'were', 'acquainted', 'four', 'years', 'ago', 'her', 'name', 'was', 'Vernita', 'Green']
43	Her code name was Copperhead. 	"Ее позывной был ""Кобра"". "	['Ее', 'позывной', 'был', 'Кобра']	['Her', 'code', 'name', 'was', 'Copperhead']
44	Mine, Black Mamba. 	"А мой - ""Черная мамба"". "	['А', 'мой', 'Черная', 'мамба']	['Mine', 'Black', 'Mamba']
45	Do you have a towel? 	Можно полотенце? 	['Можно', 'полотенце']	['Do', 'you', 'have', 'a', 'towel']
46	Yeah. 	Да. 	['Да']	['Yeah']
47	Thanks. 	Спасибо. 	['Спасибо']	['Thanks']
48	You still take cream and sugar? 	По-прежнему класть сливки и сахар? 	['По-прежнему', 'класть', 'сливки', 'и', 'сахар']	['You', 'still', 'take', 'cream', 'and', 'sugar']
49	Yeah. 	Да. 	['Да']	['Yeah']
50	So I suppose it's a little late for an apology. 	Полагаю, теперь уже поздновато извиняться, а? 	['Полагаю', 'теперь', 'уже', 'поздновато', 'извиняться', 'а']	"['So', 'I', 'suppose', ""it's"", 'a', 'little', 'late', 'for', 'an', 'apology']"
51	You suppose correctly. 	Правильно предполагаешь. 	['Правильно', 'предполагаешь']	['You', 'suppose', 'correctly']
52	Look, bitch, I need to know if you're gonna start more shit around my baby girl. 	Послушай, сука, я должна быть уверена, что ты не затеешь какую-нибудь пакость против моего ребенка! 	['Послушай', 'сука', 'я', 'должна', 'быть', 'уверена', 'что', 'ты', 'не', 'затеешь', 'какую-нибудь', 'пакость', 'против', 'моего', 'ребенка']	"['Look', 'bitch', 'I', 'need', 'to', 'know', 'if', ""you're"", 'gonna', 'start', 'more', 'shit', 'around', 'my', 'baby', 'girl']"
53	You can relax for now. 	Расслабься. 	['Расслабься']	['You', 'can', 'relax', 'for', 'now']
54	I'm not gonna murder you in front of your child, okay? 	Я не собираюсь убивать тебя на глазах дочери. 	['Я', 'не', 'собираюсь', 'убивать', 'тебя', 'на', 'глазах', 'дочери']	"[""I'm"", 'not', 'gonna', 'murder', 'you', 'in', 'front', 'of', 'your', 'child', 'okay']"
55	That's being more rational than Bill led me to believe you were capable of. 	Тебе надо быть более разумной, потому что я не знаю, что ты позволяешь себе. 	['Тебе', 'надо', 'быть', 'более', 'разумной', 'потому', 'что', 'я', 'не', 'знаю', 'что', 'ты', 'позволяешь', 'себе']	"[""That's"", 'being', 'more', 'rational', 'than', 'Bill', 'led', 'me', 'to', 'believe', 'you', 'were', 'capable', 'of']"
56	It's mercy, compassion and forgiveness I lack. 	Да, милосердия, сострадания, прощения мне как раз не хватает. 	['Да', 'милосердия', 'сострадания', 'прощения', 'мне', 'как', 'раз', 'не', 'хватает']	"[""It's"", 'mercy', 'compassion', 'and', 'forgiveness', 'I', 'lack']"
57	Not rationality. Look. I know I fucked you over. I fucked you over bad. 	Я знаю... Я круто отделала тебя тогда. 	['Я', 'знаю', 'Я', 'круто', 'отделала', 'тебя', 'тогда']	['Not', 'rationality', 'Look', 'I', 'know', 'I', 'fucked', 'you', 'over', 'I', 'fucked', 'you', 'over', 'bad']
58	I wish to God I hadn't, but I did. 	Бог видит, я не хотела, но так случилось. 	['Бог', 'видит', 'я', 'не', 'хотела', 'но', 'так', 'случилось']	"['I', 'wish', 'to', 'God', 'I', ""hadn't"", 'but', 'I', 'did']"
59	You have every right to want to get even. 	У тебя есть полное право желать расквитаться. 	['У', 'тебя', 'есть', 'полное', 'право', 'желать', 'расквитаться']	['You', 'have', 'every', 'right', 'to', 'want', 'to', 'get', 'even']
60	No, no, no, no, no. No. To get even, even Stephen, 	Нет. Расквитаться? Даже со Стивеном? 	['Нет', 'Расквитаться', 'Даже', 'со', 'Стивеном']	['No', 'no', 'no', 'no', 'no', 'No', 'To', 'get', 'even', 'even', 'Stephen']
61	I would have to kill you, go up to Nikki's room, kill her, 	Я должна была бы убить тебя. 	['Я', 'должна', 'была', 'бы', 'убить', 'тебя']	"['I', 'would', 'have', 'to', 'kill', 'you', 'go', 'up', 'to', ""Nikki's"", 'room', 'kill', 'her']"
62	then wait for your husband to come home and kill him. 	Пойти в комнату Никки, прикончить ее. Потом дождаться твоего мужа, доктора Белла, когда он придет домой и замочить его. 	['Пойти', 'в', 'комнату', 'Никки', 'прикончить', 'ее', 'Потом', 'дождаться', 'твоего', 'мужа', 'доктора', 'Белла', 'когда', 'он', 'придет', 'домой', 'и', 'замочить', 'его']	['then', 'wait', 'for', 'your', 'husband', 'to', 'come', 'home', 'and', 'kill', 'him']
63	That'd be even, Vernita. 	Тогда я могла бы полностью... 	['Тогда', 'я', 'могла', 'бы', 'полностью']	"[""That'd"", 'be', 'even', 'Vernita']"
64	That'd be about square. 	отомстить тебе. Отомстить... в квадрате. 	['отомстить', 'тебе', 'Отомстить', 'в', 'квадрате']	"[""That'd"", 'be', 'about', 'square']"
65	Look, if I could go back in a machine, I would. But I can't. 	Если бы я была в силах вернуться в строй. Но я не могу. 	['Если', 'бы', 'я', 'была', 'в', 'силах', 'вернуться', 'в', 'строй', 'Но', 'я', 'не', 'могу']	"['Look', 'if', 'I', 'could', 'go', 'back', 'in', 'a', 'machine', 'I', 'would', 'But', 'I', ""can't""]"
66	All I can tell you is that I'm a different person now. 	И все что хочу сказать тебе - я теперь другой человек. 	['И', 'все', 'что', 'хочу', 'сказать', 'тебе', 'я', 'теперь', 'другой', 'человек']	"['All', 'I', 'can', 'tell', 'you', 'is', 'that', ""I'm"", 'a', 'different', 'person', 'now']"
67	Oh, great. I don't care. 	Меня не волнует. 	['Меня', 'не', 'волнует']	"['Oh', 'great', 'I', ""don't"", 'care']"
68	Be that as it may, I know I don't deserve your mercy or your forgiveness. 	Пусть так. Знаю, я не заслужила милосердия или прощения. 	['Пусть', 'так', 'Знаю', 'я', 'не', 'заслужила', 'милосердия', 'или', 'прощения']	"['Be', 'that', 'as', 'it', 'may', 'I', 'know', 'I', ""don't"", 'deserve', 'your', 'mercy', 'or', 'your', 'forgiveness']"
69	However, I beseech you for both on behalf of my daughter. 	Но, я молю за нас двоих - от моего имени и от имени моей дочери. 	['Но', 'я', 'молю', 'за', 'нас', 'двоих', 'от', 'моего', 'имени', 'и', 'от', 'имени', 'моей', 'дочери']	['However', 'I', 'beseech', 'you', 'for', 'both', 'on', 'behalf', 'of', 'my', 'daughter']
70	Bitch, you can stop right there. 	Тварь, можешь не продолжать. 	['Тварь', 'можешь', 'не', 'продолжать']	['Bitch', 'you', 'can', 'stop', 'right', 'there']
71	Just because I have no wish to murder you before the eyes of your daughter does not mean parading her around in front of me is gonna inspire sympathy. 	Только оттого, что я не собираюсь убивать тебя на глазах твоей дочери... это не значит, что девочка вдохновила меня на симпатию к ее мамаше. 	['Только', 'оттого', 'что', 'я', 'не', 'собираюсь', 'убивать', 'тебя', 'на', 'глазах', 'твоей', 'дочери', 'это', 'не', 'значит', 'что', 'девочка', 'вдохновила', 'меня', 'на', 'симпатию', 'к', 'ее', 'мамаше']	['Just', 'because', 'I', 'have', 'no', 'wish', 'to', 'murder', 'you', 'before', 'the', 'eyes', 'of', 'your', 'daughter', 'does', 'not', 'mean', 'parading', 'her', 'around', 'in', 'front', 'of', 'me', 'is', 'gonna', 'inspire', 'sympathy']
72	You and I have unfinished business. 	У нас с тобой есть незаконченное дело. 	['У', 'нас', 'с', 'тобой', 'есть', 'незаконченное', 'дело']	['You', 'and', 'I', 'have', 'unfinished', 'business']
73	And not a goddamn fucking thing you've done in the subsequent four years, including getting knocked up, is gonna change that. 	И тебе не найти ни одной чертовой отмазки, включая мое возможное поражение,... которое изменило бы мои планы. 	['И', 'тебе', 'не', 'найти', 'ни', 'одной', 'чертовой', 'отмазки', 'включая', 'мое', 'возможное', 'поражение', 'которое', 'изменило', 'бы', 'мои', 'планы']	"['And', 'not', 'a', 'goddamn', 'fucking', 'thing', ""you've"", 'done', 'in', 'the', 'subsequent', 'four', 'years', 'including', 'getting', 'knocked', 'up', 'is', 'gonna', 'change', 'that']"
74	So when do we do this? 	Когда мы схлестнемся? 	['Когда', 'мы', 'схлестнемся']	['So', 'when', 'do', 'we', 'do', 'this']
75	It all depends. When do you wanna die? 	Все зависит от тебя. А когда тебе приятней умереть? 	['Все', 'зависит', 'от', 'тебя', 'А', 'когда', 'тебе', 'приятней', 'умереть']	['It', 'all', 'depends', 'When', 'do', 'you', 'wanna', 'die']
76	Tomorrow? The day after tomorrow? 	Завтра? Послезавтра? 	['Завтра', 'Послезавтра']	['Tomorrow', 'The', 'day', 'after', 'tomorrow']
77	How about tonight, bitch? 	Как насчет сегодняшней ночи, мразь? 	['Как', 'насчет', 'сегодняшней', 'ночи', 'мразь']	['How', 'about', 'tonight', 'bitch']
78	Splendid. Where? 	Великолепно. Где? 	['Великолепно', 'Где']	['Splendid', 'Where']
79	There's a baseball diamond where I coach little league about a mile from here. 	Бейсбольное поле, где наша местная лига проводит свои игры, примерно с милю отсюда. 	['Бейсбольное', 'поле', 'где', 'наша', 'местная', 'лига', 'проводит', 'свои', 'игры', 'примерно', 'с', 'милю', 'отсюда']	"[""There's"", 'a', 'baseball', 'diamond', 'where', 'I', 'coach', 'little', 'league', 'about', 'a', 'mile', 'from', 'here']"
80	We meet there around 2:30 in the morning, 	Мы встретимся там в половине третьего ночи, 	['Мы', 'встретимся', 'там', 'в', 'половине', 'третьего', 'ночи']	['We', 'meet', 'there', 'around', '2:30', 'in', 'the', 'morning']
81	dressed all in black, your hair in a black stocking. 	одетые во все черное, волосы свои спрячь в черный чулочек. 	['одетые', 'во', 'все', 'черное', 'волосы', 'свои', 'спрячь', 'в', 'черный', 'чулочек']	['dressed', 'all', 'in', 'black', 'your', 'hair', 'in', 'a', 'black', 'stocking']
82	And we have us a knife fight. We won't be bothered. 	Мы устроим бой на ножах. На поле нас никто не побеспокоит. 	['Мы', 'устроим', 'бой', 'на', 'ножах', 'На', 'поле', 'нас', 'никто', 'не', 'побеспокоит']	"['And', 'we', 'have', 'us', 'a', 'knife', 'fight', 'We', ""won't"", 'be', 'bothered']"
83	Now, I have to fix Nikki's cereal. 	А теперь, мне нужно приготовить кашу для Никки. 	['А', 'теперь', 'мне', 'нужно', 'приготовить', 'кашу', 'для', 'Никки']	"['Now', 'I', 'have', 'to', 'fix', ""Nikki's"", 'cereal']"
