	en	ru	ru_tokens	en_tokens
84	Bill said you were one of the best ladies he saw with an edged weapon. 	Билл всегда говорил, что не встречал ни одну леди, которая бы так мастерски владела... холодным оружием, как ты. 	['Билл', 'всегда', 'говорил', 'что', 'не', 'встречал', 'ни', 'одну', 'леди', 'которая', 'бы', 'так', 'мастерски', 'владела', 'холодным', 'оружием', 'как', 'ты']	['Bill', 'said', 'you', 'were', 'one', 'of', 'the', 'best', 'ladies', 'he', 'saw', 'with', 'an', 'edged', 'weapon']
85	Fuck you, bitch. I know he didn't qualify that shit. 	Иди ты, стерва. Я же знаю, что он этого не ценил. 	['Иди', 'ты', 'стерва', 'Я', 'же', 'знаю', 'что', 'он', 'этого', 'не', 'ценил']	"['Fuck', 'you', 'bitch', 'I', 'know', 'he', ""didn't"", 'qualify', 'that', 'shit']"
86	So you can just kiss my motherfucking ass, Black Mamba. Black Mamba. 	Так что поцелуй мою чертову задницу, Черная мамба. 	['Так', 'что', 'поцелуй', 'мою', 'чертову', 'задницу', 'Черная', 'мамба']	['So', 'you', 'can', 'just', 'kiss', 'my', 'motherfucking', 'ass', 'Black', 'Mamba', 'Black', 'Mamba']
87	I should have been motherfucking Black Mamba. 	Черная мамба... я должна была зваться гребаной Черной мамбой. 	['Черная', 'мамба', 'я', 'должна', 'была', 'зваться', 'гребаной', 'Черной', 'мамбой']	['I', 'should', 'have', 'been', 'motherfucking', 'Black', 'Mamba']
88	Weapon of choice? If you wanna stick with your butcher knife, that's fine. 	Выбор оружия за тобой. Я не хочу, чтобы ты считала меня слишком кровожадной. 	['Выбор', 'оружия', 'за', 'тобой', 'Я', 'не', 'хочу', 'чтобы', 'ты', 'считала', 'меня', 'слишком', 'кровожадной']	"['Weapon', 'of', 'choice', 'If', 'you', 'wanna', 'stick', 'with', 'your', 'butcher', 'knife', ""that's"", 'fine']"
89	Very funny, bitch. Very funny! 	Очень смешно, твою мать. 	['Очень', 'смешно', 'твою', 'мать']	['Very', 'funny', 'bitch', 'Very', 'funny']
90	It was not my intention to do this in front of you. 	В мои планы не входило совершать это в твоем присутствии. 	['В', 'мои', 'планы', 'не', 'входило', 'совершать', 'это', 'в', 'твоем', 'присутствии']	['It', 'was', 'not', 'my', 'intention', 'to', 'do', 'this', 'in', 'front', 'of', 'you']
91	For that, I'm sorry. 	За то, что так получилось, извини. 	['За', 'то', 'что', 'так', 'получилось', 'извини']	"['For', 'that', ""I'm"", 'sorry']"
92	But you can take my word for it. Your mother had it coming. 	Но, поверь моему честному слову, твоя мама такое заслужила. 	['Но', 'поверь', 'моему', 'честному', 'слову', 'твоя', 'мама', 'такое', 'заслужила']	['But', 'you', 'can', 'take', 'my', 'word', 'for', 'it', 'Your', 'mother', 'had', 'it', 'coming']
93	When you grow up, if you still feel raw about it... I'll be waiting. 	Когда ты подрастешь, и если случившееся будет продолжать терзать тебя... я к твоим услугам. 	['Когда', 'ты', 'подрастешь', 'и', 'если', 'случившееся', 'будет', 'продолжать', 'терзать', 'тебя', 'я', 'к', 'твоим', 'услугам']	"['When', 'you', 'grow', 'up', 'if', 'you', 'still', 'feel', 'raw', 'about', 'it', ""I'll"", 'be', 'waiting']"
94	For those regarded as warriors... When engaged in combat... the vanquishing of thine enemy can be the warrior's only concern. 	Для тех, кто является воином... Вступив в бой... единственной целью воина является победа над врагом. 	['Для', 'тех', 'кто', 'является', 'воином', 'Вступив', 'в', 'бой', 'единственной', 'целью', 'воина', 'является', 'победа', 'над', 'врагом']	"['For', 'those', 'regarded', 'as', 'warriors', 'When', 'engaged', 'in', 'combat', 'the', 'vanquishing', 'of', 'thine', 'enemy', 'can', 'be', 'the', ""warrior's"", 'only', 'concern']"
95	Suppress all human emotion and compassion... 	Подави всю человеческую эмоцию и сострадание 	['Подави', 'всю', 'человеческую', 'эмоцию', 'и', 'сострадание']	['Suppress', 'all', 'human', 'emotion', 'and', 'compassion']
96	...kill whoever stands in thy way, even if that be Lord God, or Buddha himself. 	убей любого, вставшего на твоем пути, даже если это будет сам Бог или Будда. 	['убей', 'любого', 'вставшего', 'на', 'твоем', 'пути', 'даже', 'если', 'это', 'будет', 'сам', 'Бог', 'или', 'Будда']	['kill', 'whoever', 'stands', 'in', 'thy', 'way', 'even', 'if', 'that', 'be', 'Lord', 'God', 'or', 'Buddha', 'himself']
97	This truth lies at the heart of the art of combat. 	Эта истина лежит в основании боевого искусства. 	['Эта', 'истина', 'лежит', 'в', 'основании', 'боевого', 'искусства']	['This', 'truth', 'lies', 'at', 'the', 'heart', 'of', 'the', 'art', 'of', 'combat']
98	Come on out to Dallas. This is Rockabilly Rhythms on KTRN, Wichita Falls. And next, we got some record. Very own wild man, Charlie Feathers. # Well # # I'm just a single fellow with a lot on my mind # # And I'm lookin' for me a woman # # But she's mighty hard to find # # Asked my country cousin # # Checked the hottest spots in town # # Oh, that little bitty woman # 	"ГЛАВА ВТОРАЯ Невеста, окропленная кровью ""Четырьмя годами и шестью месяцами ранее в Эль Пасо, штат Техас"" "	['ГЛАВА', 'ВТОРАЯ', 'Невеста', 'окропленная', 'кровью', 'Четырьмя', 'годами', 'и', 'шестью', 'месяцами', 'ранее', 'в', 'Эль', 'Пасо', 'штат', 'Техас']	"['Come', 'on', 'out', 'to', 'Dallas', 'This', 'is', 'Rockabilly', 'Rhythms', 'on', 'KTRN', 'Wichita', 'Falls', 'And', 'next', 'we', 'got', 'some', 'record', 'Very', 'own', 'wild', 'man', 'Charlie', 'Feathers', 'Well', ""I'm"", 'just', 'a', 'single', 'fellow', 'with', 'a', 'lot', 'on', 'my', 'mind', 'And', ""I'm"", ""lookin'"", 'for', 'me', 'a', 'woman', 'But', ""she's"", 'mighty', 'hard', 'to', 'find', 'Asked', 'my', 'country', 'cousin', 'Checked', 'the', 'hottest', 'spots', 'in', 'town', 'Oh', 'that', 'little', 'bitty', 'woman']"
99	Well, give me the gory details, Son Number One. 	Ну, рассказывай, что произошло. 	['Ну', 'рассказывай', 'что', 'произошло']	['Well', 'give', 'me', 'the', 'gory', 'details', 'Son', 'Number', 'One']
100	It's a goddamn massacre, Pop. 	Это чертова резня, Пап. 	['Это', 'чертова', 'резня', 'Пап']	"[""It's"", 'a', 'goddamn', 'massacre', 'Pop']"
101	They wiped out the whole wedding party, execution style. 	Они истребили полностью свадебную вечеринку, казнили их. 	['Они', 'истребили', 'полностью', 'свадебную', 'вечеринку', 'казнили', 'их']	['They', 'wiped', 'out', 'the', 'whole', 'wedding', 'party', 'execution', 'style']
102	Give me a figure. 	Живые есть? 	['Живые', 'есть']	['Give', 'me', 'a', 'figure']
103	Nine dead bodies. And we're talking the whole shebang. 	Нет, одни трупы. Все до одного. 	['Нет', 'одни', 'трупы', 'Все', 'до', 'одного']	"['Nine', 'dead', 'bodies', 'And', ""we're"", 'talking', 'the', 'whole', 'shebang']"
104	Bride. Groom. Reverend. Reverend's wife. 	Невеста, жених, друг жениха, его жена... 	['Невеста', 'жених', 'друг', 'жениха', 'его', 'жена']	"['Bride', 'Groom', 'Reverend', ""Reverend's"", 'wife']"
105	They even shot that old colored fella that plays the organ. 	Черт, они даже расстреляли старика, игравшего на органе. 	['Черт', 'они', 'даже', 'расстреляли', 'старика', 'игравшего', 'на', 'органе']	['They', 'even', 'shot', 'that', 'old', 'colored', 'fella', 'that', 'plays', 'the', 'organ']
106	It would appear somebody objected to this and wasn't able to hold their peace. 	Похоже, кто-то был против заключения этого брака. 	['Похоже', 'кто-то', 'был', 'против', 'заключения', 'этого', 'брака']	"['It', 'would', 'appear', 'somebody', 'objected', 'to', 'this', 'and', ""wasn't"", 'able', 'to', 'hold', 'their', 'peace']"
107	Good gravy, Marie. 	Вот черт! 	['Вот', 'черт']	['Good', 'gravy', 'Marie']
108	What'd I tell you, Pop? 	Что я говорил, Пап! 	['Что', 'я', 'говорил', 'Пап']	"[""What'd"", 'I', 'tell', 'you', 'Pop']"
109	It's like a goddamn Nicaraguan death squad. 	Это похоже на то чертово убийство в Никарагуа. 	['Это', 'похоже', 'на', 'то', 'чертово', 'убийство', 'в', 'Никарагуа']	"[""It's"", 'like', 'a', 'goddamn', 'Nicaraguan', 'death', 'squad']"
110	You better shit-can that blasphemy, boy. You're in a house of worship. 	Да, это дерьмо может произвести такой бардак в Божьем доме. 	['Да', 'это', 'дерьмо', 'может', 'произвести', 'такой', 'бардак', 'в', 'Божьем', 'доме']	"['You', 'better', 'shit-can', 'that', 'blasphemy', 'boy', ""You're"", 'in', 'a', 'house', 'of', 'worship']"
111	Sorry, Pop. 	Извини, Пап. 	['Извини', 'Пап']	['Sorry', 'Pop']
112	Well, this is definitely the work of professionals. 	Здесь явно работал профессионал. 	['Здесь', 'явно', 'работал', 'профессионал']	['Well', 'this', 'is', 'definitely', 'the', 'work', 'of', 'professionals']
113	I'd guesstimate Mexican Mafia hit squad. 	Мое чутье мне подсказывает, что орудовала команда. 	['Мое', 'чутье', 'мне', 'подсказывает', 'что', 'орудовала', 'команда']	"[""I'd"", 'guesstimate', 'Mexican', 'Mafia', 'hit', 'squad']"
114	Four, maybe five strong. 	Четыре, может быть пять боевиков. 	['Четыре', 'может', 'быть', 'пять', 'боевиков']	['Four', 'maybe', 'five', 'strong']
115	How can you tell? 	Почему ты так считаешь? 	['Почему', 'ты', 'так', 'считаешь']	['How', 'can', 'you', 'tell']
116	Well, a sure and steady hand did this. 	Ты только посмотри на это. 	['Ты', 'только', 'посмотри', 'на', 'это']	['Well', 'a', 'sure', 'and', 'steady', 'hand', 'did', 'this']
117	This ain't no squirrelly amateur. 	Это не чокнутый дилетант. 	['Это', 'не', 'чокнутый', 'дилетант']	"['This', ""ain't"", 'no', 'squirrelly', 'amateur']"
118	This is the work of a salty dog. 	Вот мерзавцы. 	['Вот', 'мерзавцы']	['This', 'is', 'the', 'work', 'of', 'a', 'salty', 'dog']
119	You can tell by the cleanliness of the carnage. Now, a kill-crazy rampage, though it may be, all the colors are kept inside the lines. 	Ты посмотри, как все продумано. Они могли разделаться сразу. 	['Ты', 'посмотри', 'как', 'все', 'продумано', 'Они', 'могли', 'разделаться', 'сразу']	['You', 'can', 'tell', 'by', 'the', 'cleanliness', 'of', 'the', 'carnage', 'Now', 'a', 'kill-crazy', 'rampage', 'though', 'it', 'may', 'be', 'all', 'the', 'colors', 'are', 'kept', 'inside', 'the', 'lines']
120	If you was a moron, you could almost admire it. 	Все может быть, но они ждали пока церемония подойдет к концу. Когда все это произошло, они были уже почти женаты. 	['Все', 'может', 'быть', 'но', 'они', 'ждали', 'пока', 'церемония', 'подойдет', 'к', 'концу', 'Когда', 'все', 'это', 'произошло', 'они', 'были', 'уже', 'почти', 'женаты']	['If', 'you', 'was', 'a', 'moron', 'you', 'could', 'almost', 'admire', 'it']
121	Who's the bride? 	Кто невеста? 	['Кто', 'невеста']	"[""Who's"", 'the', 'bride']"
122	Don't know. 	Не знаю. 	['Не', 'знаю']	"[""Don't"", 'know']"
123	The name on the marriage certificate is Arlene Machiavelli. 	В брачном свидетельстве написано Арлен Макиавелли. 	['В', 'брачном', 'свидетельстве', 'написано', 'Арлен', 'Макиавелли']	['The', 'name', 'on', 'the', 'marriage', 'certificate', 'is', 'Arlene', 'Machiavelli']
124	That's a fake. 	Это подделка. 	['Это', 'подделка']	"[""That's"", 'a', 'fake']"
125	"We've been calling her ""The Bride"" on account of the dress. "	Мы всегда звали ее невестой из-за ее платья. 	['Мы', 'всегда', 'звали', 'ее', 'невестой', 'из-за', 'ее', 'платья']	"[""We've"", 'been', 'calling', 'her', 'The', 'Bride', 'on', 'account', 'of', 'the', 'dress']"
126	You can tell she was pregnant. 	Судя по всему, она беременна. 	['Судя', 'по', 'всему', 'она', 'беременна']	['You', 'can', 'tell', 'she', 'was', 'pregnant']
127	Man would have to be a mad dog to shoot a goddamn good-looking gal like that in the head. 	Человек должен быть бешеной собакой, чтобы убить такую девушку в голову. 	['Человек', 'должен', 'быть', 'бешеной', 'собакой', 'чтобы', 'убить', 'такую', 'девушку', 'в', 'голову']	['Man', 'would', 'have', 'to', 'be', 'a', 'mad', 'dog', 'to', 'shoot', 'a', 'goddamn', 'good-looking', 'gal', 'like', 'that', 'in', 'the', 'head']
128	Look at her. 	Посмотри на нее. 	['Посмотри', 'на', 'нее']	['Look', 'at', 'her']
129	Hay-colored hair. Big eyes. 	Красивые волосы, большие глаза. 	['Красивые', 'волосы', 'большие', 'глаза']	['Hay-colored', 'hair', 'Big', 'eyes']
130	She's a little blood-spattered бngel. 	Ее кровь обрызгала ангела. 	['Ее', 'кровь', 'обрызгала', 'ангела']	"[""She's"", 'a', 'little', 'blood-spattered', 'бngel']"
131	Son Number One? Yeah? 	- Она что в коме? - Да. Вот черт. 	['Она', 'что', 'в', 'коме', 'Да', 'Вот', 'черт']	['Son', 'Number', 'One', 'Yeah']
132	This tall drink of cocksucker ain't dead. 	Надо было догадаться. 	['Надо', 'было', 'догадаться']	"['This', 'tall', 'drink', 'of', 'cocksucker', ""ain't"", 'dead']"
133	I might never have liked you. 	"ЭЛЛЬ ДРАЙВЕР - член ТЕРРОРИСТИЧЕСКОГО ОТРЯДА ""СМЕРТОНОСНАЯ ГАДЮКА"" Позывной: КАЛИФОРНИЙСКАЯ ГОРНАЯ ЗМЕЯ Никогда ты мне не нравилась. "	['ЭЛЛЬ', 'ДРАЙВЕР', 'член', 'ТЕРРОРИСТИЧЕСКОГО', 'ОТРЯДА', 'СМЕРТОНОСНАЯ', 'ГАДЮКА', 'Позывной', 'КАЛИФОРНИЙСКАЯ', 'ГОРНАЯ', 'ЗМЕЯ', 'Никогда', 'ты', 'мне', 'не', 'нравилась']	['I', 'might', 'never', 'have', 'liked', 'you']
134	Point in fact, I despise you. 	По правде говоря, я презираю тебя. 	['По', 'правде', 'говоря', 'я', 'презираю', 'тебя']	['Point', 'in', 'fact', 'I', 'despise', 'you']
135	But that shouldn't suggest that I don't respect you. 	"То есть, это не значит ""не уважаю"". "	['То', 'есть', 'это', 'не', 'значит', 'не', 'уважаю']	"['But', 'that', ""shouldn't"", 'suggest', 'that', 'I', ""don't"", 'respect', 'you']"
136	Dying in our sleep is a luxury that our kind is rarely afforded. 	Для таких как мы, смерть во сне - роскошь. 	['Для', 'таких', 'как', 'мы', 'смерть', 'во', 'сне', 'роскошь']	['Dying', 'in', 'our', 'sleep', 'is', 'a', 'luxury', 'that', 'our', 'kind', 'is', 'rarely', 'afforded']
137	My gift to you. 	Это мой тебе подарок. 	['Это', 'мой', 'тебе', 'подарок']	['My', 'gift', 'to', 'you']
138	For fuck's sake. 	Ради Бога! 	['Ради', 'Бога']	"['For', ""fuck's"", 'sake']"
139	Hello, Bill. 	Здравствуй, Билл. 	['Здравствуй', 'Билл']	['Hello', 'Bill']
140	What's her condition? 	В каком она состоянии? 	['В', 'каком', 'она', 'состоянии']	"[""What's"", 'her', 'condition']"
141	Comatose. 	В коме. 	['В', 'коме']	['Comatose']
142	Where is she? 	Где она? 	['Где', 'она']	['Where', 'is', 'she']
143	I'm standing over her right now. 	Сейчас я стою прямо перед ней. 	['Сейчас', 'я', 'стою', 'прямо', 'перед', 'ней']	"[""I'm"", 'standing', 'over', 'her', 'right', 'now']"
144	That's my girl. 	Это моя девушка. 	['Это', 'моя', 'девушка']	"[""That's"", 'my', 'girl']"
145	Elle, you're going to abort the mission. What? 	Элль, ты не выполнишь задание. 	['Элль', 'ты', 'не', 'выполнишь', 'задание']	"['Elle', ""you're"", 'going', 'to', 'abort', 'the', 'mission', 'What']"
146	We owe her better than that. 	Мы ей должны по гроб жизни. 	['Мы', 'ей', 'должны', 'по', 'гроб', 'жизни']	['We', 'owe', 'her', 'better', 'than', 'that']
147	Oh, you don't owe her shit! Will you keep your voice down? 	Нет, ты ей ни черта не должен! Нельзя ли потише? 	['Нет', 'ты', 'ей', 'ни', 'черта', 'не', 'должен', 'Нельзя', 'ли', 'потише']	"['Oh', 'you', ""don't"", 'owe', 'her', 'shit', 'Will', 'you', 'keep', 'your', 'voice', 'down']"
148	You don't owe her shit! 	Ты ей ни черта не должен. 	['Ты', 'ей', 'ни', 'черта', 'не', 'должен']	"['You', ""don't"", 'owe', 'her', 'shit']"
149	May I say one thing? 	Я мог сказать одну вещь. 	['Я', 'мог', 'сказать', 'одну', 'вещь']	['May', 'I', 'say', 'one', 'thing']
150	Speak. 	Говори. 	['Говори']	['Speak']
151	Y'all beat the hell out of that woman. But you didn't kill her. 	Ты ненавидишь эту женщину, но ты не убьешь ее. 	['Ты', 'ненавидишь', 'эту', 'женщину', 'но', 'ты', 'не', 'убьешь', 'ее']	"[""Y'all"", 'beat', 'the', 'hell', 'out', 'of', 'that', 'woman', 'But', 'you', ""didn't"", 'kill', 'her']"
152	And I put a bullet in her head. But her heart just kept on beating. 	Я пошлю пулю тебе в голову, если ты тронешь ее. 	['Я', 'пошлю', 'пулю', 'тебе', 'в', 'голову', 'если', 'ты', 'тронешь', 'ее']	['And', 'I', 'put', 'a', 'bullet', 'in', 'her', 'head', 'But', 'her', 'heart', 'just', 'kept', 'on', 'beating']
153	Now, you saw that yourself with your own beautiful blue eye, did you not? 	Ты же видела своим единственным красивым синим глазом. Не так ли? 	['Ты', 'же', 'видела', 'своим', 'единственным', 'красивым', 'синим', 'глазом', 'Не', 'так', 'ли']	['Now', 'you', 'saw', 'that', 'yourself', 'with', 'your', 'own', 'beautiful', 'blue', 'eye', 'did', 'you', 'not']
154	We've done a lot of things to this lady. 	Мы сделали достаточно много вещей с этой леди. 	['Мы', 'сделали', 'достаточно', 'много', 'вещей', 'с', 'этой', 'леди']	"[""We've"", 'done', 'a', 'lot', 'of', 'things', 'to', 'this', 'lady']"
155	And if she ever wakes up, we'll do a whole lot more. 	И если она очнется, то у нас будут проблемы. 	['И', 'если', 'она', 'очнется', 'то', 'у', 'нас', 'будут', 'проблемы']	"['And', 'if', 'she', 'ever', 'wakes', 'up', ""we'll"", 'do', 'a', 'whole', 'lot', 'more']"
156	But one thing we won't do is sneak into her room in the night like a filthy rat and kill her in her sleep. 	Но мы не будем красться в ее палату ночью, подобно грязной крысе и убивать ее во сне. 	['Но', 'мы', 'не', 'будем', 'красться', 'в', 'ее', 'палату', 'ночью', 'подобно', 'грязной', 'крысе', 'и', 'убивать', 'ее', 'во', 'сне']	"['But', 'one', 'thing', 'we', ""won't"", 'do', 'is', 'sneak', 'into', 'her', 'room', 'in', 'the', 'night', 'like', 'a', 'filthy', 'rat', 'and', 'kill', 'her', 'in', 'her', 'sleep']"
157	And the reason we won't do that thing is because that thing would lower us. 	И причина того, что мы не будем этого делать, то, что это унизило бы нас. 	['И', 'причина', 'того', 'что', 'мы', 'не', 'будем', 'этого', 'делать', 'то', 'что', 'это', 'унизило', 'бы', 'нас']	"['And', 'the', 'reason', 'we', ""won't"", 'do', 'that', 'thing', 'is', 'because', 'that', 'thing', 'would', 'lower', 'us']"
158	Don't you agree, Miss Driver? 	Ты не согласна, мисс Драйвер? 	['Ты', 'не', 'согласна', 'мисс', 'Драйвер']	"[""Don't"", 'you', 'agree', 'Miss', 'Driver']"
159	I guess. 	Думаю, что да. 	['Думаю', 'что', 'да']	['I', 'guess']
160	Do you really have to guess? 	Ты действительно должна думать? 	['Ты', 'действительно', 'должна', 'думать']	['Do', 'you', 'really', 'have', 'to', 'guess']
161	No. I don't really have to guess. I know. 	Нет, даже не думаю - я знаю. 	['Нет', 'даже', 'не', 'думаю', 'я', 'знаю']	"['No', 'I', ""don't"", 'really', 'have', 'to', 'guess', 'I', 'know']"
162	Come on home, honey. 	Возвращайся домой, сладкая. 	['Возвращайся', 'домой', 'сладкая']	['Come', 'on', 'home', 'honey']
163	Affirmative. 	Так точно. 	['Так', 'точно']	['Affirmative']
164	I love you very much. 	Я очень тебя люблю. 	['Я', 'очень', 'тебя', 'люблю']	['I', 'love', 'you', 'very', 'much']
165	I love you, too. 	И я тебя люблю. 	['И', 'я', 'тебя', 'люблю']	['I', 'love', 'you', 'too']
166	Bye-bye. 	Пока-пока. 	['Пока-пока']	['Bye-bye']
167	Thought that was pretty fucking funny, didn't you? 	Ты считаешь это чертовски забавным, да? 	['Ты', 'считаешь', 'это', 'чертовски', 'забавным', 'да']	"['Thought', 'that', 'was', 'pretty', 'fucking', 'funny', ""didn't"", 'you']"
168	Word of advice, shithead. Don't you ever wake up. 	Добрый совет тебе, пустышка:... ни за что не просыпайся. 	['Добрый', 'совет', 'тебе', 'пустышка', 'ни', 'за', 'что', 'не', 'просыпайся']	"['Word', 'of', 'advice', 'shithead', ""Don't"", 'you', 'ever', 'wake', 'up']"
169	At this moment, this is me at my most masochistic. 	Четыре года спустя. Но с этого момента, только я и мое самое лучшее. 	['Четыре', 'года', 'спустя', 'Но', 'с', 'этого', 'момента', 'только', 'я', 'и', 'мое', 'самое', 'лучшее']	['At', 'this', 'moment', 'this', 'is', 'me', 'at', 'my', 'most', 'masochistic']
170	Bill, it's your baby. 	Билл, это... 	['Билл', 'это']	"['Bill', ""it's"", 'your', 'baby']"
171	Oh, my baby. Four years. Four years. The price is $75 a fuck, my friend. 	Цена - 35 долларов за трах, мой друг. 	['Цена', '35', 'долларов', 'за', 'трах', 'мой', 'друг']	['Oh', 'my', 'baby', 'Four', 'years', 'Four', 'years', 'The', 'price', 'is', '75', 'a', 'fuck', 'my', 'friend']
172	You getting your freak on or what? 	"Ну что, ""тряхнем стариной"", или как? "	['Ну', 'что', 'тряхнем', 'стариной', 'или', 'как']	['You', 'getting', 'your', 'freak', 'on', 'or', 'what']
173	Oh, yeah, boy. 	Да, парень. 	['Да', 'парень']	['Oh', 'yeah', 'boy']
174	20, 40, 60, 75. 	Десять, двенадцать, тридцать... ага. 	['Десять', 'двенадцать', 'тридцать', 'ага']	['20', '40', '60', '75']
