	en	ru	ru_tokens	en_tokens
175	Yeah. Now here's the rules. 	Правила такие. 	['Правила', 'такие']	"['Yeah', 'Now', ""here's"", 'the', 'rules']"
176	Rule number one. No punching her. 	Первое - не бить ее. 	['Первое', 'не', 'бить', 'ее']	['Rule', 'number', 'one', 'No', 'punching', 'her']
177	Nurse comes in and she got a shiner or less some teeth, jig's up. 	Медсестра зайдет завтра, и если она увидит синяки... или зубов не досчитается - поднимет хай. 	['Медсестра', 'зайдет', 'завтра', 'и', 'если', 'она', 'увидит', 'синяки', 'или', 'зубов', 'не', 'досчитается', 'поднимет', 'хай']	"['Nurse', 'comes', 'in', 'and', 'she', 'got', 'a', 'shiner', 'or', 'less', 'some', 'teeth', ""jig's"", 'up']"
178	So no knuckle sandwiches under no circumstances. 	Поэтому, не шлепать по булкам ни в коем случае. 	['Поэтому', 'не', 'шлепать', 'по', 'булкам', 'ни', 'в', 'коем', 'случае']	['So', 'no', 'knuckle', 'sandwiches', 'under', 'no', 'circumstances']
179	And by the way, this cunt's a spitter. 	И, кстати говоря, эта крошка может сплюнуть - это такой моторный рефлекс. 	['И', 'кстати', 'говоря', 'эта', 'крошка', 'может', 'сплюнуть', 'это', 'такой', 'моторный', 'рефлекс']	"['And', 'by', 'the', 'way', 'this', ""cunt's"", 'a', 'spitter']"
180	It's a motor-reflex thing. But spit or no, no punching. 	Плюет, не плюет, не колотить. 	['Плюет', 'не', 'плюет', 'не', 'колотить']	"[""It's"", 'a', 'motor-reflex', 'thing', 'But', 'spit', 'or', 'no', 'no', 'punching']"
181	- Now, are clear on rule one? - Yeah. 	Ну как, мы решительно все уяснили по поводу первого правила? 	['Ну', 'как', 'мы', 'решительно', 'все', 'уяснили', 'по', 'поводу', 'первого', 'правила']	['Now', 'are', 'clear', 'on', 'rule', 'one', 'Yeah']
182	Good. Now, rule number two. No monkey bites, no hickeys. 	Да. Хорошо. Тогда правило второе. В рот не совать, на рожу не брызгать. 	['Да', 'Хорошо', 'Тогда', 'правило', 'второе', 'В', 'рот', 'не', 'совать', 'на', 'рожу', 'не', 'брызгать']	['Good', 'Now', 'rule', 'number', 'two', 'No', 'monkey', 'bites', 'no', 'hickeys']
183	In fact, no leaving no marks of no kind. 	Если проще, не покидать установленной зоны ни под каким видом. 	['Если', 'проще', 'не', 'покидать', 'установленной', 'зоны', 'ни', 'под', 'каким', 'видом']	['In', 'fact', 'no', 'leaving', 'no', 'marks', 'of', 'no', 'kind']
184	After that, it's all good, buddy. 	Но, не считая этого, все пучком, дружище. 	['Но', 'не', 'считая', 'этого', 'все', 'пучком', 'дружище']	"['After', 'that', ""it's"", 'all', 'good', 'buddy']"
185	Now, her plumbing down there don't work. So feel free to come in her all you want. 	Здесь никого не будет до завтра, так что развлекайся, сколько влезет. 	['Здесь', 'никого', 'не', 'будет', 'до', 'завтра', 'так', 'что', 'развлекайся', 'сколько', 'влезет']	"['Now', 'her', 'plumbing', 'down', 'there', ""don't"", 'work', 'So', 'feel', 'free', 'to', 'come', 'in', 'her', 'all', 'you', 'want']"
186	Keep the noise down. Try not to make a mess. 	Только потише тут - постарайся ничего здесь не разбить. 	['Только', 'потише', 'тут', 'постарайся', 'ничего', 'здесь', 'не', 'разбить']	['Keep', 'the', 'noise', 'down', 'Try', 'not', 'to', 'make', 'a', 'mess']
187	I'll be back in 20. Yeah. 	Я вернусь в двенадцать. 	['Я', 'вернусь', 'в', 'двенадцать']	"[""I'll"", 'be', 'back', 'in', '20', 'Yeah']"
188	Oh, shit. By the way, not all the time, but sometimes this chick's cooch can get drier than a bucket of sand. 	Да, чуть не забыл. Не часто, но иногда выходит так... что у нее там пересыхает, как в пустыне. 	['Да', 'чуть', 'не', 'забыл', 'Не', 'часто', 'но', 'иногда', 'выходит', 'так', 'что', 'у', 'нее', 'там', 'пересыхает', 'как', 'в', 'пустыне']	"['Oh', 'shit', 'By', 'the', 'way', 'not', 'all', 'the', 'time', 'but', 'sometimes', 'this', ""chick's"", 'cooch', 'can', 'get', 'drier', 'than', 'a', 'bucket', 'of', 'sand']"
189	If she dry, lube up with this and you'll be good to go. 	Если такое случится, смажьте вот этим, и пойдет как по маслу. 	['Если', 'такое', 'случится', 'смажьте', 'вот', 'этим', 'и', 'пойдет', 'как', 'по', 'маслу']	"['If', 'she', 'dry', 'lube', 'up', 'with', 'this', 'and', ""you'll"", 'be', 'good', 'to', 'go']"
190	Bon appetit, good buddy. 	Не справшивай, как это работает, приятель. 	['Не', 'справшивай', 'как', 'это', 'работает', 'приятель']	['Bon', 'appetit', 'good', 'buddy']
191	Oh, yeah. Oh, God damn. 	О, да. 	['О', 'да']	['Oh', 'yeah', 'Oh', 'God', 'damn']
192	You are the best-looking girl I've had today. 	Черт побери. Ты самая лучшая девушка, которую я буду иметь сегодня. 	['Черт', 'побери', 'Ты', 'самая', 'лучшая', 'девушка', 'которую', 'я', 'буду', 'иметь', 'сегодня']	"['You', 'are', 'the', 'best-looking', 'girl', ""I've"", 'had', 'today']"
193	Yo, stud! Time's up, buddy. 	Эй, жеребец, время истекло, приятель. 	['Эй', 'жеребец', 'время', 'истекло', 'приятель']	"['Yo', 'stud', ""Time's"", 'up', 'buddy']"
194	Coming in, ready or not. 	Я вхожу, готов ты или нет. 	['Я', 'вхожу', 'готов', 'ты', 'или', 'нет']	['Coming', 'in', 'ready', 'or', 'not']
195	Hey buddy, did you have yourself a good time? 	Эй, приятель, хорошо поразвлекался? 	['Эй', 'приятель', 'хорошо', 'поразвлекался']	['Hey', 'buddy', 'did', 'you', 'have', 'yourself', 'a', 'good', 'time']
196	Where's Bill? Where's Bill? 	Где Билл? 	['Где', 'Билл']	"[""Where's"", 'Bill', ""Where's"", 'Bill']"
197	Please stop hitting me. 	Прошу, пожалуйста, хватит, не бейте меня! 	['Прошу', 'пожалуйста', 'хватит', 'не', 'бейте', 'меня']	['Please', 'stop', 'hitting', 'me']
198	Where's Bill? I don't know who Bill is! 	Я не знаю, кто такой Билл. 	['Я', 'не', 'знаю', 'кто', 'такой', 'Билл']	"[""Where's"", 'Bill', 'I', ""don't"", 'know', 'who', 'Bill', 'is']"
199	Bullshit! 	Ерунда. 	['Ерунда']	['Bullshit']
200	Well, ain't you the slice of cutie pie they said you was? 	Знаешь, они говорят, что она - настоящий ломтик пирога. 	['Знаешь', 'они', 'говорят', 'что', 'она', 'настоящий', 'ломтик', 'пирога']	"['Well', ""ain't"", 'you', 'the', 'slice', 'of', 'cutie', 'pie', 'they', 'said', 'you', 'was']"
201	Jane Doe, huh? We don't know shit about you, do we? 	Джейн Доу. Они ничего не знают о тебе. 	['Джейн', 'Доу', 'Они', 'ничего', 'не', 'знают', 'о', 'тебе']	"['Jane', 'Doe', 'huh', 'We', ""don't"", 'know', 'shit', 'about', 'you', 'do', 'we']"
202	I'm from Huntsville, Texas. 	Я из Хантсвилла, штат Техас. 	['Я', 'из', 'Хантсвилла', 'штат', 'Техас']	"[""I'm"", 'from', 'Huntsville', 'Texas']"
203	My name is Buck, and I'm here to fuck. 	Бак меня звать, и я здесь чтобы драть. 	['Бак', 'меня', 'звать', 'и', 'я', 'здесь', 'чтобы', 'драть']	"['My', 'name', 'is', 'Buck', 'and', ""I'm"", 'here', 'to', 'fuck']"
204	Your name is Buck. Right? 	Бак тебя звать, верно? 	['Бак', 'тебя', 'звать', 'верно']	['Your', 'name', 'is', 'Buck', 'Right']
205	And you came here to fuck. Right? 	И ты здесь чтобы драть, так? 	['И', 'ты', 'здесь', 'чтобы', 'драть', 'так']	['And', 'you', 'came', 'here', 'to', 'fuck', 'Right']
206	Wait a minute. Wait. 	Ты, трахальщик. 	['Ты', 'трахальщик']	['Wait', 'a', 'minute', 'Wait']
207	"""Pussy Wagon."" "	Кискин дом. 	['Кискин', 'дом']	['Pussy', 'Wagon']
208	You fucker. Texas. Okay. 	Пошевели большим пальцем. 	['Пошевели', 'большим', 'пальцем']	['You', 'fucker', 'Texas', 'Okay']
209	Wiggle your big toe. Wiggle your big toe. Wiggle your big toe. 	Пошевели большим пальцем. 	['Пошевели', 'большим', 'пальцем']	['Wiggle', 'your', 'big', 'toe', 'Wiggle', 'your', 'big', 'toe', 'Wiggle', 'your', 'big', 'toe']
210	Wiggle your big toe. Wiggle your big toe. 	Пошевели большим пальцем. 	['Пошевели', 'большим', 'пальцем']	['Wiggle', 'your', 'big', 'toe', 'Wiggle', 'your', 'big', 'toe']
211	As I lay in the back of Buck's truck, trying to will my limbs out of entropy... Wiggle your big toe. 	Валяясь в пикапе Бакса, пытаясь вывести свои конечности из энтропии. 	['Валяясь', 'в', 'пикапе', 'Бакса', 'пытаясь', 'вывести', 'свои', 'конечности', 'из', 'энтропии']	"['As', 'I', 'lay', 'in', 'the', 'back', 'of', ""Buck's"", 'truck', 'trying', 'to', 'will', 'my', 'limbs', 'out', 'of', 'entropy', 'Wiggle', 'your', 'big', 'toe']"
212	...I could see the faces of the cunts who did this to me. And the dicks responsible. 	Я видела перед собой лица ублюдков, которые сотворили такое со мной. Как впрочем, и главного урода, ответственного за все. 	['Я', 'видела', 'перед', 'собой', 'лица', 'ублюдков', 'которые', 'сотворили', 'такое', 'со', 'мной', 'Как', 'впрочем', 'и', 'главного', 'урода', 'ответственного', 'за', 'все']	['I', 'could', 'see', 'the', 'faces', 'of', 'the', 'cunts', 'who', 'did', 'this', 'to', 'me', 'And', 'the', 'dicks', 'responsible']
213	Members all of the Deadly Viper Assassination Squad. 	"Всех участников детища Билла: террористического отряда ""Смертоносная гадюка"" "	['Всех', 'участников', 'детища', 'Билла', 'террористического', 'отряда', 'Смертоносная', 'гадюка']	['Members', 'all', 'of', 'the', 'Deadly', 'Viper', 'Assassination', 'Squad']
214	When fortune smiles on something as violent and ugly as revenge, it seems proof like no other that not only does God exist, you're doing his will. 	Когда удача улыбается в чем-то жестоком и омерзительном, как, например, в мести. такие минуты, кажется, доказывают не только то, что Бог существует... но еще и то, что ты выполняешь его волю. 	['Когда', 'удача', 'улыбается', 'в', 'чем-то', 'жестоком', 'и', 'омерзительном', 'как', 'например', 'в', 'мести', 'такие', 'минуты', 'кажется', 'доказывают', 'не', 'только', 'то', 'что', 'Бог', 'существует', 'но', 'еще', 'и', 'то', 'что', 'ты', 'выполняешь', 'его', 'волю']	"['When', 'fortune', 'smiles', 'on', 'something', 'as', 'violent', 'and', 'ugly', 'as', 'revenge', 'it', 'seems', 'proof', 'like', 'no', 'other', 'that', 'not', 'only', 'does', 'God', 'exist', ""you're"", 'doing', 'his', 'will']"
215	At a time when I knew the least about my enemies, the first name on my death list, O-Ren Ishii, was the easiest to find. 	Несмотря на то, что мне не было известно практически ничего о моих врагах, первое имя в моем списке смертников, О-Рен Ишии, оказалось легко найти. 	['Несмотря', 'на', 'то', 'что', 'мне', 'не', 'было', 'известно', 'практически', 'ничего', 'о', 'моих', 'врагах', 'первое', 'имя', 'в', 'моем', 'списке', 'смертников', 'О-Рен', 'Ишии', 'оказалось', 'легко', 'найти']	['At', 'a', 'time', 'when', 'I', 'knew', 'the', 'least', 'about', 'my', 'enemies', 'the', 'first', 'name', 'on', 'my', 'death', 'list', 'O-Ren', 'Ishii', 'was', 'the', 'easiest', 'to', 'find']
216	But when one manages the difficult task of becoming queen of the Tokio underworld, 	Хотя, сказать по правде, если это имя принадлежит королеве преступного мира Токио... 	['Хотя', 'сказать', 'по', 'правде', 'если', 'это', 'имя', 'принадлежит', 'королеве', 'преступного', 'мира', 'Токио']	['But', 'when', 'one', 'manages', 'the', 'difficult', 'task', 'of', 'becoming', 'queen', 'of', 'the', 'Tokio', 'underworld']
217	one doesn't keep it a secret, does one? 	"Ведь шила в мешке не утаишь? О-РЕН ИШИИ - член ТЕРРОРИСТИЧЕСКОГО ОТРЯДА ""СМЕРТОНОСНАЯ ГАДЮКА"" Позывной: водяной щитомордник ГЛАВА ТРЕТЬЯ Происхождение О-Рен "	['Ведь', 'шила', 'в', 'мешке', 'не', 'утаишь', 'О-РЕН', 'ИШИИ', 'член', 'ТЕРРОРИСТИЧЕСКОГО', 'ОТРЯДА', 'СМЕРТОНОСНАЯ', 'ГАДЮКА', 'Позывной', 'водяной', 'щитомордник', 'ГЛАВА', 'ТРЕТЬЯ', 'Происхождение', 'О-Рен']	"['one', ""doesn't"", 'keep', 'it', 'a', 'secret', 'does', 'one']"
218	O-Ren Ishii was born on an American military base in Tokio, Japan. 	О-Рен Ишии родилась на американской военной базе в Токио, в Японии. 	['О-Рен', 'Ишии', 'родилась', 'на', 'американской', 'военной', 'базе', 'в', 'Токио', 'в', 'Японии']	['O-Ren', 'Ishii', 'was', 'born', 'on', 'an', 'American', 'military', 'base', 'in', 'Tokio', 'Japan']
219	The half-Japanese, half-Chinese American Army brat made her first acquaintance with death at the age of 9. 	Наполовину японка, наполовину китаянка, она впервые познакомилась со смертью в девять лет. 	['Наполовину', 'японка', 'наполовину', 'китаянка', 'она', 'впервые', 'познакомилась', 'со', 'смертью', 'в', 'девять', 'лет']	['The', 'half-Japanese', 'half-Chinese', 'American', 'Army', 'brat', 'made', 'her', 'first', 'acquaintance', 'with', 'death', 'at', 'the', 'age', 'of', '9']
220	It was at that age she witnessed the death of her parents at the hands of Japan's most ruthless yakuza boss, Boss Matsumoto. 	В нежном возрасте она стала свидетельницей смерти родителей, которые пали от рук убийц... из клана японских якудза. Клана, которым заправлял Босс Мацумото. Ы-ы-ы-ы-ы. 	['В', 'нежном', 'возрасте', 'она', 'стала', 'свидетельницей', 'смерти', 'родителей', 'которые', 'пали', 'от', 'рук', 'убийц', 'из', 'клана', 'японских', 'якудза', 'Клана', 'которым', 'заправлял', 'Босс', 'Мацумото', 'Ы-ы-ы-ы-ы']	"['It', 'was', 'at', 'that', 'age', 'she', 'witnessed', 'the', 'death', 'of', 'her', 'parents', 'at', 'the', 'hands', 'of', ""Japan's"", 'most', 'ruthless', 'yakuza', 'boss', 'Boss', 'Matsumoto']"
221	Mommy. 	Мамочка! 	['Мамочка']	['Mommy']
222	She swore revenge. 	Она поклялась отомстить. 	['Она', 'поклялась', 'отомстить']	['She', 'swore', 'revenge']
223	Luckily for her, Boss Matsumoto was a pedophile. 	К счастью для нее, Босс Мацумото оказался педофилом. 	['К', 'счастью', 'для', 'нее', 'Босс', 'Мацумото', 'оказался', 'педофилом']	['Luckily', 'for', 'her', 'Boss', 'Matsumoto', 'was', 'a', 'pedophile']
224	At 11, she got her revenge. 	В одиннадцать, ее родители были отмщены. 	['В', 'одиннадцать', 'ее', 'родители', 'были', 'отмщены']	['At', '11', 'she', 'got', 'her', 'revenge']
225	Look at me, Matsumoto... 	Смотри на меня, Мацумото. 	['Смотри', 'на', 'меня', 'Мацумото']	['Look', 'at', 'me', 'Matsumoto']
226	...take a good look at my face. 	Смотри мне в лицо. 	['Смотри', 'мне', 'в', 'лицо']	['take', 'a', 'good', 'look', 'at', 'my', 'face']
227	Look at my eyes. 	Смотри хорошенько, не отворачивайся. Смотри мне в глаза. 	['Смотри', 'хорошенько', 'не', 'отворачивайся', 'Смотри', 'мне', 'в', 'глаза']	['Look', 'at', 'my', 'eyes']
228	Look at my mouth. 	Смотри на мой рот. 	['Смотри', 'на', 'мой', 'рот']	['Look', 'at', 'my', 'mouth']
229	Do I look familiar? 	Знакомо? 	['Знакомо']	['Do', 'I', 'look', 'familiar']
230	Do I look like somebody... you murdered?! 	Я напоминаю кого-то... которого ты убил! 	['Я', 'напоминаю', 'кого-то', 'которого', 'ты', 'убил']	['Do', 'I', 'look', 'like', 'somebody', 'you', 'murdered']
231	By 20, she was one of the top female assassins in the world. 	К двадцати годам, девушка стала непревзойденным убийцей мирового класса. 	['К', 'двадцати', 'годам', 'девушка', 'стала', 'непревзойденным', 'убийцей', 'мирового', 'класса']	['By', '20', 'she', 'was', 'one', 'of', 'the', 'top', 'female', 'assassins', 'in', 'the', 'world']
232	At 25, she did her part in the killing of nine innocent people, including my unborn daughter, in a small wedding chapel in El Paso, Texas. 	В двадцать пять она внесла свою лепту в убийство девятерых человек, включая мою нерожденную дочь. Это произошло в свадебной часовне в Эль Пасо, что в Техасе. 	['В', 'двадцать', 'пять', 'она', 'внесла', 'свою', 'лепту', 'в', 'убийство', 'девятерых', 'человек', 'включая', 'мою', 'нерожденную', 'дочь', 'Это', 'произошло', 'в', 'свадебной', 'часовне', 'в', 'Эль', 'Пасо', 'что', 'в', 'Техасе']	['At', '25', 'she', 'did', 'her', 'part', 'in', 'the', 'killing', 'of', 'nine', 'innocent', 'people', 'including', 'my', 'unborn', 'daughter', 'in', 'a', 'small', 'wedding', 'chapel', 'in', 'El', 'Paso', 'Texas']
233	But on that day four years ago she made one big mistake. 	Но в тот день, четыре года назад, она совершила одну непростительную ошибку. 	['Но', 'в', 'тот', 'день', 'четыре', 'года', 'назад', 'она', 'совершила', 'одну', 'непростительную', 'ошибку']	['But', 'on', 'that', 'day', 'four', 'years', 'ago', 'she', 'made', 'one', 'big', 'mistake']
234	She should have killed 10. 	Ей нужно было убить десятого. 	['Ей', 'нужно', 'было', 'убить', 'десятого']	['She', 'should', 'have', 'killed', '10']
235	However, before satisfaction would be mine, 	Но с ней - не будем забегать вперед, 	['Но', 'с', 'ней', 'не', 'будем', 'забегать', 'вперед']	['However', 'before', 'satisfaction', 'would', 'be', 'mine']
236	first things first. Wiggle your big toe. 	для начала мне надо расшевелить пальцы. 	['для', 'начала', 'мне', 'надо', 'расшевелить', 'пальцы']	['first', 'things', 'first', 'Wiggle', 'your', 'big', 'toe']
237	Hard part's over. 	Самое сложное позади. 	['Самое', 'сложное', 'позади']	"['Hard', ""part's"", 'over']"
238	Now, let's get these other piggies wiggling. 	Теперь давай растормошим остальных поросяток. Тринадцать часов спустя. 	['Теперь', 'давай', 'растормошим', 'остальных', 'поросяток', 'Тринадцать', 'часов', 'спустя']	"['Now', ""let's"", 'get', 'these', 'other', 'piggies', 'wiggling']"
239	Welcome to Air O. May I help you? 	Добро пожаловать в Эрроу. Чем могу помочь? 	['Добро', 'пожаловать', 'в', 'Эрроу', 'Чем', 'могу', 'помочь']	['Welcome', 'to', 'Air', 'O', 'May', 'I', 'help', 'you']
240	Okinawa. One-way. 	Билет в Окинаву... ГЛАВА ЧЕТВЕРТАЯ Человек из Окинавы Остров Окинава, Япония 	['Билет', 'в', 'Окинаву', 'ГЛАВА', 'ЧЕТВЕРТАЯ', 'Человек', 'из', 'Окинавы', 'Остров', 'Окинава', 'Япония']	['Okinawa', 'One-way']
241	Hi. 	Привет. 	['Привет']	['Hi']
242	Welcome... Welcome. 	Добро пожаловать. 	['Добро', 'пожаловать']	['Welcome', 'Welcome']
243	You English? 	Вы англичанка? 	['Вы', 'англичанка']	['You', 'English']
244	Almost. American. 	Почти - американка. 	['Почти', 'американка']	['Almost', 'American']
245	American. Welcome, American. 	Американка. Добро пожаловать. 	['Американка', 'Добро', 'пожаловать']	['American', 'Welcome', 'American']
246	Domo. 	Домо. 	['Домо']	['Domo']
247	My English very good. 	Мой английский... очень хороший. 	['Мой', 'английский', 'очень', 'хороший']	['My', 'English', 'very', 'good']
248	"You said ""domo."" Can you speak Japanese? You said ""domo."" Can you speak Japanese? "	"О, ""Домо"", очень хорошо, Вы говорите по-японски? "	['О', 'Домо', 'очень', 'хорошо', 'Вы', 'говорите', 'по-японски']	['You', 'said', 'domo', 'Can', 'you', 'speak', 'Japanese', 'You', 'said', 'domo', 'Can', 'you', 'speak', 'Japanese']
249	No, no. Just a few words I learned since yesterday. 	Не-е-е, просто вчера выучила пару слов. 	['Не-е-е', 'просто', 'вчера', 'выучила', 'пару', 'слов']	['No', 'no', 'Just', 'a', 'few', 'words', 'I', 'learned', 'since', 'yesterday']
250	Um, may I sit at the bar? 	Можно в баре посидеть? 	['Можно', 'в', 'баре', 'посидеть']	['Um', 'may', 'I', 'sit', 'at', 'the', 'bar']
251	Oh, sure, sure, sure. Please, sit. 	О, конечно, конечно, пожалуйста, сидите. 	['О', 'конечно', 'конечно', 'пожалуйста', 'сидите']	['Oh', 'sure', 'sure', 'sure', 'Please', 'sit']
252	What other words did you learn? 	Какие другие слова Вы выучили? 	['Какие', 'другие', 'слова', 'Вы', 'выучили']	['What', 'other', 'words', 'did', 'you', 'learn']
253	Oh, just a minute. 	Простите. 	['Простите']	['Oh', 'just', 'a', 'minute']
254	We have a customer. Bring out some tea, quickly. 	У нас посетитель. Принеси чаю, быстро. 	['У', 'нас', 'посетитель', 'Принеси', 'чаю', 'быстро']	['We', 'have', 'a', 'customer', 'Bring', 'out', 'some', 'tea', 'quickly']
255	I'm watching my soap operas. 	Я смотрю мыльные оперы. 	['Я', 'смотрю', 'мыльные', 'оперы']	"[""I'm"", 'watching', 'my', 'soap', 'operas']"
256	Lazy bastard... 	Ленивый ублюдок... 	['Ленивый', 'ублюдок']	['Lazy', 'bastard']
257	Screw your soap opera... Hurry up! 	К черту мыльную оперу... Поспеши! 	['К', 'черту', 'мыльную', 'оперу', 'Поспеши']	['Screw', 'your', 'soap', 'opera', 'Hurry', 'up']
