	en	ru	ru_tokens	en_tokens
691	A good friend of mine was in the bed right next door. 	На соседней койке лежал мой хороший друг. 	['На', 'соседней', 'койке', 'лежал', 'мой', 'хороший', 'друг']	['A', 'good', 'friend', 'of', 'mine', 'was', 'in', 'the', 'bed', 'right', 'next', 'door']
692	Lieutenant Dan, I got you some ice cream. 	Лейтенант Дэн, я принес Вам мороженое. 	['Лейтенант', 'Дэн', 'я', 'принес', 'Вам', 'мороженое']	['Lieutenant', 'Dan', 'I', 'got', 'you', 'some', 'ice', 'cream']
693	Lieutenant Dan, ice cream. 	Лейтенант Дэн, мороженое! 	['Лейтенант', 'Дэн', 'мороженое']	['Lieutenant', 'Dan', 'ice', 'cream']
694	It's time for your bath, Lieutenant. 	Время принимать ванну, лейтенант. 	['Время', 'принимать', 'ванну', 'лейтенант']	"[""It's"", 'time', 'for', 'your', 'bath', 'Lieutenant']"
695	Harper! 	Харпер! 	['Харпер']	['Harper']
696	Cooper, Larson, 	Купер Ларсон 	['Купер', 'Ларсон']	['Cooper', 'Larson']
697	Webster, 	Вебстер 	['Вебстер']	['Webster']
698	-Gump. Gump. -I'm Forrest Gump. 	Гамп. Гамп! Я Форрест Гамп. 	['Гамп', 'Гамп', 'Я', 'Форрест', 'Гамп']	"['Gump', 'Gump', ""I'm"", 'Forrest', 'Gump']"
699	Kyle, Nichols, 	Кайл. Николс. 	['Кайл', 'Николс']	['Kyle', 'Nichols']
700	McMill, Johnson, Tyler, 	МакМилл. Джонсон. 	['МакМилл', 'Джонсон']	['McMill', 'Johnson', 'Tyler']
701	Holiday... Surprise, surprise, surprise! 	Сюрприз, сюрприз! 	['Сюрприз', 'сюрприз']	['Holiday', 'Surprise', 'surprise', 'surprise']
702	Gump, how can you watch that stupid shit? 	Гамп, как ты можешь смотреть это тупое дерьмо? 	['Гамп', 'как', 'ты', 'можешь', 'смотреть', 'это', 'тупое', 'дерьмо']	['Gump', 'how', 'can', 'you', 'watch', 'that', 'stupid', 'shit']
703	-From the DMZ to the Delta... -Turn it off! 	Выключи.. 	['Выключи']	['From', 'the', 'DMZ', 'to', 'the', 'Delta', 'Turn', 'it', 'off']
704	...you are tuned to the American Forces Vietnam Network. 	Вы на канале Американских сил Вьетнам. 	['Вы', 'на', 'канале', 'Американских', 'сил', 'Вьетнам']	['you', 'are', 'tuned', 'to', 'the', 'American', 'Forces', 'Vietnam', 'Network']
705	This is Channel 6, Saigon. 	6 канал, Сайгон. 	['6', 'канал', 'Сайгон']	['This', 'is', 'Channel', '6', 'Saigon']
706	Good catch, Gump. 	Хорошо поймал, Гамп. 	['Хорошо', 'поймал', 'Гамп']	['Good', 'catch', 'Gump']
707	You know how to play this? 	Ты знаешь как в это играть? 	['Ты', 'знаешь', 'как', 'в', 'это', 'играть']	['You', 'know', 'how', 'to', 'play', 'this']
708	Come on, let me show you. Here. 	Да ладно. Давай я тебе покажу. 	['Да', 'ладно', 'Давай', 'я', 'тебе', 'покажу']	['Come', 'on', 'let', 'me', 'show', 'you', 'Here']
709	Now, the secret to this game is, 	Секрет этой игры заключен в том, 	['Секрет', 'этой', 'игры', 'заключен', 'в', 'том']	['Now', 'the', 'secret', 'to', 'this', 'game', 'is']
710	no matter what happens, never ever take your eye off the ball. 	что чтобы не происходило, никогда, никогда... не своди глаз с шарика. 	['что', 'чтобы', 'не', 'происходило', 'никогда', 'никогда', 'не', 'своди', 'глаз', 'с', 'шарика']	['no', 'matter', 'what', 'happens', 'never', 'ever', 'take', 'your', 'eye', 'off', 'the', 'ball']
711	All right. 	Хорошо. 	['Хорошо']	['All', 'right']
712	For some reason, Ping-Pong came very natural to me. 	По каким то причинам, пинг-понг показался мне очень простым. 	['По', 'каким', 'то', 'причинам', 'пинг-понг', 'показался', 'мне', 'очень', 'простым']	['For', 'some', 'reason', 'Ping-Pong', 'came', 'very', 'natural', 'to', 'me']
713	See? Any idiot can play. 	Вот видишь? Любой дурак может в него играть. 	['Вот', 'видишь', 'Любой', 'дурак', 'может', 'в', 'него', 'играть']	['See', 'Any', 'idiot', 'can', 'play']
714	So, I started playing it all the time. 	И я стал играть все время. 	['И', 'я', 'стал', 'играть', 'все', 'время']	['So', 'I', 'started', 'playing', 'it', 'all', 'the', 'time']
715	I played Ping-Pong 	Я играл в пинг-понг 	['Я', 'играл', 'в', 'пинг-понг']	['I', 'played', 'Ping-Pong']
716	even when I didn't have anyone to play Ping-Pong with. 	даже когда мне не с кем было в него играть. 	['даже', 'когда', 'мне', 'не', 'с', 'кем', 'было', 'в', 'него', 'играть']	"['even', 'when', 'I', ""didn't"", 'have', 'anyone', 'to', 'play', 'Ping-Pong', 'with']"
717	The hospital's people said it made me look like a duck in water, 	Люди в госпитале говорили, что я, похоже, чувствовал себя как утка на воде. 	['Люди', 'в', 'госпитале', 'говорили', 'что', 'я', 'похоже', 'чувствовал', 'себя', 'как', 'утка', 'на', 'воде']	"['The', ""hospital's"", 'people', 'said', 'it', 'made', 'me', 'look', 'like', 'a', 'duck', 'in', 'water']"
718	whatever that means. 	Я не понимал, что это значит. 	['Я', 'не', 'понимал', 'что', 'это', 'значит']	['whatever', 'that', 'means']
719	Even Lieutenant Dan would come and watch me play. 	Даже лейтенант Дэн приходил посмотреть как я играю. 	['Даже', 'лейтенант', 'Дэн', 'приходил', 'посмотреть', 'как', 'я', 'играю']	['Even', 'Lieutenant', 'Dan', 'would', 'come', 'and', 'watch', 'me', 'play']
720	I played Ping-Pong so much, I even played it in my sleep. 	Я играл в пинг-понг так много, что играл в него даже когда я спал. 	['Я', 'играл', 'в', 'пинг-понг', 'так', 'много', 'что', 'играл', 'в', 'него', 'даже', 'когда', 'я', 'спал']	['I', 'played', 'Ping-Pong', 'so', 'much', 'I', 'even', 'played', 'it', 'in', 'my', 'sleep']
721	Now, you listen to me. We all have a destiny. 	Так... Слушай меня. У нас у всех есть судьба. 	['Так', 'Слушай', 'меня', 'У', 'нас', 'у', 'всех', 'есть', 'судьба']	['Now', 'you', 'listen', 'to', 'me', 'We', 'all', 'have', 'a', 'destiny']
722	Nothing just happens, it's all part of a plan. 	Ничего просто так не происходит. Все - часть плана. 	['Ничего', 'просто', 'так', 'не', 'происходит', 'Все', 'часть', 'плана']	"['Nothing', 'just', 'happens', ""it's"", 'all', 'part', 'of', 'a', 'plan']"
723	I should have died out there with my men, 	Я должен был умереть там вместе со всеми моими людьми, 	['Я', 'должен', 'был', 'умереть', 'там', 'вместе', 'со', 'всеми', 'моими', 'людьми']	['I', 'should', 'have', 'died', 'out', 'there', 'with', 'my', 'men']
724	but now I'm nothing but a goddamn cripple, 	а сейчас я ничто, просто долбанный калека 	['а', 'сейчас', 'я', 'ничто', 'просто', 'долбанный', 'калека']	"['but', 'now', ""I'm"", 'nothing', 'but', 'a', 'goddamn', 'cripple']"
725	a legless freak! Look! Look! Look at me! 	безногий урод! Посмотри. Посмотри на меня. 	['безногий', 'урод', 'Посмотри', 'Посмотри', 'на', 'меня']	['a', 'legless', 'freak', 'Look', 'Look', 'Look', 'at', 'me']
726	Do you see that? 	Видишь? 	['Видишь']	['Do', 'you', 'see', 'that']
727	Do you know what it's like not to be able to use your legs? 	Ты хоть знаешь, что это такое... когда не можешь воспользоваться своими ногами? 	['Ты', 'хоть', 'знаешь', 'что', 'это', 'такое', 'когда', 'не', 'можешь', 'воспользоваться', 'своими', 'ногами']	"['Do', 'you', 'know', 'what', ""it's"", 'like', 'not', 'to', 'be', 'able', 'to', 'use', 'your', 'legs']"
728	Yes, sir, I do. 	Д-д-да, сэр, знаю. 	['Д-д-да', 'сэр', 'знаю']	['Yes', 'sir', 'I', 'do']
729	Did you hear what I said? 	Ты слышал, что я тебе сказал? 	['Ты', 'слышал', 'что', 'я', 'тебе', 'сказал']	['Did', 'you', 'hear', 'what', 'I', 'said']
730	You cheated me. 	Ты обманул меня! 	['Ты', 'обманул', 'меня']	['You', 'cheated', 'me']
731	I had a destiny. 	У была меня своя судьба. 	['У', 'была', 'меня', 'своя', 'судьба']	['I', 'had', 'a', 'destiny']
732	I was supposed to die in the field, with honor! 	Мне было предначертано умереть на поле боя, с честью! 	['Мне', 'было', 'предначертано', 'умереть', 'на', 'поле', 'боя', 'с', 'честью']	['I', 'was', 'supposed', 'to', 'die', 'in', 'the', 'field', 'with', 'honor']
733	That was my destiny, and you cheated me out of it! 	Это была моя судьба, а ты... ты украл у меня это! 	['Это', 'была', 'моя', 'судьба', 'а', 'ты', 'ты', 'украл', 'у', 'меня', 'это']	['That', 'was', 'my', 'destiny', 'and', 'you', 'cheated', 'me', 'out', 'of', 'it']
734	Do you understand what I'm saying, Gump? 	Ты понимаешь, что я говорю? 	['Ты', 'понимаешь', 'что', 'я', 'говорю']	"['Do', 'you', 'understand', 'what', ""I'm"", 'saying', 'Gump']"
735	This wasn't supposed to happen, not to me. 	Этого не должно было произойти. Только не со мной. 	['Этого', 'не', 'должно', 'было', 'произойти', 'Только', 'не', 'со', 'мной']	"['This', ""wasn't"", 'supposed', 'to', 'happen', 'not', 'to', 'me']"
736	I had a destiny. 	У меня была судьба. 	['У', 'меня', 'была', 'судьба']	['I', 'had', 'a', 'destiny']
737	I was Lieutenant Dan Taylor. 	Я был... Лейтенант... Дэн Тейлор. 	['Я', 'был', 'Лейтенант', 'Дэн', 'Тейлор']	['I', 'was', 'Lieutenant', 'Dan', 'Taylor']
738	You're still Lieutenant Dan. 	Вы до сих пор... Лейтенант Дэн. 	['Вы', 'до', 'сих', 'пор', 'Лейтенант', 'Дэн']	"[""You're"", 'still', 'Lieutenant', 'Dan']"
739	Look at me. 	Посмотри на меня. 	['Посмотри', 'на', 'меня']	['Look', 'at', 'me']
740	What am I gonna do now? 	Что мне теперь делать? 	['Что', 'мне', 'теперь', 'делать']	['What', 'am', 'I', 'gonna', 'do', 'now']
741	What am I gonna do now? 	Что мне теперь делать? 	['Что', 'мне', 'теперь', 'делать']	['What', 'am', 'I', 'gonna', 'do', 'now']
742	PFC Gump? 	Рядовой Гамп? 	['Рядовой', 'Гамп']	['PFC', 'Gump']
743	Yes, sir! 	Да, сэр! 	['Да', 'сэр']	['Yes', 'sir']
744	As you were. 	Вольно. 	['Вольно']	['As', 'you', 'were']
745	Son, you've been awarded the Medal of Honor. 	Сынок, тебя наградили медалью чести. 	['Сынок', 'тебя', 'наградили', 'медалью', 'чести']	"['Son', ""you've"", 'been', 'awarded', 'the', 'Medal', 'of', 'Honor']"
746	Guess what, Lieutenant Dan, they want to give me a... 	Лейтенант Дэн? Мне хотят вручить медаль.. 	['Лейтенант', 'Дэн', 'Мне', 'хотят', 'вручить', 'медаль']	['Guess', 'what', 'Lieutenant', 'Dan', 'they', 'want', 'to', 'give', 'me', 'a']
747	Ma'am, what'd they do with Lieutenant Dan? 	Мэм. А что сделали с лейтенантом Дэном? 	['Мэм', 'А', 'что', 'сделали', 'с', 'лейтенантом', 'Дэном']	"[""Ma'am"", ""what'd"", 'they', 'do', 'with', 'Lieutenant', 'Dan']"
748	They sent him home. 	Отправили его домой. 	['Отправили', 'его', 'домой']	['They', 'sent', 'him', 'home']
749	Two weeks later, I left Vietnam. 	Двумя неделями позже, я покинул Вьетнам. 	['Двумя', 'неделями', 'позже', 'я', 'покинул', 'Вьетнам']	['Two', 'weeks', 'later', 'I', 'left', 'Vietnam']
750	The ceremony was kicked off with a candid speech by the President 	Церемония началась с того, что президент выступил с речью 	['Церемония', 'началась', 'с', 'того', 'что', 'президент', 'выступил', 'с', 'речью']	['The', 'ceremony', 'was', 'kicked', 'off', 'with', 'a', 'candid', 'speech', 'by', 'the', 'President']
751	regarding the need for further escalation of the war in Vietnam. 	о расширении войны во Вьетнаме. 	['о', 'расширении', 'войны', 'во', 'Вьетнаме']	['regarding', 'the', 'need', 'for', 'further', 'escalation', 'of', 'the', 'war', 'in', 'Vietnam']
752	President Johnson awarded four Medals of Honor to men from each of the Armed Services. 	Джонсон вручил 4 Медали за отвагу людям из разных отраслей армии. 	['Джонсон', 'вручил', '4', 'Медали', 'за', 'отвагу', 'людям', 'из', 'разных', 'отраслей', 'армии']	['President', 'Johnson', 'awarded', 'four', 'Medals', 'of', 'Honor', 'to', 'men', 'from', 'each', 'of', 'the', 'Armed', 'Services']
753	America owes you a debt of gratitude, son. 	Америка в долгу перед тобой, сынок. 	['Америка', 'в', 'долгу', 'перед', 'тобой', 'сынок']	['America', 'owes', 'you', 'a', 'debt', 'of', 'gratitude', 'son']
754	I understand you were wounded. Where were you hit? 	Я так понимаю ты был ранен. Куда тебе попало? 	['Я', 'так', 'понимаю', 'ты', 'был', 'ранен', 'Куда', 'тебе', 'попало']	['I', 'understand', 'you', 'were', 'wounded', 'Where', 'were', 'you', 'hit']
755	-In the buttocks, sir. -That must be a sight. 	В ягодицу, сэр. Мда...Это наверное то еще зрелище. 	['В', 'ягодицу', 'сэр', 'Мда...Это', 'наверное', 'то', 'еще', 'зрелище']	['In', 'the', 'buttocks', 'sir', 'That', 'must', 'be', 'a', 'sight']
756	I'd kind of like to see that. 	Я бы с удовольствием на это посмотрел. 	['Я', 'бы', 'с', 'удовольствием', 'на', 'это', 'посмотрел']	"[""I'd"", 'kind', 'of', 'like', 'to', 'see', 'that']"
757	God damn, son. 	Черт! Ну, сынок... 	['Черт', 'Ну', 'сынок']	['God', 'damn', 'son']
758	After that, Mama went to the hotel to lay down, 	После этого, мама поехала в гостиницу отдохнуть, 	['После', 'этого', 'мама', 'поехала', 'в', 'гостиницу', 'отдохнуть']	['After', 'that', 'Mama', 'went', 'to', 'the', 'hotel', 'to', 'lay', 'down']
759	so I went out for a walk to see our nation's capital. 	а я отправился погулять и посмотреть на столицу страны. 	['а', 'я', 'отправился', 'погулять', 'и', 'посмотреть', 'на', 'столицу', 'страны']	"['so', 'I', 'went', 'out', 'for', 'a', 'walk', 'to', 'see', 'our', ""nation's"", 'capital']"
760	Hilary, all right, I've got the vets, what do you want me to do with them? What are you doing here so late? 	Хилари! Я был на осмотре. Что ты собираешься с ними делать? 	['Хилари', 'Я', 'был', 'на', 'осмотре', 'Что', 'ты', 'собираешься', 'с', 'ними', 'делать']	"['Hilary', 'all', 'right', ""I've"", 'got', 'the', 'vets', 'what', 'do', 'you', 'want', 'me', 'to', 'do', 'with', 'them', 'What', 'are', 'you', 'doing', 'here', 'so', 'late']"
761	It's a good thing Mama was resting, 'cause the streets was awful crowded 	Хорошо, что мама пошла отдохнуть, потому что на улице была большая толпа народу 	['Хорошо', 'что', 'мама', 'пошла', 'отдохнуть', 'потому', 'что', 'на', 'улице', 'была', 'большая', 'толпа', 'народу']	"[""It's"", 'a', 'good', 'thing', 'Mama', 'was', 'resting', ""'cause"", 'the', 'streets', 'was', 'awful', 'crowded']"
762	with people looking at all the statues and monuments, 	осматривающая монументы и статуи. 	['осматривающая', 'монументы', 'и', 'статуи']	['with', 'people', 'looking', 'at', 'all', 'the', 'statues', 'and', 'monuments']
763	and some of them people were loud and pushy. 	Некоторые из них шумели, толкались. 	['Некоторые', 'из', 'них', 'шумели', 'толкались']	['and', 'some', 'of', 'them', 'people', 'were', 'loud', 'and', 'pushy']
764	Okay, follow me! Come on. Let's move it out. 	Пойдемте за мной! 	['Пойдемте', 'за', 'мной']	"['Okay', 'follow', 'me', 'Come', 'on', ""Let's"", 'move', 'it', 'out']"
765	Everywhere I went, I had to stand in line. 	Где бы я ни был, мне везде приходилось стоять в очереди. 	['Где', 'бы', 'я', 'ни', 'был', 'мне', 'везде', 'приходилось', 'стоять', 'в', 'очереди']	['Everywhere', 'I', 'went', 'I', 'had', 'to', 'stand', 'in', 'line']
766	Follow me, let's go! Come on. Let's go. Stand here. 	Давайте. Пошли! 	['Давайте', 'Пошли']	"['Follow', 'me', ""let's"", 'go', 'Come', 'on', ""Let's"", 'go', 'Stand', 'here']"
767	Hey, you're a good man for doing this. Good! 	Эй, ты хороший человек, если это делаешь. Ты хороший. 	['Эй', 'ты', 'хороший', 'человек', 'если', 'это', 'делаешь', 'Ты', 'хороший']	"['Hey', ""you're"", 'a', 'good', 'man', 'for', 'doing', 'this', 'Good']"
768	Okay. 	Ладно. 	['Ладно']	['Okay']
769	There was this man giving a little talk. 	Там говорил один человек, 	['Там', 'говорил', 'один', 'человек']	['There', 'was', 'this', 'man', 'giving', 'a', 'little', 'talk']
770	And for some reason, he was wearing an American flag for a shirt. Now, I'm gonna bring up some soldiers... 	Почему-то он был одет в американский флаг вместо рубашки. 	['Почему-то', 'он', 'был', 'одет', 'в', 'американский', 'флаг', 'вместо', 'рубашки']	"['And', 'for', 'some', 'reason', 'he', 'was', 'wearing', 'an', 'American', 'flag', 'for', 'a', 'shirt', 'Now', ""I'm"", 'gonna', 'bring', 'up', 'some', 'soldiers']"
771	"And he liked to say the ""F"" word. "	И ему нравилось материться... очень. 	['И', 'ему', 'нравилось', 'материться', 'очень']	['And', 'he', 'liked', 'to', 'say', 'the', 'F', 'word']
772	"A lot. ""F"" this and ""F"" that. "	Матом кроет то, матом кроет се. 	['Матом', 'кроет', 'то', 'матом', 'кроет', 'се']	['A', 'lot', 'F', 'this', 'and', 'F', 'that']
773	"And every time he said the ""F"" word, "	И каждый раз, когда он что-нибудь материл 	['И', 'каждый', 'раз', 'когда', 'он', 'что-нибудь', 'материл']	['And', 'every', 'time', 'he', 'said', 'the', 'F', 'word']
774	people, for some reason, well, they'd cheer. 	люди почему-то одобрительно аплодировали. 	['люди', 'почему-то', 'одобрительно', 'аплодировали']	"['people', 'for', 'some', 'reason', 'well', ""they'd"", 'cheer']"
775	...where to stick this fucking war! Yeah! Yeah! Yeah! 	Да! Да! 	['Да', 'Да']	['where', 'to', 'stick', 'this', 'fucking', 'war', 'Yeah', 'Yeah', 'Yeah']
776	Come on, man, come up here, man. 	Пойдем. Поднимайся, мужик. 	['Пойдем', 'Поднимайся', 'мужик']	['Come', 'on', 'man', 'come', 'up', 'here', 'man']
777	Come on. Come on. Yeah, you! Come on. Move, move, move. 	Давайте, давайте сюда. 	['Давайте', 'давайте', 'сюда']	['Come', 'on', 'Come', 'on', 'Yeah', 'you', 'Come', 'on', 'Move', 'move', 'move']
778	You can do it. Just get up there. Go on. That's it. 	Да! Давайте. Пошевеливайтесь! Поднимайся. Вставай сюда. 	['Да', 'Давайте', 'Пошевеливайтесь', 'Поднимайся', 'Вставай', 'сюда']	"['You', 'can', 'do', 'it', 'Just', 'get', 'up', 'there', 'Go', 'on', ""That's"", 'it']"
779	Tell us a little bit about the war, man. 	Расскажи нам немного о войне. 	['Расскажи', 'нам', 'немного', 'о', 'войне']	['Tell', 'us', 'a', 'little', 'bit', 'about', 'the', 'war', 'man']
780	The war in Vietnam? 	О войне во Вьетнаме? 	['О', 'войне', 'во', 'Вьетнаме']	['The', 'war', 'in', 'Vietnam']
781	-The war in Viet-fucking-nam! -Yeah! Peace! Come on, man, go! -Come on! -Peace! 	Война во Вьет- мать его, -наме! 	['Война', 'во', 'Вьет', 'мать', 'его', 'наме']	['The', 'war', 'in', 'Viet-fucking-nam', 'Yeah', 'Peace', 'Come', 'on', 'man', 'go', 'Come', 'on', 'Peace']
782	Well... 	Ну... 	['Ну']	['Well']
783	There was only one thing I could say about the war in Vietnam. 	Я только одно могу сказать 	['Я', 'только', 'одно', 'могу', 'сказать']	['There', 'was', 'only', 'one', 'thing', 'I', 'could', 'say', 'about', 'the', 'war', 'in', 'Vietnam']
784	...there's only one thing I can say about the war in Vietnam. 	о войне во Вьетнаме. Только одну вещь... о войне... во Вьетнаме. 	['о', 'войне', 'во', 'Вьетнаме', 'Только', 'одну', 'вещь', 'о', 'войне', 'во', 'Вьетнаме']	"[""there's"", 'only', 'one', 'thing', 'I', 'can', 'say', 'about', 'the', 'war', 'in', 'Vietnam']"
785	In Vietnam, your... 	Во Вьетнаме... 	['Во', 'Вьетнаме']	['In', 'Vietnam', 'your']
786	Hey, what the hell are you... 	Черт, что ты делаешь? 	['Черт', 'что', 'ты', 'делаешь']	['Hey', 'what', 'the', 'hell', 'are', 'you']
787	I'll beat your head in, you goddamn oinker! 	Я тебе башку оторву, придурок хренов. 	['Я', 'тебе', 'башку', 'оторву', 'придурок', 'хренов']	"[""I'll"", 'beat', 'your', 'head', 'in', 'you', 'goddamn', 'oinker']"
788	Jesus Christ, what'd they do with this? 	Господи ты Боже мой! Что он сделал? 	['Господи', 'ты', 'Боже', 'мой', 'Что', 'он', 'сделал']	"['Jesus', 'Christ', ""what'd"", 'they', 'do', 'with', 'this']"
789	We can't hear you! 	Не слышу! 	['Не', 'слышу']	"['We', ""can't"", 'hear', 'you']"
790	We can't hear anything! 	Ничего не слышу! 	['Ничего', 'не', 'слышу']	"['We', ""can't"", 'hear', 'anything']"
791	-This one! This one! Give me that! -Turn it up! 	Этот! Дай мне! 	['Этот', 'Дай', 'мне']	['This', 'one', 'This', 'one', 'Give', 'me', 'that', 'Turn', 'it', 'up']
792	Speak up! 	Говори! 	['Говори']	['Speak', 'up']
793	That's it! 	Это все. 	['Это', 'все']	"[""That's"", 'it']"
794	...and that's all I have to say about that. 	Это все, что я могу сказать об этом. 	['Это', 'все', 'что', 'я', 'могу', 'сказать', 'об', 'этом']	"['and', ""that's"", 'all', 'I', 'have', 'to', 'say', 'about', 'that']"
795	That's so right on, man. You said it all. 	Ты молодец, мужик. Ты все сказал. 	['Ты', 'молодец', 'мужик', 'Ты', 'все', 'сказал']	"[""That's"", 'so', 'right', 'on', 'man', 'You', 'said', 'it', 'all']"
796	What's your name, man? 	Как тебя зовут? 	['Как', 'тебя', 'зовут']	"[""What's"", 'your', 'name', 'man']"
797	My name is Forrest. Forrest Gump. 	Меня зовут Форрест. Форрест Гамп. 	['Меня', 'зовут', 'Форрест', 'Форрест', 'Гамп']	['My', 'name', 'is', 'Forrest', 'Forrest', 'Gump']
798	Forrest Gump! 	Форрест Гамп! 	['Форрест', 'Гамп']	['Forrest', 'Gump']
799	-Gump! -Gump! 	- Гамп! Гамп! - Гамп! 	['Гамп', 'Гамп', 'Гамп']	['Gump', 'Gump']
800	Forrest! Forrest! 	Форрест! Форрест! 	['Форрест', 'Форрест']	['Forrest', 'Forrest']
801	-Jenny! -Forrest! 	Дженни! Форрест! 	['Дженни', 'Форрест']	['Jenny', 'Forrest']
802	Hey! Hey! 	Привет! 	['Привет']	['Hey', 'Hey']
