	en	ru	ru_tokens	en_tokens
391	Gump! What's your sole purpose in this Army? 	Гамп! Какова твоя цель пребывания в армии? 	['Гамп', 'Какова', 'твоя', 'цель', 'пребывания', 'в', 'армии']	"['Gump', ""What's"", 'your', 'sole', 'purpose', 'in', 'this', 'Army']"
392	To do whatever you tell me, Drill Sergeant! 	Делать все, что Вы мне говорите, сержант Дрилл. 	['Делать', 'все', 'что', 'Вы', 'мне', 'говорите', 'сержант', 'Дрилл']	['To', 'do', 'whatever', 'you', 'tell', 'me', 'Drill', 'Sergeant']
393	God damn it, Gump! You're a goddamn genius! 	Черт возьми, Гамп. Ты просто сраный гений! 	['Черт', 'возьми', 'Гамп', 'Ты', 'просто', 'сраный', 'гений']	"['God', 'damn', 'it', 'Gump', ""You're"", 'a', 'goddamn', 'genius']"
394	That's the most outstanding answer I've ever heard. 	Это самый охренительный ответ, который я когда-либо слышал в жизни. 	['Это', 'самый', 'охренительный', 'ответ', 'который', 'я', 'когда-либо', 'слышал', 'в', 'жизни']	"[""That's"", 'the', 'most', 'outstanding', 'answer', ""I've"", 'ever', 'heard']"
395	You must have a goddamn IQ of 160! 	У тебя наверное IQ 160. 	['У', 'тебя', 'наверное', 'IQ', '160']	['You', 'must', 'have', 'a', 'goddamn', 'IQ', 'of', '160']
396	You are goddamn gifted, Private Gump! 	У тебя просто дар какой-то, рядовой Гамп. 	['У', 'тебя', 'просто', 'дар', 'какой-то', 'рядовой', 'Гамп']	['You', 'are', 'goddamn', 'gifted', 'Private', 'Gump']
397	Listen up, people! 	Слушайте меня! 	['Слушайте', 'меня']	['Listen', 'up', 'people']
398	Now, for some reason, I fit in the Army like one of them round pegs. 	По каким-то причинам, я вписался в армейскую жизнь 	['По', 'каким-то', 'причинам', 'я', 'вписался', 'в', 'армейскую', 'жизнь']	['Now', 'for', 'some', 'reason', 'I', 'fit', 'in', 'the', 'Army', 'like', 'one', 'of', 'them', 'round', 'pegs']
399	It's not really hard. 	Это на самом деле не тяжело. 	['Это', 'на', 'самом', 'деле', 'не', 'тяжело']	"[""It's"", 'not', 'really', 'hard']"
400	You just make your bed real neat and remember to stand up straight, 	Вы просто должны заправлять постель, стоять ровно, 	['Вы', 'просто', 'должны', 'заправлять', 'постель', 'стоять', 'ровно']	['You', 'just', 'make', 'your', 'bed', 'real', 'neat', 'and', 'remember', 'to', 'stand', 'up', 'straight']
401	"and always answer every question with, ""Yes, Drill Sergeant!"" "	"и всегда на каждый вопрос отвечать, с добавлением: ""Да, сержант Дрилль"" "	['и', 'всегда', 'на', 'каждый', 'вопрос', 'отвечать', 'с', 'добавлением', 'Да', 'сержант', 'Дрилль']	['and', 'always', 'answer', 'every', 'question', 'with', 'Yes', 'Drill', 'Sergeant']
402	Is that clear? 	Понятно? 	['Понятно']	['Is', 'that', 'clear']
403	-Yes, Drill Sergeant! -Yes, Drill Sergeant! 	Да, сержант Дрилль! 	['Да', 'сержант', 'Дрилль']	['Yes', 'Drill', 'Sergeant', 'Yes', 'Drill', 'Sergeant']
404	What you do is, you just drag your nets along the bottom. 	Опускаешь трал, 	['Опускаешь', 'трал']	['What', 'you', 'do', 'is', 'you', 'just', 'drag', 'your', 'nets', 'along', 'the', 'bottom']
405	On a good day, you can catch over 100 pounds of shrimp. 	И в хороший день ты можешь поймать больше 100 фунтов этих креветок. 	['И', 'в', 'хороший', 'день', 'ты', 'можешь', 'поймать', 'больше', '100', 'фунтов', 'этих', 'креветок']	['On', 'a', 'good', 'day', 'you', 'can', 'catch', 'over', '100', 'pounds', 'of', 'shrimp']
406	If everything goes all right, two men shrimping 10 hours, 	Ну, подумай, если 2 человека по 10 часов ловят креветок. 	['Ну', 'подумай', 'если', '2', 'человека', 'по', '10', 'часов', 'ловят', 'креветок']	['If', 'everything', 'goes', 'all', 'right', 'two', 'men', 'shrimping', '10', 'hours']
407	less what you spend on gas, you can... 	то там будет в итоге... 	['то', 'там', 'будет', 'в', 'итоге']	['less', 'what', 'you', 'spend', 'on', 'gas', 'you', 'can']
408	-Done, Drill Sergeant! -Gump! 	Готово, сержант Дрилль! 	['Готово', 'сержант', 'Дрилль']	['Done', 'Drill', 'Sergeant', 'Gump']
409	Why did you put that weapon together so quickly, Gump? 	Гамп! Как ты так быстро собрал винтовку? 	['Гамп', 'Как', 'ты', 'так', 'быстро', 'собрал', 'винтовку']	['Why', 'did', 'you', 'put', 'that', 'weapon', 'together', 'so', 'quickly', 'Gump']
410	You told me to, Drill Sergeant. 	Вы мне сказали так сделать, сержант Дрилль. 	['Вы', 'мне', 'сказали', 'так', 'сделать', 'сержант', 'Дрилль']	['You', 'told', 'me', 'to', 'Drill', 'Sergeant']
411	Jesus H. Christ, this is a new company record. 	Господи ты Боже мой. Это новый рекорд в роте. 	['Господи', 'ты', 'Боже', 'мой', 'Это', 'новый', 'рекорд', 'в', 'роте']	['Jesus', 'H', 'Christ', 'this', 'is', 'a', 'new', 'company', 'record']
412	If it wouldn't be a waste of such a damn fine enlisted man, 	Если бы потеря такого рядового не была бы такой большой утратой, 	['Если', 'бы', 'потеря', 'такого', 'рядового', 'не', 'была', 'бы', 'такой', 'большой', 'утратой']	"['If', 'it', ""wouldn't"", 'be', 'a', 'waste', 'of', 'such', 'a', 'damn', 'fine', 'enlisted', 'man']"
413	I'd recommend you for OCS, Private Gump. 	я бы порекомендовал тебя перевести в сержанты, рядовой Гамп. 	['я', 'бы', 'порекомендовал', 'тебя', 'перевести', 'в', 'сержанты', 'рядовой', 'Гамп']	"[""I'd"", 'recommend', 'you', 'for', 'OCS', 'Private', 'Gump']"
414	You are gonna be a general some day, Gump. 	Когда-нибудь ты станешь генералом! 	['Когда-нибудь', 'ты', 'станешь', 'генералом']	['You', 'are', 'gonna', 'be', 'a', 'general', 'some', 'day', 'Gump']
415	Now, disassemble your weapon and continue! 	А теперь разбери оружие. 	['А', 'теперь', 'разбери', 'оружие']	['Now', 'disassemble', 'your', 'weapon', 'and', 'continue']
416	Anyway, like I was saying, shrimp is the fruit of the sea. 	Я тебе говорю, креветки - фрукт моря. 	['Я', 'тебе', 'говорю', 'креветки', 'фрукт', 'моря']	['Anyway', 'like', 'I', 'was', 'saying', 'shrimp', 'is', 'the', 'fruit', 'of', 'the', 'sea']
417	You can barbecue it, boil it, broil it, bake it, sautГ© it. 	Ты можешь их коптить, варить, жарить, печь, парить. 	['Ты', 'можешь', 'их', 'коптить', 'варить', 'жарить', 'печь', 'парить']	['You', 'can', 'barbecue', 'it', 'boil', 'it', 'broil', 'it', 'bake', 'it', 'sautГ©', 'it']
418	There's shrimp kebabs, shrimp Creole... 	Из них можно сделать креветочный кебаб, 	['Из', 'них', 'можно', 'сделать', 'креветочный', 'кебаб']	"[""There's"", 'shrimp', 'kebabs', 'shrimp', 'Creole']"
419	...shrimp gumbo, pan fried, deep fried, stir fried. 	можно делать гамбо, жарить в масле, без масла. пассировать. 	['можно', 'делать', 'гамбо', 'жарить', 'в', 'масле', 'без', 'масла', 'пассировать']	['shrimp', 'gumbo', 'pan', 'fried', 'deep', 'fried', 'stir', 'fried']
420	There's pineapple shrimp, lemon shrimp, 	Это креветки в ананасе 	['Это', 'креветки', 'в', 'ананасе']	"[""There's"", 'pineapple', 'shrimp', 'lemon', 'shrimp']"
421	coconut shrimp, pepper shrimp... 	и креветки в лимоне, креветки в кокосе, креветки с перцем, 	['и', 'креветки', 'в', 'лимоне', 'креветки', 'в', 'кокосе', 'креветки', 'с', 'перцем']	['coconut', 'shrimp', 'pepper', 'shrimp']
422	...shrimp soup, shrimp stew, shrimp salad, shrimp and potatoes, 	креветочный суп, креветочное рагу, креветочный салат, креветки с картошкой, 	['креветочный', 'суп', 'креветочное', 'рагу', 'креветочный', 'салат', 'креветки', 'с', 'картошкой']	['shrimp', 'soup', 'shrimp', 'stew', 'shrimp', 'salad', 'shrimp', 'and', 'potatoes']
423	shrimp burger, shrimp sandwich... 	креветбургеры, сандвичи с креветками. 	['креветбургеры', 'сандвичи', 'с', 'креветками']	['shrimp', 'burger', 'shrimp', 'sandwich']
424	That's... That's about it. 	Ну это по-моему все. 	['Ну', 'это', 'по-моему', 'все']	"[""That's"", ""That's"", 'about', 'it']"
425	Night time in the Army is a lonely time. 	Ночью в армии одиноко. 	['Ночью', 'в', 'армии', 'одиноко']	['Night', 'time', 'in', 'the', 'Army', 'is', 'a', 'lonely', 'time']
426	We'd lay there in our bunks and I'd miss my mama. 	Мы все ложились на кровати 	['Мы', 'все', 'ложились', 'на', 'кровати']	"[""We'd"", 'lay', 'there', 'in', 'our', 'bunks', 'and', ""I'd"", 'miss', 'my', 'mama']"
427	And I'd miss Jenny. 	и по Дженни. 	['и', 'по', 'Дженни']	"['And', ""I'd"", 'miss', 'Jenny']"
428	Hey, Gump, get a load of the tits on her! 	Эй, Гамп! Ты только посмотри, какие у нее сиськи. 	['Эй', 'Гамп', 'Ты', 'только', 'посмотри', 'какие', 'у', 'нее', 'сиськи']	['Hey', 'Gump', 'get', 'a', 'load', 'of', 'the', 'tits', 'on', 'her']
429	Turns out, Jenny had gotten into some trouble over 	Выяснилось... что у Дженни были кое-какие неприятности 	['Выяснилось', 'что', 'у', 'Дженни', 'были', 'кое-какие', 'неприятности']	['Turns', 'out', 'Jenny', 'had', 'gotten', 'into', 'some', 'trouble', 'over']
430	some photos of her in her college sweater, 	из-за фотографий, на которых она в форме колледжа. 	['из-за', 'фотографий', 'на', 'которых', 'она', 'в', 'форме', 'колледжа']	['some', 'photos', 'of', 'her', 'in', 'her', 'college', 'sweater']
431	and she was thrown out of school. 	И ее выперли оттуда. 	['И', 'ее', 'выперли', 'оттуда']	['and', 'she', 'was', 'thrown', 'out', 'of', 'school']
432	But that wasn't a bad thing, 	Но это было неплохо. 	['Но', 'это', 'было', 'неплохо']	"['But', 'that', ""wasn't"", 'a', 'bad', 'thing']"
433	because a man who owns a theater in Memphis, Tennessee, 	Потому что человек, который имел театр в Мемфисе, штат Теннесси. 	['Потому', 'что', 'человек', 'который', 'имел', 'театр', 'в', 'Мемфисе', 'штат', 'Теннесси']	['because', 'a', 'man', 'who', 'owns', 'a', 'theater', 'in', 'Memphis', 'Tennessee']
434	saw those photos and offered Jenny a job singing in a show. 	видел эти фотографии.. и предложил Дженни петь в одном из шоу. 	['видел', 'эти', 'фотографии', 'и', 'предложил', 'Дженни', 'петь', 'в', 'одном', 'из', 'шоу']	['saw', 'those', 'photos', 'and', 'offered', 'Jenny', 'a', 'job', 'singing', 'in', 'a', 'show']
435	The first chance I got, 	И при первой же возможности, 	['И', 'при', 'первой', 'же', 'возможности']	['The', 'first', 'chance', 'I', 'got']
436	I took the bus up to Memphis to see her perform in that show. 	я сел в автобус до Мемфиса, посмотреть на нее в шоу. 	['я', 'сел', 'в', 'автобус', 'до', 'Мемфиса', 'посмотреть', 'на', 'нее', 'в', 'шоу']	['I', 'took', 'the', 'bus', 'up', 'to', 'Memphis', 'to', 'see', 'her', 'perform', 'in', 'that', 'show']
437	That was Amber, Amber Flame. 	Это был Амбер, Амбер Флэйм. 	['Это', 'был', 'Амбер', 'Амбер', 'Флэйм']	['That', 'was', 'Amber', 'Amber', 'Flame']
438	Give her a big hand, guys. Good job, Amber. 	Встречаем большими аплодисментами. 	['Встречаем', 'большими', 'аплодисментами']	['Give', 'her', 'a', 'big', 'hand', 'guys', 'Good', 'job', 'Amber']
439	And now, for your listening and viewing pleasure, 	А теперь, для услаждения ваших глаз и ушей, 	['А', 'теперь', 'для', 'услаждения', 'ваших', 'глаз', 'и', 'ушей']	['And', 'now', 'for', 'your', 'listening', 'and', 'viewing', 'pleasure']
440	direct from Hollywood, California, our very own beatnik beauty, 	прямо из Голливуда, Калифорния, наша самая настоящая красотка. 	['прямо', 'из', 'Голливуда', 'Калифорния', 'наша', 'самая', 'настоящая', 'красотка']	['direct', 'from', 'Hollywood', 'California', 'our', 'very', 'own', 'beatnik', 'beauty']
441	let's give a big round of applause to the luscious Bobbi Dylan. -All right! -Bobbi! 	Давайте встретим аплодисментами сладчайшую Бобби Дилан. 	['Давайте', 'встретим', 'аплодисментами', 'сладчайшую', 'Бобби', 'Дилан']	"[""let's"", 'give', 'a', 'big', 'round', 'of', 'applause', 'to', 'the', 'luscious', 'Bobbi', 'Dylan', 'All', 'right', 'Bobbi']"
442	Her dream had come true. 	Ее мечта осуществилась. 	['Ее', 'мечта', 'осуществилась']	['Her', 'dream', 'had', 'come', 'true']
443	She was a folk singer. 	Она стала народной певицей. 	['Она', 'стала', 'народной', 'певицей']	['She', 'was', 'a', 'folk', 'singer']
444	Come on, baby. Shake it up. Shake it up, now. 	Ну давай потряси кое-чем... 	['Ну', 'давай', 'потряси', 'кое-чем']	['Come', 'on', 'baby', 'Shake', 'it', 'up', 'Shake', 'it', 'up', 'now']
445	Hey, buddy, get her a harmonica. 	Дайте кто-нибудь гармонь. 	['Дайте', 'кто-нибудь', 'гармонь']	['Hey', 'buddy', 'get', 'her', 'a', 'harmonica']
446	Hey, honey, this ain't Captain Kangaroo. 	Это тебе не капитан Кангару. 	['Это', 'тебе', 'не', 'капитан', 'Кангару']	"['Hey', 'honey', 'this', ""ain't"", 'Captain', 'Kangaroo']"
447	Hey, honey, I got something here for you. 	Эй, дорогая, у меня есть кое-что для тебя. 	['Эй', 'дорогая', 'у', 'меня', 'есть', 'кое-что', 'для', 'тебя']	['Hey', 'honey', 'I', 'got', 'something', 'here', 'for', 'you']
448	-God damn it! -Hey! Hey! Stupid jerk! 	Да черт с тобой!. Ты тупое ничтожество! 	['Да', 'черт', 'с', 'тобой', 'Ты', 'тупое', 'ничтожество']	['God', 'damn', 'it', 'Hey', 'Hey', 'Stupid', 'jerk']
449	I'm singing a song here. 	Я здесь песню пою. 	['Я', 'здесь', 'песню', 'пою']	"[""I'm"", 'singing', 'a', 'song', 'here']"
450	Polly, get out here! 	Полли, пошла отсюда. 	['Полли', 'пошла', 'отсюда']	['Polly', 'get', 'out', 'here']
451	-Shut up, there! -Don't be so shy, honey. 	Заткнись! 	['Заткнись']	"['Shut', 'up', 'there', ""Don't"", 'be', 'so', 'shy', 'honey']"
452	Oh, shut up! 	Заткнись!! 	['Заткнись']	['Oh', 'shut', 'up']
453	Forrest, what are you doing here? 	Форрест, что ты тут делаешь? 	['Форрест', 'что', 'ты', 'тут', 'делаешь']	['Forrest', 'what', 'are', 'you', 'doing', 'here']
454	-What are you doing? -Hey! 	Что ты делаешь? Эй! 	['Что', 'ты', 'делаешь', 'Эй']	['What', 'are', 'you', 'doing', 'Hey']
455	-Come on. -What are you doing? 	Что ты делаешь, Форрест? 	['Что', 'ты', 'делаешь', 'Форрест']	['Come', 'on', 'What', 'are', 'you', 'doing']
456	Forrest, let me down! 	Отпусти меня. 	['Отпусти', 'меня']	['Forrest', 'let', 'me', 'down']
457	You can't keep doing this, Forrest. 	Ха ха ха. Ты не можешь постоянно это делать, Форрест. 	['Ха', 'ха', 'ха', 'Ты', 'не', 'можешь', 'постоянно', 'это', 'делать', 'Форрест']	"['You', ""can't"", 'keep', 'doing', 'this', 'Forrest']"
458	You can't keep trying to rescue me all the time. 	Ты не можешь постоянно пытаться спасти меня. 	['Ты', 'не', 'можешь', 'постоянно', 'пытаться', 'спасти', 'меня']	"['You', ""can't"", 'keep', 'trying', 'to', 'rescue', 'me', 'all', 'the', 'time']"
459	-They was trying to grab you. -A lot of people try to grab me. 	Они хотели полапать тебя. Много людей пытается меня полапать. 	['Они', 'хотели', 'полапать', 'тебя', 'Много', 'людей', 'пытается', 'меня', 'полапать']	['They', 'was', 'trying', 'to', 'grab', 'you', 'A', 'lot', 'of', 'people', 'try', 'to', 'grab', 'me']
460	Just... You can't keep doing this all the time. 	Просто ты не можешь всегда это делать. 	['Просто', 'ты', 'не', 'можешь', 'всегда', 'это', 'делать']	"['Just', 'You', ""can't"", 'keep', 'doing', 'this', 'all', 'the', 'time']"
461	I can't help it. I love you. 	Ничего не могу с этим сделать. Я люблю тебя. 	['Ничего', 'не', 'могу', 'с', 'этим', 'сделать', 'Я', 'люблю', 'тебя']	"['I', ""can't"", 'help', 'it', 'I', 'love', 'you']"
462	Forrest, you don't know what love is. 	Форрест... Ты не знаешь, что такое любовь. 	['Форрест', 'Ты', 'не', 'знаешь', 'что', 'такое', 'любовь']	"['Forrest', 'you', ""don't"", 'know', 'what', 'love', 'is']"
463	You remember that time we prayed, Forrest? 	Ты помнишь, как мы с тобой молились, Форрест? 	['Ты', 'помнишь', 'как', 'мы', 'с', 'тобой', 'молились', 'Форрест']	['You', 'remember', 'that', 'time', 'we', 'prayed', 'Forrest']
464	We prayed for God to turn me into a bird so I could fly far, far away? 	Мы молили Бога, чтобы он обернул меня в птичку, так чтобы я могла улететь далеко-далеко. 	['Мы', 'молили', 'Бога', 'чтобы', 'он', 'обернул', 'меня', 'в', 'птичку', 'так', 'чтобы', 'я', 'могла', 'улететь', 'далеко-далеко']	['We', 'prayed', 'for', 'God', 'to', 'turn', 'me', 'into', 'a', 'bird', 'so', 'I', 'could', 'fly', 'far', 'far', 'away']
465	Yes, I do. 	Да, я помню. 	['Да', 'я', 'помню']	['Yes', 'I', 'do']
466	You think I could fly off this bridge? 	Как ты думаешь, я могу взлететь с этого моста? 	['Как', 'ты', 'думаешь', 'я', 'могу', 'взлететь', 'с', 'этого', 'моста']	['You', 'think', 'I', 'could', 'fly', 'off', 'this', 'bridge']
467	What do you mean, Jenny? 	Что ты имеешь ввиду, Дженни? 	['Что', 'ты', 'имеешь', 'ввиду', 'Дженни']	['What', 'do', 'you', 'mean', 'Jenny']
468	Nothing. 	Ничего. 	['Ничего']	['Nothing']
469	I gotta get out of here. 	Мне надо уехать отсюда. 	['Мне', 'надо', 'уехать', 'отсюда']	['I', 'gotta', 'get', 'out', 'of', 'here']
470	Wait, Jenny... 	Подожди, Дженни. 	['Подожди', 'Дженни']	['Wait', 'Jenny']
471	Forrest, you stay away from me, okay? You just stay away from me, please. 	Форрест, держись от меня подальше. ОК? Оставь меня в покое, пожалуйста. 	['Форрест', 'держись', 'от', 'меня', 'подальше', 'ОК', 'Оставь', 'меня', 'в', 'покое', 'пожалуйста']	['Forrest', 'you', 'stay', 'away', 'from', 'me', 'okay', 'You', 'just', 'stay', 'away', 'from', 'me', 'please']
472	Can I have a ride? -Where you going? -I don't care. 	Не подвезете? А куда тебе надо? Без разницы. 	['Не', 'подвезете', 'А', 'куда', 'тебе', 'надо', 'Без', 'разницы']	"['Can', 'I', 'have', 'a', 'ride', 'Where', 'you', 'going', 'I', ""don't"", 'care']"
473	Get in the truck. 	Садись. 	['Садись']	['Get', 'in', 'the', 'truck']
474	So, bye-bye, Jenny. 	Пока-пока, Дженни.. 	['Пока-пока', 'Дженни']	['So', 'bye-bye', 'Jenny']
475	They sending me to Vietnam. 	Меня отправляют во Вьетнам. 	['Меня', 'отправляют', 'во', 'Вьетнам']	['They', 'sending', 'me', 'to', 'Vietnam']
476	It's this whole other country. 	Это совершенно другая страна. 	['Это', 'совершенно', 'другая', 'страна']	"[""It's"", 'this', 'whole', 'other', 'country']"
477	Just hang on a minute. 	Подожди минутку.. 	['Подожди', 'минутку']	['Just', 'hang', 'on', 'a', 'minute']
478	Listen, you promise me something, okay? 	Послушай, пообещай мне одну вещь, хорошо? 	['Послушай', 'пообещай', 'мне', 'одну', 'вещь', 'хорошо']	['Listen', 'you', 'promise', 'me', 'something', 'okay']
479	Just, if you're ever in trouble, don't try to be brave. You just run, okay? Just run away. 	Если у тебя будут когда-нибудь неприятности, не будь храбрецом. Просто убегай.ОК? Просто убегай. 	['Если', 'у', 'тебя', 'будут', 'когда-нибудь', 'неприятности', 'не', 'будь', 'храбрецом', 'Просто', 'убегай.ОК', 'Просто', 'убегай']	"['Just', 'if', ""you're"", 'ever', 'in', 'trouble', ""don't"", 'try', 'to', 'be', 'brave', 'You', 'just', 'run', 'okay', 'Just', 'run', 'away']"
480	Okay. 	О.К. 	['О.К']	['Okay']
481	Jenny. 	Дженни. 	['Дженни']	['Jenny']
482	I'll write you all the time. 	Я буду писать тебе постоянно. 	['Я', 'буду', 'писать', 'тебе', 'постоянно']	"[""I'll"", 'write', 'you', 'all', 'the', 'time']"
483	And just like that, she was gone. 	Итак, она уехала. Итак, она уехала. 	['Итак', 'она', 'уехала', 'Итак', 'она', 'уехала']	['And', 'just', 'like', 'that', 'she', 'was', 'gone']
484	You come back safe to me, do you hear? 	Возвращайся целым и невредимым. Слышишь? 	['Возвращайся', 'целым', 'и', 'невредимым', 'Слышишь']	['You', 'come', 'back', 'safe', 'to', 'me', 'do', 'you', 'hear']
485	Now, they told us that Vietnam was gonna be very different 	Нам сказали, что Вьетнам очень отличается 	['Нам', 'сказали', 'что', 'Вьетнам', 'очень', 'отличается']	['Now', 'they', 'told', 'us', 'that', 'Vietnam', 'was', 'gonna', 'be', 'very', 'different']
486	from the United States of America. 	От США. 	['От', 'США']	['from', 'the', 'United', 'States', 'of', 'America']
487	And except for all the beer cans and the barbecue, it was. 	Не считая барбекю и пива, так оно и было. 	['Не', 'считая', 'барбекю', 'и', 'пива', 'так', 'оно', 'и', 'было']	['And', 'except', 'for', 'all', 'the', 'beer', 'cans', 'and', 'the', 'barbecue', 'it', 'was']
488	Hey, I bet there's shrimp all in these waters. 	Готов поспорить, в этой воде куча креветок. 	['Готов', 'поспорить', 'в', 'этой', 'воде', 'куча', 'креветок']	"['Hey', 'I', 'bet', ""there's"", 'shrimp', 'all', 'in', 'these', 'waters']"
489	They tell me these Vietnams is good shrimpers. 	Говорят, что вьетнамские креветки очень хорошие. 	['Говорят', 'что', 'вьетнамские', 'креветки', 'очень', 'хорошие']	['They', 'tell', 'me', 'these', 'Vietnams', 'is', 'good', 'shrimpers']
