	en	ru	ru_tokens	en_tokens
218	Yo, can you guys talk about this later? Now pull my ass up! 	Эй,вы можете поговорить об этом позже? Затащи меня! 	['Эй,вы', 'можете', 'поговорить', 'об', 'этом', 'позже', 'Затащи', 'меня']	['Yo', 'can', 'you', 'guys', 'talk', 'about', 'this', 'later', 'Now', 'pull', 'my', 'ass', 'up']
219	She was running for this guy, Braga, and things went bad. 	Она возила товар для этого парня, Брага, и он её убрал. 	['Она', 'возила', 'товар', 'для', 'этого', 'парня', 'Брага', 'и', 'он', 'её', 'убрал']	['She', 'was', 'running', 'for', 'this', 'guy', 'Braga', 'and', 'things', 'went', 'bad']
220	Please! 	Пожалуйста! 	['Пожалуйста']	['Please']
221	I'm going to get these guys, Dom. 	Я возьму этих ребят, Дом. 	['Я', 'возьму', 'этих', 'ребят', 'Дом']	"[""I'm"", 'going', 'to', 'get', 'these', 'guys', 'Dom']"
222	Now let me do my job and bring him up. 	Но не мешай мне выполнять работу и подними его. 	['Но', 'не', 'мешай', 'мне', 'выполнять', 'работу', 'и', 'подними', 'его']	['Now', 'let', 'me', 'do', 'my', 'job', 'and', 'bring', 'him', 'up']
223	I'm going to kill this Braga. 	Я уничтожу Брага. 	['Я', 'уничтожу', 'Брага']	"[""I'm"", 'going', 'to', 'kill', 'this', 'Braga']"
224	God! 	Боже! 	['Боже']	['God']
225	And anyone else who gets in my way. 	И всех, кто станет у меня на пути. 	['И', 'всех', 'кто', 'станет', 'у', 'меня', 'на', 'пути']	['And', 'anyone', 'else', 'who', 'gets', 'in', 'my', 'way']
226	Hey! 	Эй! 	['Эй']	['Hey']
227	Don't let go. 	Не отпускай. 	['Не', 'отпускай']	"[""Don't"", 'let', 'go']"
228	O'Conner! 	О'Коннер! 	"[""О'Коннер""]"	"[""O'Conner""]"
229	O'Conner! If you ever release a witness of mine again... 	О'Коннер! Если ты еще раз отпустишь моего свидетеля... 	"[""О'Коннер"", 'Если', 'ты', 'еще', 'раз', 'отпустишь', 'моего', 'свидетеля']"	"[""O'Conner"", 'If', 'you', 'ever', 'release', 'a', 'witness', 'of', 'mine', 'again']"
230	That's enough! - Don't touch me. 	Хватит! Не трогай меня. 	['Хватит', 'Не', 'трогай', 'меня']	"[""That's"", 'enough', ""Don't"", 'touch', 'me']"
231	I'm fine! - That's enough. 	Я в порядке! Уймитесь. 	['Я', 'в', 'порядке', 'Уймитесь']	"[""I'm"", 'fine', ""That's"", 'enough']"
232	You're through, O'Conner! I said that's enough! 	Тебе конец, О'Коннер! Я сказал хватит! 	"['Тебе', 'конец', ""О'Коннер"", 'Я', 'сказал', 'хватит']"	"[""You're"", 'through', ""O'Conner"", 'I', 'said', ""that's"", 'enough']"
233	Stasiak, go get yourself cleaned up. 	Стасиак, иди умойся. 	['Стасиак', 'иди', 'умойся']	['Stasiak', 'go', 'get', 'yourself', 'cleaned', 'up']
234	What? He hit me first! You... 	Что? Он первый меня ударил! Ты... 	['Что', 'Он', 'первый', 'меня', 'ударил', 'Ты']	['What', 'He', 'hit', 'me', 'first', 'You']
235	This isn't the Cub Scouts! 	Это не клуб скаутов! 	['Это', 'не', 'клуб', 'скаутов']	"['This', ""isn't"", 'the', 'Cub', 'Scouts']"
236	Now, go on! You're bleeding on my floor. 	Всё, ступай! Ты пачкаешь мой пол. 	['Всё', 'ступай', 'Ты', 'пачкаешь', 'мой', 'пол']	"['Now', 'go', 'on', ""You're"", 'bleeding', 'on', 'my', 'floor']"
237	O'Conner, do you know the difference between a cop and a criminal? 	О'Коннер, ты знаешь, что отделяет копа от преступника? 	"[""О'Коннер"", 'ты', 'знаешь', 'что', 'отделяет', 'копа', 'от', 'преступника']"	"[""O'Conner"", 'do', 'you', 'know', 'the', 'difference', 'between', 'a', 'cop', 'and', 'a', 'criminal']"
238	What? One bad judgment call. 	Что? Одно неверное решение. 	['Что', 'Одно', 'неверное', 'решение']	['What', 'One', 'bad', 'judgment', 'call']
239	Keep your shit in line, son. 	Держи себя в руках, сынок. 	['Держи', 'себя', 'в', 'руках', 'сынок']	['Keep', 'your', 'shit', 'in', 'line', 'son']
240	Have a good time. 	Развлекайтесь. 	['Развлекайтесь']	['Have', 'a', 'good', 'time']
241	Take a seat. 	Садись. 	['Садись']	['Take', 'a', 'seat']
242	Good news. We have intel that Braga's number 2, Ramon Campos, 	Отличные новости. За нашими данными правая рука Браги - Рамон Кампос, 	['Отличные', 'новости', 'За', 'нашими', 'данными', 'правая', 'рука', 'Браги', 'Рамон', 'Кампос']	"['Good', 'news', 'We', 'have', 'intel', 'that', ""Braga's"", 'number', '2', 'Ramon', 'Campos']"
243	will hold a street race in Koreatown tomorrow night 	завтра ночью устроит уличную гонку в Корейском квартале, 	['завтра', 'ночью', 'устроит', 'уличную', 'гонку', 'в', 'Корейском', 'квартале']	['will', 'hold', 'a', 'street', 'race', 'in', 'Koreatown', 'tomorrow', 'night']
244	to fill a slot on his team. 	чтобы пополнить ряды курьеров. 	['чтобы', 'пополнить', 'ряды', 'курьеров']	['to', 'fill', 'a', 'slot', 'on', 'his', 'team']
245	They've already chosen 3 drivers from previous races. 	Он уже выбрал трёх гонщиков с предидущих гонок. 	['Он', 'уже', 'выбрал', 'трёх', 'гонщиков', 'с', 'предидущих', 'гонок']	"[""They've"", 'already', 'chosen', '3', 'drivers', 'from', 'previous', 'races']"
246	Our newest informant, Mr. David Park, 	Наш новый информатор, Мр. Дэвид Парк, 	['Наш', 'новый', 'информатор', 'Мр', 'Дэвид', 'Парк']	['Our', 'newest', 'informant', 'Mr', 'David', 'Park']
247	has been kind enough to get us into the race. 	любезно добавил нас в гонку . 	['любезно', 'добавил', 'нас', 'в', 'гонку']	['has', 'been', 'kind', 'enough', 'to', 'get', 'us', 'into', 'the', 'race']
248	O'Conner, you're up. 	О'Коннер, вперёд. 	"[""О'Коннер"", 'вперёд']"	"[""O'Conner"", ""you're"", 'up']"
249	Let me guess, winner gets the slot. 	Дайте угадать, победитель получает место. 	['Дайте', 'угадать', 'победитель', 'получает', 'место']	['Let', 'me', 'guess', 'winner', 'gets', 'the', 'slot']
250	All right, so these are all the imports the city has in impound. 	Хорошо, это все конфискованные городом иномарки. 	['Хорошо', 'это', 'все', 'конфискованные', 'городом', 'иномарки']	['All', 'right', 'so', 'these', 'are', 'all', 'the', 'imports', 'the', 'city', 'has', 'in', 'impound']
251	Okay, nice. Pick your poison. 	Хорошо, отлично. Выбирай свой яд. 	['Хорошо', 'отлично', 'Выбирай', 'свой', 'яд']	['Okay', 'nice', 'Pick', 'your', 'poison']
252	All right, 2206. I crashed one of those. 	Хорошо, 2206. однажды я такую разбил. 	['Хорошо', '2206', 'однажды', 'я', 'такую', 'разбил']	['All', 'right', '2206', 'I', 'crashed', 'one', 'of', 'those']
253	3418 and 2765. 	3418 и 2765. 	['3418', 'и', '2765']	['3418', 'and', '2765']
254	Okay, so which one do you want? 	Хорошо, какую ты хочешь? 	['Хорошо', 'какую', 'ты', 'хочешь']	['Okay', 'so', 'which', 'one', 'do', 'you', 'want']
255	I want them all. 	Я хочу все. 	['Я', 'хочу', 'все']	['I', 'want', 'them', 'all']
256	Standard issue tracking device. 	Стандартный маячек системы слижения. 	['Стандартный', 'маячек', 'системы', 'слижения']	['Standard', 'issue', 'tracking', 'device']
257	Boss wants to know where you are at all times. 	Босс хочет знать, где ты находишься всё время. 	['Босс', 'хочет', 'знать', 'где', 'ты', 'находишься', 'всё', 'время']	['Boss', 'wants', 'to', 'know', 'where', 'you', 'are', 'at', 'all', 'times']
258	You want to play with it? 	Ты хочешь поиграть с этим? 	['Ты', 'хочешь', 'поиграть', 'с', 'этим']	['You', 'want', 'to', 'play', 'with', 'it']
259	Hey! 	Эй! 	['Эй']	['Hey']
260	What are you looking at, nutsack? 	Чего уставился, недоносок? 	['Чего', 'уставился', 'недоносок']	['What', 'are', 'you', 'looking', 'at', 'nutsack']
261	I don't know. You tell me. 	Я не знаю. Ты скажи мне. 	['Я', 'не', 'знаю', 'Ты', 'скажи', 'мне']	"['I', ""don't"", 'know', 'You', 'tell', 'me']"
262	The racer wants what Dwight's got. 	Гонщик хочет то, что есть у Двайта. 	['Гонщик', 'хочет', 'то', 'что', 'есть', 'у', 'Двайта']	"['The', 'racer', 'wants', 'what', ""Dwight's"", 'got']"
263	See, but, ladies, Dwight's already on the team. 	Только вот, леди, Двайт уже в команде. 	['Только', 'вот', 'леди', 'Двайт', 'уже', 'в', 'команде']	"['See', 'but', 'ladies', ""Dwight's"", 'already', 'on', 'the', 'team']"
264	You got to be fast if you want to drive for Braga. 	Ты должен быть быстрым, если ты хочешь рулить для Брага. 	['Ты', 'должен', 'быть', 'быстрым', 'если', 'ты', 'хочешь', 'рулить', 'для', 'Брага']	['You', 'got', 'to', 'be', 'fast', 'if', 'you', 'want', 'to', 'drive', 'for', 'Braga']
265	Is there a problem here? No. 	Здесь есть какие-то проблемы? Нет. 	['Здесь', 'есть', 'какие-то', 'проблемы', 'Нет']	['Is', 'there', 'a', 'problem', 'here', 'No']
266	You one of Park's guys, blondie? 	Ты один из Парковых парней, блондинчек? 	['Ты', 'один', 'из', 'Парковых', 'парней', 'блондинчек']	"['You', 'one', 'of', ""Park's"", 'guys', 'blondie']"
267	Yeah. Yeah, I am. 	Да. Да, это я. 	['Да', 'Да', 'это', 'я']	['Yeah', 'Yeah', 'I', 'am']
268	Follow me. 	Следуй за мной. 	['Следуй', 'за', 'мной']	['Follow', 'me']
269	See you later, punk. 	Увидимся позже, панк. 	['Увидимся', 'позже', 'панк']	['See', 'you', 'later', 'punk']
270	You, too, punk. 	С тобой тоже, панк. 	['С', 'тобой', 'тоже', 'панк']	['You', 'too', 'punk']
271	Bull's-eye, coсo, come on! 	Да не парся ты, чёрт возьми! 	['Да', 'не', 'парся', 'ты', 'чёрт', 'возьми']	"[""Bull's-eye"", 'coсo', 'come', 'on']"
272	We can do this all day. 	Мы можем делать это целый день. 	['Мы', 'можем', 'делать', 'это', 'целый', 'день']	['We', 'can', 'do', 'this', 'all', 'day']
273	You all know why you're here. 	Все вы знаете, почему вы здесь. 	['Все', 'вы', 'знаете', 'почему', 'вы', 'здесь']	"['You', 'all', 'know', 'why', ""you're"", 'here']"
274	Good drivers 	Хороших водил 	['Хороших', 'водил']	['Good', 'drivers']
275	are a dime a dozen. 	по медяку за дюжину. 	['по', 'медяку', 'за', 'дюжину']	['are', 'a', 'dime', 'a', 'dozen']
276	Man, every corner's got a chingadera tuner racing for pinks. 	И на каждом углу толкают навороченные тачки для пижонов. 	['И', 'на', 'каждом', 'углу', 'толкают', 'навороченные', 'тачки', 'для', 'пижонов']	"['Man', 'every', ""corner's"", 'got', 'a', 'chingadera', 'tuner', 'racing', 'for', 'pinks']"
277	That's not what Braga has got me looking for. 	Но, я для Браги не таких ищу. 	['Но', 'я', 'для', 'Браги', 'не', 'таких', 'ищу']	"[""That's"", 'not', 'what', 'Braga', 'has', 'got', 'me', 'looking', 'for']"
278	Braga wants someone that would sell their abuelita to be behind the wheel. 	Брага нужны те, кто продаст даже родную бабулю, лишь бы покрутить баранку. 	['Брага', 'нужны', 'те', 'кто', 'продаст', 'даже', 'родную', 'бабулю', 'лишь', 'бы', 'покрутить', 'баранку']	['Braga', 'wants', 'someone', 'that', 'would', 'sell', 'their', 'abuelita', 'to', 'be', 'behind', 'the', 'wheel']
279	Someone that drives their 10-second cars not in a straight line, 	Те, кто готовы водить свои десяти секундные тачки не только на прямой, 	['Те', 'кто', 'готовы', 'водить', 'свои', 'десяти', 'секундные', 'тачки', 'не', 'только', 'на', 'прямой']	['Someone', 'that', 'drives', 'their', '10-second', 'cars', 'not', 'in', 'a', 'straight', 'line']
280	but to push it and make it through places no one else would take it. 	но рвануть туда, где слабаки пасуют. 	['но', 'рвануть', 'туда', 'где', 'слабаки', 'пасуют']	['but', 'to', 'push', 'it', 'and', 'make', 'it', 'through', 'places', 'no', 'one', 'else', 'would', 'take', 'it']
281	Real drivers. 	Реальные водилы. 	['Реальные', 'водилы']	['Real', 'drivers']
282	So, what are we hauling? 	Итак, что мы перевозим? 	['Итак', 'что', 'мы', 'перевозим']	['So', 'what', 'are', 'we', 'hauling']
283	For the money Braga's paying, you don't need to know. 	За те деньги, которые платит Брага, тебе не обязательно это знать. 	['За', 'те', 'деньги', 'которые', 'платит', 'Брага', 'тебе', 'не', 'обязательно', 'это', 'знать']	"['For', 'the', 'money', ""Braga's"", 'paying', 'you', ""don't"", 'need', 'to', 'know']"
284	You just said you wanted real drivers. 	Ты просто сказал, что тебе нужны реальные водилы. 	['Ты', 'просто', 'сказал', 'что', 'тебе', 'нужны', 'реальные', 'водилы']	['You', 'just', 'said', 'you', 'wanted', 'real', 'drivers']
285	A real driver knows exactly what's in his car. 	Реальный водила обязан знать, что в его тачке. 	['Реальный', 'водила', 'обязан', 'знать', 'что', 'в', 'его', 'тачке']	"['A', 'real', 'driver', 'knows', 'exactly', ""what's"", 'in', 'his', 'car']"
286	Mira, real driver, 	Псолушай, реальный водила, 	['Псолушай', 'реальный', 'водила']	['Mira', 'real', 'driver']
287	nobody's forcing you to race. 	никто тебя не заставляет ехать. 	['никто', 'тебя', 'не', 'заставляет', 'ехать']	"[""nobody's"", 'forcing', 'you', 'to', 'race']"
288	You the boss? 	Ты босс? 	['Ты', 'босс']	['You', 'the', 'boss']
289	Or am I talking to the boss? 	Или я говорю с боссом? 	['Или', 'я', 'говорю', 'с', 'боссом']	['Or', 'am', 'I', 'talking', 'to', 'the', 'boss']
290	Do I look like a boss? 	Я что похож на босса? 	['Я', 'что', 'похож', 'на', 'босса']	['Do', 'I', 'look', 'like', 'a', 'boss']
291	My job is to find the best drivers, period. 	Моё дело найти лучших водил, не больше. 	['Моё', 'дело', 'найти', 'лучших', 'водил', 'не', 'больше']	['My', 'job', 'is', 'to', 'find', 'the', 'best', 'drivers', 'period']
292	Whoever wins the race gets the info. We cool? 	Кто выиграет гонки, получит информацию. Устраивает? 	['Кто', 'выиграет', 'гонки', 'получит', 'информацию', 'Устраивает']	['Whoever', 'wins', 'the', 'race', 'gets', 'the', 'info', 'We', 'cool']
293	Are we cool? 	Устраивает? 	['Устраивает']	['Are', 'we', 'cool']
294	Yeah, we're cool. 	Да, устраивает. 	['Да', 'устраивает']	"['Yeah', ""we're"", 'cool']"
295	No, we ain't cool, man. 	Нет, не устраивает, мужик. 	['Нет', 'не', 'устраивает', 'мужик']	"['No', 'we', ""ain't"", 'cool', 'man']"
296	Who's closing these streets? 	Кто перекроет эти улицы? 	['Кто', 'перекроет', 'эти', 'улицы']	"[""Who's"", 'closing', 'these', 'streets']"
297	No one. That's the point. 	Никто. В этом фишка. 	['Никто', 'В', 'этом', 'фишка']	"['No', 'one', ""That's"", 'the', 'point']"
298	Please wait while directions are downloaded. 	Пожалуйста, ждите загрузки инструкции. 	['Пожалуйста', 'ждите', 'загрузки', 'инструкции']	['Please', 'wait', 'while', 'directions', 'are', 'downloaded']
299	Proceed to the highlighted route. 	Следуйте по указанному маршруту. 	['Следуйте', 'по', 'указанному', 'маршруту']	['Proceed', 'to', 'the', 'highlighted', 'route']
300	10, 	Десять, 	['Десять']	['10']
301	9, 	девять, 	['девять']	['9']
302	8, 	восемь, 	['восемь']	['8']
303	7, 	семь, 	['семь']	['7']
304	6... 	шесть... 	['шесть']	['6']
305	You sure you want to do this? - A lot has changed. 	Уверен, что хочешь сделать это? Многое изменилось. 	['Уверен', 'что', 'хочешь', 'сделать', 'это', 'Многое', 'изменилось']	['You', 'sure', 'you', 'want', 'to', 'do', 'this', 'A', 'lot', 'has', 'changed']
306	4... You' re right. 	...четыре... Ты прав. 	['четыре', 'Ты', 'прав']	"['4', ""You'"", 're', 'right']"
307	3, 	...три, 	['три']	['3']
308	2, 	два, 	['два']	['2']
309	1, 	один, 	['один']	['1']
310	Go! 	старт! 	['старт']	['Go']
311	Right turn ahead. 	Впереди поворот на право. 	['Впереди', 'поворот', 'на', 'право']	['Right', 'turn', 'ahead']
312	You are now 5 miles from your destination. 	Вы сейчас в 5 милях от места назначения. 	['Вы', 'сейчас', 'в', '5', 'милях', 'от', 'места', 'назначения']	['You', 'are', 'now', '5', 'miles', 'from', 'your', 'destination']
313	How's my ass look, Chia Pet? 	Как тебе моя жопа, чурка? 	['Как', 'тебе', 'моя', 'жопа', 'чурка']	"[""How's"", 'my', 'ass', 'look', 'Chia', 'Pet']"
314	Ghetto Smurf. 	Смёрф из Гетто. 	['Смёрф', 'из', 'Гетто']	['Ghetto', 'Smurf']
315	Dead man driving. 	Езда мертвеца. 	['Езда', 'мертвеца']	['Dead', 'man', 'driving']
316	Come on! 	Давай! 	['Давай']	['Come', 'on']
317	Right turn ahead. 	Впереди поворот на право. 	['Впереди', 'поворот', 'на', 'право']	['Right', 'turn', 'ahead']
318	Shit! 	Дерьмо! 	['Дерьмо']	['Shit']
319	Damn. 	Чёрт. 	['Чёрт']	['Damn']
320	Rerouting. Rerouting. 	Вернитесь на маршрут. 	['Вернитесь', 'на', 'маршрут']	['Rerouting', 'Rerouting']
321	Proceed straight ahead. 	Продолжайте ехать прямо. 	['Продолжайте', 'ехать', 'прямо']	['Proceed', 'straight', 'ahead']
322	Rerouting. 	Вернитесь на маршрут. 	['Вернитесь', 'на', 'маршрут']	['Rerouting']
323	Shit. 	Дерьмо. 	['Дерьмо']	['Shit']
324	Rerouting. Just shut up! 	Вернитесь на маршрут. Заткнись! 	['Вернитесь', 'на', 'маршрут', 'Заткнись']	['Rerouting', 'Just', 'shut', 'up']
325	You are 2. 6 miles from destination. 	Вы в 2.6 милях от места назначения. 	['Вы', 'в', '2.6', 'милях', 'от', 'места', 'назначения']	['You', 'are', '2', '6', 'miles', 'from', 'destination']
326	Oops, I didn't see you. 	Ой, я тебя не заметил. 	['Ой', 'я', 'тебя', 'не', 'заметил']	"['Oops', 'I', ""didn't"", 'see', 'you']"
327	You are now 4 and one-half miles from your destination. 	Вы сейчас в 4.5 милях от места назначения. 	['Вы', 'сейчас', 'в', '4.5', 'милях', 'от', 'места', 'назначения']	['You', 'are', 'now', '4', 'and', 'one-half', 'miles', 'from', 'your', 'destination']
328	U-turn, if possible. Are you kidding me? 	Развернитесь, если возможно. Ты надо мной издеваешься? 	['Развернитесь', 'если', 'возможно', 'Ты', 'надо', 'мной', 'издеваешься']	['U-turn', 'if', 'possible', 'Are', 'you', 'kidding', 'me']
329	You are now 4. 2 miles from your destination. 	Вы сейчас в 4.2 милях от места назначения. 	['Вы', 'сейчас', 'в', '4.2', 'милях', 'от', 'места', 'назначения']	['You', 'are', 'now', '4', '2', 'miles', 'from', 'your', 'destination']
330	Sorry, car. 	Прости, машинка. 	['Прости', 'машинка']	['Sorry', 'car']
331	You are now one mile from your destination. 	Вы сейчас в 1 мили от места назначения. 	['Вы', 'сейчас', 'в', '1', 'мили', 'от', 'места', 'назначения']	['You', 'are', 'now', 'one', 'mile', 'from', 'your', 'destination']
332	Yeah, guess who's back, Dom? 	Да, угадай, кто вернулся, Дом? 	['Да', 'угадай', 'кто', 'вернулся', 'Дом']	"['Yeah', 'guess', ""who's"", 'back', 'Dom']"
333	Let's go! 	Давай! 	['Давай']	"[""Let's"", 'go']"
334	Nice car, baby! 	Хорошая тачка, детка! 	['Хорошая', 'тачка', 'детка']	['Nice', 'car', 'baby']
335	Bitch! 	Сука! 	['Сука']	['Bitch']
336	You are now one-quarter mile from your destination. 	Вы сейчас в четверти мили от места назначения.. 	['Вы', 'сейчас', 'в', 'четверти', 'мили', 'от', 'места', 'назначения']	['You', 'are', 'now', 'one-quarter', 'mile', 'from', 'your', 'destination']
337	Too early, Dom. 	Слишком рано, Дом. 	['Слишком', 'рано', 'Дом']	['Too', 'early', 'Dom']
338	No! 	Нет! 	['Нет']	['No']
339	Still a buster. 	Рулить научись. 	['Рулить', 'научись']	['Still', 'a', 'buster']
340	You have reached your destination. Goodbye. 	Вы добрались до места назначения. До свидания. 	['Вы', 'добрались', 'до', 'места', 'назначения', 'До', 'свидания']	['You', 'have', 'reached', 'your', 'destination', 'Goodbye']
341	At least we know you can't beat me straight up. 	Теперь мы знаем, что ты не можешь выиграть у меня по честному. 	['Теперь', 'мы', 'знаем', 'что', 'ты', 'не', 'можешь', 'выиграть', 'у', 'меня', 'по', 'честному']	"['At', 'least', 'we', 'know', 'you', ""can't"", 'beat', 'me', 'straight', 'up']"
342	I didn't know there were any rules. 	Я не знал, что у нас были какие-то правила. 	['Я', 'не', 'знал', 'что', 'у', 'нас', 'были', 'какие-то', 'правила']	"['I', ""didn't"", 'know', 'there', 'were', 'any', 'rules']"
343	Now that's what I call real driving. 	Это то, что я называю настоящей ездой. 	['Это', 'то', 'что', 'я', 'называю', 'настоящей', 'ездой']	"['Now', ""that's"", 'what', 'I', 'call', 'real', 'driving']"
344	No, that's bullshit, man! 	Нет, это всё собачье дерьмо, мужик! 	['Нет', 'это', 'всё', 'собачье', 'дерьмо', 'мужик']	"['No', ""that's"", 'bullshit', 'man']"
345	Go cry to your mama, eh? 	Иди поплачься маме, хорошо? 	['Иди', 'поплачься', 'маме', 'хорошо']	['Go', 'cry', 'to', 'your', 'mama', 'eh']
346	You work for Braga now. 	Теперь ты работаешь на Брага. 	['Теперь', 'ты', 'работаешь', 'на', 'Брага']	['You', 'work', 'for', 'Braga', 'now']
347	When the GPS calls, you follow. 	По сигналу GPS, выезжай. 	['По', 'сигналу', 'GPS', 'выезжай']	['When', 'the', 'GPS', 'calls', 'you', 'follow']
348	Driver's license. 	Водительские права. 	['Водительские', 'права']	"[""Driver's"", 'license']"
349	What driver's license? 	Какие водительские права? 	['Какие', 'водительские', 'права']	"['What', ""driver's"", 'license']"
350	Thumb. 	Палец. 	['Палец']	['Thumb']
351	Cell phone number. 	Номер мобильного. 	['Номер', 'мобильного']	['Cell', 'phone', 'number']
