	en	ru	ru_tokens	en_tokens
996	I'm sorry I ruined your New Year's Eve party, Lieutenant Dan. 	Простите, что вашу Новогоднюю вечеринку, лейтенант Дэн. 	['Простите', 'что', 'вашу', 'Новогоднюю', 'вечеринку', 'лейтенант', 'Дэн']	"[""I'm"", 'sorry', 'I', 'ruined', 'your', 'New', ""Year's"", 'Eve', 'party', 'Lieutenant', 'Dan']"
997	She tasted like cigarettes. 	Она на вкус была как сигарета. 	['Она', 'на', 'вкус', 'была', 'как', 'сигарета']	['She', 'tasted', 'like', 'cigarettes']
998	I guess Lieutenant Dan figured there's some things you just can't change. 	Думаю, лейтенант Дэн понял, что некоторые вещи нельзя изменить. 	['Думаю', 'лейтенант', 'Дэн', 'понял', 'что', 'некоторые', 'вещи', 'нельзя', 'изменить']	"['I', 'guess', 'Lieutenant', 'Dan', 'figured', ""there's"", 'some', 'things', 'you', 'just', ""can't"", 'change']"
999	He didn't want to be called crippled, just like I didn't want to be called stupid. 	Он не хотел, чтобы его называли калекой, также как и я не хотел, чтобы меня называли дураком. 	['Он', 'не', 'хотел', 'чтобы', 'его', 'называли', 'калекой', 'также', 'как', 'и', 'я', 'не', 'хотел', 'чтобы', 'меня', 'называли', 'дураком']	"['He', ""didn't"", 'want', 'to', 'be', 'called', 'crippled', 'just', 'like', 'I', ""didn't"", 'want', 'to', 'be', 'called', 'stupid']"
1000	Happy New Year, Gump. 	С новым Годом, Гамп. 	['С', 'новым', 'Годом', 'Гамп']	['Happy', 'New', 'Year', 'Gump']
1001	The US Ping-Pong team 	Команда США по пинг-понгу 	['Команда', 'США', 'по', 'пинг-понгу']	['The', 'US', 'Ping-Pong', 'team']
1002	met with President Nixon today at an Oval Office ceremony... 	встретилась сегодня с президентом Никсоном... 	['встретилась', 'сегодня', 'с', 'президентом', 'Никсоном']	['met', 'with', 'President', 'Nixon', 'today', 'at', 'an', 'Oval', 'Office', 'ceremony']
1003	And wouldn't you know it? A few months later, 	Тебе интересно? Через несколько месяцев, 	['Тебе', 'интересно', 'Через', 'несколько', 'месяцев']	"['And', ""wouldn't"", 'you', 'know', 'it', 'A', 'few', 'months', 'later']"
1004	they invited me and the Ping-Pong team to visit the White House. 	меня и команду по пинг-понгу пригласили в Белый Дом. 	['меня', 'и', 'команду', 'по', 'пинг-понгу', 'пригласили', 'в', 'Белый', 'Дом']	['they', 'invited', 'me', 'and', 'the', 'Ping-Pong', 'team', 'to', 'visit', 'the', 'White', 'House']
1005	So, I went, again. 	И я пошел... снова. 	['И', 'я', 'пошел', 'снова']	['So', 'I', 'went', 'again']
1006	And I met the President of the United States, again. 	И я снова встретился с президентом Америки. 	['И', 'я', 'снова', 'встретился', 'с', 'президентом', 'Америки']	['And', 'I', 'met', 'the', 'President', 'of', 'the', 'United', 'States', 'again']
1007	Only, this time, they didn't get us rooms in a real fancy hotel. 	Только в этот раз нас не повели в комнату в шикарном отеле. 	['Только', 'в', 'этот', 'раз', 'нас', 'не', 'повели', 'в', 'комнату', 'в', 'шикарном', 'отеле']	"['Only', 'this', 'time', 'they', ""didn't"", 'get', 'us', 'rooms', 'in', 'a', 'real', 'fancy', 'hotel']"
1008	So, are you enjoying yourself in our nation's capital, young man? 	Тебе нравится проводить время в столице нашей страны, молодой человек? 	['Тебе', 'нравится', 'проводить', 'время', 'в', 'столице', 'нашей', 'страны', 'молодой', 'человек']	"['So', 'are', 'you', 'enjoying', 'yourself', 'in', 'our', ""nation's"", 'capital', 'young', 'man']"
1009	-Yes, sir. -Well, where are you staying? 	Где вы остановились? 	['Где', 'вы', 'остановились']	['Yes', 'sir', 'Well', 'where', 'are', 'you', 'staying']
1010	-It's called the Hotel Ebbott. -Oh, no, no, no, no. I know of a much nicer hotel. It's brand-new, very modern. 	Отель Эббот. Нет, нет, нет. Я знаю много отелей, которые намного лучше. Совершенно новые. Очень современные. 	['Отель', 'Эббот', 'Нет', 'нет', 'нет', 'Я', 'знаю', 'много', 'отелей', 'которые', 'намного', 'лучше', 'Совершенно', 'новые', 'Очень', 'современные']	"[""It's"", 'called', 'the', 'Hotel', 'Ebbott', 'Oh', 'no', 'no', 'no', 'no', 'I', 'know', 'of', 'a', 'much', 'nicer', 'hotel', ""It's"", 'brand-new', 'very', 'modern']"
1011	I'll have my people take care of it for you. 	Я скажу своим людям, чтобы вас перевезли. 	['Я', 'скажу', 'своим', 'людям', 'чтобы', 'вас', 'перевезли']	"[""I'll"", 'have', 'my', 'people', 'take', 'care', 'of', 'it', 'for', 'you']"
1012	Security, Frank Wills. 	Охрана. 	['Охрана']	['Security', 'Frank', 'Wills']
1013	Yeah, sir, you might want to send a maintenance man 	Да, сэр. Не могли бы Вы прислать кого-нибудь из группы технического сервиса 	['Да', 'сэр', 'Не', 'могли', 'бы', 'Вы', 'прислать', 'кого-нибудь', 'из', 'группы', 'технического', 'сервиса']	['Yeah', 'sir', 'you', 'might', 'want', 'to', 'send', 'a', 'maintenance', 'man']
1014	over to that office across the way. 	в офис через дорогу. 	['в', 'офис', 'через', 'дорогу']	['over', 'to', 'that', 'office', 'across', 'the', 'way']
1015	The lights are off, and they must be looking for a fuse box or something, 	Там света нет. Пусть они посмотрят пробки, 	['Там', 'света', 'нет', 'Пусть', 'они', 'посмотрят', 'пробки']	['The', 'lights', 'are', 'off', 'and', 'they', 'must', 'be', 'looking', 'for', 'a', 'fuse', 'box', 'or', 'something']
1016	'cause them flashlights, they're keeping me awake. 	потому что они постоянно ходят с фонариками, и я заснуть не могу. 	['потому', 'что', 'они', 'постоянно', 'ходят', 'с', 'фонариками', 'и', 'я', 'заснуть', 'не', 'могу']	"[""'cause"", 'them', 'flashlights', ""they're"", 'keeping', 'me', 'awake']"
1017	Okay, sir. I'll check it out. 	Да, сэр. Я проверю. 	['Да', 'сэр', 'Я', 'проверю']	"['Okay', 'sir', ""I'll"", 'check', 'it', 'out']"
1018	-Thank you. -No problem. -Good night. -Good night. 	Спасибо. Спокойной ночи. 	['Спасибо', 'Спокойной', 'ночи']	['Thank', 'you', 'No', 'problem', 'Good', 'night', 'Good', 'night']
1019	Therefore, I shall resign the presidency effective at noon tomorrow. 	Поэтому... Решение о моем уходе с президентского поста вступит в силу завтра в полдень. 	['Поэтому', 'Решение', 'о', 'моем', 'уходе', 'с', 'президентского', 'поста', 'вступит', 'в', 'силу', 'завтра', 'в', 'полдень']	['Therefore', 'I', 'shall', 'resign', 'the', 'presidency', 'effective', 'at', 'noon', 'tomorrow']
1020	Vice President Ford 	Вице-президент Форд 	['Вице-президент', 'Форд']	['Vice', 'President', 'Ford']
1021	will be sworn in as president at that hour in this office. 	будет объявлен президентом в этот же час в этом офисе. 	['будет', 'объявлен', 'президентом', 'в', 'этот', 'же', 'час', 'в', 'этом', 'офисе']	['will', 'be', 'sworn', 'in', 'as', 'president', 'at', 'that', 'hour', 'in', 'this', 'office']
1022	As I recall the high hopes for America with which we began this second term... Sergeant Gump. 	Форрест Гамп. 	['Форрест', 'Гамп']	['As', 'I', 'recall', 'the', 'high', 'hopes', 'for', 'America', 'with', 'which', 'we', 'began', 'this', 'second', 'term', 'Sergeant', 'Gump']
1023	-Yes, sir! -As you were. 	Да, сэр! Вольно. 	['Да', 'сэр', 'Вольно']	['Yes', 'sir', 'As', 'you', 'were']
1024	I have your discharge papers. Your service is up, son. 	Это бумага о твоей демобилизации. Служба окончена, сынок. 	['Это', 'бумага', 'о', 'твоей', 'демобилизации', 'Служба', 'окончена', 'сынок']	['I', 'have', 'your', 'discharge', 'papers', 'Your', 'service', 'is', 'up', 'son']
1025	Does this mean I can't play Ping-Pong no more? 	Это означает, что я не смогу больше играть в пинг-понг? 	['Это', 'означает', 'что', 'я', 'не', 'смогу', 'больше', 'играть', 'в', 'пинг-понг']	"['Does', 'this', 'mean', 'I', ""can't"", 'play', 'Ping-Pong', 'no', 'more']"
1026	For the Army it does. 	Для армии нет. 	['Для', 'армии', 'нет']	['For', 'the', 'Army', 'it', 'does']
1027	And just like that, my service in the United States Army was over. 	Таким образом, моя служба в армии США окончилась. 	['Таким', 'образом', 'моя', 'служба', 'в', 'армии', 'США', 'окончилась']	['And', 'just', 'like', 'that', 'my', 'service', 'in', 'the', 'United', 'States', 'Army', 'was', 'over']
1028	So, I went home. 	Я отправился домой. 	['Я', 'отправился', 'домой']	['So', 'I', 'went', 'home']
1029	-I'm home, Mama. -I know, I know. 	Я дома, мама. Я знаю, знаю. 	['Я', 'дома', 'мама', 'Я', 'знаю', 'знаю']	"[""I'm"", 'home', 'Mama', 'I', 'know', 'I', 'know']"
1030	-Louise, he's here. -Now, when I got home, I had no idea, but Mama had had all sorts of visitors. 	Луиза, он приехал. Теперь, когда я оказался дома, у меня не было никаких идей. Но мама знала столько разных людей. 	['Луиза', 'он', 'приехал', 'Теперь', 'когда', 'я', 'оказался', 'дома', 'у', 'меня', 'не', 'было', 'никаких', 'идей', 'Но', 'мама', 'знала', 'столько', 'разных', 'людей']	"['Louise', ""he's"", 'here', 'Now', 'when', 'I', 'got', 'home', 'I', 'had', 'no', 'idea', 'but', 'Mama', 'had', 'had', 'all', 'sorts', 'of', 'visitors']"
1031	We've had all sorts of visitors, Forrest. Everybody wants you to use their Ping-Pong stuff. 	Мы знали много разных людей. Все хотят с тобой встретиться, все на тему пинг-понга. 	['Мы', 'знали', 'много', 'разных', 'людей', 'Все', 'хотят', 'с', 'тобой', 'встретиться', 'все', 'на', 'тему', 'пинг-понга']	"[""We've"", 'had', 'all', 'sorts', 'of', 'visitors', 'Forrest', 'Everybody', 'wants', 'you', 'to', 'use', 'their', 'Ping-Pong', 'stuff']"
1032	One man even left a check for $25,000 	Один из них даже оставил чек на $25000, 	['Один', 'из', 'них', 'даже', 'оставил', 'чек', 'на', '25000']	['One', 'man', 'even', 'left', 'a', 'check', 'for', '25,000']
1033	if you'd be agreeable to saying you liked using their paddle. 	если ты будешь говорить, что ты играл их ракеткой. 	['если', 'ты', 'будешь', 'говорить', 'что', 'ты', 'играл', 'их', 'ракеткой']	"['if', ""you'd"", 'be', 'agreeable', 'to', 'saying', 'you', 'liked', 'using', 'their', 'paddle']"
1034	Oh, but, Mama, I only like using my own paddle. 	Но я играл только своей ракеткой. 	['Но', 'я', 'играл', 'только', 'своей', 'ракеткой']	['Oh', 'but', 'Mama', 'I', 'only', 'like', 'using', 'my', 'own', 'paddle']
1035	-Hi, Miss Louise. -Hey, Forrest. 	Здравствуйте, мисс Луиза. Привет, Форрест. 	['Здравствуйте', 'мисс', 'Луиза', 'Привет', 'Форрест']	['Hi', 'Miss', 'Louise', 'Hey', 'Forrest']
1036	I know that. I know that. But it's $25,000, Forrest. 	Я знаю, но $25000, Форрест. 	['Я', 'знаю', 'но', '25000', 'Форрест']	"['I', 'know', 'that', 'I', 'know', 'that', 'But', ""it's"", '25,000', 'Forrest']"
1037	I thought maybe you could hold it for a while, see if it grows on you. 	Я думаю, может быть стоит это сделать, может что и получиться. 	['Я', 'думаю', 'может', 'быть', 'стоит', 'это', 'сделать', 'может', 'что', 'и', 'получиться']	['I', 'thought', 'maybe', 'you', 'could', 'hold', 'it', 'for', 'a', 'while', 'see', 'if', 'it', 'grows', 'on', 'you']
1038	-Oh, you look good, Forrest. -That Mama, she sure was right. 	Мама, естественно, была права. 	['Мама', 'естественно', 'была', 'права']	['Oh', 'you', 'look', 'good', 'Forrest', 'That', 'Mama', 'she', 'sure', 'was', 'right']
1039	-You look real good. -It's funny how things work out. 	Смешно, как все получилось, 	['Смешно', 'как', 'все', 'получилось']	"['You', 'look', 'real', 'good', ""It's"", 'funny', 'how', 'things', 'work', 'out']"
1040	I didn't stay home for long, because I'd made a promise to Bubba, 	Я дома долго не задержался потому что я должен был выполнить для Баббу свое обещание. 	['Я', 'дома', 'долго', 'не', 'задержался', 'потому', 'что', 'я', 'должен', 'был', 'выполнить', 'для', 'Баббу', 'свое', 'обещание']	"['I', ""didn't"", 'stay', 'home', 'for', 'long', 'because', ""I'd"", 'made', 'a', 'promise', 'to', 'Bubba']"
1041	and I always try to keep my promise. So, I went on down to Bayou La Batre 	А я всегда пытаюсь выполнить свои обещания. Итак я отправился в Бае Ла Батре 	['А', 'я', 'всегда', 'пытаюсь', 'выполнить', 'свои', 'обещания', 'Итак', 'я', 'отправился', 'в', 'Бае', 'Ла', 'Батре']	['and', 'I', 'always', 'try', 'to', 'keep', 'my', 'promise', 'So', 'I', 'went', 'on', 'down', 'to', 'Bayou', 'La', 'Batre']
1042	to meet Bubba's family and make their introduction. 	встретиться с семьей Баббы. 	['встретиться', 'с', 'семьей', 'Баббы']	"['to', 'meet', ""Bubba's"", 'family', 'and', 'make', 'their', 'introduction']"
1043	Are you crazy, or just plain stupid? 	Ты сумасшедший или просто дурак? 	['Ты', 'сумасшедший', 'или', 'просто', 'дурак']	['Are', 'you', 'crazy', 'or', 'just', 'plain', 'stupid']
1044	Stupid is as stupid does, Mrs. Blue. I guess. 	Дурак тот, кто себя ведет как дурак, Миссис Блю. Наверное. 	['Дурак', 'тот', 'кто', 'себя', 'ведет', 'как', 'дурак', 'Миссис', 'Блю', 'Наверное']	['Stupid', 'is', 'as', 'stupid', 'does', 'Mrs', 'Blue', 'I', 'guess']
1045	And, of course, I paid my respect to Bubba himself. 	И, конечно, я отдал почести и самому Баббе. 	['И', 'конечно', 'я', 'отдал', 'почести', 'и', 'самому', 'Баббе']	['And', 'of', 'course', 'I', 'paid', 'my', 'respect', 'to', 'Bubba', 'himself']
1046	Hey, Bubba, it's me, Forrest Gump. 	Привет Бабба. Это я, Форрест. 	['Привет', 'Бабба', 'Это', 'я', 'Форрест']	"['Hey', 'Bubba', ""it's"", 'me', 'Forrest', 'Gump']"
1047	I remember everything you said, and I got it all figured out. 	Я помню все, что ты мне говорил и я все подсчитал. 	['Я', 'помню', 'все', 'что', 'ты', 'мне', 'говорил', 'и', 'я', 'все', 'подсчитал']	['I', 'remember', 'everything', 'you', 'said', 'and', 'I', 'got', 'it', 'all', 'figured', 'out']
1048	I'm taking the $24,562 and 47 cents that I got... 	У меня есть $24,562.47 	['У', 'меня', 'есть', '24,562.47']	"[""I'm"", 'taking', 'the', '24,562', 'and', '47', 'cents', 'that', 'I', 'got']"
1049	Or, that's left after a new hair cut and a new suit, 	Столько осталось после того, как я купил себе новый костюм, подстригся, 	['Столько', 'осталось', 'после', 'того', 'как', 'я', 'купил', 'себе', 'новый', 'костюм', 'подстригся']	"['Or', ""that's"", 'left', 'after', 'a', 'new', 'hair', 'cut', 'and', 'a', 'new', 'suit']"
1050	and I took Mama out to a real fancy dinner, 	сводил маму в шикарный ресторан, 	['сводил', 'маму', 'в', 'шикарный', 'ресторан']	['and', 'I', 'took', 'Mama', 'out', 'to', 'a', 'real', 'fancy', 'dinner']
1051	and I bought a bus ticket and three Dr. Peppers. 	купил билет на автобус и купил три банки Доктор Пеппер. 	['купил', 'билет', 'на', 'автобус', 'и', 'купил', 'три', 'банки', 'Доктор', 'Пеппер']	['and', 'I', 'bought', 'a', 'bus', 'ticket', 'and', 'three', 'Dr', 'Peppers']
1052	Tell me something. Are you stupid or something? 	Скажи мне что-нибудь. Ты дурак что ли? 	['Скажи', 'мне', 'что-нибудь', 'Ты', 'дурак', 'что', 'ли']	['Tell', 'me', 'something', 'Are', 'you', 'stupid', 'or', 'something']
1053	Stupid is as stupid does, sir. 	Дурак тот, кто ведет себя как дурак, сэр. 	['Дурак', 'тот', 'кто', 'ведет', 'себя', 'как', 'дурак', 'сэр']	['Stupid', 'is', 'as', 'stupid', 'does', 'sir']
1054	Well, that's what's left after me saying, 	Ну, что тебе еще сказать, 	['Ну', 'что', 'тебе', 'еще', 'сказать']	"['Well', ""that's"", ""what's"", 'left', 'after', 'me', 'saying']"
1055	"""When I was in China on the All-America Ping-Pong team, "	Когда я был в Китае в американской сборной 	['Когда', 'я', 'был', 'в', 'Китае', 'в', 'американской', 'сборной']	['When', 'I', 'was', 'in', 'China', 'on', 'the', 'All-America', 'Ping-Pong', 'team']
1056	"""I just loved playing Ping-Pong with my Flex-O-Light Ping-Pong paddle,"" "	я любил играть в пинг-понг моей ракеткой Флекс-О-Лит. 	['я', 'любил', 'играть', 'в', 'пинг-понг', 'моей', 'ракеткой', 'Флекс-О-Лит']	['I', 'just', 'loved', 'playing', 'Ping-Pong', 'with', 'my', 'Flex-O-Light', 'Ping-Pong', 'paddle']
1057	which everybody knows isn't true, 	Все, конечно знают , что это не так, 	['Все', 'конечно', 'знают', 'что', 'это', 'не', 'так']	"['which', 'everybody', 'knows', ""isn't"", 'true']"
1058	but Mama says it's just a little white lie 	но мама сказала, что это маленькая безобидная ложь. 	['но', 'мама', 'сказала', 'что', 'это', 'маленькая', 'безобидная', 'ложь']	"['but', 'Mama', 'says', ""it's"", 'just', 'a', 'little', 'white', 'lie']"
1059	so it wouldn't hurt nobody. 	и что это никому не принесет вреда. 	['и', 'что', 'это', 'никому', 'не', 'принесет', 'вреда']	"['so', 'it', ""wouldn't"", 'hurt', 'nobody']"
1060	So, anyway, I'm putting all that on gas, ropes and new nets 	В общем, я вложил все в бензин, канаты, новые сети 	['В', 'общем', 'я', 'вложил', 'все', 'в', 'бензин', 'канаты', 'новые', 'сети']	"['So', 'anyway', ""I'm"", 'putting', 'all', 'that', 'on', 'gas', 'ropes', 'and', 'new', 'nets']"
1061	and a brand-new shrimping boat. 	и лодку, с иголочки. 	['и', 'лодку', 'с', 'иголочки']	['and', 'a', 'brand-new', 'shrimping', 'boat']
1062	Now, Bubba had told me everything he knew about shrimping, 	Бабба рассказал мне все, что он знал о креветках. 	['Бабба', 'рассказал', 'мне', 'все', 'что', 'он', 'знал', 'о', 'креветках']	['Now', 'Bubba', 'had', 'told', 'me', 'everything', 'he', 'knew', 'about', 'shrimping']
1063	but you know what I found out? 	Но знаете, что я сам узнал? 	['Но', 'знаете', 'что', 'я', 'сам', 'узнал']	['but', 'you', 'know', 'what', 'I', 'found', 'out']
1064	Shrimping is tough. 	Ловля креветок - дело непростое. 	['Ловля', 'креветок', 'дело', 'непростое']	['Shrimping', 'is', 'tough']
1065	I only caught five. 	Я поймал только пятерых. 	['Я', 'поймал', 'только', 'пятерых']	['I', 'only', 'caught', 'five']
1066	A couple more, you could have yourself a cocktail. 	Еще парочку, и ты сможешь себе сделать креветочный коктейль. 	['Еще', 'парочку', 'и', 'ты', 'сможешь', 'себе', 'сделать', 'креветочный', 'коктейль']	['A', 'couple', 'more', 'you', 'could', 'have', 'yourself', 'a', 'cocktail']
1067	Hey, you ever think about naming this old boat? 	Эй, ты когда-нибудь думал, как назвать лодку? 	['Эй', 'ты', 'когда-нибудь', 'думал', 'как', 'назвать', 'лодку']	['Hey', 'you', 'ever', 'think', 'about', 'naming', 'this', 'old', 'boat']
1068	It's bad luck to have a boat without a name. 	Лодка без имени несет неудачу. 	['Лодка', 'без', 'имени', 'несет', 'неудачу']	"[""It's"", 'bad', 'luck', 'to', 'have', 'a', 'boat', 'without', 'a', 'name']"
1069	I'd never named a boat before, but there was only one I could think of, 	Я до этого никогда не называл лодки, но было только одно имя, которое шло мне в голову: 	['Я', 'до', 'этого', 'никогда', 'не', 'называл', 'лодки', 'но', 'было', 'только', 'одно', 'имя', 'которое', 'шло', 'мне', 'в', 'голову']	"[""I'd"", 'never', 'named', 'a', 'boat', 'before', 'but', 'there', 'was', 'only', 'one', 'I', 'could', 'think', 'of']"
1070	the most beautiful name in the wide world. 	самое красивое имя в мире. 	['самое', 'красивое', 'имя', 'в', 'мире']	['the', 'most', 'beautiful', 'name', 'in', 'the', 'wide', 'world']
1071	Now, I hadn't heard from Jenny in a long while, 	я не слышал о Дженни долгое время, 	['я', 'не', 'слышал', 'о', 'Дженни', 'долгое', 'время']	"['Now', 'I', ""hadn't"", 'heard', 'from', 'Jenny', 'in', 'a', 'long', 'while']"
1072	but I thought about her a lot, 	но я много о ней думал. 	['но', 'я', 'много', 'о', 'ней', 'думал']	['but', 'I', 'thought', 'about', 'her', 'a', 'lot']
1073	and I hoped that whatever she was doing made her happy. 	И я надеялся, что чтобы она ни делала, она была счастлива. 	['И', 'я', 'надеялся', 'что', 'чтобы', 'она', 'ни', 'делала', 'она', 'была', 'счастлива']	['and', 'I', 'hoped', 'that', 'whatever', 'she', 'was', 'doing', 'made', 'her', 'happy']
1074	I thought about Jenny all the time. 	Я думал о Дженни все время. 	['Я', 'думал', 'о', 'Дженни', 'все', 'время']	['I', 'thought', 'about', 'Jenny', 'all', 'the', 'time']
1075	Hey! 	Эй! 	['Эй']	['Hey']
1076	Lieutenant Dan, what are you doing here? 	Лейтенант Дэн, что вы здесь делаете? 	['Лейтенант', 'Дэн', 'что', 'вы', 'здесь', 'делаете']	['Lieutenant', 'Dan', 'what', 'are', 'you', 'doing', 'here']
1077	Well, thought I'd try out my sea legs. 	Решил размять ноги на воде. 	['Решил', 'размять', 'ноги', 'на', 'воде']	"['Well', 'thought', ""I'd"", 'try', 'out', 'my', 'sea', 'legs']"
1078	But you ain't got no legs, Lieutenant Dan. 	Но у вас же нету ног, лейтенант Дэн. 	['Но', 'у', 'вас', 'же', 'нету', 'ног', 'лейтенант', 'Дэн']	"['But', 'you', ""ain't"", 'got', 'no', 'legs', 'Lieutenant', 'Dan']"
1079	Yes, I know that. 	Да, я знаю. 	['Да', 'я', 'знаю']	['Yes', 'I', 'know', 'that']
1080	You wrote me a letter, you idiot. 	Ты же прислал мне письмо, идиот. 	['Ты', 'же', 'прислал', 'мне', 'письмо', 'идиот']	['You', 'wrote', 'me', 'a', 'letter', 'you', 'idiot']
